source_file,channel,message_id,ts_title,date_ymd,time_hm,text
C:\Users\user\Downloads\Telegram Desktop\ChatExport_2026-02-02 (3)\messages.html,판판펀치,5,25.01.2025 13:54:33 UTC+09:00,2025-01-25,13:54,개인 복기용 메모장
C:\Users\user\Downloads\Telegram Desktop\ChatExport_2026-02-02 (3)\messages.html,판판펀치,6,25.01.2025 13:54:45 UTC+09:00,2025-01-25,13:54,+) 지듣노
C:\Users\user\Downloads\Telegram Desktop\ChatExport_2026-02-02 (3)\messages.html,판판펀치,7,25.01.2025 13:55:04 UTC+09:00,2025-01-25,13:55,"아하토큰용 신카 고르기
+) 신규면 신규이벤 찾아서 받기

통신비할인
https://card.kbcard.com/CRD/DVIEW/HCAMCXPRICAC0076?mainCC=a&cooperationcode=04482 - 30이상 유플러스 12,000 할인

마일리지
https://m.kbcard.com/CRD/DVIEW/MCAMCXHIACRC0002?mainCC=b&allianceCode=09126&jehuId=KBSTR - 400만원까지 1500원당 대한항공 2마일 / 400이후 1000원당 1마일 / KBpay 결제 필수

깡할인
https://www.tossbank.com/product-service/card/wide-card - 500만원까지 2% 할인

넥슨캐쉬
https://www.hyundaicard.com/cpc/cr/CPCCR0201_01.hc?cardflag=N&cardWcd=NXHCV&eventCode=00000
무제한 3% 넥슨포인트 적립 / 현금화하면 2.5%정도 할인(팔라고)"
C:\Users\user\Downloads\Telegram Desktop\ChatExport_2026-02-02 (3)\messages.html,판판펀치,8,25.01.2025 13:55:12 UTC+09:00,2025-01-25,13:55,https://youtu.be/ugpywe34_30?si=RzWatIcEUYfHSxEw
C:\Users\user\Downloads\Telegram Desktop\ChatExport_2026-02-02 (3)\messages.html,판판펀치,11,19.03.2025 14:44:46 UTC+09:00,2025-03-19,14:44,"사하라 시즌3 오픈 // 현재 FAQ 및 이슈들 

1. 현재 출첵(1exp) 미션이 일부 유저들만 클레임 가능.
- 오늘이 시즌3 오픈날이라 아직 데이터 동기화가 진행중임. 데이터 동기화가 완료되면 클레임 가능해질 예정.

2. 시즌2 데미갓 SBT 민팅은 wen??
- 1번 내용과 마찬가지로, 오늘이 시즌3 오픈날이라 아직 데이터 동기화가 진행중임. 데이터 동기화가 완료되면 민팅 가능해질 예정.

3. 시즌3 신규유저는 Sigil of Initial 민팅이 안되고, 그 중 일부는 ""사하라 성취 NFT""만 민팅가능.
- 1번 내용과 마찬가지로, 오늘이 시즌3 오픈날이라 아직 데이터 동기화가 진행중임. 데이터 동기화가 완료되면 민팅 가능해질 예정.

4. 아무 task도 apply 안했는데 밴당했어요
- 팀왈) 이미 해당 문제에 대해 플랫폼에 알림이 갔을 거임. 알림을 확인해주세요.
알림 못받았으면 팀원한테 연락해야할듯.

5. 일부 task에서 DP를 1개만 제출했는데(또는 DP를 제출도 안했음), 왜 daily limit에 도달했다고 뜨나요?
- 팀왈) task 할당의 공정성 및 불균형한 작업 액세스를 방지하기 위해 유저당 최대 작업 부하(DP 제출 가능 횟수)를 설정했음. 이를 통해 고품질 데이터를 제공하는 진정한 기여자는 공정한 기회를 얻을 수 있을 것. 이런 사용자당 task 제출 limit은 UTC 오전 00:30 기준으로 매일 초기화되서 다음 날에도 DP를 제출할수 있을 거임.
**  이제 각 계정에는 모든 작업에 걸쳐 공유되는 일일 총 제출 한도가 있습니다. 따라서 사용자는 자신의 상황에 따라 작업의 우선순위를 정해야 할 수도 있습니다. ** 중요

6. S2에서 몇 가지 task에서 exam에 떨어졌는데, 이제 더 이상 이 task들에 접근할 수 없는 것 같습니다. 다시 exam을 볼 기회가 있을까요?
-  사용자들이 exam을 다시 볼 수 있는 추가 기회를 가질 수 있도록 exam bank를 업데이트하는 것을 고려하고 있음.
- 아마 다음 라운드에서 동일한 도메인의 새로운 task가 도입되면 사용자가 exam을 다시 치를 수 있는 기회를 줄 것으로 예상함."
C:\Users\user\Downloads\Telegram Desktop\ChatExport_2026-02-02 (3)\messages.html,판판펀치,13,19.03.2025 15:19:40 UTC+09:00,2025-03-19,15:19,"그래서 사하라 시즌3는 시즌2와 뭐가 다르냐?

일단 가장 중요한 것.
** 이제 각 계정에 모든 작업에 걸쳐 공유되는 일일 총 제출 한도(data point)가 존재함. **

- EXP 획득을 기준으로, 시즌2에는 크게 
  - 출첵(1exp)
  - 매일 20SP이상 획득(5exp) 미션
  - Oracle of Knowledge (Model Optimization, Persona Emulation, Tech Chronicles에서 각각 100SP를 획득하면 30exp씩 얻을 수 있는 미션)
이 있었음.
다만 Oracle 미션은 시즌 내내 진행되는거기 때문에 각 섹션별 요구하는 SP량을 천천히 채우면서 사하라 일퀘를 하면됐었음.

근데 시즌3들어서 새로운 퀘스트들이 추가됨.
- 기존 Oracle 미션과 달리, 이제 하루에 Prompt Collection/ Persona Emulation (젤 어려운 task들)로 최소 40SP씩 받으면 3exp를 주는 daily 미션으로 바꿔버림.
- Grand Oracle of Knowledge(기존 Oracle of Knowledge 미션)에서
  Tech Chronicles, Model Optimization, Pawspective 관련 Task들에서 
  각각 최대 100 / 200 / 300 SP를 얻어서  30 / 10 / 5 EXP를 클레임하도록 바꿧음. 

* 시즌2당시 리뷰 task 기준 task 당
   1SP/1DP 리뷰 task = 보통 제출한도 하루에 10개
   2SP/1DP 리뷰 task =  제출한도 8개엿음. 
(annotate은 제출한도 다른데 결론적으로 review랑 얻는 SP는 거진 같음)
하지만 일일 총 제출 한도가 도입되면서 review task 3개 기준 모든 task를 일일 제출한도까지 제출할 수 없어짐."
C:\Users\user\Downloads\Telegram Desktop\ChatExport_2026-02-02 (3)\messages.html,판판펀치,14,19.03.2025 15:21:33 UTC+09:00,2025-03-19,15:21,"결론
앞서 말했듯 계정당 모든 task에 공유되는 일일 총 제출한도가 생겼기 때문에, 시즌2처럼 그냥 모든 task들 무지성으로 daily limit까지 DP제출하기가 더 이상 안되고, 자기 상황에 맞춰서 전략적으로 접근해야함.

- Grand Oracle of Knowledge 미션이 Tech Chronicles, Model Optimization, Pawspective 섹션만 해당이니, 해당 섹션 먼저 100SP를 채워서 30 EXP를 각각 얻는게 바람직해보임. 계정당 제출한도가 생겼기 때문에 해당 섹션이 아닌 task에 DP를 제출해 하루에 사용가능한 DP 제출 횟수를 쓰는걸 잘 생각해야함.

- AI 활용을 잘해서 Persona, Prompt Task를 어지간히 approve 잘 시키는거가 아닌이상, 매일 3exp 미션 노리고 마냥 해당 task들 시도하는 것은 난이도가 높아서  계정당 공유되는 DP제출횟수를 무의미하게 차감할 수 있으니 각자 상황에 맞춰서 전략적으로 DP 제출횟수를 사용해야할거임. 괜히 시도했다가 daily 제출횟수 다 써서 20SP획득 미션도 클레임 못할수도..."
C:\Users\user\Downloads\Telegram Desktop\ChatExport_2026-02-02 (3)\messages.html,판판펀치,17,20.03.2025 14:18:13 UTC+09:00,2025-03-20,14:18,"⭐️Sahara AI Exam 
Red Teaming Challenge - Adversarial Prompts for Explicit/Adult Content - Llama Family

답
1. What is the purpose of LLM jailbreaking attacks?
- To identify security vulnerabilities in the model

2. What does “Jailbreaking” Large Language Models (LLMs) refer to?
- Using specially crafted prompts to bypass design restrictions and enable LLMs to perform prohibited or unintended operations.

3. In the context of Large Language Models, what does “Transformer” mean?
- A deep learning model architecture that uses self-attention to process and understand input data efficiently, revolutionizing NLP and beyond.

4. What is the role of the Chain of Thoughts’ technique when testing LLMs?
- To promote step-by-step reasoning, enhancing accuracy and uncovering logical capabilities.

5. In the context of system prompting, what is the “Chain of Thoughts”?
- A technique that guides models to generate step-by-step reasoning for complex tasks."
C:\Users\user\Downloads\Telegram Desktop\ChatExport_2026-02-02 (3)\messages.html,판판펀치,18,22.03.2025 16:38:59 UTC+09:00,2025-03-22,16:38,"아직도 5exp / 출첵 미션들 클레임 제대로 안되는 사람들 있는거 같긴한데 지금 기준 출첵은 19,20,21일까지 / 5exp 미션은 19,20일까지 클레임가능한듯
출첵 미션 버그나서 20일 건너뛰고 19, 21일만 받아지는 버그도 있나봄

이제 19,20,21일 어치까진 정상 클레임되는듯

솔직히 이럴거면 걍 안정화된 상태에서 새로운 시즌 진행해줬으면 함"
C:\Users\user\Downloads\Telegram Desktop\ChatExport_2026-02-02 (3)\messages.html,판판펀치,19,23.03.2025 18:50:29 UTC+09:00,2025-03-23,18:50,시즌2 10000등 이내였던 사람은 데미갓 민팅가능
C:\Users\user\Downloads\Telegram Desktop\ChatExport_2026-02-02 (3)\messages.html,판판펀치,21,24.03.2025 13:39:00 UTC+09:00,2025-03-24,13:39,"⭐️Sahara AI Exam 
Deadpool’s Chaotic Gig - Bar Fight Recovery (Gig I), (Gig II), (Gig III)

답
1. What does RLHF stand for in the context of machine learning?
•   Reinforcement Learning from Human Feedback.

2. Which of the following is a primary goal of using RLHF with LLMs?
•   To align model outputs with human values and preferences.

3. In the context of LLMs, what is a ""prompt""?
•   An input given to the model to generate a response.

4. What role do human evaluators play in RLHF?
•   They provide feedback on the model's outputs.

5. Which of the following is a common challenge in RLHF?
•   Collecting high-quality, consistent human feedback."
C:\Users\user\Downloads\Telegram Desktop\ChatExport_2026-02-02 (3)\messages.html,판판펀치,22,24.03.2025 13:41:22 UTC+09:00,2025-03-24,13:41,"⭐️Sahara AI Exam 
Pet Aging Insights - Caring for Senior Pets

답
1. Which of the following pets is known for its ability to regrow its tail if it loses it?
•   Lizard

2. Which of the following pets is nocturnal by nature?
•   Hedgehog

3. What is the term for a group of rabbits?
•   Fluffle

4. What is the average gestation period for a cat?
•   60 days

5. Which of the following pets is known for its ability to change color based on its environment?
•   Chameleon"
C:\Users\user\Downloads\Telegram Desktop\ChatExport_2026-02-02 (3)\messages.html,판판펀치,23,24.03.2025 13:43:58 UTC+09:00,2025-03-24,13:43,"⭐️Sahara AI Exam 
Unusual Lodgings - Unique Places to Stay

답
1. Which country is known as the ""Land of the Rising Sun""?
•   Japan

2. About how long is the Nile River?
•   4000 miles

3. What is the name of the highest navigable lake in the world, shared by Peru and Bolivia?
•   Lake Titicaca

4. Which country is home to the ""Door to Hell,"" a natural gas field that has been burning continuously since 1971?
•   Turkmenistan

5. What is the term for the phenomenon where travelers experience fatigue and disorientation after crossing multiple time zones quickly?
•   Jet lag"
C:\Users\user\Downloads\Telegram Desktop\ChatExport_2026-02-02 (3)\messages.html,판판펀치,24,24.03.2025 13:46:54 UTC+09:00,2025-03-24,13:46,"⭐️Sahara AI Exam 
Your Dream Job... In Text Form!

답
1. Which company developed the ""Unreal Engine,"" a widely used game engine in the gaming industry?
•   Epic Games

2. What is the name of the protagonist in the ""Legend of Zelda"" series?
•   Link

3. What does ""MMORPG"" stand for in gaming terminology?
•   Massively Multiplayer Online Role-Playing Game

4. Which gaming company is responsible for creating the ""Assassin's Creed"" series?
•   Ubisoft

5. What is the term for the practice of playing video games for an audience, often on platforms like Twitch or YouTube?
•   Streaming"
C:\Users\user\Downloads\Telegram Desktop\ChatExport_2026-02-02 (3)\messages.html,판판펀치,25,24.03.2025 13:48:37 UTC+09:00,2025-03-24,13:48,"⭐️Sahara AI Exam 
Tech Workflows - Optimizing Processes

답
1. Which company developed the first commercially successful graphical user interface (GUI)?
•   Xerox

2. What is the primary function of a router in a network?
•   To connect devices and direct data traffic

3. What does ""IoT"" stand for?
•   Internet of Things

4. Which of the following is a cloud computing service provided by Amazon?
•   AWS (Amazon Web Services)

5. What is the purpose of a VPN (Virtual Private Network)?
•   To encrypt internet traffic and provide anonymity"
C:\Users\user\Downloads\Telegram Desktop\ChatExport_2026-02-02 (3)\messages.html,판판펀치,26,24.03.2025 14:41:08 UTC+09:00,2025-03-24,14:41,"Model Optimization Task들 깨알팁

Model Optimization Task들은 봇방지로 저렇게 객관식 문제를 하나씩 껴놓는데, 선지중에서 대문자로 시작하는 선지가 정답 선지임.
복붙해서 gpt 돌리는 시간에 뇌비워서 대문자로 시작하는 선지 고르면 사하라에 할당할 뇌용량을 좀 비울 수 있음. 
사실 대충 문제 읽어봐도 진짜 말 안되는 선지들 가운데 선지 하나만 적합하게 넣어주기 때문에 큰 문제는 없지만, 간혹 헷갈리게 줄때가 있으면 대문자 시작 선지 (대문자가 없다면 숫자로 시작하는 선지 기타등등..) 골라서 풀면 됨"
C:\Users\user\Downloads\Telegram Desktop\ChatExport_2026-02-02 (3)\messages.html,판판펀치,30,25.03.2025 15:47:17 UTC+09:00,2025-03-25,15:47,"Review Task 미세팁

Review 걸리면 보통 짜증나는게 다른 사람들(annotator)이 제출한 DP가 있어야 리뷰작업을 할 수 있는데, 이게 시즌 후반가면 갈수록 경쟁이 치열해져서 리뷰 DP 배정받기가 힘듦. 
그래서 All data points have been reviewed만 뜨고 빨리 리뷰 못하는 경우가 많은데, 지금까지의 경험으로는 개인적으로 저렇게 Task 창이랑 Working 창 녹화한 gif처럼 창 왔다갔다하는게 제일 빠르고 편하게 DP 잡는법 같음. 물론 더 좋은 방법이 있을 수 있음..

Review 버튼 활성화 안되어 있어도 링크상에서 sahara-data 부분 working으로 바꿔서 왔다갔다 하면댐
예시)
https://app.saharalabs.ai/#/individualLabeler/sahara-data/~~~
→ https://app.saharalabs.ai/#/individualLabeler/working/~~~"
C:\Users\user\Downloads\Telegram Desktop\ChatExport_2026-02-02 (3)\messages.html,판판펀치,31,30.03.2025 16:07:17 UTC+09:00,2025-03-30,16:07,"안녕하세요 오랜만입니다
다름이 아니라 개인사정으로 사하라 관련 포스팅을 못하고 있는데 저는 앞으로 이번 시즌3은 출첵만 부탁해서 마칠예정입니다..
아무래도 높은 확률로 시즌4가 진행될 것 같은데, 그때 뵙겠습니다!"
C:\Users\user\Downloads\Telegram Desktop\ChatExport_2026-02-02 (3)\messages.html,판판펀치,32,19.05.2025 23:28:42 UTC+09:00,2025-05-19,23:28,"350만 명, 프라이빗 테스트 20만 명 이상 참여!
이번 SIWA 테스트넷에서는 데이터셋 소유권과 기여도를 온체인에서 등록하고 추적할 수 있는 레지스트리 시스템이 도입되었습니다.

이제 개발자, 데이터 기여자, AI 스타트업은 AI 자산을 투명하게 등록, 추적, 수익화할 수 있습니다.
탈중앙화 AI 경제의 새로운 시대가 열립니다. 🌐

이번 SIWA 테스트넷은 아래 3가지 핵심 요소를 중심으로 구성됩니다:
1️⃣ 데이터셋 NFT 민팅
2️⃣ 글로벌 자산 레지스트리
3️⃣ 자동화된 기여도 추적 시스템

바로 포털을 방문해 참여해보세요! 
포털 링크: https://portal.saharalabs.ai/main/explore

웹사이트|트위터|디스코드|블로그
한국 커뮤니티 공지방|한국 커뮤니티 채팅방"
C:\Users\user\Downloads\Telegram Desktop\ChatExport_2026-02-02 (3)\messages.html,판판펀치,33,24.05.2025 21:41:08 UTC+09:00,2025-05-24,21:41,"huma finance claim site open

워낙 소액으로 참여하기도 했고, 커뮤니티활동도 안해서 기대가 없었는데 생각보다 많이 챙겨줘서 생각치 못한 용돈 받은 기분이네요

챗굴 - 디코 role 기준
- 5렙 (초반엔 2렙컷) Newborn Role - 1800개
- 10렙 Baby Huma Role - 2900개 정도

* 챗굴 exp는 짠편(1채팅당 2~3exp 정도?) - 하지만 2렙은 2~3시간이면 찍어서 아주 효율이 좋았던 편.  (10렙은 gg)

애초에 프로젝트차원에서 챗굴을 권장하지도 않았고 디코 exp봇이 터진적도 있어서 기대안했는데 Newborn 할당으로 1800개나 챙겨줬네요. 
요즘 대부분 이런 커뮤니티 할당 에드가 카이토로 넘어가고 있는데 낭만의 채팅딸깍 2렙 다계했었으면 맛드몽현

예치
저는 풀 마지막으로 열렸을때 소액 Maxi로 3개월 락업해서 의미없는 정도로 할당받았는데 초창기에 넣으신분들은 거의 절반정도도 나왔다고 하네요

의외로 바낸도 뚫고, 에드는 시즌3까지 있을 예정이니 Huma에 bullish하다면 시즌3까지 에드 챙겨보셔도 좋을듯하네요"
C:\Users\user\Downloads\Telegram Desktop\ChatExport_2026-02-02 (3)\messages.html,판판펀치,34,28.05.2025 22:27:38 UTC+09:00,2025-05-28,22:27,"우선

bsc > soph 3배 따리"
C:\Users\user\Downloads\Telegram Desktop\ChatExport_2026-02-02 (3)\messages.html,판판펀치,35,28.05.2025 22:46:32 UTC+09:00,2025-05-28,22:46,"BSC -> SOPHON 루트

""기출문제""

Endpoint
https://docs.layerzero.network/v2/deployments/deployed-contracts

룰루"
C:\Users\user\Downloads\Telegram Desktop\ChatExport_2026-02-02 (3)\messages.html,판판펀치,36,30.05.2025 12:35:23 UTC+09:00,2025-05-30,12:35,"많이들 참여하고 있는 Loud (생전 야핑 안하다가 저도 해보는중)

근데 Phase 2 (Smart Follower 10명 모으면 받을 수 있는 fcfs) 스냅샷은 이미 며칠 전에 찍혔다고 하네요
(실제로 스마트 팔로워 돈주고 파는거도 생겨나고 있는 걸 보면 맞는 판단이라고 생각되네요)

며칠전부터 smart follower 수 10명이상이었지만 솔라나 지갑을 Kaito 사이트에서 연결하지 않으신분들은 지금이라도 연결해주시면 IAO 참가 가능하시고, 저처럼 어제부터 스마트 팔로워 모으고 Stay Loudio 하신분들은 쭉 열심히 LOUD해서 top 1000 노려보면 될것 같습니다!

원문"
C:\Users\user\Downloads\Telegram Desktop\ChatExport_2026-02-02 (3)\messages.html,판판펀치,37,30.05.2025 22:46:45 UTC+09:00,2025-05-30,22:46,"Loud top 1000 스냅샷 soon

원문보기"
C:\Users\user\Downloads\Telegram Desktop\ChatExport_2026-02-02 (3)\messages.html,판판펀치,38,31.05.2025 01:07:36 UTC+09:00,2025-05-31,01:07,"The END
원문보기"
C:\Users\user\Downloads\Telegram Desktop\ChatExport_2026-02-02 (3)\messages.html,판판펀치,39,09.06.2025 20:49:12 UTC+09:00,2025-06-09,20:49,"이전에 여러 텔방에서 WL뿌린 하리쪽 NFT BAE

WL대상 지갑주소 걷는중

채널링크몽현"
C:\Users\user\Downloads\Telegram Desktop\ChatExport_2026-02-02 (3)\messages.html,판판펀치,40,09.06.2025 23:49:29 UTC+09:00,2025-06-09,23:49,"No Plasma CAP increase for today

혹시나 기대한사람들은 자러갑시당"
C:\Users\user\Downloads\Telegram Desktop\ChatExport_2026-02-02 (3)\messages.html,판판펀치,41,10.06.2025 08:57:53 UTC+09:00,2025-06-10,08:57,"사하라 빌드패드 wl대상 메일 왔네요
데미갓은 150불 정도 할당받은듯?

https://www.buidlpad.com/projects/sahara-ai/invite

kyc완료 하시고 기간내에 이 링크에 받으신 초대코드 입력하시면 될 것 같습니다"
C:\Users\user\Downloads\Telegram Desktop\ChatExport_2026-02-02 (3)\messages.html,판판펀치,42,10.06.2025 09:35:06 UTC+09:00,2025-06-10,09:35,"닉네임에 🔆 달고 여우 붙이기 = 200$ >> 매일 task 몇시간 투자해서 테넷 데미갓 똥꼬쇼하기 = 150$

오늘도 번번히 커뮤 할당 승
데미갓 에드 많이 챙겨다오"
C:\Users\user\Downloads\Telegram Desktop\ChatExport_2026-02-02 (3)\messages.html,판판펀치,43,17.06.2025 15:15:01 UTC+09:00,2025-06-17,15:15,"빗썸 공식 실시간 알림 채널 등장.. 

더따리 게섯거라~

https://t.me/BithumbExchangeData"
C:\Users\user\Downloads\Telegram Desktop\ChatExport_2026-02-02 (3)\messages.html,판판펀치,44,17.06.2025 15:53:21 UTC+09:00,2025-06-17,15:53,"채널 들어가고 구글폼 제출하면 3천원도 받으니까 구글폼 제출도 합시다! 
🙂🙃🙂🙃🙂

공지 원문"
C:\Users\user\Downloads\Telegram Desktop\ChatExport_2026-02-02 (3)\messages.html,판판펀치,45,18.06.2025 09:04:41 UTC+09:00,2025-06-18,09:04,"업비트(Upbit) 공지변경
[안내] 업비트 팝업스토어에 초대합니다! (갤럭시 S25엣지 업비트 익스클루시브 수량 추가 안내)
2025-06-18 09:00:00"
C:\Users\user\Downloads\Telegram Desktop\ChatExport_2026-02-02 (3)\messages.html,판판펀치,46,18.06.2025 09:08:37 UTC+09:00,2025-06-18,09:08,이제 업비트 팝업스토어 갤럭시 s25 하루당 5대씩 추첨
C:\Users\user\Downloads\Telegram Desktop\ChatExport_2026-02-02 (3)\messages.html,판판펀치,47,19.06.2025 17:07:22 UTC+09:00,2025-06-19,17:07,"사하라 6월 26일 TGE인 듯

https://www.okx.com/help/okx-to-list-sahara-sahara-ai-for-spot-trading"
C:\Users\user\Downloads\Telegram Desktop\ChatExport_2026-02-02 (3)\messages.html,판판펀치,48,19.06.2025 17:15:22 UTC+09:00,2025-06-19,17:15,"🚨 드디어 TGE 🚨
새로운 빅뉴스입니다!
사하라 AI가 @okx 와 파트너십을 맺고
총 2개의 리워드 풀을 통해
$SAHARA 토큰 28,000,000개를
에어드랍으로 배포합니다! 🪂

👉 https://okx.SaharaAI.com

#SaharaAI #TGE #에어드랍 #OKX 

https://x.com/SaharaLabsAI/status/1935609639175119277"
C:\Users\user\Downloads\Telegram Desktop\ChatExport_2026-02-02 (3)\messages.html,판판펀치,49,19.06.2025 17:17:21 UTC+09:00,2025-06-19,17:17,"사하라했던 사람들은 
https://okx.saharaai.com/
에서 Pool A 등록하기"
C:\Users\user\Downloads\Telegram Desktop\ChatExport_2026-02-02 (3)\messages.html,판판펀치,50,20.06.2025 16:07:06 UTC+09:00,2025-06-20,16:07,TGE ≠ OKX campaign
C:\Users\user\Downloads\Telegram Desktop\ChatExport_2026-02-02 (3)\messages.html,판판펀치,51,20.06.2025 16:25:20 UTC+09:00,2025-06-20,16:25,"TGE ≠ OKX campaign 
추가설명) okx pool에 등록해두면 사하라 dsp 에어드랍을 okx 거래소로 받는다는 말은 사실이 아닙니다. 
OKX Pool관련 캠페인은 OKX 유저를 위한 exclusive airdrop, 즉 별개 에어드랍이고 DSP 에어드랍을 위한 클레임 페이지는 따로 있을 예정입니다"
C:\Users\user\Downloads\Telegram Desktop\ChatExport_2026-02-02 (3)\messages.html,판판펀치,52,21.06.2025 00:37:53 UTC+09:00,2025-06-21,00:37,"https://stickerdom.store/bundle/1/26
bayc 스티커 웹사이트"
C:\Users\user\Downloads\Telegram Desktop\ChatExport_2026-02-02 (3)\messages.html,판판펀치,53,22.06.2025 05:17:50 UTC+09:00,2025-06-22,05:17,"사하라 OKX 별도 이벤트 지금까지 Pool A 제출한거 초기화돼서 다시 제출해야한다네요
까먹지말구 다시 제출합시다 🙂🙃🙂🙃🙂

제출기한 6.24 오후 5시까지

공지 원문"
C:\Users\user\Downloads\Telegram Desktop\ChatExport_2026-02-02 (3)\messages.html,판판펀치,54,22.06.2025 16:15:32 UTC+09:00,2025-06-22,16:15,에호호 시바루웨후후 인생
C:\Users\user\Downloads\Telegram Desktop\ChatExport_2026-02-02 (3)\messages.html,판판펀치,55,25.06.2025 00:26:28 UTC+09:00,2025-06-25,00:26,구라쟁이 속출중
C:\Users\user\Downloads\Telegram Desktop\ChatExport_2026-02-02 (3)\messages.html,판판펀치,56,25.06.2025 04:37:14 UTC+09:00,2025-06-25,04:37,사하라 디코롤도 뭐 좀 챙겨주려나보네요
C:\Users\user\Downloads\Telegram Desktop\ChatExport_2026-02-02 (3)\messages.html,판판펀치,57,25.06.2025 20:07:56 UTC+09:00,2025-06-25,20:07,Sahara OKX Pool A 보상 268개 들어왔네요
C:\Users\user\Downloads\Telegram Desktop\ChatExport_2026-02-02 (3)\messages.html,판판펀치,58,26.06.2025 12:58:02 UTC+09:00,2025-06-26,12:58,"사하라 준비해보기

CA (ETH, BSC)
0xFDFfB411C4A70AA7C95D5C981a6Fb4Da867e1111

0. 거래소 상장시간 관련
> 하단의 채널 글 보시면 가독성 좋을 듯
> https://t.me/SUS_secretnote/4595

1. 비들패드 클레임 관련
> ETH 체인으로 클레임 가능할 듯
> 바낸 계정 연결 이유는 바낸에서 ETH랑 BNB 둘다 받아줌

2. 테스트넷 클레임 관련
> 이건 BNB 체인으로 클레임
> 혹시나 모를까봐 클레임 시 추가 수수료가 있음(가스비 말고)
> 이거 관련해서는 하단의 FAQ 참조

3. 브릿지 관련
> 저는 Relay아니면 Portal 쓸 것 같음
> https://www.relay.link/bridge
> https://portalbridge.com/

4. 주의사항
> 브릿지 사고 조심 (환불, 네이티브 여부 등등)
> 위의 사항과 다른 루트 or 새로운 정보 있을 땐 빠르게 하시길
> 테스트넷 할당자 반드시 BNB 추가 클레임피 체크

글로벌 동시상장 30분 이후 업빗썸 상장인데 갭도 고민해보면 좋겠음. 이런거 전략구상해서 해보고 안해보고 천지차이임. 야핑이랑 비슷한건데 안하는 사람은 끝까지 안함(본인 저격임)"
C:\Users\user\Downloads\Telegram Desktop\ChatExport_2026-02-02 (3)\messages.html,판판펀치,59,26.06.2025 19:06:59 UTC+09:00,2025-06-26,19:06,비들패드 클레임시간 오후 8시
C:\Users\user\Downloads\Telegram Desktop\ChatExport_2026-02-02 (3)\messages.html,판판펀치,60,26.06.2025 19:31:41 UTC+09:00,2025-06-26,19:31,"$Sahara 웜홀 브릿지는 래핑된 이더 사하라를 줌 (ca 다름)

업비트 입금 : 0xFDFfB411C4A70AA7C95D5C981a6Fb4Da867e1111

웜홀 브릿지 : 0x0CAb456149EE99F87574daA80bC2b6b74aF594Db"
C:\Users\user\Downloads\Telegram Desktop\ChatExport_2026-02-02 (3)\messages.html,판판펀치,61,26.06.2025 20:29:57 UTC+09:00,2025-06-26,20:29,이제 슬슬 출금 잘 되는거같기도
C:\Users\user\Downloads\Telegram Desktop\ChatExport_2026-02-02 (3)\messages.html,판판펀치,62,26.06.2025 21:24:51 UTC+09:00,2025-06-26,21:24,빗썸도 10시로 바꿧네
C:\Users\user\Downloads\Telegram Desktop\ChatExport_2026-02-02 (3)\messages.html,판판펀치,63,26.06.2025 21:24:51 UTC+09:00,2025-06-26,21:24,"빗썸(Bithumb) 공지변경
사하라에이아이(SAHARA) 원화 마켓 추가 (거래 오픈 시간 오후 10:00 예정)
2025-06-26 21:24:31"
C:\Users\user\Downloads\Telegram Desktop\ChatExport_2026-02-02 (3)\messages.html,판판펀치,64,26.06.2025 23:59:15 UTC+09:00,2025-06-26,23:59,사하라 길고도 짧은 여정 수고하셨습니다!!
C:\Users\user\Downloads\Telegram Desktop\ChatExport_2026-02-02 (3)\messages.html,판판펀치,65,27.06.2025 14:22:39 UTC+09:00,2025-06-27,14:22,"이전에 말씀드렸던 탈중앙화 커뮤니티는 금일 후한 보상을 발표한 밈코어로 시작합니다.

현재 관리자는 저 하나이고 여러분들의 참여는 자율입니다.

제가 커뮤니티에 글을 써서 수혜를 받을 생각은 추호도 없으며

기존에 S급 프로젝트가 아닌 A~B급을 하려고 했는데 밈코어는 보상으로만 보면 S급이지만 시기가 너무 적절해서 이걸로했습니다.

좀 추하지만 제 개인 피드에는 조금씩 적되 최대한 커뮤니티에는 현재 고정되어 있는 공지글 (아마 하루 이틀내로 다른 유저분의 글로 덮여질것입니다) 이외에는 제가 노출되지 않을 거라서 제 개인피드까지 버프 받을 것 같지는 않다고 생각했습니다.

양해부탁드립니다

https://x.com/i/communities/1938459353465688551"
C:\Users\user\Downloads\Telegram Desktop\ChatExport_2026-02-02 (3)\messages.html,판판펀치,66,07.07.2025 16:53:09 UTC+09:00,2025-07-07,16:53,"TAC SBT 구매하신분들 이전에 디코 First Force 롤 받아가라고 여기저기서 공지 돌아다녔었죠
근데 초반에 Ton Keeper 말고 다른 월렛은 자꾸 사이트에서 인증하는데 에러가 떠서 그냥 귀찮아서 냅두고 있었는데 이제 OKX 월렛도 인증 정상적으로 가능하도록 고쳐놨네요
생각난 김에 하고 왔음

Role 클레임 사이트 | 디스코드"
C:\Users\user\Downloads\Telegram Desktop\ChatExport_2026-02-02 (3)\messages.html,판판펀치,67,11.07.2025 16:26:21 UTC+09:00,2025-07-11,16:26,"[Dria Early Contributor Appreciation Program] 

https://dria.co/edge-ai/my-node 

Dria에서 노드 돌리고 있는 사람 대상으로 뽀찌 챙겨주는 프로그램 시작하나보네요

usd로 보상챙겨주고, 위에 링크따라서 claim하면 됩니다

기준:
1. 포인트 상위 50%이상만 claim 가능
2. last 30일동안 task 하나라도 처리한 노드 (보상 자체는 all-time points 기준)

*
- Reward pool = Total points * 0.000025
- Reward 계산식: (Your points / Total points in your percentile) × (Your percentile’s % of total pool) × (Total reward pool in USD)

이번 7.10 보상은
Total reward pool: $10K+
Percentile breakdown:
Top 10%: ≥ 10,065 points (~2,738 nodes)
Top 20%: ≥ 7,900 points (~5,476 nodes)
Top 30%: ≥ 6,175 points (~8,214 nodes)
Top 40%: ≥ 5,357 points (~10,952 nodes)
Top 50%: ≥ 4,806.5 points (~13,690 nodes)
로 끊어서 제공될 예정

PS. 보상엄청 적은게 정상임.."
C:\Users\user\Downloads\Telegram Desktop\ChatExport_2026-02-02 (3)\messages.html,판판펀치,68,12.07.2025 23:38:44 UTC+09:00,2025-07-12,23:38,게이트(83.33%/100%) Completed
C:\Users\user\Downloads\Telegram Desktop\ChatExport_2026-02-02 (3)\messages.html,판판펀치,69,13.07.2025 21:36:36 UTC+09:00,2025-07-13,21:36,"https://www.bitgetapp.com/asia/events/pumpfun-publicsale

세일페이지 들어가면 얼마 할당됐는지 바로 나오네요 (들어간 양의 28%)"
C:\Users\user\Downloads\Telegram Desktop\ChatExport_2026-02-02 (3)\messages.html,판판펀치,70,13.07.2025 23:06:40 UTC+09:00,2025-07-13,23:06,"펌펀 세일 못한거 화나서 게아오 런치패드나 참여중


게이트 런치패드 | 공지"
C:\Users\user\Downloads\Telegram Desktop\ChatExport_2026-02-02 (3)\messages.html,판판펀치,71,15.07.2025 00:54:02 UTC+09:00,2025-07-15,00:54,그만연장해 젠장
C:\Users\user\Downloads\Telegram Desktop\ChatExport_2026-02-02 (3)\messages.html,판판펀치,72,31.07.2025 17:12:16 UTC+09:00,2025-07-31,17:12,얍드몽현 쌀먹
C:\Users\user\Downloads\Telegram Desktop\ChatExport_2026-02-02 (3)\messages.html,판판펀치,73,05.08.2025 16:41:22 UTC+09:00,2025-08-05,16:41,"밈코어 밋업 후기

게을러서 안하다가 첫 야핑을 밈코어/밈엑스로 시작했었는데, 제 첫 야핑 소득을 안겨다준 밈코어 밋업에 @Fachenko 님 덕분에 운좋게 다녀올 수 있었습니다

원체 자금력이 빵빵한 팀이다보니 밋업에서 래플/에어드랍/프라이즈 풀도 상상이상이었고, 밋업 컨텐츠도 재밌게 짜주셔서 즐겁게 밋업 즐기고 왔습니다

홀덤은 쫄보라 안하고 블랙잭만 했는데 딜러분한테 싹 드레인당해버렸네요
딜러분이 너무 잘함..

$M 200개 에어드랍도 받고 블랙잭 도파민도 느끼고 아주 재밌었습니다

KOL은 아니라 하꼬주제에 다른 유명인사분들한테 인사하면 와사바리 당할거같아서 면식 있는 분들이랑만 조용히 밋업 즐기다가 나왔네요

야핑도 하면서 은근 정든 프로젝트라 다음 밋업/사이드 파티도 있으면 꼭 참가하고 싶네요

트위터에두 짤막하게 후기남겼습니다"
C:\Users\user\Downloads\Telegram Desktop\ChatExport_2026-02-02 (3)\messages.html,판판펀치,76,05.08.2025 22:13:46 UTC+09:00,2025-08-05,22:13,"https://open.kakao.com/o/gNW5pUKh

2차 배급받은거 일부분 메가코히로 환원하겠습니다"
C:\Users\user\Downloads\Telegram Desktop\ChatExport_2026-02-02 (3)\messages.html,판판펀치,78,05.08.2025 22:32:50 UTC+09:00,2025-08-05,22:32,"밋업 에드받은거 일부분 환원했습니다!

메가커피로 끝내면 재미없을거같아서 소소한 후펌도 같이 준비했습니다

생각보다 다들 정답을 많이 맞추시더라구요

밈코어 화이팅~"
C:\Users\user\Downloads\Telegram Desktop\ChatExport_2026-02-02 (3)\messages.html,판판펀치,81,06.08.2025 19:42:05 UTC+09:00,2025-08-06,19:42,"밈코어 2차에드 감사합니다!!!!
재밌는 밋업 열어주셔서 감사합니다!!!"
C:\Users\user\Downloads\Telegram Desktop\ChatExport_2026-02-02 (3)\messages.html,판판펀치,82,08.08.2025 18:37:47 UTC+09:00,2025-08-08,18:37,"TREE 원점회귀중

빗썸 상장쇽 is good😡"
C:\Users\user\Downloads\Telegram Desktop\ChatExport_2026-02-02 (3)\messages.html,판판펀치,83,15.08.2025 16:42:17 UTC+09:00,2025-08-15,16:42,"https://www.3ridge.io/event/68904d026aeb38763f7e8567

디스프레드측에서 Mitosis 관련 스토리텔러 캠페인하길래 얼마정도 받을까 궁금해서 살짝 살펴보기

https://dashboard.despreadlabs.io/kimchi-map-pretge?dateRange=30D&utm_source=3ridge.io

현재 디스프레드 자체제작 텔레그램 마인드쉐어 대시보드상에서 대략 2.3%인데 이 마이토시스의 점유율에 따라 전체 보상 풀이 변동됨. 
시즌 종료 시점(내일 8.16 오후 12시) 기준 마인드쉐어에 따라 해당 시즌의 총 $MITO 토큰 보상 풀이 결정됨.

2~5% 마인드쉐어 산정하면 전체 발행량(1B $MITO)의 0.01% $MITO가 할당.

스토리텔러풀은 kol들끼리 노나묵으면 되니까 일반커뮤니티 풀할당만 보면 총 보상풀의 40퍼, 200명에게 랜덤추천지급임

현재 글쓰는시점기준 참여인원수 168명이니까 200명은 무조건 채운다고 보면

1B * 0.01 * 0.01 * 0.4 = 총 40k $MITO 가 보상풀

200명씩 나눠먹으면 인당 200 $MITO

FDV $250~500M로 생각하면 밥값 정도 나오는데 mitosis 관련 게시글 3개이상 작성 기준이니 심심한사람들은 내일까지 작성해서 해봐도 좋을듯"
C:\Users\user\Downloads\Telegram Desktop\ChatExport_2026-02-02 (3)\messages.html,판판펀치,85,16.08.2025 00:10:08 UTC+09:00,2025-08-16,00:10,"[ 바이낸스에서 고이율로 1달간 꿀 빨아보자 ]

1줄 요약 : 바이낸스 풍차해서 2.3만달러로 이율 30% 빨기

(1) 바이낸스에서 9월 16일까지 USDC 예치할 경우 10%의 보너스 이자를 보장합니다. 

(2) Loan을 통해 코인을 담보로 다른 코인을 빌리게되면 담보로 잡힌 코인은 Earn에 자동으로 넣어집니다.

즉, USDC를 담보로 USDT를 빌리면 USDC는 10%의 이자를 맛보게 됩니다.

여유가 있으면 10만불 예치 후 77000$를 빌리면 23000$으로 10만불의 효과를 내는 셈이 됩니다. 돈이 여유가 없으면 가능한대로 USDT를 빌리고 USDC를 사서 예치하세요 (여러번)

현재 USDC 이율 12.22% (10% + 2.22%) 
USDT 대출이율 6.5%

((12.22% * 4.34) - (6.5% * 3.34)) = 31%의 이율

만약 USDT 대출이율이 4.5%로 줄어지면 37.68%

Risk :
Binance 거래소가 망할 확률
USDC가 디패깅날 확률"
C:\Users\user\Downloads\Telegram Desktop\ChatExport_2026-02-02 (3)\messages.html,판판펀치,86,20.08.2025 16:29:25 UTC+09:00,2025-08-20,16:29,"롯데월드 밋업 존버중 😡😡

https://lu.ma/bgu1iirz"
C:\Users\user\Downloads\Telegram Desktop\ChatExport_2026-02-02 (3)\messages.html,판판펀치,87,20.08.2025 19:15:43 UTC+09:00,2025-08-20,19:15,"FABLO KBW 티켓 당첨자 발표

떨어진웨후

*2차 이벤트도 해서 그거라도 넣음"
C:\Users\user\Downloads\Telegram Desktop\ChatExport_2026-02-02 (3)\messages.html,판판펀치,89,21.08.2025 13:44:21 UTC+09:00,2025-08-21,13:44,파티끝몽현
C:\Users\user\Downloads\Telegram Desktop\ChatExport_2026-02-02 (3)\messages.html,판판펀치,90,21.08.2025 13:47:43 UTC+09:00,2025-08-21,13:47,"KBW 빗썸 이벤트도 오늘 당첨 톡왔네요

당첨되신분은 내일17시까지 빗썸 고객센터로 전화하기"
C:\Users\user\Downloads\Telegram Desktop\ChatExport_2026-02-02 (3)\messages.html,판판펀치,91,21.08.2025 13:57:18 UTC+09:00,2025-08-21,13:57,"방금 있었던 일.txt

하리에서 이더 가격이 튀기 시작해서 하이퍼 스캔보니까

어떤 유저가 들고 있는 비트를 팔고 이더를 시장가로 사주고 있었음

바낸은 4290$ 인데 시장가로 긁히는 가격은 ~4450$ 까지

바로 보내서 조금 팔아봄

기부천사 : https://hypurrscan.io/address/0x2ea18c23f72a4b6172c55b411823cdc5335923f4"
C:\Users\user\Downloads\Telegram Desktop\ChatExport_2026-02-02 (3)\messages.html,판판펀치,94,21.08.2025 14:56:41 UTC+09:00,2025-08-21,14:56,기념으로 사봤습니다
C:\Users\user\Downloads\Telegram Desktop\ChatExport_2026-02-02 (3)\messages.html,판판펀치,95,21.08.2025 15:28:07 UTC+09:00,2025-08-21,15:28,"스트라이크 업비트 핫월렛 채우고 출금해주는듯

https://etherscan.io/address/0x8a62adb3b622051531257cc15a6eb38a32af9e38#tokentxns

천하제일 유동성 털어먹기대회 시작"
C:\Users\user\Downloads\Telegram Desktop\ChatExport_2026-02-02 (3)\messages.html,판판펀치,97,22.08.2025 17:00:33 UTC+09:00,2025-08-22,17:00,"바이낸스(Binance) 공지
Plasma USDT Locked Product: Total Subscription Limit Expands to 1B USDT With a New 250M USDT Quota 
2025-08-22 17:00:08"
C:\Users\user\Downloads\Telegram Desktop\ChatExport_2026-02-02 (3)\messages.html,판판펀치,98,22.08.2025 17:04:23 UTC+09:00,2025-08-22,17:04,"총 1B 까지 늘릴예정이고, 오늘 오후6시부터 추가 캡 열리는건 250M 추가임

apr 4토막날예정..."
C:\Users\user\Downloads\Telegram Desktop\ChatExport_2026-02-02 (3)\messages.html,판판펀치,99,22.08.2025 20:59:44 UTC+09:00,2025-08-22,20:59,"이상한 고래가 하리 BTC 매도 후 ETH 매수하는
 것 때문에 갭이 나는 걸 계속 모니터링함. 

다들 바낸에서 이더 구하고 던졌는데 난 그냥 델타 열리는 생각 안하고 호가 위아래로 계속 댐. 하필 외부라서 손으로 했는데도 수익이 남. 

--- 
손 매매 해도 수익이 날 것이라고 확신한 이유

(뇌피셜)
초반에는 하리에서 mm 돌리고 있는 윈터뮤트 같은 친구들이 계속 메이커 대주고 있어서 피뢰침이 안나왔음.

근데 문제는 고래가 300 비트씩 들고 eth로 바꿨기 때문에 mm 돌리는 친구들의 인벤토리가 빵꾸가 나기 시작한 것 같음.

처음에는 테토남 매수 다 받아먹으려고 30이더 50이더씩 호가 꽂아놓고 있었는데,

고래 인벤토리에 BTC 50개 정도 남은 순간부터 하리 오더북이 비기 시작함. 그 때부터 피뢰침이 쏴지고 손으로 딸깍 딸깍 매수매도 대줘도 사팔이 됐던듯.

하리가 말이 안되는게 상대방이 뭐하는지 다 보이니깐, btc 개수 0되는 순간 거래 안하면 됐고, btc 역갭 난거 먹고 마무리 지으면 됐음.

그러다가 다시 고래 지갑에 비트 꽂히면 전쟁 준비하기를 반복할 수가 있었음."
C:\Users\user\Downloads\Telegram Desktop\ChatExport_2026-02-02 (3)\messages.html,판판펀치,100,26.08.2025 16:48:17 UTC+09:00,2025-08-26,16:48,mexc WLFI 런패 (신규유저전용 + 풀캡 26USDT😆)
C:\Users\user\Downloads\Telegram Desktop\ChatExport_2026-02-02 (3)\messages.html,판판펀치,101,26.08.2025 16:49:59 UTC+09:00,2025-08-26,16:49,Worse than pump launchpad (max cap $75)🤔
C:\Users\user\Downloads\Telegram Desktop\ChatExport_2026-02-02 (3)\messages.html,판판펀치,104,29.08.2025 11:56:00 UTC+09:00,2025-08-29,11:56,?
C:\Users\user\Downloads\Telegram Desktop\ChatExport_2026-02-02 (3)\messages.html,판판펀치,105,29.08.2025 15:35:18 UTC+09:00,2025-08-29,15:35,"BINANCE FUTURES ARE CURRENTLY OFFLINE: MARKET

🔗 velo.xyz"
C:\Users\user\Downloads\Telegram Desktop\ChatExport_2026-02-02 (3)\messages.html,판판펀치,106,29.08.2025 16:49:44 UTC+09:00,2025-08-29,16:49,웨후
C:\Users\user\Downloads\Telegram Desktop\ChatExport_2026-02-02 (3)\messages.html,판판펀치,107,30.08.2025 20:52:06 UTC+09:00,2025-08-30,20:52,"일기장
밈코어 토큰 M이 급등해서 bsc <-> memecore 간 아비트라지

브릿지: https://app.free.tech/M?from=bnb&to=memecore
(다른 브릿지 더 있는지는 모름)

* 무턱대고 보내면 컨트랙에 물량없으면 채워질때까지 묶여서 개쳐맞음

아마 브릿지 트잭넣은 순서대로 해당 컨트랙에 M 채워지면 보낼수 있는 물량 순서대로 보내주는거같음(걍 랜덤으로 보내주는거같기도하고 몰루)

몇바퀴씩 돌리는건 마지막에 다 토해낼수도 있고
또 이렇게 급등이벤트 나오면(팀에서 물량 많이 쥐고 운전하는듯. 밋업 전에도 쫙 올렸는데 이번 kbw때도 지속적으로 운전하지않을까 싶을지도) 컨트랙 물량 지켜보고 선착순 이벤트느낌으로 참여할듯

https://explorer.meson.fi/
여기서도 직관적으로 브릿지 트잭들 구경가능"
C:\Users\user\Downloads\Telegram Desktop\ChatExport_2026-02-02 (3)\messages.html,판판펀치,108,01.09.2025 22:43:36 UTC+09:00,2025-09-01,22:43,"아무것도 안하고 선선만 먹은 사람의 오늘 수익날수있었던 것들 복기

1. eth sol chain간 gap(빨리보냈으면 10%이상, 늦게보냈으면 4%)

2. 따리 - 1등: 쿠코인, 2등: 야썸, 3등 업비트, 4등: mexc?
-현물상장을 클레임 동시에 여는곳과, 클레임이후에 여는곳을 나누어서 베팅할 이유가 있었다고봄(복기해봐도, 쿠코인에는 못보냈을거같음)

3. bybit,okx,bitget 선선 2퍼 (안정적인 가정을 꾸릴 자격이 있는 남자)

4. wlfi의 선선수요가 xpl로 향해서 바낸<>하리 xpl갭이 좁혀질거예상하고 베팅(2프로긴한데, 슬피고려하면 1프로)


종합적으로 wlfi의 상장일정이나 대해서 공부를 했었어야 했는데
선선에만 집착해서 뚝채우고 알빠노 한게 너무아쉬운 하루임"
C:\Users\user\Downloads\Telegram Desktop\ChatExport_2026-02-02 (3)\messages.html,판판펀치,109,02.09.2025 09:08:41 UTC+09:00,2025-09-02,09:08,"FABLO KBW2025 무료 초대권 이벤트 2탄 당첨자 발표

FABLO 어플 - 더보기 - 나의아이템 - 쿠폰
에서 확인가능

당첨되면 이렇게 쿠폰이 들어와있음

빗썸 당첨됐는데 또 당첨됐네;;"
C:\Users\user\Downloads\Telegram Desktop\ChatExport_2026-02-02 (3)\messages.html,판판펀치,111,02.09.2025 21:08:16 UTC+09:00,2025-09-02,21:08,"최근에 여기저기 돈넣을데가 너무 많아서 기념 뱃지만 챙기려고 100불만 재미삼아넣었는데 풀얼로드몽현

돈 많이넣어서 쥐좃할당받았으면 좀 피눈물났을거같음

*노티어는 290불 할당이엇나봄"
C:\Users\user\Downloads\Telegram Desktop\ChatExport_2026-02-02 (3)\messages.html,판판펀치,112,02.09.2025 23:35:33 UTC+09:00,2025-09-02,23:35,빗썸 서버터진듯
C:\Users\user\Downloads\Telegram Desktop\ChatExport_2026-02-02 (3)\messages.html,판판펀치,113,03.09.2025 21:16:48 UTC+09:00,2025-09-03,21:16,"KBW2025 티켓 2장 남아서 2장 뿌릴게요

가실분들은 폼에다가 이번주말까지 작성부탁.. 

https://x.com/methepann/status/1963214072196809168"
C:\Users\user\Downloads\Telegram Desktop\ChatExport_2026-02-02 (3)\messages.html,판판펀치,114,08.09.2025 15:28:19 UTC+09:00,2025-09-08,15:28,"추첨해서 대상자에게 트위터 dm으로 전달완료했습니다 😉

생각보다 많이 참여해주셨는데 나중에 더 기회가 있다면 이외에도 여러가지 뿌리도록 노력하겠습니다 ☕️"
C:\Users\user\Downloads\Telegram Desktop\ChatExport_2026-02-02 (3)\messages.html,판판펀치,115,09.09.2025 00:36:39 UTC+09:00,2025-09-09,00:36,빗썸도 뭐 보여주나
C:\Users\user\Downloads\Telegram Desktop\ChatExport_2026-02-02 (3)\messages.html,판판펀치,116,11.09.2025 00:58:10 UTC+09:00,2025-09-11,00:58,"칼데라도 2~3분전에 30분 연기공지 때렸었음
그 30분동안 바낸 상장후 출금열리고 상장 강행했었음"
C:\Users\user\Downloads\Telegram Desktop\ChatExport_2026-02-02 (3)\messages.html,판판펀치,117,11.09.2025 01:39:52 UTC+09:00,2025-09-11,01:39,상장 강행 생각하고 덱스에서 안긁어서 보낸 아비러들이 상따 갈긴거같네
C:\Users\user\Downloads\Telegram Desktop\ChatExport_2026-02-02 (3)\messages.html,판판펀치,118,11.09.2025 02:44:03 UTC+09:00,2025-09-11,02:44,"다들 알겠지만 그래도 근거 적어보면

긍정적인 점은 (유통량 이슈)

덱스 구림, 체인 구림, 브릿지 공브 제외 전부 먹통이라 이더 구하기 힘듦에도 불구하고? 그렇기 때문에? 클레임 열리고 현선갭이 10% 이내?로 내려옴 

L2라 업비트 주소 전부 같고 얼추 돌려보니까 100억도 안들어옴

그래서 그냥 클레임 풀리고 보내놓은 이더 이더렉스에서 전부 스왑 하고 보냄(딸깍 20번에 스왑한번 겨우 된거 같네)

부정적인 점은(매수세 이슈)

새벽 1시반 상장임  오픈렛저 망함 이번주 4개째 원상임 등등으로 화력을 많이 죽여놔서 그나마 70원 간거같네 

소폰 정도 조건만 됐어도 100원 찍을거라 생각했었음

1. 자체 메인넷 가진 친구들은 미리미리 돈을 넣어두기 + 기본적인 주류 덱스, 브릿지는 숙지 해두기(이후 앱스, 메가이더, OG, 모나드 등등)

2. 개인적으로 유통량 흥조건이 매수세 악조건보다 훨씬 크다 생각함 이번은 특히 그 양쪽이 극단적이었어서 업비트 따리 판단할떄 저 두개 기준으로 나눠 생각하면 판단에 도움이 됩니다"
C:\Users\user\Downloads\Telegram Desktop\ChatExport_2026-02-02 (3)\messages.html,판판펀치,119,11.09.2025 18:51:21 UTC+09:00,2025-09-11,18:51,거래지원 중인 펌프(PUMP)의 심볼명은 PUMPBTC로 지원될 예정입니다.
C:\Users\user\Downloads\Telegram Desktop\ChatExport_2026-02-02 (3)\messages.html,판판펀치,120,11.09.2025 19:31:04 UTC+09:00,2025-09-11,19:31,"https://polymarket.com/event/who-will-win-the-usdh-ticker-159?tid=1757586585198

호가 꽤 있네"
C:\Users\user\Downloads\Telegram Desktop\ChatExport_2026-02-02 (3)\messages.html,판판펀치,121,15.09.2025 13:15:11 UTC+09:00,2025-09-15,13:15,"빗썸(Bithumb) 공지변경
아반티스(AVNT) 원화 마켓 추가 (거래 오픈 오후 1시 30분 예정)
2025-09-15 13:14:55"
C:\Users\user\Downloads\Telegram Desktop\ChatExport_2026-02-02 (3)\messages.html,판판펀치,122,15.09.2025 13:15:21 UTC+09:00,2025-09-15,13:15,기싸움 on
C:\Users\user\Downloads\Telegram Desktop\ChatExport_2026-02-02 (3)\messages.html,판판펀치,124,16.09.2025 21:00:18 UTC+09:00,2025-09-16,21:00,"$AVNT 상장(Up,Bit,Binance)

타임라인
2025.09.15 11:30 - 😇 업비트 $AVNT 상장 공지
- 거래 지원: 2025.09.15 14:00 예정
- 체인: Base
- 현선 4~5퍼 까지 벌어졋다가 0.5~1퍼대 유지
2025.09.15 12:04 - 😆 빗썸 $AVNT 상장 공지
- 거래 지원: 2025.09.15 14:00 예정
- 체인: Base
2025.09.15 12:47 - 😁 바이낸스 $AVNT spot 상장 공지  
- 거래 지원: 2025.09.15 14:00 예정
- 출금지원 예정: 2025.09.15 15:00 예정
2025.09.15 13:11 - 😇 업비트 $AVNT 거래지원 개시 시점 변경 공지
- 업비트의 견제시작 (거래시점 30분 앞당김) - 거래 지원: 13:30 (수정)
- *빗썸 수정공지는 기타 공지방(대표적으로 새우잡이어선 공지방) 등에 뜨지만 업비트 수정공지는 못잡아줌. 업비트는 공식 텔그방 알람 켜둘것. *
2025.09.15 13:14 - 😆빗썸 $AVNT 거래지원 개시 시점 변경
- 빗썸 헐레벌떡 기싸움 수정공지
- 거래지원: 13:30 (수정)
- 수정 공지 당시 빗썸 입금액 약 6억원
- 업비트 거래시점 수정 공지 이후부터 현선 다시 벌어지기 시작. 3~5퍼대 현선.
2025.09.15 13:30 - 😇😆 업빗썸 입금량
- 업비트: 110억 가량
- 빗썸: 22억 가량
2025.09.15 13:35 - 😇😆 업빗썸 거래 시작
- 업비트
    - 1초봉 H:1690
    - 매도봇 돌렷어야 최상의 플레이
    - 상남자식 생따리 엿으면 많이 먹었을듯(운빨)
- 빗썸
    - H:1671
- 둘다 6~8% 정도 1분봉기준 김프
- 1분봉 따리 못먹은사람들 바낸 따리하러 회군
    - 안빼주다가 13:56 쯤에 빼주기 시작
    - 역프 구간 돌입
2025.09.15 14:00 - 😁 바낸 spot 상장
- 1초봉 H:1.4 
- 딱히 프리미엄 없음
2025.09.15 14:00 ~ 이후 
- 미친 후펌으로 1.5불까지 찍고 내려옴
- 숏 헷징치고 안푼사람들 모두 덤프트럭에 교통사고
- 따리의 영역보단 매매의 영역이라 그냥 간략하게만 타임라인 작성


특이사항
- 업비트 의문의 상장들 공통점 : ""피터틸의 Founders Fund, 리드 투자"" (출처: 돈포하 채널  참조)
- FLOCK에 이은 코베/베이스 관련 픽 상장
- 상장전에 이미 많이 올랐다고(유?출) 생각했는데 더 올림..

후기
- 매도봇 안돌리고 멍때리다가 별로 이득못봄"
C:\Users\user\Downloads\Telegram Desktop\ChatExport_2026-02-02 (3)\messages.html,판판펀치,125,16.09.2025 21:02:45 UTC+09:00,2025-09-16,21:02,"노션에다가 개인 복기용으로 상장 복기하던건데 채널에도 생각나면 올려볼 생각

부족한 점 알려주세요..

텔그는 사진 넣기가 힘들어서 노션만큼 가독성이 안좋은듯

노션에 넣어둔 중간중간 현선갭 차트나 상장당시 차트나 이런건 걍 귀찮아서 빼버림"
C:\Users\user\Downloads\Telegram Desktop\ChatExport_2026-02-02 (3)\messages.html,판판펀치,126,16.09.2025 21:43:10 UTC+09:00,2025-09-16,21:43,"$ZKC 상장 (Up/Bit/Binance)

토큰 총 공급량 1B / 초기 유통량 200M 가량
- BNB Smart Chain
0x15247e6E23D3923a853cCf15940A20CCdf16e94a
- Ethereum
0x000006c2A22ff4A44ff1f5d0F2ed65F781F55555
- Base:
0xAA61bB7777bD01B684347961918f1E07fBbCe7CF
프리마켓은 Whales Market만 존재

브릿지 
- Wormhole
- 이외에 다른것도 있긴했음(생략)

타임라인
2025.09.12 - 😁 Binance $ZKC Spot 상장 공지 
- 거래 지원: 2025.09.15 23:00 예정
- 체인: ETH, BNB
2025.09.15 18:04 - 😁 Binance Wallet 공지: $ZKC Alpha 거래시작 21:30
- Alpha 물량 인당 90ZKC
2025.09.15 18:25 - 😇 업비트 $ZKC 상장 공지
- 체인: ETH
- 거래 지원: 2025.09.15 23:00 예정
2025.09.15 18:35 - 😆 빗썸 $ZKC 상장 공지
- 체인: ETH
- 거래 지원: 2025.09.15 23:00 예정
2025.09.15 20:58 가량 - Kaito 디코 공지
- $ZKC에 대한 세부 정보를 곧 공유해 드릴 예정이니 계속 지켜봐 주세요. 현재는 가스비로 이더리움 네트워크에 $ETH를 충전할 수 있습니다
2025.09.15 21:23 - 😁 Binance Alpha 거래 시작
- 21:30분 상장이라고는 하지만 살짝 더 빨리 거래 시작하는경우가 있어서 미리 대기타고 있었는데 생각보다 거래 시작을 빨리함
- Liq 약 3.26M
- 2불 터치후 21:30분 바낸 알파 클레임 매도 압력으로 1.5라인까지 하락 (베스트 매집 타이밍)
- 1.5~1.6에서 매집 타이밍을 많이줌
- ** 재밌는거
    - 0xC06a306CfA4Cb2AcfC9e9F3740EBfb69D670969C
    - 해당 지갑이 팬케이크 스왑 풀 만들어지고 팀에서 유동성 넣어주는거 봇돌려서 스나이핑으로 잔뜩 긁음
2025.09.15 21:50 - 🍪 ETH dex pool
- liq는 당연하지만 bsc풀보다 부족해서 조심했어야함
- 슬피 고려해서 중간중간 ZKC(eth)가 더 싼 경우가 있었기 때문에 수량 모을때 브릿지 안해도 되게 eth에서 조금 매집햇어도 괜찮앗음.
- 다만 ETH → BSC 브릿지는 18분 걸린다는 말보고 시도는 안해봄
2025.09.15 22:09 - 에어드랍 물량 클레임 시작
- 야핑/프로버 에드 물량
- 카이토 런패 물량은 아직 안풀림
2025.09.15 22:00 중후반경 - 브릿지 상태 메롱
- 웜홀 route가 2개 정도 있었는데 10시 중후반 부터 bsc → eth 브릿지 상태가 메롱해지기 시작 (대부분의 브릿지 트잭이 안보내짐)
    - 하나는 스왑비가 다르고
    - 하나는 거진 1:1 비율 but Mayan으로 가면 감옥에 갇힘
    - 필자도 생각없이 보냈다가 40분가량 쳐묶임 (환불은 또 테더로 해줘서 시간러그 + 손해봄)
    - 브릿지 10~20분 지나도 갈 기미가 안보이길래 ETH dex 달려가서 매수해서 보냄
    - 브릿지 상태 메롱 + 아직까지 카이토 런패 클레임 공지 X → 상장 강행한다면 미친 대흥따리 예감
2025.09.15 22:30 - 😁 Binance Boundless(ZKC) Future/Margin 공지 
- 거래 지원: 2025.09.15 23:00
2025.09.15 23:00 - 😁 Binance 거래 시작 (Spot/Futures)
- H:1.8 이후 하락 1.4~1.5 부근대 유지
- 현선 15퍼 ~ 출금 안열어서 천천히 현선 잡히기 시작
2025.09.15 23:05 - 😇😆업빗썸 거래 시작
- 22:50 기준 입금량
    - 업비트 대략 46억
    - 빗썸 대략 10억
- 22:55 - 😇 업비트 매도 최저가 기준 업데이트 (상장 강행)
    - 상장 강행 이후 🍪 dex $ZKC 가격 1.9까지 상승
- 업비트/빗썸 모두 상장 강행(입금량 아슬아슬하게 내부 가이드라인 최소컷 채운듯)
    - 빗썸은 업비트가 강행해서 입금량 애매했지만 일단 닥상장 누른듯
- 😇 업비트: 2900~3000원 스타트 후 3700 까지 후펌
    - 1.5~1.6 매집가 기준 김프 2900~3000원대에도 30~40%
    - 1.8~1.9 뒤늦게 대가리 깨고 매수했어도 김프 10~20%대는 줌
- 😆 빗썸: 2900~3300 스타트 후 업비트 대비 적은 물량으로 미친 후펌 (ATH 7000원)
    - 당시 거래직전 빗썸/업비트 호가봤으면 빗썸이 업비트에 비해 텅텅인게 한눈에 보일정도
- 빗썸 입금량이 적었고, 5~6천원 돌파시점에 후따리 보내면 최소 한사이클은 무조건 먹여줄거라는 판단에 후따리 시작
    - 당시 bsc→eth 브릿징해서 보내기에는 시간 촉박 / 22:00 중후반 부근에 보낸 브릿지 아직도 환불안된 점 생각해서 이더 덱스에서 긁어서 보냄
    - liq 텅텅이라 앞 트잭찍히는거 보고 피뢰침 피해서 매수
    - 후따리 용사들로 인해 ZKC(eth) 2불선에 안착
    - 한 사이클 보내고 나서 고래형님들 7000에서 반토막까지 밀어버리는거 보고 욕심 안부리고 한사이클에서 스탑.
        - 웬만해서는 봇돌리는 따리형들 못이김
2025.09.15 23:44 - 😁 Binance 출금 오픈
- 바낸 출금 물량으로 차트 진압완료 (범인은 you know who…)
- 공지후 현선 8퍼까지 벌어짐
2025.09.16 00:00 - Kaito 공지 ($ZKC 런패 물량 곧 에어드랍 하겠다) 
- 런패 물량 헷징
    - 풀펀비 유지하다가 풀펀비 살짝 풀려서 1시에 바낸 기준 대략 -1.45% 펀비 상납
- 출금은 2025.09.16 00:40분 가량부터 열린듯
    - 스왑/출금 가스비 이슈(fee가 사악했음)
2025.09.16 02:30 - 😅  Boundless(ZKC) Coinbase Spot 상장 공지 

당시 리스크/고려해야 할 점 이모저모
- 카이토 런패가 제때 세일물량 분배해줄까?
    - 카이토 런치패드에는 47M $ZKC 할당 (평단 FDV 290M) / 이중 50%만 TGE 언락 , 나머지는 6개월 후 언락
    - 전체 공급량의 2% 가량이 풀리기 때문에 카이토 런패 클레임이 상장 전에 되느냐에 따라 따리 흥행의 행방이 상당히 달라짐.
    - 따리하면서도 여러 고수들의 얘기도 듣기도 했고 지금껏 카이토의 행보를 보았기 때문에 카이토의 기술력 부족 이슈로 상장 후에 클레임 풀린다는 쪽으로 베팅.
        - 지금까지 8개 프로젝트 런치패드를 진행중이지만 진행과정에서 잡음이 굉장히 많았음 (할당 이슈, 보증금 이슈, 환불 이슈…)
        - 런패 진행도 제대로 못하는데 첫번째 런패 클레임이 원활히 돌아갈거라고 생각하는건 너무 낙관적인 예측이라고 판단
- 상장 연기 및 바낸 출금 오픈
    - 다만 최근 상장 기조를 봤을 때 웬만하면 상장 강행했기 때문에 따리 해볼만하다고 생각함
    - 다만 칼데라처럼 업빗썸 30분연기하고 짱펑이 상장 직후에 출금열었으면..
        - 당시 지갑 까보면 바낸 핫 물량이 많았어서 업비트 견제로 짱펑 입맛대로 출금 열어버려서 죽였을 수도 있음
        - 세자리 일기장님도 이야기하셨던 내용
- 웨일즈마켓 장외거래가 보고 0.8~1불선 스타트 생각햇고, 1.2~1.3불도 대가리 깨고 살 생각이엇는데 실제 덱스 스타트가 너무 비싸서 손이 안갔음
    - 당시 장외가 $0.9 / MC 180M 가량.
    - 장외마켓이 Whales Market만 상장해있다는 점 / Pre market 거래량이 그렇게 크지는 않았다는 점 → 국내 거래소 및 바이낸스 등 Major CEX 상장 기대감으로 가격 견인했다고 보고 솔직히 시작가 1.5불 이상은 생각해본적이 없음.
    - 무케님이 상장 당일날 장외가 관련해서 맛있게 말아주셨으니 디테일은 해당 게시글 보는게 더 좋음


후기
- 맛드몽현
- 상장따리/후따리 적당히 먹고 숏 진입도 생각해볼걸"
C:\Users\user\Downloads\Telegram Desktop\ChatExport_2026-02-02 (3)\messages.html,판판펀치,127,17.09.2025 19:07:40 UTC+09:00,2025-09-17,19:07,"개인적인 복기 텔방에 옮겨본건데 많은 분들이 봐주셔서 살짝 부끄럽네요
포워딩해주신 선생님들 감사하고 부족한 점 있으면 많은 피드백 바랍니다
따리 초보인에옹🥲

그리고 아무래도 텔레그램으로 글을 길게 써보긴 거의 처음이라 가독성에 대한 고려가 미진했네요

그래서 앞으로는 가독성 좋게 그냥 노션에다 정리해볼까 싶네요

어제 AVNT/ZKC 상장 복기했던거 노션에다가 더 가독성 좋게해서 올렸으니 텔그 글 말구 노션글 봐주시면 될 것 같습니다 😒

$ZKC 상장 (Up/Bit/Binance)
$AVNT 상장 (Up/Bit/Binance)"
C:\Users\user\Downloads\Telegram Desktop\ChatExport_2026-02-02 (3)\messages.html,판판펀치,128,17.09.2025 20:17:45 UTC+09:00,2025-09-17,20:17,"오늘도 업빗썸의 상장이 있었습니다

TOSHI랑 HOLO 상장이었는데 이번에도 좋은 퍼포먼스를 보여줬네요

요 근래 원상 퍼포먼스가 너무 좋은데 이러다가 언제 한번 망따리에 교통사고 당할거 같아서 두렵네요

금일 따리는 외출 나갔다 와서 멀뚱멀뚱단 합류했다가 포모와서 후따리만 좀 해봤는데 인간지표 적립했네요 😂

노션 복기 ⤵️
$TOSHI 상장 (Up/Bit)
$HOLO 상장 (Bit)"
C:\Users\user\Downloads\Telegram Desktop\ChatExport_2026-02-02 (3)\messages.html,판판펀치,130,19.09.2025 13:59:52 UTC+09:00,2025-09-19,13:59,"다들 원상을 확신하던 BARD가 어김없이 원상을 했습니다

슬슬 망따리 나올 타이밍이 아닐까하는 얘기를 꺼냈었는데 종합적으로 보면 플레이에 따라 망따리가 되기 아주 쉬운 따리가 아니었나 싶네요

몇몇 플레이 / 그때그때 최선의 판단을 한 사람들 제하면 먹기가 힘들기도 했고 여러가지 자연재해가 있어서 고난도의 따리가 아니였나 생각이 듭니다

LA TAO 따리 복기는 좀만 있다 올리고 어제의 메인디쉬 먼저 올리겠습니다

노션 복기 ⤵️
$BARD 상장 (Up/Bit/Binance)"
C:\Users\user\Downloads\Telegram Desktop\ChatExport_2026-02-02 (3)\messages.html,판판펀치,131,19.09.2025 23:17:37 UTC+09:00,2025-09-19,23:17,"사이드 디시였던 LA와 TAO편입니다

메인이었던 롬바드에 비하면 쉬운 난이도였습니다

의외로 TAO가 18일날 상장중 난도 대비 가장 나은 퍼포먼스를 보여줘서 놀랐습니다
TAO는 무난무난 평범한 원상이었지만 눈여겨볼만한 플레이도 있어서 한번 보면 좋을 것 같네요

아마 LA는 옆상대비 암살이 많이 심어져있던거도 하나의 망따리 요인이 되지않았나 싶기도 합니다

다만 이 3개 상장이 저녁시간대에 몰려서 LA → TAO → BARD 순으로 집중력을 소모해야 해서 굉장히 피로했네요
하나씩 순차적으로 한 코인에 집중할 수 있었던 것도 아니고 거진 이 3개를 동시에 봐야했어서 더욱 피로했던 것 같네요

공지 자체는 비슷한 시간대에 나왔기 때문에 선택과 집중을 하는 편이 더 나았을 것 같긴합니다..

노션 복기 ⤵
$LA 상장 (Up) 
$TAO 상장 (Bit)"
C:\Users\user\Downloads\Telegram Desktop\ChatExport_2026-02-02 (3)\messages.html,판판펀치,133,20.09.2025 21:21:45 UTC+09:00,2025-09-20,21:21,"KMNO 상장 복기입니다

특별한 일은 없었습니다

다만 경석이형이 btc usdt 마켓에 이것저것 엄청 상장시켜놔서 슬슬 암살픽을 하나 미리 생각해두고 싶네요

평일 상장러쉬 끝나고 주말 휴식기 찾아왔으니 그동안은 아스터 펀비작 등 아스터에서 먹거리들을 좀 찾아볼까 싶네요

노션 복기 ⤵
$KMNO 상장 (Bit)"
C:\Users\user\Downloads\Telegram Desktop\ChatExport_2026-02-02 (3)\messages.html,판판펀치,134,22.09.2025 15:22:18 UTC+09:00,2025-09-22,15:22,"0g mainnet - Layerzero OFT

스게 프론트에 안올라올 가능성 꽤 있다고 생각
프론트에 없으면 컨트랙으로 쏘기

BNB eid : 30102
ETH eid: 30101
0G mainnet eid: 30388

예시 트잭
bsc → mainnet
https://bscscan.com/tx/0xa8ca9fe850c89b1f5ca38df8ab62eca44b6dbe3d950955e16b3972c256f2ca3e

mainnet dex: https://jaine.app/swap"
C:\Users\user\Downloads\Telegram Desktop\ChatExport_2026-02-02 (3)\messages.html,판판펀치,135,22.09.2025 19:08:16 UTC+09:00,2025-09-22,19:08,"클레임X 브릿지X

일단 스게 프론트는 뜨긴함 (보내봤자 안보내질거임 브릿지 성공트잭 아직 새로 안뜸) 

+) 업빗썸 연기

개인적으로 바낸 출금 열리지 않을까 싶습니다

https://stargate.finance/bridge?srcChain=bsc&srcToken=0x4B948d64dE1F71fCd12fB586f4c776421a35b3eE&dstChain=og&dstToken=0xEeeeeEeeeEeEeeEeEeEeeEEEeeeeEeeeeeeeEEeE"
C:\Users\user\Downloads\Telegram Desktop\ChatExport_2026-02-02 (3)\messages.html,판판펀치,136,25.09.2025 17:12:29 UTC+09:00,2025-09-25,17:12,"폭풍같았던 KBW 기간도 슬슬 끝이 보이네요
그동안 본행사/여러 사이드파티 참석해서 집에서 찬찬히 정리할 시간이 없어서 많이 늦었습니다

아일릿도 코앞에서 보고, 야간 롯데월드도 가보고 그 과정에서 수많은 고수들을 실물로 영접해보기까지하면서 바쁜 나날을 보냈습니다..
여기저기 돌아다니는데 상장은 계속하고, UXLINK/PINKFONG 등등 여러 이벤트가 계속 터져서 너무 바빳네요

그래서 플라즈마 상장전 밀린 숙제 조금이라도 올려볼까 합니다
오늘은 9.22 원상 목록들만 어느정도 정리해놨는데, 아침에 기습 옆상한 SUN도 괜찮은 퍼포먼스를 보여줬고, 0G는 아시다시피 crime 그 자체였죠

나머지 상장은 최대한 빨리 올려볼려고 노력중이긴한데 상장 당시에 바로바로 이게 작성을 해야되는데 며칠 지난채로 기억이 희미해지고 + 피로가 쌓인 상태로 기록하니 가독성도 이전에 비해 떨어지고 뭔가 놓치거나 그때 당시 쓰고싶었던 내용을 100% 반영해서 못쓰겠네요 ㅠㅠ

그래서 0G 포함 이후 복기들이 좀 미흡한 점이 이전보다 더 많이 보일 수 있으니 많은 피드백 부탁드립니다..
특히 0G의 경우는 타임라인도 복잡하고 당시에도 많이 혼란스러웠어서 깔끔하게 정리하기가 어렵네요


노션 복기 ⤵️
$SUN 상장 (Up) 
$0G 상장 (Up/Bit/Binance)"
C:\Users\user\Downloads\Telegram Desktop\ChatExport_2026-02-02 (3)\messages.html,판판펀치,138,25.09.2025 20:11:25 UTC+09:00,2025-09-25,20:11,"플라즈마 브릿지

스타게이트:
https://stargate.finance/bridge?srcChain=bsc&srcToken=0x405FBc9004D857903bFD6b3357792D71a50726b0&dstChain=plasma&dstToken=0xEeeeeEeeeEeEeeEeEeEeeEEEeeeeEeeeeeeeEEeE

docs보면 점퍼, 디브릿지, 릴레이 등 어그리게이터나 CCIP/하이퍼레인 등등 있는데 스게 프론트에 올라왔으니 스게만 보면 될듯

레제로 트잭 찍히는건 계속 봤는데 굳이 컨트랙 안해도 빠르게 스게 프론트 올라올거 같아서 기다리다가 이제 공유"
C:\Users\user\Downloads\Telegram Desktop\ChatExport_2026-02-02 (3)\messages.html,판판펀치,139,25.09.2025 21:40:24 UTC+09:00,2025-09-25,21:40,라는데 실제로 들어온 사람들이 있는지
C:\Users\user\Downloads\Telegram Desktop\ChatExport_2026-02-02 (3)\messages.html,판판펀치,140,25.09.2025 21:43:45 UTC+09:00,2025-09-25,21:43,이거 오해가 있을수도있는데 커뮤 물량 =역할가진사람 ㅠㅠ!!
C:\Users\user\Downloads\Telegram Desktop\ChatExport_2026-02-02 (3)\messages.html,판판펀치,141,26.09.2025 02:20:24 UTC+09:00,2025-09-26,02:20,"하리 새벽에 레전드 USDT 아비트라지 찬스 있었음
최대 4%갭까지 줌
이제는 호가 빵빵해져서 맛없어진 에후.."
C:\Users\user\Downloads\Telegram Desktop\ChatExport_2026-02-02 (3)\messages.html,판판펀치,142,26.09.2025 18:57:39 UTC+09:00,2025-09-26,18:57,"MIRA 브릿지는 역시 레제로
bsc -> base로 보내는거는 스게 프론트에 안올라오면 컨트랙으로 쏘기"
C:\Users\user\Downloads\Telegram Desktop\ChatExport_2026-02-02 (3)\messages.html,판판펀치,143,27.09.2025 16:34:29 UTC+09:00,2025-09-27,16:34,"지각생의 9.23, 9.24일 원상 끄적끄적 복기입니다

FLUID가 흥따리였습니다
HEMI는 뭐 평범한 1~2퍼 띠기 따리였는데 빗썸 원상보다는 CZ meta로 인한 hemi의 상승, 바이낸스 상장 쪽을 보는게 더 도움될 것 같다는 생각입니다

크게 길게 작성할만한 내용은 없는 따리몽현들이고, KBW기간동안 지금 원상을 10개를 해서 숙제가 너무 많이 쌓였습니다..

이번주 KBW 기간동안 한 원상은 이제 6개 남았네요...

노션 복기 ⤵️
$FLUID 상장 (Up) 
$HEMI 상장 (Bit/Binance)"
C:\Users\user\Downloads\Telegram Desktop\ChatExport_2026-02-02 (3)\messages.html,판판펀치,145,27.09.2025 16:56:23 UTC+09:00,2025-09-27,16:56,"그리고 어제 @tk_yeo 선생님이 승인해주셔서 좋은 기회 받아 디파이앱 프라이빗 밋업에 다녀왔었습니다

퀴즈 진행도 재밌었고, 디파이앱 관련 알파도 듣고 내로라하는 유명 kol분들을 두 눈으로 담을 수 있었던 귀중한 시간이었습니다

너무 유명하신분들이 많아서 쭈구리로 얌전하게 밥만먹고 조용히 있다가 면식 있는 몇몇 분들한테만 인사좀 드리고, 미라따리하러 tk선생님한테 인사드리고 나왔습니다..

밥몽현도 아주 맛있었고 좋았습니다
사진은 당일 밥몽현 사진입니다

디파이앱 선물 수수료도 0.01%로 인하되었으니 열심히 실사용해가면서 Bonus HOME 언락해볼까 합니다!"
C:\Users\user\Downloads\Telegram Desktop\ChatExport_2026-02-02 (3)\messages.html,판판펀치,151,29.09.2025 15:10:37 UTC+09:00,2025-09-29,15:10,"KBW 기간 상장 중 Big thing 중 하나 였던 XPL입니다

세일이나 에드나 너무 혜자였지만(망따리 요건)  노션에 작성해둔 여러 가지 요인으로 따리 자체만 놓고보면 망따리였습니다

XPL 복기 자체는 초고수 팡팡님의 웨옹복기가 있으니 팡팡님쪽 복기를 보는게 더 피와 살이 되지않을까 싶네요

주말에 좀 쉬느라 밀린 숙제가 아직 좀 남았는데 열심히 해보겠습니다
그리고 다시 평일 스타트라 숙제가 더 많아질 것 같네요😂

노션 복기 ⤵️
$XPL 상장 (Up/Binance)"
C:\Users\user\Downloads\Telegram Desktop\ChatExport_2026-02-02 (3)\messages.html,판판펀치,152,29.09.2025 18:32:22 UTC+09:00,2025-09-29,18:32,"SUPER

- 아발 - 이더메인넷
- 상장공지뜨고 할만했던 플레이
- 갭 좀 심했었음 10~20%
- AVAX -> ETH 브릿지 
- https://blackhole.xyz/bridge"
C:\Users\user\Downloads\Telegram Desktop\ChatExport_2026-02-02 (3)\messages.html,판판펀치,154,29.09.2025 20:18:06 UTC+09:00,2025-09-29,20:18,"FLUID 기출 생각(FLUID도 후펌줬음)나서 바로 업비트 보냄
맛드몽현

업비트 대흥따리로 시작하면 아발란체 dex가가 못따라와서 아발란체에서 호다닥 긁어서 브릿지보내서 업비트보내서 먹은듯"
C:\Users\user\Downloads\Telegram Desktop\ChatExport_2026-02-02 (3)\messages.html,판판펀치,155,29.09.2025 21:15:08 UTC+09:00,2025-09-29,21:15,"https://www.bithumb.com/react/inout/address/register/coin

빗썸 이거 등록하면 입금심사 없음

반드시 등록해 ㄱㄱ"
C:\Users\user\Downloads\Telegram Desktop\ChatExport_2026-02-02 (3)\messages.html,판판펀치,156,29.09.2025 22:02:48 UTC+09:00,2025-09-29,22:02,"업비트 핫월렛

https://etherscan.io/address/0xe2ae7b9df303b877d555fd871e9d771f71fc28b9

https://etherscan.io/address/0x8b09c96f6c36c1728a64bf35dc8584388384ca91

https://etherscan.io/address/0x52CA871D923E80fb03A1c92fde969CaD5014ae28

0.8기준 대략 91억원?"
C:\Users\user\Downloads\Telegram Desktop\ChatExport_2026-02-02 (3)\messages.html,판판펀치,157,30.09.2025 00:25:49 UTC+09:00,2025-09-30,00:25,"이번엔 따리는 왜 성공했을까?

단순하게 말하자면 모든 상황이 흥따리로 가는 선택지를 골라줬음.
1.에드 클레임 막힘
2.비들패드 일부만 클레임 됨
3.브릿지 소요시간이 매우 오래걸림
4.미친듯한 기위 상승

이 모든게 겹쳤고,당연히 흥따리로 갈 수 밖에 없었다고 생각함

더 이상 물량이 안나올것이고 나온다해도 상장시간이 코앞이라 시간 대비 괜찮을거 같아서
0.6에 이더에서 좀 더 긁었음.

기위가 높아서 가스비 때문에 생각보다 주저하시는분들도 있었는듯

그리고 업빗썸 둘중 하나 선택을 했어야 했는데 둘다 입금액이 생각보다 적어서 고민을 좀 하다가 

둘다 선택함.
업비트 70 빗썸 30 수준으로 보냈음.
결국 업비트는 내 평단기준 약 4배라는 흥따리를 보여주었고
빗썸도 최소 2배의 흥따리를 보여줬음.

저는 그래도 비록 높은가격에 팔진 못했지만 그래도 만족 빗썸은 안팔려서 한참이나 뒤에 팔음 그래도 만족."
C:\Users\user\Downloads\Telegram Desktop\ChatExport_2026-02-02 (3)\messages.html,판판펀치,158,30.09.2025 17:52:56 UTC+09:00,2025-09-30,17:52,"반갑읍니다 행님들.
OPENMIND 한국 커뮤니티. 처음 인사 올립니다.

KBW를 기점으로 OPENMIND가 한국 커뮤니티를 본격적으로 만나기 위하여 여러분과 함께할 특별한 커뮤니티 이벤트를 준비했습니다

🤖OPENMIND란?
OPENMIND는 ""Linux on Ethereum for robotics""라는 개념으로, 지능형 기계를 위한 탈중앙화 운영체제를 개발합니다.
로봇 기종에 관계없이 사용 가능한 OM1 운영체제와 FABRIC 통신 프로토콜을 통해 다양한 로봇들이 하나의 생태계에서 소통할 수 있게 합니다. AI와 DePIN(탈중앙화 물리 인프라)을 결합한 블록체인 기반 로봇 생태계로, 기존 중앙집중식 시스템을 넘어선 분산형 로봇 네트워크를 구현하고 있습니다.
참여방법 

1. OPENMIND 한국 공지방에 입장합니다.
2. OPENMIND 한국 채팅방에 입장합니다.
3. 채팅방에 인사를 남겨주세요.
4. 구글폼을 작성해주세요.

참여 기간
2025. 09. 30 (18:00) ~ 2025. 10. 05 (19:00)

이벤트 보상
- BBQ 황금 올리브 치킨+콜라1.25L : 20명 추첨
- 스타벅스 아이스 아메리카노 T: 100명 추첨"
C:\Users\user\Downloads\Telegram Desktop\ChatExport_2026-02-02 (3)\messages.html,판판펀치,159,30.09.2025 19:22:44 UTC+09:00,2025-09-30,19:22,"어제는 대흥따리 2개가 있었네요
어제 같은 따리를 바로바로 올려야 되는데 밀린 숙제가 많아 이전 상장 2개 먼저 올리겠습니다

XPL 상장 당일날(9.25) 빗썸에서 마구잡이 상장 진행한 BTR, POPCAT 복기입니다

크게 복기할만할 거리가 있었던 상장은 아니니 결과정도만 가볍게 숙지하시면 될 것 같습니다

찬찬히 숙제 해결해나가려 했는데 경석/백영 듀오가 부족해보였는지 숙제 3개 더 얹어줘서 최대한 빨리 따라잡아보겠습니다...

노션 복기 ⤵️
$BTR 상장 (Bit) 
$POPCAT 상장 (Bit)"
C:\Users\user\Downloads\Telegram Desktop\ChatExport_2026-02-02 (3)\messages.html,판판펀치,161,02.10.2025 20:07:55 UTC+09:00,2025-10-02,20:07,"1. DoubleZero의 기본 토큰 이름은 무엇입니까?

✅ 2Z

2. SEC가 2Z 토큰에 대해 발행한 것은 무엇입니까?

✅ 비조치의견서(No-Action Letter)

3. 더블제로의 핵심 미션은 무엇입니까?

✅ 대역폭 증가, 지연 감소 (IBRL)

4. 기여자들이 왜 광섬유 링크를 더블제로 네트워크에 추가합니까?

✅ 자신들의 기여 가치에 따라 2Z 토큰 보상을 받기 위해

5. 더블제로의 공정한 보상 분배를 가능하게 하는 알고리즘은 무엇입니까?

✅ 셰플리 값(Shapley Value)

6. 2025년 10월 2일 기준, 솔라나 스테이킹 비중의 몇 %가 더블제로 네트워크에 연결되어 있었습니까?

✅ 21%

7. 더블제로가 메인넷-베타를 출시한 시점은 언제입니까?

✅ 2025년 3분기

8. 더블제로 네트워크에서 2Z 토큰은 어떻게 인센티브 역할을 합니까?

✅ 네트워크 기여자들에게 보상으로 지급된다

9. 아래 중 더블제로의 잠재적 활용 사례가 아닌 것은 무엇입니까?

✅ 가정용 인터넷 연결

10. 다음 중 더블제로의 기여자로 나열된 회사는 무엇입니까?

✅ 갤럭시(Galaxy)"
C:\Users\user\Downloads\Telegram Desktop\ChatExport_2026-02-02 (3)\messages.html,판판펀치,162,02.10.2025 22:54:58 UTC+09:00,2025-10-02,22:54,"오늘 맛있었던 것 중 생각나는 건

1. 메테오라 fee 빨기
2. 적당히 사서 따리
3. 선물 쇽
4. 후따리 잘하기
5. 선선갭 - 바이낸스가 살짝 더 낮았음

근래 따리 중에서 제일 바쁘게 움직였네요

근데 결과는 1~5 다 하고도 손해를 겨우 면한 수준인레후

애매하게 메테오라 진입하고, 애매하게 사고, 애매하게 후따리 한 게 패착인 듯

메테오라는 준비 잘 해서 레인지 잘 설정해둬야 했고 성공한 케이스 

매수는 원래 하던 데로 가격 신경 안 쓰고 긁었어야 했고

쇽은.. 쉽지 않음.. 머든 간 다음엔 더 준비해서 잘 먹어봐야겠네요 

솔라나는 몽가 먹을 게 많다.. 🍗"
C:\Users\user\Downloads\Telegram Desktop\ChatExport_2026-02-02 (3)\messages.html,판판펀치,163,02.10.2025 23:03:42 UTC+09:00,2025-10-02,23:03,"더블제로로 리스크 감수를 줄이고, 돈버는방법정리

1. 메테오라풀설정

정말 잘 모르는 분야이지만, 이번에 잘하는 사람들보면서 많이 배웠는데
낮은 가격에라도, 메테오라 풀 설정 잘해놓고, 체결시켰으면 괜찮았던것 같음

2. 하리<>binance 갭
7~9%정도 갭이 3분동안 유지되었고, 오더북도 빵빵레후 였음
그이후에, 3~4%갭이 15분동안 꽤 오래유지되어서, 잡기에 정말괜찮았음
indexprice도 바이낸스 현물추종인거 확인후, 진입했음

하리공지방 텔레그램이, 트위터알림보다 30초정도 빨리와서, 꼭 알림켜두는거 추천

3. backpack spot출금따리
backpack spot가격이 dex보다 15%정도 낮아서, 선물헷지후, 따리했어도 괜찮았음"
C:\Users\user\Downloads\Telegram Desktop\ChatExport_2026-02-02 (3)\messages.html,판판펀치,164,03.10.2025 15:39:45 UTC+09:00,2025-10-03,15:39,"더블제로는 좀 무서워서 보수적으로 플레이했는데, 결과적으로 패인이었네요
리테일 물량이 거진 0이고 마음대로 운전가능한 코인이라 무서워서 그런건데, crime szn에는 그냥 대가리 깨는게 답이네요

레이디움/메테오라만 좀 돌리다가 마지막에 최고점에서 하락할때 마구마구 사지면서 커뮤니티 멤버가 되서 기도하다가 적당히 도망가고 후따리로 겨우 멘징하고 일당만 했네요😒

오늘은 9.26일자 복기 마저 올리겠습니다

MIRA 상장복기는 따리 처음해보시는분들이면 꼭 한번씩 해보시면 좋을 것같네요
나머지 2개는 크게 중요하진 않고, FLUID는 업비트 -> 빗썸 따라 원상하는 경우 예후가 어떤지 알아보는 그런 감성으로 보시면 될 것 같습니다

이제 긴 연휴의 시작인데, 아마 원상도 당분간 휴식기일 확률이 아주 높습니다
저는 밀린 숙제 후다닥 끝내서 올릴테니 많이 봐주세용 😒


노션 복기 ⤵️
$MIRA 상장 (Up/Bit/Binance) ✨✨✨🥰
$CUDIS 상장 (Bit) 
$FLUID 상장 (Bit)"
C:\Users\user\Downloads\Telegram Desktop\ChatExport_2026-02-02 (3)\messages.html,판판펀치,167,04.10.2025 19:35:34 UTC+09:00,2025-10-04,19:35,"연휴 잘 보내고 계신가요?

밀린 숙제 이제 3개만 더하면 끝이네요

9.29일자 복기입니다
복기할 내용이 많았던 정신없던 날이었습니다

FF은 두말할 것 없고, SUPER도 복기할만한 가치가 충분히 있는 원상이라고 생각합니다
특히 FLUID때와 유사한 조건으로 FLUID 복기를 했더라면, 나름의 근거를 가지고 베팅을 할 수 있었던 픽이 아닐까 싶네요
단순 업비트 따리 외에도 큰 기회가 있었던 픽이기도 하구요

빗썸 XPL 상장은 사실 크게 안봐도 무방할것 같습니다
단순 기록용으로 작성만 해놨습니다


노션 복기 ⤵️
$FF 상장 (Up/Bit/Binance)  ✨✨✨
$SUPER 상장 (Up)  ✨✨
$XPL 상장 (Bit)"
C:\Users\user\Downloads\Telegram Desktop\ChatExport_2026-02-02 (3)\messages.html,판판펀치,170,05.10.2025 13:02:16 UTC+09:00,2025-10-05,13:02,"안녕하세요. zi존파워잼민입니다. 
정말 많은 분들께서 질문을 보내주셔서 진심으로 감사드립니다.
최대한 많은 분들을 선정해 답변드리고 싶었지만, 일일이 답장드리지 못한 점 양해 부탁드립니다.

저 역시 따리를 완벽하게 잘 해내는 건 아니지만, 코인판에서 꾸준히 따리를 해오며 쌓아온 경험을 바탕으로
조금이나마 여러분에게 도움이 되고자 이번 Q&A를 준비하게 되었습니다.

이 아래에는 여러분이 주신 질문들에 대한 답변을 정리했습니다.

Q. 따리를 하기 위한 준비물과 세팅 방법 
체인별 가스비: 최소 30달러 이상은 넣어두시는게 좋습니다.
(특히 이더리움 체인은 가스비가 높으니 조금 더 여유 있게 준비하는 게 좋습니다.)
브릿지가 필요할 경우 양쪽 체인에 테더 또는 써클 넣어놓기

세팅 방법
-새로운 체인일 경우 RPC 바꿔놓기(선택사항 굳이 안해도 됨)
-브릿지 미리 켜두기
-CA(컨트랙트 주소) 메모해두기
-상장 시간 메모해두기
-알람,매도 봇 셋팅 해두기

Q. 공식 코인이 출시되었을 때 DEX 구매 전 오피셜 코인인지 확인하는 법이 궁금합니다
공식홈페이지,트위터,거래소 공지,코인마켓캡에서 확인이 가능합니다.

Q. 업비트 입금 네트워크와 미리 dex상장한 네트워크가 다를때 브릿지가 필요한데 그 브릿지를 어떤 방식으로 찾으시나요? 
-컨트랙트에서 트랜 찾아보기
-X에서 찾아보기
-구글에 검색
이 정도만 해도 대부분 필요한 정보는 다 찾을 수 있습니다.

Q. 다양한 브릿지 루트알려주세욤. 
레이어제로, 하이퍼레인, 트랜스포터, 웜홀, 컨트랙트 정도가 있네요.

Q. 따리할때 초보자들이 가장 많이하는 실수, 및 절대 하지말아야하는 것들 
CA나 심볼을 확인하지 않거나,
체인을 헷갈리고 입출금 주소를 체크하지 않는 경우도 있습니다.
절대 시드 100%로 따리하지 말기, 헷징 안 잡기, 근거 없이 들어가지 말기.

Q. 상장공지가 떴을때 제일 먼저 떠오르는 아이디어나 사고의 흐름이 궁금해요!  어디 사이트에서 뭘 확인하고 진행하는지요 
상장 공지가 업비트나 빗썸 기준으로 나왔다면,
지난번 상장 복기를 한 번 더 보고 머릿속에 새겨두고
체인 지원 여부를 확인하고,
그다음 CA(컨트랙트 주소)를 찾은 뒤 브릿지를 확인합니다.
그리고 시나리오를 어느정도 짜보는 듯 합니다.

Q. 거래소별 핫월렛 입금량을 보면서 따리를 해야할것같은데, 따로 확인하시는 방법이 있나요? 
데이터맥시를 활용해
핫월렛을 제공받는 대로 사용하거나,
제가 직접 최소 입금을 넣어 직접 핫을 따보기도 합니다.
만약 따내지 못할 경우에는 지인분들의 도움을 받는 편입니다.

Q. 따리할때 업비트, 빗썸에 몇 대 몇 비율로 보내는지 궁금해요! 
당시에는 입금액에 비례하긴 했지만,
예전에는 한 곳에 모두 넣었습니다.
지금은 보통 업비트 6, 빗썸 4 정도의 비율로 나누거나, 상황에 따라 다시 몰빵하기도 합니다.

Q. 내가 하려는 따리의 흥망을 판단할 수 있는 기준
-입금량
-체인 속도 여부
-MC, FDV
-CEX 상장 여부
-CEX 입금까지 시간 여부(컨펌 횟수)
대부분 이러한 요소들을 바탕으로 흥할지 망할지를 어느 정도 예측해봅니다.

Q. 따리할때 매수분만 따지면 총 시드의 몇퍼정도 잡으시나용? 
해당 질문은 저의 시드를 유추해 볼 수 있기에 다른 답변이지만
제가 따리를 할 때 어떤 방식을 추구하는지는 말씀드릴 수 있습니다.
저는 항상 정해진 금액 안에서만 플레이합니다.
예를 들어 1,000달러로 시작했다면 그 금액만 사용하고,
더 태우고 싶을 때도 최대한 2배 이내로만 늘립니다.

이유는 간단합니다.
따리는 기회가 계속 오지만,과하게 들어가면 한 번의 실수로 많은 시드를 잃을 수가 있습니다.
그래서 저는 늘 리스크를 통제하면서 꾸준히 참여하는 방향을 택했습니다.
이게 장기적으로 보면 가장 안정적이고, 결국 더 오래 살아남는 방법이라고 생각합니다.

Q.업빗썸 상장을 예상하고 웨일즈 마켓과 같은 프리마켓에서 미리 긁기도 하나요?
이것도 조금 생각해봤는데, 고려해야 할 것이 너무 많습니다.
프리마켓 가격도 중요하고 CEX 상장,헷징 여부도 중요해서 생각할 부분이 많습니다.
그래서 테스트해볼 만한 플레이가 아닐까 싶네요.

Q. 업빗썸 상장이 뜨고 모든거래소 출금이 열려있고 현선갭도 크지 않을때는 헷징을 하나요? 헷징을 하지않는다면 그 기준이 궁금합니다.
헷징은 리스크를 최소한으로 줄일 수 있는 수단입니다.
무조건 헷징하는 것이 좋다고 생각합니다.
저는 한 번 노헷징으로 크게 손실을 본 이후로 최대한 헷징을 하는 편이네요.
시드를 지키기 위해서라면 필수라고 생각합니다.

제가 따로 헷징을 하지 않는 기준은
CEX 상장 여부, 생각보다 반응이 안왔을 경우,핫월렛이 적을 경우
그럴 때는 상승분까지 함께 먹을 수 있어서 헷징을 하지 않았던 것 같습니다.
또는 외부에 있어 정리를 바로 하지 못할 경우에도 헷징을 생략하곤 했습니다.

Q. fdv가 5b-6b 이런 엄청 무거운 상황 이였는데 그래도 어느정도 업사이드가 있겟다고 판단하신건가요 
예전에는 밸류를 많이 고려했었는데,
최근에 상장한 코인들을 보면 불장이 지속 되는 이상 TGE 상장 시 밸류가 크게 중요하지 않은 것 같습니다.

예를 들어, 지난번 2Z의 경우를 보면 FDV가 약 16B까지 찍었는데요,
솔직히 말도 안 되는 밸류라고 생각했습니다.
하지만 24시간이 지난 현재 상황을 보면 FDV가 약 5B 정도로 내려왔습니다.

이런 사례를 보면, TGE 당시에는 밸류를 크게 신경 쓰지 않는 것이 오히려 낫다고 생각합니다.

Q. 이미 프리마켓의 2-3배의 가격으로 바낸 알파에 상장을 했을때 에드 클레임,상장 지연 같은 안좋은 이슈가 뜰 때 덱스 가격에 영향을 끼치는데 이럴땐 어떠한 방법으로 판단을 하시나요? 
저는 DCA(분할 매수) 방식으로 코인을 구매합니다.
상황이 매번 다르기 때문에, 천천히 나눠서 매수하는 게 가장 좋다고 생각합니다.
또는 본인이 낮은 가격이라 생각 할 때 더 담는 편이라 생각하네요
그래서 언제 어디서 물량이 나오는지 미리 체크해두는 것이 중요하고,
그때그때 상황을 확인하면서 대응하는 게 효율적입니다.

Q. 미라는 후따리 3번넘게 돌릴동안 김프 유지되었는데 더블제로는 하다가 뒤질뻔 했는데여 둘 차이가 뭐라고 생각하십니까
미라와 더블제로의 차이는 
거래소 입금 시 필요한 컨펌(확인) 횟수에서 크게 나타났습니다.
미라의 경우 저는 당시 직접 참여하진 않았지만,
체인이 BASE였기 때문에 입금까지 약 15~20분 정도 걸렸을 것으로 생각합니다.
반면 더블제로(2Z)는 SOL 체인이라 입금 속도가 훨씬 빨랐습니다.
약 3~4분 이내로 입금이 완료되었기 때문에,
많은 사람들이 DEX에서 빠르게 긁어 보내며 물량을 던졌던 것으로 보입니다.

Q. 지금같은 불장이 아닌 장이 조용할때도 계속 따리를 해오셨는지, 앞으로 장이 죽어도 계속 따리를 하실건지?
따리를 본격적으로 한지 1년~2년쯤 된 것 같네요 불장,물장 가리지 않고 많이 했습니다.
꾸준히 해오면서 많이 잃기도 하고, 많이 벌기도 했습니다.
그래서 앞으로도 제가 가장 잘하는 분야가 이거라고 생각하고,
계속 꾸준히 이어갈 것 같습니다.

Q. 요즘 따리, 에드작, 예치작 이 메타가 언제까지 갈 거라 보시나요?  
위에서 말씀하신 메타는 코인의 기본이라 할 수 있습니다.
매매 역시 기본이라고 생각하지만, 새로운 메타가 생기더라도
앞서 언급한 그 메타가 완전히 사라지지는 않을 겁니다.
순환되는 메타라고 생각하시면 이해하기 쉬울 것 같습니다.

다만 따리는 예외일 수도 있습니다.
요즘은 고도화된 봇이 너무 많아서,
자동으로 돌리는 분들도 꽤 많아 프리미엄이 매우 빨리 줄어듭니다.
즉,먹을 파이가 점점 고도화된 봇 때문에 손으로는 절대 못먹는 상황이 온다고 말씀드리고 싶네요.

긴글 읽어주셔서 감사합니다.
아래는 당첨자분들 입니다.
많은 성원에 힘입어 상품 규모를 늘렸습니다.

당첨자 안내
최우수상: 배달의민족 이용권 2만 원 - @EJseong95 님
우수상: 배달의민족 이용권 1만 원 - @Arblover256 님
그 외 질문자분들: 커피 쿠폰
@ahnho,@AbbaAbbaAn1,@copymatch1,@bjk258482,@PJ777PJ,@kimclaim,@kikiki897,@parnakr,@MoonWhale_KR,@JOKER_7274
,@Levelcap_Agent,@minjoon0102,@msk0529,@choicb"
C:\Users\user\Downloads\Telegram Desktop\ChatExport_2026-02-02 (3)\messages.html,판판펀치,171,05.10.2025 18:35:12 UTC+09:00,2025-10-05,18:35,"SOMI 복기입니다

MIRA-SUPER-FF로 업저씨들 스트레스 테스트 및 설거지 진행 후 하루간의 휴식기 이후 상장된 post-TGE 원상이었습니다

오랜만에 망따리였는데, 솜니아는 여러가지 이유로 참여안한 원상 따리입니다
피곤하기도 했고...

망따리임에도 역시 충분히 복기할 가치가 있던 따리였습니다
업비트나 빗썸이나 퍼포먼스는 비슷했습니다 (둘다 망...)
다만, 원상 따리 제하고 다른 기회들을 잘 포착했으면 따리꾼들 싹 잡아죽일때도 충분히 괜찮은 수익을 올릴 수 있었던 이벤트였습니다

이로써 남은 숙제 2개 😌

노션 복기 ⤵
$SOMI 상장 (Up/Bit) 😈"
C:\Users\user\Downloads\Telegram Desktop\ChatExport_2026-02-02 (3)\messages.html,판판펀치,172,07.10.2025 16:15:13 UTC+09:00,2025-10-07,16:15,"DOOD 업비트 핫월렛

https://solscan.io/account/Dtg461zxsxWukZbKRMPoa4BDXtdcLTaPvSKdbt3Xrk23#transfers
https://solscan.io/account/HoegqUk7NB3W3B68L98h724u7nB94JABjhq6uk8Njwbj#transfers
https://solscan.io/account/7V43WztAom3CFuTzbamWzjvTX8oAPs3iwg1xbARbvwCq#transfers
https://solscan.io/account/8LNNuKoFbRX64ov9uLmKrs6czztJwmidWArGjDk9kAJ

현재 기준 입금액 대략 193억"
C:\Users\user\Downloads\Telegram Desktop\ChatExport_2026-02-02 (3)\messages.html,판판펀치,173,08.10.2025 12:04:13 UTC+09:00,2025-10-08,12:04,"코리 TEA 할당발표

바텀업 방식이라해서 쥐좃소액만 넣었는데 더 넣을걸~

** 최대 1300불까지 할당받은듯"
C:\Users\user\Downloads\Telegram Desktop\ChatExport_2026-02-02 (3)\messages.html,판판펀치,174,08.10.2025 12:43:41 UTC+09:00,2025-10-08,12:43,"Tea
 - $3M raised | $11M committed 
// Oversubscription Rate x3.67
- 5,000+ purchasers
// 참가자당 평균 수요 $2200
- $1311 max allocation per user

WalletConnect
- $4M raised | $15.5M pre-funded purchases
// Oversubscription Rate x3.88
- 18K+ purchasers 
// 참가자당 평균 수요 $861
- $399 max allocation per user

바텀업 할당으로 알고 있어서 조금만 넣었는데, 데이터 쌓고 세일 메타가 지속될 시 커밋된 세일 물량이랑 참여자 수 고려해서 가성비 세팅해야겠음

이번 tea 가성비 세팅은 대실패

다시보니 생각보다 tea 세일 적게 참여한거같은데 region이랑 다른 세일들이 워낙 많아서 긍가"
C:\Users\user\Downloads\Telegram Desktop\ChatExport_2026-02-02 (3)\messages.html,판판펀치,175,08.10.2025 15:44:57 UTC+09:00,2025-10-08,15:44,"추석 연휴도 어느덧 끝나가네요
살짝 휴식기 가지고 왔습니다

오늘은 10.2일자 상장입니다

- 2Z의 경우 앞서 말했듯 보수적으로 접근해서 아쉬웠던 따리였습니다
솔쪽 상장의 경우 메테오라를 좀 더 적극적으로 활용해야될 것 같습니다

- SUPER의 경우, FLUID(업비트→빗썸)으로 이어지는 기출따라, SUPER도 비슷하게 플레이했으면 나름 쏠쏠한 일당을 챙겨갈 수 있었습니다

사실 둘다 미리 써놨는데, 2Z 차트가 트뷰에 바로바로 안올라와서 그냥 올립니다
메테오라 풀 차트가 알파 거래 시작부터 타임라인이 안찍혀서 갭 차트는 생략했습니다
어차피 2Z 상장의 가장 키 포인트는 메테오라 플레이라 생각해서, 이번엔 좀 더 간략하게 작성했습니다 

이로써 숙제가 끝~
인줄 알았는데
어제 업비트, 빗썸의 기습 명절상장으로 바로 숙제가 2개 더 늘어버렸습니다
이건 후다닥 써서 내일 올리겠습니다 

그리고 따리보단 지금 븐브밈쪽이 아주 핫해서 그쪽으로 자꾸 눈길이 가네요
못참고 븐브밈 참전마려운데, 아마 제가 가면 완벽하게 븐브밈장 진압하고 엔드게임 만들 수 있을 것 같네요...

노션 복기 ⤵
$2Z 상장 (Up/Bit/Binance) 🍎
$SUPER 상장 (Bit)"
C:\Users\user\Downloads\Telegram Desktop\ChatExport_2026-02-02 (3)\messages.html,판판펀치,177,08.10.2025 19:46:17 UTC+09:00,2025-10-08,19:46,"Asterdex 상장될 코인 미리 알기
- 다른 중국인 채널에 상장 전 미리 올라왔던 내용
- 실제로 해당 메세지가 올라운 뒤 1시간 후에 상장됨

따는법
1. 개발자 도구 연 뒤 Network 탭 들어가기
2. asset 검색 후 all-asset-logo 들어가기
3. Response 누른 후 assetCode 뒤에 오는 것들 확인
4. profit"
C:\Users\user\Downloads\Telegram Desktop\ChatExport_2026-02-02 (3)\messages.html,판판펀치,179,09.10.2025 00:20:06 UTC+09:00,2025-10-09,00:20,"이미 api 따서 많이들 알람봇 만들어서 켜놓는중

따로 만들기 귀찮은 사람은 해당 채널 알람켜기
↓↓
https://t.me/Newsbothub

*살~짝 느림"
C:\Users\user\Downloads\Telegram Desktop\ChatExport_2026-02-02 (3)\messages.html,판판펀치,180,09.10.2025 18:30:42 UTC+09:00,2025-10-09,18:30,"추석 연휴가 벌써 끝나가네요

오늘은 특수했던 추석 명절 상장입니다
설마싶었는데 진짜 해버려서 당황했었습니다

- DOOD는 참여했었는데, 잘 오르길래 반 털고 반 업비트로 가져갔었는데 그냥 다 털고 연휴 즐길 걸 그랬네요
업저씨들은 하하호호 깨송편 먹을동안 아비러들끼리 혈투 벌인 기분이었습니다

- XAN은 DOOD때문에 심력소모해서 피곤해서 패스했었습니다

평소라면 그렇게 크게 기억에 남을 따리는 아닐 것 같지만 명절 상장이라는 나름의 특수한 케이스니 데이터를 쌓아놓으면 좋을 것 같습니다
+) 그리고 다음 솔 체인 상장은 메테오라 플레이에 좀 더 집중해보고 싶네요

이로써 진짜 밀린 숙제 끝 😌

노션 복기 ⤵
$DOOD 상장 (Up) 
$XAN 상장 (Bit)"
C:\Users\user\Downloads\Telegram Desktop\ChatExport_2026-02-02 (3)\messages.html,판판펀치,182,10.10.2025 21:11:21 UTC+09:00,2025-10-10,21:11,"연휴 끝나자마자 부지런히 상장하네요

- IN은 망따리였습니다
저시총이라 그래도 어느정도 견인해줄줄 알았는데 따리꾼들만 싹죽이고 후펌 주고 있네요 (현재진행형)
내 돈돌려내라...

- ASTER는 입금액 너무 커서 패스했었습니다
결과는 딱 정프

당분간은 TGE따리에 좀 더 집중해보고, 아닌것들은 보수적으로 플레이할까 싶습니다
븐브밈장은 즐기지도 못했는데 왜 연대책임을..

노션 복기 ⤵
$IN 상장 (Up) 
$ASTER 상장 (Bit)"
C:\Users\user\Downloads\Telegram Desktop\ChatExport_2026-02-02 (3)\messages.html,판판펀치,184,11.10.2025 18:39:31 UTC+09:00,2025-10-11,18:39,"1. OI가 가득 차 있는 상태에서 큰 변동성 → 해외 거래소의 연쇄 청산으로 인한 급락
2. 업비트 현물은 버팀 → 김프가 크게 발생했음
3. 앞으로 추가적인 하락이 발생 → 연쇄 청산이 불가능해짐 → 해외 급락도 드라마틱하지 않을 것 → 큰 김프가 발생하지 않지 않을까?
4. 또한 투심이 죽어 TGE 원상이든 뭘 하든 이제는 재미 없을 것 같음
5. 업비트 잡 코인들 2~3%띠기 김프도 이제 없어지고 안정을 되찾는 중

결론 : 최대한 입국을 더 할까 고민됨"
C:\Users\user\Downloads\Telegram Desktop\ChatExport_2026-02-02 (3)\messages.html,판판펀치,185,11.10.2025 20:47:34 UTC+09:00,2025-10-11,20:47,"BWENEWS: 👍Binance Co-founder Heyi apologizes for user transaction issues during market fluctuations, stating the exchange will compensate for losses directly attributable to Binance, but not for market-related losses. |source: Twitter https://x.com/heyibinance/status/1976976922283221445

BWENEWS: 바이낸스 공동 설립자 Heyi는 시장 변동 중 사용자 거래 문제에 대해 사과하며, 바이낸스가 직접적인 손실에 대해서는 보상하지만 시장 관련 손실에 대해서는 보상하지 않을 것이라고 밝혔습니다. |출처: 트위터

————————————
2025-10-11 19:47:11"
C:\Users\user\Downloads\Telegram Desktop\ChatExport_2026-02-02 (3)\messages.html,판판펀치,186,12.10.2025 10:32:30 UTC+09:00,2025-10-12,10:32,"시드 3~4자리 형님들의 관세빔 플레이 복기 글

https://m.blog.naver.com/gwoni__/224038335092
https://blog.naver.com/yunsmina
https://blog.naver.com/leeju506/224038185077

평소에 블로그 활동 잘 안하시지만 이렇게라도 글 써주시는 것만으로도 감사합니다 ♥️"
C:\Users\user\Downloads\Telegram Desktop\ChatExport_2026-02-02 (3)\messages.html,판판펀치,187,13.10.2025 11:23:16 UTC+09:00,2025-10-13,11:23,"https://app.aborean.finance/positions/v3/abstract/2113
 
들어가서 첫번째 사진 이더페어 고르고 
두번째 사진 동그라미 친것처럼 최소-최대가 약 100불 되도록(2틱) 골라서
이더,써클 박고 스테이킹 눌러서(언제든 뺄 수 있음) apr 3천퍼 이상 파먹다가 
레인지 밖으로 나가면 점퍼에서 다시 스왑해서 리밸하면댐

https://jumper.exchange/ko?fromChain=2741&fromToken=0x3439153EB7AF838Ad19d56E1571FBD09333C2809&toChain=2741&toToken=0x0000000000000000000000000000000000000000

앱스로 들어갈때, 나올때 스타게이트 쓰기
처음엔 거래소에서 이더,써클 반반 사서 태워 들어가면됨

https://stargate.finance/bridge?srcChain=abstract&srcToken=0xEeeeeEeeeEeEeeEeEeEeeEEEeeeeEeeeeeeeEEeE&dstChain=arbitrum&dstToken=0xEeeeeEeeeEeEeeEeEeEeeEEEeeeeEeeeeeeeEEeE"
C:\Users\user\Downloads\Telegram Desktop\ChatExport_2026-02-02 (3)\messages.html,판판펀치,189,13.10.2025 16:06:49 UTC+09:00,2025-10-13,16:06,Hyperliquid.
C:\Users\user\Downloads\Telegram Desktop\ChatExport_2026-02-02 (3)\messages.html,판판펀치,190,15.10.2025 02:16:54 UTC+09:00,2025-10-15,02:16,"앱스트랙트의 Aborean:

""아보리안 Abstract XP 업데이트 안내드립니다.

이번 주 스냅샷에는 아보리안에서 LP를 생성한 모든 사용자가 포함되지 않은 것으로 보입니다.

현재 XP가 올바르게 조정될 수 있도록 Abstract 팀과 협력 중입니다.

기다려주셔서 감사합니다.""

곧 XP 들어갑니다.

출처"
C:\Users\user\Downloads\Telegram Desktop\ChatExport_2026-02-02 (3)\messages.html,판판펀치,191,16.10.2025 16:45:35 UTC+09:00,2025-10-16,16:45,"오랜만에 상장 복기입니다

모두가 YB 원상을 기대했지만 국감을 앞둔 경석이형이 대신 이름 비슷한 YGG 옆상을 했습니다

- YGG 따리는 너무 비싸게 초반에 긁어서 생따리한 거 아니면 따리꾼도 넉넉한 김프로 먹여주고, 후펌으로 400원대까지 올려준 대흥따리였습니다. 후따리도 바낸출금 열리기 전까지 먹여주고, 각종 체인을 이용한 맛드몽현 플레이도 가능했네요

워낙 거래소별로 출금 중지된 타이밍이 다른지라 모든 걸 담아내진 못했습니다..

가능한 플레이가 생각보다 되게 많았던 상장이라 한번쯤 복기해두면 좋을 것 같습니다

노션 복기 ⤵
$YGG 상장 (Up)"
C:\Users\user\Downloads\Telegram Desktop\ChatExport_2026-02-02 (3)\messages.html,판판펀치,192,17.10.2025 18:18:25 UTC+09:00,2025-10-17,18:18,"ZEROBASE (ZBT)

바이낸스 알파 상장: 9월 30일 20:00시 추정(한국시간 기준)
업비트 상장 시간: 9월 30일 22:00시(한국 시간 기준)

총 토큰 공급량:1B
상장 시 유통량:220M (총 토큰 공급량의 22%)

웨일즈 마켓에서 0.55불에 거래중
MC : 121M
FDV : 550M

CA
ETH,BSC 0xfAB99fCF605fD8f4593EDb70A43bA56542777777

코멘트
동일한 CA이고 BSC,ETH 밖에 없는듯
생각하지도 못했던 코인이 상장 해버려서 저도 좀 얼떨떨한데
그래도 츄라이 해볼만한듯
플레이는 여러방법이 있을듯
갭잡기모드 해봐도 되고 순수 따리해봐도 되고 등등 많음
하지만 본인만의 기준을 어느정도 정하고 플레이 하는것을 추천함

이 글은 알아내는 정보대로 수정 해드릴예정"
C:\Users\user\Downloads\Telegram Desktop\ChatExport_2026-02-02 (3)\messages.html,판판펀치,193,17.10.2025 18:20:49 UTC+09:00,2025-10-17,18:20,"+) 
바이낸스 알파 상장: 2025.10.17 20:00
바이낸스 선물 상장: 2025.10.17 20:30
업비트 상장: 2025.10.17 22:00 

CA: ETH/BSC/BASE 0xfAB99fCF605fD8f4593EDb70A43bA56542777777

브릿지: https://app.zerobase.pro/

다 OFT라 레제로 컨트랙 쏴도 됨
스게 프론트에는 없긴함"
C:\Users\user\Downloads\Telegram Desktop\ChatExport_2026-02-02 (3)\messages.html,판판펀치,194,17.10.2025 20:00:45 UTC+09:00,2025-10-17,20:00,0.7~0.6 스타트
C:\Users\user\Downloads\Telegram Desktop\ChatExport_2026-02-02 (3)\messages.html,판판펀치,195,17.10.2025 20:46:07 UTC+09:00,2025-10-17,20:46,"1️⃣ 검증 가능한 연산(Verifiable Computation)을 통해 글로벌 금융의 근본적인 신뢰 격차 해소
→ 제로베이스의 미션을 그대로 반영한 문장입니다.

2️⃣ 증명 생성 및 라우팅을 위한 허브–프루버(HUB–Prover) 협업 모델
→ 네트워크 구조 설명에 명시되어 있습니다.

3️⃣ 리스크 중립적인 CeFi/DeFi 아비트라지 전략과 ZK 프로버 수익을 결합한 형태의 수익
→ zkStaking의 수익 구조를 정확히 묘사합니다.

4️⃣ USDT/USDC를 예치하고, USDT/USDC와 ZBT로 수익을 얻음
→ zkStaking의 기본 메커니즘입니다.

5️⃣ ZK 증명을 통해 델타 중립성과 레버리지 한도를 검증하며, 거래는 온체인에 기록되고, 평판 있는 수탁기관과 거래소를 사용함
→ 제로베이스의 CeDeFi 리스크 관리 구조를 나타냅니다.

6️⃣ ZBT는 제로베이스의 증명 네트워크를 구동하는 유틸리티 토큰이다
→ 네이티브 유틸리티 토큰으로 명시되어 있습니다.

7️⃣ 암호학적 증명 작업을 수행 — 할당된 작업에 대해 영지식 증명을 생성하거나 릴레이하여 ZBT 보상을 획득
→ 프루버(Prover)의 역할 설명과 일치합니다.

8️⃣ zkLogin, zkStaking, ProofYield, zkCEX
→ 제로베이스 증명 네트워크가 지원하는 대표 애플리케이션입니다.

9️⃣ 오프체인에서 리스크 중립적인 자본 전략을 수행하고, 해당 결과를 ZK 방식으로 검증
→ zkStaking의 작동 원리입니다.

🔟 민감한 데이터를 노드 운영자로부터 보호하기 위해 회로를 비공개로 실행함
→ TEE의 핵심 역할 설명입니다."
C:\Users\user\Downloads\Telegram Desktop\ChatExport_2026-02-02 (3)\messages.html,판판펀치,196,18.10.2025 23:19:13 UTC+09:00,2025-10-18,23:19,"어제 많은 피해자를 낳은 ZBT 복기 올리기전에 17일날 상장러쉬한 짜바리 4개 먼저 올립니다

어차피 메인은 ZBT기도 하고,
사실 크게 볼 내용은 없어서 건너뛰어도 됩니다
다 김프 제외 1~2퍼 띠기 / 간간한 현선 플레이 / 상장숏 이정도?
따리 자체로는 한번 거래 시작 연기한 두들이 제일 퍼포먼스가 좋았던 것 같네요

그리고 빗썸 하루에 상장 4개 진행한건 또 처음본거같네요

ZBT가 쓸 내용이 많아서 좀 걸렸네요
ZBT도 글은 얼추 다 정리했는데, 트뷰에 차트가 아직 업뎃이 안돼서 차트 올라오길 기다리고 있습니다
올라오면 정리해서 올릴게요

노션 복기 ⤵
$ZORA 상장 (Up) 
$IN 상장 (Bit) 
$YB 상장 (Bit) 
$DOOD 상장 (Bit)"
C:\Users\user\Downloads\Telegram Desktop\ChatExport_2026-02-02 (3)\messages.html,판판펀치,200,20.10.2025 17:51:20 UTC+09:00,2025-10-20,17:51,"BIO 업비트 핫 월렛

- https://etherscan.io/address/0x438Ef9D353BE60851b4e39c5Ee7B8fb01D4D7C27
- https://etherscan.io/address/0x7DA6787331c1244dBd9DD34eeD5778B5326EEB57
- https://etherscan.io/address/0xcBDE6f524aa5f12D4D7B5Ed1168409983e474266

2025.10.20 17:50
32,755,819 $BIO / $3,802,950 / 약 57억 가량

놓친 거 있으면 제보 부탁드립니다 😒"
C:\Users\user\Downloads\Telegram Desktop\ChatExport_2026-02-02 (3)\messages.html,판판펀치,201,20.10.2025 18:48:34 UTC+09:00,2025-10-20,18:48,"1. 바낸 현선갭 17% 유지 중
2. 업비트 - 바낸 현현 갭 김프 없음
3. 빗썸은 출금한도 130만원 한도

누가 물량 다들고 노는거 같은데 ㅇㅂㅇ.?"
C:\Users\user\Downloads\Telegram Desktop\ChatExport_2026-02-02 (3)\messages.html,판판펀치,202,21.10.2025 16:00:44 UTC+09:00,2025-10-21,16:00,"F 업비트 핫 월렛

1. https://etherscan.io/address/0x316Ec3BCa6889aB7f7eEC16D945f0B514C8353f0#tokentxns

2. https://etherscan.io/address/0xcC789276bd3eb0aeb4a74E196dB6292e15133564#tokentxns

3. https://etherscan.io/address/0xd8825bde655dfb864315ea26893e0ee0f24727ed#tokentxns

2025.10.21 16:00
358,409,267 $F / 현재가 $0.0167 기준 $5,985,434 / 약 90억 가량"
C:\Users\user\Downloads\Telegram Desktop\ChatExport_2026-02-02 (3)\messages.html,판판펀치,203,23.10.2025 15:29:07 UTC+09:00,2025-10-23,15:29,"ZBT 복기입니다

아시다시피 상당히 많은 피해자들을 낳은 따리입니다
개인적으로, 근래 따리 기조의 변곡점이 되는 상장이 아닐까 생각합니다

따리 이전에도 ZBT 상장 결과에 따라 앞으로의 기조가 바뀔 것 같다고 생각하였는데, ZBT 원상이 실패로 돌아가면서 따리에 다소 보수적인 입장이 되어버렸습니다

높은 김프, 불안한 시장 상황 등에 대한 고려는 물론, 막판에 살짝 몇몇 요소들이 망따리 초식으로 변모하였더라도 충분히 상쇄될만한 bullish한 흥따리 초식들이 많았기 때문에 베팅을 하였지만, 뼈아픈 실수였네요
물론 dex 고점도 고려했지만, 근래 지속된 불장 TGE Crime 원상 마인드셋에서 벗어나지 못한 것 같습니다
기존 장세가 유지되었다면, 적어도 2~30퍼는 먹여줬을 따리라고 생각하지만 트럼프발 관세빔 이후로 시장이 회복되지 않은게 여실히 느껴지네요

이대로 꾸득이로 내리면서 모두 말려죽이거나, 이러다가도 시장이 확 좋아지기도 하기 때문에 조심스럽지만, 현재 시황이 유지된다면 앞으로 TGE따리에 대한 기대감은 많이 희석될 것 같습니다


노션 복기 ⤵
$ZBT 상장 (Up/Bit/Binance)"
C:\Users\user\Downloads\Telegram Desktop\ChatExport_2026-02-02 (3)\messages.html,판판펀치,210,23.10.2025 15:45:40 UTC+09:00,2025-10-23,15:45,"지각한 이유)
- 코인 디톡스하려고 여행 다녀왔어요
  - 원래 여행 기간중에 좀만 다듬어서 바로 올릴려고 했습니다
  - 근데 여행 중에 모멘텀 야핑 조별과제도 같이해야하고, 상장도 마구잡이로 있어가지고 정신이 없더라구요...

- ZBT는 사실 할말도 많았는데 여행 다녀오니까 뇌가 초기화돼서 여차저차 넣고 싶은 내용이 더 많았는데 다 까먹어버린 것 같습니다..
 - ZBT는 진짜 글도 다써놨는데, 트뷰에서 pancakeswap pool 덱스차트 안올려줌 + ETH pool 덱스차트 안올려줘서 간단하게 오늘 마무리 정리하고 올렸습니다..
 - 그리고 업비트/빗썸 차트도 17일에 바로 안올려주고 한 20일 밤늦게 올려주더라구요...

+) 여행동안 업빗썸 둘이서 쓰레기짬통 대결로 마구잡이 상장해서 복기할게 또 늘어났네요(경석아 적당히 좀 해라)
 컴퓨터 앞에서 계속 지켜보지 못하고 여행중 핸드폰으로만 간간히 체크해서 ~CPOOL까지 퀄리티는 다소 부족할 수 있습니다..
직접 따리 참여하거나 계속 지켜본거 아닌이상 복기의 현장감이 떨어지거든요

+) 잡설이 길었는데, 결론은 지금 밀린 따리 말고 더 올리고 싶은 복기들도 있는데, 이거까지 다 올리려면 시간이 좀 걸릴것같습니다
별거없는 복기지만 봐주셔서 고맙습니다~ 
사진은 글만 넣기 심심해서 여행사진같이 올려요"
C:\Users\user\Downloads\Telegram Desktop\ChatExport_2026-02-02 (3)\messages.html,판판펀치,212,24.10.2025 10:33:56 UTC+09:00,2025-10-24,10:33,"Stable deposit 근황

20개도 안되는 지갑이 5블럭 내 $600M을 채운 모습"
C:\Users\user\Downloads\Telegram Desktop\ChatExport_2026-02-02 (3)\messages.html,판판펀치,213,24.10.2025 11:08:36 UTC+09:00,2025-10-24,11:08,"Stable 못넣은 사람은 무엇을해야하나?

- ctStableUSDT / ctStablefrxUSD
- 위에 이더스캔들어가서 300명 홀더리스트 쫘악 확인하기
- 한국인들 지갑 리스트업 싸악하기 
- 외국인들 지갑 리스트업 싸악하기
- 괜찮은사람 알람 걸고 팔로업하기"
C:\Users\user\Downloads\Telegram Desktop\ChatExport_2026-02-02 (3)\messages.html,판판펀치,214,24.10.2025 16:01:41 UTC+09:00,2025-10-24,16:01,"https://upbit.onelink.me/dH32/wa12nyl3

1️⃣ 자산 브릿징 등의 사용자 활동에 대한 로열티 및 리워드 프로그램
2️⃣ 국제은행간통신협회 (SWIFT)
3️⃣ 상호운용성
4️⃣ 솔라나 ↔️ 이더리움
5️⃣ 체인 간 토큰 브릿징
6️⃣ USDC
7️⃣ 3분의 2 이상
8️⃣ 19개
9️⃣ 네이티브 토큰 전송 (Native Token Transfer)
🔟 권한 증명 (Proof of Authority)"
C:\Users\user\Downloads\Telegram Desktop\ChatExport_2026-02-02 (3)\messages.html,판판펀치,215,24.10.2025 19:35:20 UTC+09:00,2025-10-24,19:35,"BIO

- 생따리, 현선 모두 꽤 먹여줌
- 빗썸 출금 장난질 본격적으로 시작

- 근래 상장 중 입금액이 상당히 적었던 따리 (흥따리 요인)
- 투심이 많이 죽은 상황이고 거래량도 안터져서 ""입금액""이라는 절대적인 기준이 중요해진듯

노션 복기 ⤵
$BIO 상장 (Up)"
C:\Users\user\Downloads\Telegram Desktop\ChatExport_2026-02-02 (3)\messages.html,판판펀치,216,25.10.2025 16:34:00 UTC+09:00,2025-10-25,16:34,"launchcoin delisting recap

fdv에 비해서 하리 oi가 굉장히 컸는데, 이걸보고 청산공격이라고 처음에는 생각했음(하리 청산가는 mark-price기준)

xpl ptsd가 와서 벌벌 떨고있었는데
진입한 이유로 몇가지가 있음

1. 대충 상폐공지 읽어보니까, 펀비 30번은 먹을수있는 시간이었음

2. pre-market이 아니라, 펀비를 1시간에 1%씩 내면서 공격해야함

3. 그렇다면 빠르게 오더북 밀어버리면서 싹 청산내야 했는데 hyperdash 터미널로 확인한 결과, 눈에 띄는 온체인 공격자가 없었음

4. 새벽이어서 비몽사몽 했지만, 공격은 아니라고 생각, 그리고 공격자가 너무나 불리한 상황이었음

5. 정말 조금만 숏포지션 잡았고, 롱포지션은 bybit에서 sol랜딩해서 50%정도만 현물구매함

6. 하리에 있는것들 바이빗 상폐하면 한번 소액으로 해볼만한 플레이 였던듯(돈은 많이 벌지못함)"
C:\Users\user\Downloads\Telegram Desktop\ChatExport_2026-02-02 (3)\messages.html,판판펀치,219,25.10.2025 18:55:23 UTC+09:00,2025-10-25,18:55,"10.21 상장입니다

장이 안좋은 걸 여실히 체감할 수 있던 날이었던 것 같네요

- F는 낮은 시총임에도 전원 물림엔딩으로 마무리되었습니다. 
입금액도 약 90억; 100억 언더로 많다고 할 순 없지만, 현재 장과 거래량으로서는 소화하기 부담스러웠던 물량이었던 것 같습니다
* 근데 어제부터 운전시작해서 엄청 견인해놨네요...

+) 그리고 빗썸 출금 장난질이 가장 심했던 원상이었던 것 같습니다.
사실 몰래 빗썸 스토리텔러 등록해놨는데 채널에는 빗썸 출금 장난질 친다는 글만 쓰게 되네요(빗썸 얘기는 열심히 하는중)
거래소의 가장 기본적인 요소들을 가지고 장난질쳐서 신뢰를 무너뜨리면 누가 빗썸을 써줄까요? 잘 처신했으면 좋겠습니다

- ZORA/RECALL은 업비트 신퓨쳐스 상장 이후에 빗썸이 따라서 2 상장 갈긴터라, 관심도도 떨어지고, 크게 볼만한 거리도 없었습니다

노션 복기 ⤵
$F 상장 (Up) 
$ZORA 상장 (Bit) 
$RECALL 상장 (Bit)"
C:\Users\user\Downloads\Telegram Desktop\ChatExport_2026-02-02 (3)\messages.html,판판펀치,222,26.10.2025 17:09:57 UTC+09:00,2025-10-26,17:09,"10.22 CPOOL 상장입니다

- 따리 자체는 망따리 or 겨우 본전치기 가능했습니다
솔라나쪽 가격반응이 느려서 해당 부분을 잘 캐치해서 기민하게 행동했다면 괜찮은 수익을 볼 수 있었습니다
개인적으로 근래 따리는 이런 크로스체인 먹거리/현선에 집중하고 있습니다

+) 빗썸 장난질도 여전했습니다
빗썸은 갭난다고 속지말고 꼭 헷징하거나 현선플레이만 하는걸 추천드립니다

노션 복기 ⤵
$CPOOL 상장 (Up/Bit)"
C:\Users\user\Downloads\Telegram Desktop\ChatExport_2026-02-02 (3)\messages.html,판판펀치,223,27.10.2025 15:59:15 UTC+09:00,2025-10-27,15:59,"ORDER

빗썸도 상장되어있었고, SUPER상장(09.29)에 btc마켓 상장햇었던 픽입니다
근래 펍덱 관련 코인들이 상장이 많이 되고 있어서 암살 심어놓으신 분들도 꽤 있었을 것 같네요

- 간만에 흥따리였습니다
후펌을 꽤 쎄게 줬는데, 옆상이기도 하고 근래 워낙 망따리 비율이 높았어서 후펌까지 버티긴 쉽지않았을 것 같네요
ORDER의 경우 체인이 워낙 많았는데, sol/arb 쪽 가격반응이 느려서 해당 부분을 잘 이용해서 플레이했으면 좋았을 것 같네요
브릿지 속도도 빨랐고, 체인별로 유동성도 나쁘지 않아서 크로스체인 플레이하기 나쁘지 않았습니다
후따리도 dex 여러 체인 이용해서 싸게 긁어서 보냇으면 1바퀴 정도 먹을 수 있었습니다

** 빗썸은 여전히 출금 느리게 빼줬습니다

이로써 원상 밀린거는 다 따라잡았네요🤔

노션 복기 ⤵
$ORDER 상장 (Up)"
C:\Users\user\Downloads\Telegram Desktop\ChatExport_2026-02-02 (3)\messages.html,판판펀치,224,27.10.2025 23:31:48 UTC+09:00,2025-10-27,23:31,"Stable USDT 미리 Approve하기

하는 방법
0. 이더스캔 본인지갑연결
1. 테더 컨트랙트 접속
2. Approve 클릭
3. Spender에 Concrete CA 입력
4. Value는 USDT 승인금액임 (본인 마음대로하시길)
5. Write 끝

USDT를 넣는거라 USDT 승인이 필요함.
다음에도 똑같은 CA에서 진행할지는 모르겠음."
C:\Users\user\Downloads\Telegram Desktop\ChatExport_2026-02-02 (3)\messages.html,판판펀치,225,28.10.2025 18:22:47 UTC+09:00,2025-10-28,18:22,"작년에 페이코인으로 꿀 빨았던 썰

생각보다 HTX(구 후오비)에 이상한 페어들이 많았음.
그중에 WPCI라는 페어가 있었음 (지금은 상폐됨)

WPCI = Wrapped Paycoin
랩핑된 PCI(페이코인)임.
랩핑을 풀면 PCI(페이코인)가 되는 구조였고, 브릿지를 통해 언랩핑할 수 있었음

본론으로 들어가자면,
WPCI는 가끔가다가 봇인지 뭔지 모르겠는데 HTX에서 계속 조금씩 누가 물량을 던지는 느낌이었음.

그래서 HTX와 빗썸, 코빗 간 괴리가 많게는 60~70%, 적게는 10% 정도 났었음.
그 덕에 스프레드가 많이 비어 있었고, 거래량도 매우 적었음
그래서 오히려 그 스프레드를 이용하기 시작했음

최대한 밑에다가 리밋 주문을 걸어두고 매수될 때까지 기다리거나,
김프 계산해서 먹을 수 있으면 지정가로 매수 후 마구마구 따리했었음

따리할 때 해당 브릿지를 통해 랩핑을 풀어야 했는데 코빗 지갑만 가능했음

HTX → 메인지갑 → 브릿지(코빗 지갑) → 빗썸
이런 식으로 거쳐서 갔는데, 생각보다 빗썸에서 안 받아줘서 너무 오래 걸렸음
기본 1시간 많게는 3~4시간 걸렸음

코빗에 팔려고 했는데 호가창 물량도 적고,
비교했을 때 1원이라도 더 먹으려고 빗썸에 팔았음 결국 내 물량을 받아줄 사람이 필요했음

결국 이 기회를 빗썸 페이코인 재상장 이후부터 HTX WPCI 상폐 때까지 따리를 했었음 
덕분에 이걸로 주수입원이 하나 더 생겼었음

이 꿀통을 거의 10개월 정도 빨았던 것 같음
늘 기회를 주진 않았지만 기회를 조금씩 주긴 했었음

지금 생각하면 알람봇을 만들거나 최소한 자동화를 해놨더라면 더 많이 먹고 더 효율적으로 했을 듯

꿀통이 깨진 건 아쉽지만,
나는 계속 꿀통을 찾으러 이곳저곳 돌아다닐 듯.

이번 스토리텔러에 페이코인이 있어서 이 글 써봤음

지금은 WPCI라는 코인 자체가 없어진듯
유동성도 제로임 
쓸모 있을진 모르겠지만
브릿지 사용법 공식 PDF임 
랩핑 푸는 방법"
C:\Users\user\Downloads\Telegram Desktop\ChatExport_2026-02-02 (3)\messages.html,판판펀치,226,28.10.2025 20:05:57 UTC+09:00,2025-10-28,20:05,"KERNEL

참여는 안하고 멀뚱멀뚱단했어요
현선도 안잡았고..

거래 시작 전에 BTC마켓/빗썸 김프 위로 갭좀 유지되던거 먹을까 고민했는데 안먹었네요
그나마 이번따리에서 시도해볼만한거 아니었을까 싶네요

쓸내용이 별로없어서 걍 지금 글만 보고 넘기셔도 될듯

노션 복기 ⤵
$KERNEL 상장 (Up)"
C:\Users\user\Downloads\Telegram Desktop\ChatExport_2026-02-02 (3)\messages.html,판판펀치,227,28.10.2025 22:35:16 UTC+09:00,2025-10-28,22:35,"Entrave (펌프펀+예측마켓) 방금 퍼블릭 열림
시장 거래 (Trade Markets)
결과에 대한 주식을 매수하고 매도

시장 생성 (Create Markets)
직접 나만의 예측시장을 생성

유동성 공급 (Provide Liquidity)
시장에 자금을 공급하고 보상 획득

(source)

가입만 해도 지금 포인트 주는 것 같네요.

가입하기 노레퍼럴"
C:\Users\user\Downloads\Telegram Desktop\ChatExport_2026-02-02 (3)\messages.html,판판펀치,228,29.10.2025 16:55:21 UTC+09:00,2025-10-29,16:55,"ENSO 업비트 핫 월렛

1. https://etherscan.io/address/0x34aeab989141e4116a10050297f5b8bf54e46dc1#tokentxns

2. https://etherscan.io/address/0xE954dF205f2fFd3B670fbacc88e707E6F8495E2c#tokentxns

3. https://etherscan.io/address/0x8F7EaeD7aC7930Fa9da3b1B6486De4fdf954Bb45#tokentxns

2025.10.29 17:00
2,781,835 $ENSO /  $2.28 기준 $6,342,583 / 약 94억 가량"
C:\Users\user\Downloads\Telegram Desktop\ChatExport_2026-02-02 (3)\messages.html,판판펀치,229,30.10.2025 21:46:42 UTC+09:00,2025-10-30,21:46,"ENSO

오랜만에 흥따리였네요
쎄게 후펌 주는것도 괜시리 오랜만에 보는것같아요

빗썸 상장 공지 뜨고 현선0퍼대라 긁으려고 했는데 말하던 사이 업비트 빔으로 현선 바로 6퍼대 찍는거 보고 기력 떨어져서 현선 못잡았네요...

요약 → 흥따리/강한후펌/현선0퍼에잡을걸 

노션 복기 ⤵
$ENSO 상장 (Up/Bit)"
C:\Users\user\Downloads\Telegram Desktop\ChatExport_2026-02-02 (3)\messages.html,판판펀치,230,31.10.2025 15:34:51 UTC+09:00,2025-10-31,15:34,"이미 고수분들이 많이들 복기해주신 ZKC입니다

유의종목 지정 후 입출막 가두리가 있었습니다
가두리로 인해 해외CEX와 괴리가 심했는데, 이 과정에서 먹거리가 좀 있었습니다
(12일 즈음에 발사함)

제가 나중에 보려고 노션에다가 대충 차트만 띡띡해놓은거라 복기 자체는 노션 밑에 콩햄이랑 로우나님 복기 보시는게 더 도움될 것 같습니당

너무 원상만 올리는거 같아서 다른 것도 올려봤어요
원래 18 19 주말즈음에 올릴려고 했는데 이것저것 다른 밀린거 하다보니까 완전 뒷북으로 올리게 됐네요

노션 복기 ⤵
$ZKC 유의 종목 지정 및 해제"
C:\Users\user\Downloads\Telegram Desktop\ChatExport_2026-02-02 (3)\messages.html,판판펀치,231,31.10.2025 16:01:48 UTC+09:00,2025-10-31,16:01,"https://upbit.onelink.me/dH32/t2ygj3lw

1️⃣ 전통 기업, 커스터디 기관, 금융기관 및 온체인 애플리케이션
2️⃣ 4,000억 달러 이상
3️⃣ 종단 간 암호화(End-to-End Encryption) 및 단일 장애점이 없는 구조
4️⃣ 온체인 상호작용을 위한 신뢰 레이어(Trust Layer)
5️⃣ 지갑과 애플리케이션 간의 암호화된 원활한 연결을 지원한다.
6️⃣ 페드로 고메스(Pedro Gomes), 2018년
7️⃣ 체인 구분 없이 동작 가능(Chain-agnostic) — Ethereum, Solana, Bitcoin 등 다양한 생태계
8️⃣ 금융 인터넷(Financial Internet)을 위한 연결 레이어(Connectivity Layer)
9️⃣ 온체인 경제 전반에서 지갑, 애플리케이션, 블록체인 간의 안전하고 원활한 연결을 가능하게 한다는 뜻
🔟 7만 개 이상의 앱, 700개 이상의 지갑"
C:\Users\user\Downloads\Telegram Desktop\ChatExport_2026-02-02 (3)\messages.html,판판펀치,232,02.11.2025 22:15:37 UTC+09:00,2025-11-02,22:15,"오피니언 금주 코드

BUIDLO

사이트 좀 뜯어보면 찾을 수 있어요

invite code때문에 아직 못하시는 분들도 있는 것 같아서 공유

밑에는 제 웨옹퍼럴입니다 ☕️
써주시면 감사 (1000불 볼륨 채우고 셀퍼럴하세요)
웨옹퍼럴"
C:\Users\user\Downloads\Telegram Desktop\ChatExport_2026-02-02 (3)\messages.html,판판펀치,233,02.11.2025 22:23:35 UTC+09:00,2025-11-02,22:23,"+)
참고로 오케스 월렛 앱에서 
switch to desktop mode로 바꾸면 핸드폰에서도 오피니언작 할 수 있어요
invite code 안뚫어두면 귀찮으니까 모바일도 뚫어둡시다"
C:\Users\user\Downloads\Telegram Desktop\ChatExport_2026-02-02 (3)\messages.html,판판펀치,234,02.11.2025 22:40:24 UTC+09:00,2025-11-02,22:40,"보니까 서버에서 2차 검증해서 컷하는 것 같아서 신규 지갑으로 연결/가입은 어려울 것 같네요... 🥲
 
기존에 오피니언 가입해둔 지갑이 있는데, 컴퓨터 여러 대에 초대 코드 입력을 안해놔서 프론트 접속 안되는 경우 활용하면 좋을 것 같습니다

우회 방법을 찾아보겠지만 신규 지갑 가입하셔야 하는 분들은 우선 공식 공지를 기다리는게 좋을 것 같습니다🍎"
C:\Users\user\Downloads\Telegram Desktop\ChatExport_2026-02-02 (3)\messages.html,판판펀치,235,03.11.2025 18:46:30 UTC+09:00,2025-11-03,18:46,"KITE

바낸스팟 : 22시
업비트 : 22시
빗썸 : 22시

총 토큰 공급량: 10,000,000,000 KITE
상장 시 유통량: 1,800,000,000 KITE (총 공급량의 18%)

웨일즈 마켓($0.12) 기준
MC : 216M
FDV : 1.2B

CA
BSC,ETH,AVAX: 0x904567252D8F48555b7447c67dCA23F0372E16be

브릿지: 레이어제로 , 

테스트 트잭
BSC
https://bscscan.com/tx/0x247849170f613200dd65ba1c2ef6fadc0380fcf4e54e11c96b8b3dcb1068d949

ETH
https://etherscan.io/tx/0x6e7d829a7b12670ef8bee88db152e8154c31303d27c50abba2088a4e3eda697e

AVAX
https://snowtrace.io/tx/0xc4084eea1eab383a0753a3315b8a4edc557afa1b2a1a9c3e2a5c8018f9536f9f?chainid=43114

코멘트
예시트잭은 예시트잭일분 참고하시고 직접 소액으로 테스트 해보셔야 함

장이 안좋아 저도 가용시드의 일부만 참전 할 예정이고,
절대 많은 비중을 챙기지마셈.적게 벌어도 안잃는게 중요함.

입금 거래소는 어디로 할지는 좀 생각을 해봐야하는데 업비트 90퍼라 생각중
이런 장에는 업비트가 그나마 나을듯함"
C:\Users\user\Downloads\Telegram Desktop\ChatExport_2026-02-02 (3)\messages.html,판판펀치,236,04.11.2025 22:30:11 UTC+09:00,2025-11-04,22:30,"🔥  2025.11.04 모멘텀 상장·매매 요약

국내 상장
- 업비트: BTC, USDT 마켓만 상장 [공지 18시 35분] → 입금량 체크 못했어요.
- 빗썸: 원화 상장[공지 19시 6분] → 실제 입금액 약 21억 규모

HODLER 에어드랍 규모
- 이번 바낸 호들러 에어드랍 가치 약 40억 수준
- 앞으로 비슷한 신규 코인 상장 시에는 HODLER 물량 수량 먼저 체크 필수
- 평균적으로 대략 100억 전후 분배가 많고, 결과적으로 바낸 대흥따리

다음 기회에 집중 해야하는거
- 호들러 물량이 적으면 빗썸이라도 현선 (바낸 알파 < > 타거래소 프리숏) 4퍼까지는 잡아볼만한거 같음.
- 5만불 잡을 시 최대 손실 2천불(어차피 매매하면 맨날날리는돈 현선은 신이다) 
- 알파(수이지갑 임포트) 한 후에 지갑에 들고있다가 흥따나면 바낸으로 입금

오늘 매매 회고
오늘은 DEX 고점 정리 OR 바낸 현/선물 정리가 가장 좋은 선택이었네요. 

업비트는 최저 매도 호가 690원 (당시 정프 약 620원)
→ 690 ~ 720원 구간에서 약 1.5 BTC 정도 체결
→ 업비트/빗썸(망따) 모두 이번판은 크게 먹기 힘든 구조

사실 모든 건 결국 결과론적이긴한데요..
방장도 국내 원상이 빗썸뿐이라 현선 3퍼도 내기아까워서 싸지못함.

저도 솔직히 어제 놀고 오늘 멍때리다가 이틀을 날렸습니다. 복기 잘해봐서 다음꺼 먹어봐요 ㅠㅠ"
C:\Users\user\Downloads\Telegram Desktop\ChatExport_2026-02-02 (3)\messages.html,판판펀치,239,05.11.2025 22:01:28 UTC+09:00,2025-11-05,22:01,"BASE, $TRUST 빼고 나머지 문제는 선지중에서 제일 긴거 누르면 됨"
C:\Users\user\Downloads\Telegram Desktop\ChatExport_2026-02-02 (3)\messages.html,판판펀치,240,06.11.2025 14:51:37 UTC+09:00,2025-11-06,14:51,"KITE

입금액 적었던 TGE 흥따리
중간중간 브릿지넘겨서 쌀먹도 가능했고 마지막에 브릿지 쌀먹찬스도 있었네요

오랜만에 상장복기 쓰는 기분이네요
트뷰 dex 차트 올라오는거 기다리다가 지쳐서 dex 차트 / dex 갭 빼고 걍 올렸습니다
며칠사이에 MMT에 TRUST에 BAL exploit에 뭐뭐 너무 많았어서 KITE가 벌써 한달전 일 같네요
그래서 쓰는데 자꾸 기억이 희미해서 퀄리티는 좀 낮을 수도 있습니다..
할건 많고 트뷰 차트는 안올라오고 상장복기도 밀리고 이것저것 올릴거도 밀려서 답답하네요😒
나중에 dex 차트 올라오고 kite 생각이 나면 그때 dex 차트 추가해서 좀 살 붙여볼까합니다

노션 복기 ⤵
$KITE 상장 (Up/Bit/Binance)"
C:\Users\user\Downloads\Telegram Desktop\ChatExport_2026-02-02 (3)\messages.html,판판펀치,241,08.11.2025 19:31:44 UTC+09:00,2025-11-08,19:31,"MMT

굉장한 Crime을 보여준 MMT입니다

따리 자체적으로는 크게 볼만한 건 없지만, 많은 사람들의 뇌리에 오랫동안 박혀있게 될 것 같습니다..
deed 포함 에드 물량 안풀고 유통량 적은채로 물량 쥐고 운전하면 얼마나 운전하면서 사람들을 털어먹을 수 있는지 보여준 것 같네요

- 따리 자체적으로는 바이낸스 따리가 흥따리였고, 앞으로 바이낸스도 좀 눈여겨봐야할 것 같네요
엄청난 Crime을 보여주면서 갭 먹으려던 많은 아비러들을 지옥으로 보내버렸는데, 장이 안좋으니 아비러들까지 다 털어먹네요..
잃으면 복구가 어려운 장이기에 이런 crime 코인들은 현선이든 갭이 나도 최대한 안건들면서 플레이해야 할 것 같습니다

여러 디파이 exploit에 상장따리에 여러가지 갭드몽현 이벤트, stable 참여하려고 새벽에 밤새고 이러다보니까 컨디션이 메롱해져서 좀 늦어졌습니다..
+) 그리고 MMT 말고도 CUDIS 라던가 기타 이것저것 쓰다보니 글이 좀 길어졌습니다
크립토는 며칠만 지나도 다른 이벤트에 덧씌워져서 기억이 뭔가 희미해지기도 하고 MMT 새벽에 crime 당시에 자고 있어서 아무래도 좀 부족한 점이 있을 수 있습니다

노션 복기 ⤵
$MMT 상장 (Up/Bit/Binance)"
C:\Users\user\Downloads\Telegram Desktop\ChatExport_2026-02-02 (3)\messages.html,판판펀치,242,10.11.2025 16:24:17 UTC+09:00,2025-11-10,16:24,"정확히는 저 글보고 좀더 브릿지 트젝체크를해서 선선을 잡을지 현선을 돌릴지 체크를 했어야했네요.
잡지 말아야할게 아니라 좀더 분석해서 트젝을 체크해야한다는뜻.

완전 알파BSC물량이랑 수이랑 딱붙어서 찾아봤는데 제가 글올릴때 브릿지를 채워줬네요.

따라서 선선이 붙었고 몇몇 고수들은 갭 100퍼복사를했네요.
평소 고수들 지갑트래킹을해놓는데 보니까 당일만들어서 새지갑사용해서 캐치를못했던 것 같아요.

너무너무 아쉽네요. 가끔 연락하는 고수분 코별님(@coin_start_lee)은 제 글 본 후 디코 등등 리서칭해서 결국 갭드셨네요.. 정말 신
복기잘해서 다음기회 놓치지맙시다 우리 ㅠㅠ

BSC>SUI 브릿지사이트
수이 브릿지트젝
수이브릿지 채워주는 모지갑"
C:\Users\user\Downloads\Telegram Desktop\ChatExport_2026-02-02 (3)\messages.html,판판펀치,244,10.11.2025 16:40:11 UTC+09:00,2025-11-10,16:40,"TRUST

- 빗썸의 엔소 이후 대 흥 따 리
이번 trust 급으로 빗썸이 업비트 대비해 압도적으로 흥따리였던건 오랜만이네요..
맨날 빗썸 조롱했는데 보여줄땐 보여주네요
다음 빗썸 흥까지 쿨타임이 얼마나 걸릴지가 이제 제일 궁금하네요

- 후따리도 거진 무한으로 먹여줬습니다
   - 초반에 빗썸 몇바퀴 먹여주고, 이후에 의문의 누군가가 국내 거래소(특히 업비트)에 호가를 계속 대주면서 갭이 계속 유지됐는데, 이를 이용해 새벽까지 무한 쌀먹 후따리 구간이 있었습니다

- 현선도 선물 상장하고 초반에 3~4퍼대까지 좁혀졌을때 잡았으면 괜찮게 수익 볼 수 있었을 것 같아요

스테이블 밤새면서 sign 트잭박고 했는데 비례배분 통수 맞고 몸상태도 메롱해지고 시들시들해져서 좀 게을러졌네요
위에 AIA 갭이 정말 아쉽네요..
그리고 트뷰에서 마찬가지로 TRUST dex 차트도 안올려줘서 늦기도 했습니다 ㅠ 걍 빼고 올렸어요

노션 복기 ⤵
$TRUST 상장 (Up/Bit)"
C:\Users\user\Downloads\Telegram Desktop\ChatExport_2026-02-02 (3)\messages.html,판판펀치,245,11.11.2025 19:25:24 UTC+09:00,2025-11-11,19:25,"한창 아까 LSK 갭 날때 실수로 공브 보내신 분들도 보이고 Across에 묶이신분들도 보여서 간략하게 LSK 브릿지 관련 정리

브릿지
- https://bridge.lisk.com/
- https://superbridge.app/?fromChainId=1135&toChainId=1&tokenAddress=0xac485391EB2d7D88253a7F1eF18C37f4242D1A24
- https://app.across.to/bridge

공식 브릿지
- Lisk도 OP stack 기반 Optimistic Rollup로 Base 공브와 동일하게 7일 대기 시간 필요함

- 브릿지 프로세스
    1. 출금 초기화
    2. Prove tx
    3. Challenge Period(7일 - OP stack의 security feature 표준이라 무조건 일주일임)
    4. Finalize

- 자세하게 알고 싶은 사람은 참조
- 따라서 빠른 브릿지를 위해선 Across와 같은 서드파티 브릿지를 사용해야함

서드파티 브릿지 (Across)
- 프로세스 1줄 요약: (ETH에서) Hub Pool → Spoke Pool → Relayer → 사용자 지갑

**
- Hub Pool(0xc186fa914353c44b2e33ebe05f21846f1048beda) - 메인 유동성 풀 | 릴레이어들이 유동성 예치하는 중앙 풀
- Spoke Pool(0x5c7bcd6e7de5423a257d81b442095a1a6ced35c5) - 브릿지 요청 처리 | 사용자 요청을 릴레이어에게 중계
- Relayer(0x428ab2ba90eba0a4be7af34c9ac451ab061ac010) - 릴레이어 | 경쟁적으로 즉시 유동성 제공
- Relayer 2(0xc69ccf28b0413b7a0475e1bd9297e0f2fae8ec32) - 릴레이어 | 백업 또는 경쟁 릴레이어
**

- 브릿지 프로세스
    1. Deposit (Lisk Chain) - 지갑에서 Lisk SpokePool에 LSK deposit
    2. 릴레이어 경쟁: 다수의 릴레이어가 가장 빠른 실행을 위해 경쟁
    3. 즉시 전송: 선택된 릴레이어가 자신의 LSK를 사용자 지갑에 직접 전송
    4. 후속 정산: 릴레이어는 Hub Pool에서 자금을 회수하여 정산

- 결론
    - 소요시간 1분남짓
    - Pool에 있는 LSK 잘 보고 넘기기 (아니면 묶임)
        - 묶였을 경우, Across의 경우 시간 지나면 Expired 처리되고 나중에 refund 가능해짐
            - refund까지 한 3시간 걸렸다고 함
    - 아마 Across도 ETH pool을 공브로 넘겨서 받아서 풀이 채워지는데 시간이 걸릴것으로 추정

틀린 부분 있으면 알려주세용"
C:\Users\user\Downloads\Telegram Desktop\ChatExport_2026-02-02 (3)\messages.html,판판펀치,246,12.11.2025 15:23:22 UTC+09:00,2025-11-12,15:23,"엘리자 따먹기
상호좀요
https://x.com/monghyun523/status/1988430076241989691?s=20"
C:\Users\user\Downloads\Telegram Desktop\ChatExport_2026-02-02 (3)\messages.html,판판펀치,247,14.11.2025 14:21:33 UTC+09:00,2025-11-14,14:21,"근래 바낸따리가 흥따리가 많았어서 간략 복기

MMT - SAPIEN - ALLO 모두 흥따리

MMT - crime coin / TGE 당일 바낸따리가 가장 퍼포먼스 좋았음
SAPIEN - 메타를 잘 타고난 저시총 로보틱스 바낸 상장 흥따리
ALLO - 국내 원상 뚫을만했지만 못 뚫음. 에드 장난질 // 따리는 흥따리. TGE 따리 관점으로는 충분히 플레이해봄직했을 따리

바낸따리는 흥 흥 흥을 잇다가 BANK에서 상장빔 태초마을로 회귀 → 상장 후 상장 전보다 더 쳐박기로 망따리로 꺾였네요
흥따리만 기록해놔서 BANK는 건너뛰겠습니다

금주는 국내 거래소가 이례적으로 일주일 내내 단 한차례도 상장을 하지 않았네요
바낸따리도 3연흥 이후 망따리로 꺾이긴 했지만 당분간은 바낸따리도 좀 더 신경을 투자해서 볼 것 같습니다

노션 복기 ⤵
$MMT 상장 (Up/Bit/Binance)
$SAPIEN 상장 (Binance) 
$ALLO 상장 (Binance)"
C:\Users\user\Downloads\Telegram Desktop\ChatExport_2026-02-02 (3)\messages.html,판판펀치,249,17.11.2025 17:55:00 UTC+09:00,2025-11-17,17:55,"https://x.com/monghyun523/status/1990342320018133272?s=20

일당 30k 상호 리트윗 좋아요좀요"
C:\Users\user\Downloads\Telegram Desktop\ChatExport_2026-02-02 (3)\messages.html,판판펀치,250,18.11.2025 22:00:55 UTC+09:00,2025-11-18,22:00,"그냥 진짜 할거없어서 이런거나 하는중

$MET binance long<>hyperliquid short
1%정도 price gap있었고

하리쪽 스프레드가 꽤 있어서
price gap(100bp)+funding gap(20bp)-스프레드(15*2bp)-수수료(10*2bp)=70bp

적당히 잡았으면 포지션 사이즈대비 50~70bp정도 나왔고(1bp=0.01%) 천천히 좁혀져서 늦게봤어도 잡을만했던듯

리스크는
-하리에서 야랄나는거
->fdv대비 mc높아서 괜찮다고 생각
-현선 안줄어듬
->업비트상장+솔라나라서 무조건 줄어든다고 생각

이런거는 일주일에 몇개씩뜨는듯
그냥 어떻게든 현금확보할려고 회전율 빠르게 도는것만 들어가는중"
C:\Users\user\Downloads\Telegram Desktop\ChatExport_2026-02-02 (3)\messages.html,판판펀치,252,19.11.2025 17:02:41 UTC+09:00,2025-11-19,17:02,"MET

거진 2주만의 원상이네요
메테오라가 그래도 TGE때 거래소 다 뚫을줄 알았는데 결국 한참 지나고서 상장하게됐네요

- 노잼따리긴 하지만, 하락장에 나름 인건비 챙겨준 따리였습니다
생따리치신분들은 전반적으로 4~6퍼정도 가져가고, 현선도 1퍼대에 잘잡았으면 4~5퍼대에 털 기회 많이 준 것 같습니다

- 업비트가 짜치게 MET2 티커로 상장해서 봇 작동안된 사람들이 꽤 있었을 것 같네요

- 이외에 선선도 1~2퍼대 정도 있었어서 선선도 적당히 쌀먹 가능했습니다

노션 복기 ⤵
$MET 상장 (Up/Bit)"
C:\Users\user\Downloads\Telegram Desktop\ChatExport_2026-02-02 (3)\messages.html,판판펀치,253,24.11.2025 17:08:53 UTC+09:00,2025-11-24,17:08,"AI16Z

- 스냅샷 이후 물량 리브랜딩 안해준다함
- 출금열어줌
- 이러지마라"
C:\Users\user\Downloads\Telegram Desktop\ChatExport_2026-02-02 (3)\messages.html,판판펀치,255,25.11.2025 01:55:54 UTC+09:00,2025-11-25,01:55,"https://x.com/monghyun523/status/1992991535974277197?s=20

오늘 모나드상장에 했던것들 적어봤읍니다
리트윗 상호 부탁드릴게요.. 도와주세요.."
C:\Users\user\Downloads\Telegram Desktop\ChatExport_2026-02-02 (3)\messages.html,판판펀치,256,27.11.2025 19:46:17 UTC+09:00,2025-11-27,19:46,"PIEVERSE

트뷰 차트가 이제 올라와서 이제 올립니다..

크게 기록할만한 내용은 없고, 상장공지 이후 계속 올라서 생따리전사들은 만족할만큼 먹었을 것 같네요

현선은 1퍼띠기 쌀먹 가능했습니다

요즘 자도자도 피곤해서 모나드랑 플룸 이런건 천천히 정리해서 차근차근 올릴게요
모나드/플룸/자이온/CHOG/업비트해킹입출막 등등하니까 은근 바쁘네요

노션 복기 ⤵
$PIEVERSE 상장 (Bit)"
C:\Users\user\Downloads\Telegram Desktop\ChatExport_2026-02-02 (3)\messages.html,판판펀치,257,27.11.2025 19:58:17 UTC+09:00,2025-11-27,19:58,"https://theddari.com/trends/race

🥳"
C:\Users\user\Downloads\Telegram Desktop\ChatExport_2026-02-02 (3)\messages.html,판판펀치,258,28.11.2025 23:09:17 UTC+09:00,2025-11-28,23:09,"MON

모나드 복기 지각생입니다
오래전부터 커뮤작하던걸 봤는데 TGE한걸 보니 감회가 새롭네요
보라돌이단들의 성불을 축하합니다

- 우선 국내 상장 따리 자체로는 이득보기 쉽지않았을 것 같네요
dex에서 긁어서 3B 위 평단이면 손해권이었습니다

- 아시다시피 전국민이 참여하는 코베 세일을 진행했었습니다
Total Supply의 7.5% / 초기 유통량의 70% 가량이 토큰세일에 할당됐었습니다
모나드 프리마켓가가 계속 떨어지면서 세일가를 위협해서 over subscription율이 높진않았었습니다
결론적으로는 세일 물량 안정적으로 헷징하거나 홀딩했으면 대 수익을 거둘수있었네요...😞

- Best Play는 코베 역현선이었습니다
코베 세일 가두리 물량으로 코베 모나드 가격 전반적으로 역프가 형성되면서 역현선을 잡았으면 아주 맛있게 냠냠할 수 있었습니다

- 이외에 dex-dex 갭 아비트라지 / LP 등등 여러가지 플레이가 더 가능했습니다

근래 컨디션이 좀 안좋아서 이날 거의 졸면서 brain fog 가득 낀 상태로 간신히 따리했는데 모나드가 상장 이후에 이렇게 가격오를줄 알았으면 이날 푹 잘걸 그랬네용.. 😖

노션 복기 ⤵
$MON 상장 (Up/Bit)"
C:\Users\user\Downloads\Telegram Desktop\ChatExport_2026-02-02 (3)\messages.html,판판펀치,259,29.11.2025 11:57:03 UTC+09:00,2025-11-29,11:57,"업비트 VIP 전담에서 연락옴

1. 11.28. 23:45분 ~ 입금 개시 이후부터는 이전 SOL 주소로 코인을 입금하면 반영이 불가능하니 매우 주의할 것

2. 11.28. 23:45분 ~ 입금 개시 이전까지는 입금 반영 순차로 진행될 예정"
C:\Users\user\Downloads\Telegram Desktop\ChatExport_2026-02-02 (3)\messages.html,판판펀치,260,01.12.2025 16:26:28 UTC+09:00,2025-12-01,16:26,"업비트 SOL 핫 해킹 아비트라지 복기 (11/27 05:30 ~ )

<수익 창출 가능했던 방법>

1. SOL 체인 입출금 중단 공지 (11.27. 05:27)
- 사안의 심각성을 고려 → 입출금 중단 장기화 가능성 → 업비트에서 SOL 계열 코인 현선 잡기
- BEST PICK : MET2, RAY, ORCA (저시총 + 물량이 적은 코인)
- 하지만 상대적으로 시총이 큰 코인이더라도 SOL 계열이라면 최소 5% 이상 김프 주었기에, 호가 좋은 코인에 대해 크게 배팅했어도 좋았음

2. SOL 체인 외 모든 코인 입출금 중단 공지 (11.27. 08:55)
- SOL 뿐만 아니라 모든 계열 입출금 또한 장기화 됨에 따른 현선 잡기 플레이
- 27일 밤부터 SOL 계열 코인의 힘이 빠지면서 SOL 계열 외 코인으로 수급이 넘어감
- BEST PICK : ALT, SAFE, COMP 
- 이때부터는 저시총 + 호가 얇은 코인들 모두 펌핑 쇼 시작

3. 이더리움 계열 입금 개시 (12.01. 13:00)
- COMP, SAHARA, ARKM, HYPER 등 최대 40%까지 김프를 밀 수 있는 기회가 있었음
- 12:55:23초를 기점으로 이후에 발생한 트잭만 입금 반영됨
- 입금 생성이 13시 00분 55초 경 된것으로 보임.
- 입금 생성까지 대략 '6분 32초' 이전에 발생한 트잭이 가장 빠르게 반영된 것

————————————————————-
<손실 발생했던 방법>

1. 업비트 암살 픽이 경주마 낙첨
- 현선 손실 (극 초기에 잡았다면 대략 -1%)
- 토탈 -5000$ 발생

2. 기존 업비트 주소로 보낸 경우
- 입금 반영까지 오랜 시간이 소요되며 이자 발생
- 예시) CYBER 3일간 -3200$ 발생 등
- 토탈 -6000$ 이자 발생

3. 입금 개시 전 현선 배팅 후 따리 실패
- COMP. SAHARA 등 따리 실패로 인해 발생하는 현선 로스 
- 토탈 -6000$ 발생
————————————————————
<정산>
1. 30억 현선 풀배팅 → 수익 : +1.2억
2. SOL 계열 배팅
- JTO, MET2, MEW, W, MOODENG, PENGU, PUMP 
3. 그 외 계열 배팅
- LPT, FLOCK, AERO, ZORA, ALT, ENSO, IN, WAL, LA, TAIKO, SUN, USDC, ZKC, ZBT, NXPC, ORDER, API3, MOVE, AVNT, KAITO, RED, ANIME, OPEN, F, CELO, VANA, CRO, QTUM, AXS, KNC, AKT, BAT
4. BEST PICK
(1) MET2 : 2.5껄
(2) FLOCK : 1.8껄
(3) LPT : 1.3껄
(4) JTO : 1껄
(5) ALT : 1껄
(6) MEW : 1껄
(7) MOODENG : 1껄
(8) LA : 1껄
(9) ZORA : 8근
(10) PENGU : 5근

등등..
————————————————————
<결론> 
1. 해킹의 규모를 체크하고 입출금 중단으로 인한 업비트의 펌핑 가능성 체크
2. 업비트 공지에 따르면 대략 500억 해킹인데.. 이 정도 규모라면 충분히 재기가능하므로 큰 문제 아니라 판단
3. SOL 계열은 사고가 발생했기에 장기화 가능성이 매우 높음 → 현선 배팅했어야 함
4. 2019년도와는 다르게 코인 종목이 매우 많기 때문에 한 두 종목에서 미친듯한 펌핑이 오래 지속되지 못할 것이라 판단 되었음
5. SOL 계열 외 다른 코인 중 김프가 없는 코인 위주로 배팅해서 수익 발생했음
6. 이더리움 계열 입금과 같은 사례를 잘 복기하여 수익을 낼 수 있게 해야함
→ 다음에 비슷한 기회가 있다면, 소액으로 여러 발을 긴 인터벌로 전송할 것 같음 
7. 이제 정신차리고 다시 지갑 등록하러가자.."
C:\Users\user\Downloads\Telegram Desktop\ChatExport_2026-02-02 (3)\messages.html,판판펀치,261,02.12.2025 17:53:38 UTC+09:00,2025-12-02,17:53,"PLUME

요즘 좀 게을러져서 천천히 올리고 있습니다..
업비트 입출막도 계속 보고있기도 했구요

간만에 옆상이었는데도 대흥따리였네요
여러가지로 수익볼 기회도 있었고 전반적으로 따리 공부할때 참조하면 좋을 거 같은 상장이었던 것 같아요 (거래소별 핫 모니터링, CEX간 브릿징 체킹 등등..)

- 옆상이라 기대감이 적었는데 Bybit 핫도 빨리 털리고, Binance가 ETH 지갑 점검하면서 입출막된게 흥따리에 도움을 준 것 같아요

- Plume → ETH 공브가 6~7일 걸려서 ETH 물량이 한정적이었고, dex도 유동성이 작았기 때문에 거래소 핫 물량을 열심히 봤어야 했습니다

- 다양한 거래소에서 따리가 가능했지만 특히 Bybit → Binance → 업비트 거치는 루트를 빨리 캐치했으면 좋았을 것 같습니다

- 이후 거래소 핫 다 털리고 입출금 suspended된 이후에도 dex로 꾸준히 쌀먹 기회 있었습니다

노션 복기 ⤵
$PLUME 상장 (Up)"
C:\Users\user\Downloads\Telegram Desktop\ChatExport_2026-02-02 (3)\messages.html,판판펀치,262,03.12.2025 00:33:13 UTC+09:00,2025-12-03,00:33,"Quanto (구. OXFUN)

- zhusu (전 쓰리애로우 캐피탈 창립자) 가 만든 meme perpdex 였음
- 메이저 코인 + 밈코인 선물거래가 가능했음
- 작년 11월쯔음 처음 접한게 $OX 토큰 펀비 1시간당 0.1% 캐먹으려고 갔엇음
- $OX토큰을 담보로 사용할수있어서 OX토큰을 구매한뒤 1배율 숏을치면 크게 리스크없이 펀비를 시간당 0.1%씩 캐먹을수있었음 (0.01% ~ 0.1%)
- 하루에 최대 2.4%씩 달달했음 
- 펀비 3~4달 캐먹었던거같음
- 업비트 상장때 OXFUN은 현물 추종이라 ORCA같은거 숏치고 다른데서 롱치면 펀비 + 갭 먹을수있었음 

- zhusu가 아침마다 OXFUN 거래소키고 코인얘기하는 라이브스트리밍도 맨날했었음
- 수익을 OX토큰으로 주는점, 호가가 종종이상해지는점 출금 늦어지는점 등등 몇가지 맘에 들지않는게 잇었음
- 그래도 나름 PERPDEX치고 완성도가 있었음. 볼트도 운영하고, 거래 끊킴없고, 신규코인상장도 빨리빨리해줬음
- 어느순간부터 출금을 점점 늦게해줬음 
- 보통 30분이내 되던게 종종 6시간 12시간 걸렸던거같음 
- 웃긴게 얘내 5만불입금하면 5만불은 잘뺴주는데 수익난거는 엄청 늦게뺴줬음
- 이때 전 사용멈췄음

- 주변에 몇명은 지속적으로 쓰고있었음
- 어느순간 출금 하루 이틀씩걸리고 디스코드에도 계속 출금 이슈 언급되고 그랬었음
- 디스코드 채팅보면 KONG2LOVE형님 맨날 돈안빼준다고 항의하고있었음
- 어느순간 관리자들 안보이고 출금 안해주고 계정 밴 시켰음

- 엄청 아쉬운게 OX토큰 탑홀더로 들고잇었었음
- 거래소 나쁘지않고, zhusu가 매일 스트리밍 키면서 거래소 언급하면서 코인얘기하고, 신규밈코 나오면 10M만 넘어가면 바로바로 신청넣으면 상장시켜주고 했었음
- 운영, 마케팅만 좀더 잘하면 무조건 지금보다 잘될거라고 생각했었음
- 그때만해도 꽤 괜찮다 생각하면서 열심히 내려올떄마다 샀음
- 거의 1년가까이 들고있다가 입출금 이슈 계속 생기면서 9월 초중순언저리에 눈물머금고 다 정리함
- 9월 말에 갑자기 PERPDEX 코인들 전부 하나하나 언급되면서 오르는 타이밍이왔음
- KILOEX, 블루핀, 신퓨처스, 퍼프토큰 다 막 올랐었음
- 거래소자체가 잘될줄알았는데 어쩃든 토큰 10배 넘게오름
- 개미붙으면 죽어도 안올려주나보다.
- 판지 2주도안되서 엉엉울었다.
- 11월부터 거래소닫음"
C:\Users\user\Downloads\Telegram Desktop\ChatExport_2026-02-02 (3)\messages.html,판판펀치,264,04.12.2025 22:30:20 UTC+09:00,2025-12-04,22:30,"XION

당일 PLUME에 묻힌 감이 없잖아 있는데 흥따리였습니다
따리도 따리지만, 상장후 무자비한 후펌이 인상적이었네요

- 초반에 긁어놓고 생따리했으면 100% 이상 수익도 볼 수 있었습니다
뒤에 후펌으로 1900원까지 가긴했지만 매매의 영역이라 패스
상남자라 롱까지 쳤으면 1시간 풀음펀도 낭낭하게 챙겼겠네요

plume 하느라 정신팔렸던 것도 있고 상장시간에 나가야했어서 따로 참여못하고 나중에 천천히 구경했었네요
개인적으로 ibc는 경험치가 0라 다음에 ibc쪽 상장하면 대처할 수 있게 간단하게 공부해둘까 합니다

- dex 따리가 나름 괜찮았던거같은데 제대로 못봐서 나중에 참고하게 몇글자 남겨둡니다

노션 복기 ⤵
$XION 상장 (Bit)"
C:\Users\user\Downloads\Telegram Desktop\ChatExport_2026-02-02 (3)\messages.html,판판펀치,265,07.12.2025 20:09:39 UTC+09:00,2025-12-07,20:09,"IRYS

근래 있었던 빗썸 흥따리 시리즈 중 하나입니다

- 현선보다는 생따리 잘 쌌으면 10퍼대 수익도 볼 수 있었습니다
개인적으로 PIEVERSE - XION - IRYS를 거치면서 업비트 해킹사태가 터진 해당 기간동안 빗썸 생따리에 더 적극적으로 베팅하게 된 계기가 되었던 따리였던 것 같네요

며칠 좀 바깥 싸돌아댕기느라 늦었네요
앞으로 남은 BOB, TRAC, SAPIEN은 크게 덧붙일 말은 없지만 업비트 해킹 기간 동안 빗썸 상장의 기대감을 반영한 따리가 아닌가 싶어요
이제는 해킹 입출막도 다 마무리되었고 아마 내일 스테이블이 TGE 국내 상장이 되지않을까 싶긴하네요

노션 복기 ⤵
$IRYS 상장 (Bit)"
C:\Users\user\Downloads\Telegram Desktop\ChatExport_2026-02-02 (3)\messages.html,판판펀치,266,08.12.2025 20:11:14 UTC+09:00,2025-12-08,20:11,"사람들이 잘 모르는 나만 알고싶은 텔방 모음

1. 저스트코인 (https://t.me/JUSTCRYT)
: 바이브 코딩의 선구자. 텔레그램에 서식하는 수많은 따개비들을 코딩으로 이끈 꿈과 희망 그리고 빛. 나도 코딩하면 이렇게 다 만들 수 있겠지? 라는 희망찬 마음으로 코딩하러 들어갔다가 아 난 역시 모자란 친구구나라는 깨달음을 주게해줌. 광고도 없고 본인이 만드는 프로그램 위주로 올리는 채널인데 배울점이 아주 많음. 코딩 배워보고싶으신분은 일단 여기로.. 

2. 김피카썬더볼트 (https://t.me/Pika_Kim)
: 레전드 따리 고인물. 코린이시절부터 박치기해가며 배운 따리에 대해 가감없이 설명하고 복기하는 채널. 나 진짜 따리 혼모노를 알고싶은데? 하면 여기로.. 채널 만드신지 얼마 안 되셨고 곧 떡상할 채널이니 미리 들어가세요ㅋㅋㅋ 

3. 사랑방 (https://t.me/Sarangbang_Crypto)
: 피카님과 마찬가지로 따리 위주의 정보와 복기를 하는 채널. ""콩이러브가 또 다 밀었대..""에서 그 콩이러브님이 하는 채널. 여긴 채널도 채널인데 채팅방이 아주 맛집. 열심히 보다보면 가끔가다 고수형들이 힌트도 가끔 주시는 자비를 보여주심..

4. 갱생코인 (https://t.me/gensencoin)
: 내가 문버드를 민팅하게해준 장본인. 코인판에서 오랫동안 뒹굴어서 이것저것 다 아시는 고인물. 가끔가다 이거 좀 괜찮다 싶은 거 스윽 올리는데 그게 말도 안 되는 리턴으로 돌아오는 경우가 있음. 예전에 무슨 NFT pass 같은 것도 공유하셔서 5껄인가 한방에 버시는 거 보고 머리 띵했던걸로 기억

5. 인생코인 (https://t.me/lnsanecoin)
: 나랑 동갑인 친구지만 정말 배울점이 많은 연우. 그냥 머리가 좋은건지 경험을 많이해본건지 코인 관련된 거에서 모르는게 없음. ""저 코인 접었어요."" 라는 인삿말로 띵가띵가 노는 거 처럼 보이지만 시드는 전혀 놀고있지 않은 고수의 채널. 글 리젠도 많은 편이고 전부 봐서 나쁠 거 없는 유용한 정보 많음.

6. 작업일지 (https://t.me/kimmm1kim)
: 다계정의 신. 나루토에 록리가 있다면 코인판엔 작업일지가 있다. 에드작 하기 조낸 싫을 때 이 채널보면 아 난 정말 게으른 코인충이구나를 깨닫게 해주심. 보다보면 귀감과 자극과 반성과 회고와 따라할껄 등등의 여러 감정을 느끼게 해주는 채널

7. MEME (https://t.me/Yndegen)
: 가끔가다 밈코 관련한 시나리오와 컨트렉트가 올라오는데 꽤나 승률이 높은편. BSC 체인 밈코를 배워보고싶다면 여기로.. 나름대로의 원칙과 매매근거가 확실하신 편이고 그 과정을 보며 배우게 되는점이 많음. 

8. 낙제 Rezet의 영웅담 (https://t.me/RezetSide)
: Rezet님이 하시는 메인 채널. 공모주, 에드작, 쌀먹 등등의 로우리스크 미들리턴을 노리는 전략이 가득한 채널. 특히 리젯님 채팅방에 있다보면 나를 포함해서 공모주 안 한다고 회초리맞는 여러 따개비들 많이 볼 수 있음. 본인이 코린이인데 아무것도 모른다하면 리젯님 방 가서 쌀먹과 에드작부터 배워보는게..

10. 판판펀치 (https://t.me/pannpunch)
: 원상 따리 복기 맛집. 판판님이 하시는 채널인데 복기 올라올 때마다 노션 같이보는 재미가 있음. 이 채널도 역시 따리/아비트라지 관심 있으신분들은 꼭 가야하는 채널

11. Crypto Sea (https://t.me/crypt0_sea)
: 'USELESS BOY' 여명님의 채널. 레전드 고수로 잘 알려져있고 채널보단 채팅방에서 지나가듯 얘기하는게 꿀통이 많음. 그냥 옆에 있다보면 뭐 하나라도 보게되고 배우게 되는 그런 채널. 메테오라가 뭔지도 모르다가 여기 채팅방에서 얘기하는 거 보고 어깨너머로 배웠음... 서당개가 되어보자!

12. 로우나의 코인방 (https://t.me/Rowna999)
: '레전드 부산 근육남' 로우나님의 채널. 본인이 코인판에서 하는 생각과 전략을 솔직하고 꾸밈없이 보여주심. 가끔가다 소신발언도 조금씩 해주시는데 재밌음. 그리고 두루두루 다 잘하시는 올라운더. 부산 사나이의 솔직담백 코인판 살아남기를 보고싶다면 여기로..

13. 돈버는 작당모의 (https://t.me/cryptopangpang)
: 돈되는 거 할줄 모른다고 써있지만 아이러니하게도 정말 잘 하시는 채널. 따리부터해서 코인판 이벤트, 세일 기타 등등 코인판 A to Z 다 하시는 거 같음. 코린이를 위한 가이드를 세세하게 적어주셨던게 기억에 남음 https://t.me/cryptopangpang/2919
아직도 안 읽어봤다면 꼭 읽어보자! 그리고 따리할 때 음챗 슬쩍 들어가면 가끔 다같이 따리하는 모습을 볼 수 있음..

14. NA (https://t.me/btcbullforever)
: 개그맨 특별전형."
C:\Users\user\Downloads\Telegram Desktop\ChatExport_2026-02-02 (3)\messages.html,판판펀치,267,09.12.2025 15:36:17 UTC+09:00,2025-12-09,15:36,"BOB, TRAC

업비트 해킹기간동안 빗썸 흥따리 마지막 불꽃편입니다
지난 IRYS처럼 BOB랑 TRAC도 둘다 코베픽인 개잡코 상장이었습니다

- 앞선 PIEVERSE-XION-IRYS와 비슷하게 BOB-TRAC도 현선보다는 생따리가 best였습니다
BOB - 저시총 / TRAC - 헷징못함 등의 특징점도 꼽아볼 수 있겠습니다


최근에 따리웨옹고수인 피카님이 채널을 오픈해서 소중한 복기를 작성해주시고 계시는데, 고수들의 사고과정을 보는건 항상 중요하다고 생각합니다
노션 복기안에 피카님 복기 링크도 함께 첨부해두었습니다🤒

어제 stable 빡집중하려고 써놓고 안올렸는데 이럴줄알았으면 그냥 올릴걸 그랬네요
금일 상장하는 allora는 바낸따리는 나름 흥이었는데 빗썸은 어케될지 궁금하네요


노션 복기 ⤵
$BOB 상장 (Bit) 
$TRAC 상장 (Bit)"
C:\Users\user\Downloads\Telegram Desktop\ChatExport_2026-02-02 (3)\messages.html,판판펀치,269,10.12.2025 00:20:30 UTC+09:00,2025-12-10,00:20,"WET Presale 복기
봇으로 인한 1차 세일에 실패하고, 2차 세일로 재오픈
달라진 점: 캡챠(클라우드플레어), Transaction Priority Fee(프론트)
시간을 미루다가 갑자기 오픈해버려 엄청 정교한 봇이 아닌 이상 인터넷 빠른 사람들이 먹었을 것으로 추정

먹을 수 있었던 방법(성공율 높은 순서)

1. 엄청 정교한 봇 (브라우저 X)
     - 미리 웹사이트를 리버싱 했어야함(AI 정도 수준도 가능), 할 시간은 충분히 있었음
     - 봇 작동 방식?
           1. /live에 계속 요청해서 열리는 시간, 주소 체크
           2. Public/Private RPC 통해 트렌젝션 넣기
           3. 캡챠 키 계속 받아오기 (공개된 솔버들은 대부분 15초 이상 걸려서 계속 받아와야 함)
           4. 캡챠키로 confirm-commit API 넣기 (사진 2, 3 참고)
         
2. 반자동화 - BEST
     - NA님 / kkda님 스크립트
     - 변수가 너무 많았음(캡챠 속도, 상장 시간 변화 등) 버튼 누르기 정도의 봇이 제일 최고

3. 수동
     - 언제 세일이 시작되는지 알려주는 정도의 봇을 만들었어야함, 시간 한번 늦춰졌을 때 AI라도 사용해서 대충 만들어 뒀으면 수월했을 것 같음 (이거라도 했어야했음....)


참고로 리스크도 1 > 2 > 3 순임, 여러가지 변수로 인해 2번이 베스트였음"
C:\Users\user\Downloads\Telegram Desktop\ChatExport_2026-02-02 (3)\messages.html,판판펀치,273,10.12.2025 18:14:03 UTC+09:00,2025-12-10,18:14,"SAPIEN

무난

- 상장공지빔 이후 눌리면서 박스권 형성했을 때 잘 담아서 생따했으면 best

- 현선은 펀비탐 이후 잘 잡아서 플레이했으면 2~3퍼대 

개인적으로 PIEVERSE-XION-IRYS-BOB-TRAC의 과도한 빗썸 흥따리 기조를 온건하게 끝내준듯
계속 흥따리라 한번 2~30% 맞으면서 크게 부러지는거 감수하고  무지성 생따리를 계속갈겼는데, SAPIEN이 나름 나쁘지않게 진행되면서 적당한 생따리 수익으로 마무리

다만 저시총, IRYS의 비슷한 입금액 등 고려했을 때 보여준 SAPIEN 상장 퍼포먼스가 근래 빗썸 흥따리 기조의 어느정도 분기점에 도달했다고 판단해 SAPIEN 이후로는 빗썸 따리는 다시 다소 보수적으로 진입

경석이형의 업비트 상장을 얌전히 기다리는중..

노션 복기 ⤵
$SAPIEN 상장 (Bit)"
C:\Users\user\Downloads\Telegram Desktop\ChatExport_2026-02-02 (3)\messages.html,판판펀치,274,12.12.2025 17:18:33 UTC+09:00,2025-12-12,17:18,"ALLO

노맛따리

- 아마 ASTER 이후 첫 빗썸 입금량 40억 돌파 상장

- 상장공지빔 다 빼는 태초마을행 / 현선0퍼대 / 상장 직후 정직한 정프~약역프

딱히 안봐도 되는 상장이었슴니다
11월 초중순때 Binance 스팟 상장한 코인들을 좀 몰아서 해줬네요
SAPIEN에서도 말했지만 빗썸 따리 다시 확 죽은거같아서 보수적으로 하는중입니다

사실 ALLO는 늦게 일어나서 보고 현선0/입금량/ALLO 상태 보고 귀찮아서 패스했네요
한참전 바이낸스 상장할때 같이 TGE 상장했으면 맛있었을 것 같은데 아쉽네요

노션 복기 ⤵
$ALLO 상장 (Bit)"
C:\Users\user\Downloads\Telegram Desktop\ChatExport_2026-02-02 (3)\messages.html,판판펀치,275,14.12.2025 14:11:51 UTC+09:00,2025-12-14,14:11,"STABLE

노맛따리2

- 도태런치풀수감에드물량 + 현선0 콜라보로 60억가량 입금액

- 상장공지빔 다 빼는 태초마을행 / 현선0퍼대 / 상장 직후 정직한 정프~약역프

딱히 안봐도 되는 상장2
첫 상장빔/현선/입금들어올 도태김치에드물량/4시 부근 입금량보고 인건비도 안나올거같아서 그냥 멀뚱단 합류
스테이블 TGE에 국내거래소/바낸도 못뚫고 토크노믹스도 쉽지않고 roi 10%도 안챙겨주고 여러모로 실망스러운 플젝

근래 게을러서 복기 밀렸던거 드디어 다썼네요
근래 먹은 갭이나 기타등등은 심심하면 올릴게요

노션 복기 ⤵
$STABLE 상장 (Bit)"
C:\Users\user\Downloads\Telegram Desktop\ChatExport_2026-02-02 (3)\messages.html,판판펀치,276,15.12.2025 12:38:45 UTC+09:00,2025-12-15,12:38,"*코린이용 브릿지 컨트랙트 (BSC->타체인 쏘는 법 예시/프론트 미지원시 사용 한정)

1. 코인마켓캡에서 토큰 검색
2. Explorers 란에 bsc 스캔에 들어가서 contract 클릭
3. write contract 리스트 중 send가 있다면 높은 확률로 스게 백엔드 브릿지가 가능한 코인
4. send 함수 누른 후 아래의 값들을 맞게 채워넣기...
  -send : 가스비 (다른 브릿지 트젝보고 사용한 가스비 그대로 넣으면 됨)
  -dstEid : 어느 체인으로 보낼지에 대한 란
  레제로docs나 디코더 사용해서 풀기
  -to : 받을 주소 (본인 지갑 주소에서 0x 빼기)
  0x000000000000000000000000[0x뺀 지갑주소]
  -amountLD :  보낼 수량 (테스트 시엔 0으로 설정)
  -minAmountLD :  슬리피지 조정 가능한 란이나 amountLD와 동일하게 작성 (고려 안해도 대부분 그대로 넘어가기 때문)
  -extraOptions : 가스 리밋 관련 란... 이것 역시 디코더로 풀고 그대로 넣으면 됨
  -composdMsh, oftCmd 둘 다 보통 0x으로 설정
  -native fee : 0.001의 가스비를 send에 적었을 시 이 값은 1이 됨. 0.00 빼고 뒷부분만 복붙하여 써주면 됨. (wei형식이기 때문인데 자세한건 gpt에게 질문하기)
  -IzTokenFee : Fee를 토큰으로 낼지, 네이티브 토큰으로 낼지.... 99%의 경우 0을 씁니다. (bnb로 지불하기 때문)
  -refundAddress : 환불주소, 위와 다르게 0x를 포함한 자신의 개인지갑 주소를 적어주면 끝

이제 write를 눌렀을 때.. 메타마스크 기준 ""이 트랜잭션은 실패할 확률이 높습니다""일 경우 뭔가 잘못된 상태라고 생각하고 변수 다시 조정하기.
외에 바로 정상적인 컨펌창이 나올 경우 그대로 진행하면 0개 테스트는 끝!

브릿지 수량과 nativeFee 둘 다 wei를 기준으로 계산해야 하므로 지피티를 활용하시면 값을 더 빨리 구하실 수 있습니다.

남의 성공 트잭들의 값 훔쳐보는 방법 : 디코더에 브릿지 성공한 트잭해시 붙여넣고 돌리기!

*반드시 0개 테스트 트랜젝션을 먼저 넣어본 후 성공적으로 트랜젝션이 들어갔는지 확인하시길 권합니다.

*최근에는 프론트를 빠르게 지원하는 추세이므로... 스타게이트 프론트 (브릿지 사이트 내)에서 가능하다면 컨트랙 브릿지를 할 필요 없습니다."
C:\Users\user\Downloads\Telegram Desktop\ChatExport_2026-02-02 (3)\messages.html,판판펀치,277,15.12.2025 18:22:12 UTC+09:00,2025-12-15,18:22,"WET 

업비트 핫 월렛

1. https://solscan.io/account/7Ng5jdYGV7PLDMLEqxPhJ9q7ma2gLyL1V2s1khVaAGat

2. https://solscan.io/account/7zRoQfhuvdHtQpjZAaz7rN1DAfjHyeWP2TCc8mWASTJL

3. https://solscan.io/account/8XC4zALxqw5cVJxFadPDL29b4TtTVLD7Mb1DYieqaaes

4. https://solscan.io/account/8eqnbCoLFKFoPbdbCEbSn1SU7cRmhP3t7KFA2bGt9TsC

빗썸 핫 월렛

1. https://solscan.io/account/4vujAA3KkxtXdkW6Tm5L6TgnF66zKUAkHZdyrk4fVFCy

2025.12.15 18:20
업비트 - 25,192,807 $WET /  $0.28 기준 $7,053,985 / 약 105억 가량
빗썸 - 2,074,209 $WET /  $0.28 기준 $580,778 / 약 8.6억 가량"
C:\Users\user\Downloads\Telegram Desktop\ChatExport_2026-02-02 (3)\messages.html,판판펀치,278,17.12.2025 16:09:26 UTC+09:00,2025-12-17,16:09,"WET

흥따리

- 근 2주 반만의 업비트 상장

- 빗썸 입금량 집계 중 신메타 시작

- 생따리(Best)
   - dex에서 빨리 긁었으면 평단 아주 좋게 가져갈 수 있었음
- 현선도 괜찮은 수익
   - dex 잘 긁었으면 역현선도 가능했음
- 선선
   - 상장 이후 8퍼대갭까지 있었는데, 펀비타임 이후에 잡든 잘 잡아서 플레이했으면 3%대 가량 빨 수 있었음
- 빗썸 역프 쌀먹

개인적으로 렌딩댑 있나 살펴보다가 dex 빨리 못긁은게 아주 아쉽네요
이것저것 했는데 수익은 못봤네요..

그래도 이것저것 복기할만한 가치가 있는 따리였던 것 같습니다
쓰다보니 복기도 좀 길어졌네요
EDEN도 오늘안으로 올려볼게요

노션 복기 ⤵
$WET 상장 (Up/Bit)"
C:\Users\user\Downloads\Telegram Desktop\ChatExport_2026-02-02 (3)\messages.html,판판펀치,279,18.12.2025 13:43:42 UTC+09:00,2025-12-18,13:43,"WET

- 업비트 원상하면서 풀펀비가 낌
- 바이낸스, 바이빗 선물-선물 갭이 8%까지 있었음
- 거래소별 펀딩피시간이 바낸 4시간, 바이빗1시간 이였음
- 펀비 -2% 내고도 조금은 남겠다 싶어서 선물선물 갭잡음
- 6%대에 진입해서 -2%내고 4프로정도 부터
바이낸스도 1시간으로 바뀜
- 다음날 아침 바이낸스/바이빗 갭이 0.5~1%까지 줄어듬
- 투입자금대비 3%정도 먹은듯
- 선물-선물 갭이 좋은게 레버리지를 활용할수있는데 따로 레버는 안썻는데 좀 쓸걸 후회중
- 바이빗/바이낸스 펀딩피 계산식이 살짝다른데 이것도 계산식 공부 다시해봐야할거같음

바이낸스 -42874 , 펀비 +19,414 = $-23460
바이빗 펀비제외 수익 = $37198
이익금 = $13737"
C:\Users\user\Downloads\Telegram Desktop\ChatExport_2026-02-02 (3)\messages.html,판판펀치,281,18.12.2025 17:57:41 UTC+09:00,2025-12-18,17:57,"EDEN

- 초저시총 상장

- 상장 연기
  - 솔직히 상장 연기 안해도 당시 dex가 기준 15억가량 됐어서 충분히 상장할법했는데 굳이 연기함
  - 연기하면서 가격 하락 / 결론적으로는 상장 연기 전 후 입금액은 비슷해짐

- Point) 바이낸스 출금
  - 상장 공지 이후 바이낸스 핫이 빠르게 털리고, 핫을 안 채워주면서 거래소 간 괴리가 심했음
 - 거래 시작(5:35) 이후 9시 가량에 핫이 채워지면서 트럭형님들이 10%대 갭 진압하며 마무리

- (Best) CEX (Binance 제외) - Binance 현선 
  - 거래 시작전까지 바이낸스 핫 안채워줄거 베팅하고 잡았으면 현선 20퍼대까지 꼈어서 대수익  

- 생따리
   - 어지간히 평단 낮게 잡은거 아니었으면 좀 곤란
   - dex 고점 털이했으면 well played (매매)

- 선선/펀비도 찬스있었던 것 같은데 직접 플레이 안해봐서 생략..

초저시총인데 힘도 생각보다 약하고, 굳이 상장 연기한것도 상당히 에오했던 부분.
대부분 공짜현선에 바이낸스 현선을 잡았을텐데, 거래 시작까지 핫 안채워주고 역현선까지 끼면서 물린 사람들이 많았음
핫 모니터링하다가 빗썸/dex 달려가서 먹었으면 좋았을듯

원래 어제 올릴려 했는데 좀 늦었네용


노션 복기 ⤵
$EDEN 상장 (Bit)"
C:\Users\user\Downloads\Telegram Desktop\ChatExport_2026-02-02 (3)\messages.html,판판펀치,282,20.12.2025 17:20:34 UTC+09:00,2025-12-20,17:20,"DEXE

노잼 따리

- 현선 0퍼대

- 상장공지 후 초반 생매수 / 생따리시 약이득

- 입금액 15~16억 가량

크게 첨언할 것도 없는 흔한 빗썸 개잡코 상장이었습니다
위에 적은 3줄 정도만 알고 넘어가시면 될 것 같습니다
이전 빗썸 흥따리 시기처럼 한번 흥따리가 터져주기전까지는 참여하지 않거나/사이즈를 줄여서 참여하고 있습니다

노션 복기 ⤵
$DEXE 상장 (Bit)"
C:\Users\user\Downloads\Telegram Desktop\ChatExport_2026-02-02 (3)\messages.html,판판펀치,283,24.12.2025 13:57:03 UTC+09:00,2025-12-24,13:57,"https://x.com/monghyun523/status/2003493956303323397?s=20

엘프 벗기기(1)
복기가 길어서 두편으로 나눕니다 상호좀요"
C:\Users\user\Downloads\Telegram Desktop\ChatExport_2026-02-02 (3)\messages.html,판판펀치,284,24.12.2025 13:57:03 UTC+09:00,2025-12-24,13:57,"https://x.com/monghyun523/status/2003505988318695854?s=20

엘프 벗기기(2)

상호좀요"
C:\Users\user\Downloads\Telegram Desktop\ChatExport_2026-02-02 (3)\messages.html,판판펀치,285,24.12.2025 16:08:13 UTC+09:00,2025-12-24,16:08,"AI16Z 코인원

- 스왑 지원 대상: 에이아이식스틴즈(AI16Z)를 보유한 고객
- 스냅샷 시점: 별도 안내 예정
-  출금 및 거래 일시중단 일정: 별도 안내 예정

토큰 스왑 비율:
- 1:6 스왑 지원 대상: 2025.11.11 20:40(KST) 시점부터 스냅샷 시점까지 매매 없이 동일한 수량의 AI16Z를 보유한 경우 해당 물량
- 그 외 AI16Z 보유 이용자: 스냅샷 시점 보유 수량에 따라, 재단에서 제공한 토큰스왑 대상 잔여 물량을 보유 비율에 맞춰 스왑 지원
https://coinone.co.kr/info/notice/5000"
C:\Users\user\Downloads\Telegram Desktop\ChatExport_2026-02-02 (3)\messages.html,판판펀치,286,25.12.2025 15:12:26 UTC+09:00,2025-12-25,15:12,"THQ

노맛 따리2

- 헷징 x (MEXC 캡 100불)

- 생따리
   - 거래 시작 전 하락 당시 특정 평단만 생존
   - dex 고점

- 입금액 20억 가량

- EDEN보다 저시총 / 그럼에도...
  - 근래 상장들 고려하면 시총은 따리시 고려 factor에서 비중을 많이 낮춰도 되지않나 싶음


어제 올리려 했는데 하루종일 토스 쇼핑하다가 오늘 올렸네요

메리 크리스마스 🎄🎄🎄

노션 복기 ⤵
$THQ 상장 (Bit)"
C:\Users\user\Downloads\Telegram Desktop\ChatExport_2026-02-02 (3)\messages.html,판판펀치,287,26.12.2025 17:29:31 UTC+09:00,2025-12-26,17:29,"ZKP

업비트 핫 월렛

1. https://etherscan.io/token/0xe1be424f442d0687129128c6c38aace44f8c8dbc?a=0x434b16a964557ef58847e17290e768048bd7855f

2. https://etherscan.io/token/0xe1be424f442d0687129128c6c38aace44f8c8dbc?a=0x2cc5a71e0243110449023db7b1efb7ebf18eff98

