{"source_file": "C:\\Users\\user\\Downloads\\Telegram Desktop\\ChatExport_2026-02-02 (3)\\messages.html", "channel": "íŒíŒí€ì¹˜", "message_id": 5, "ts_title": "25.01.2025 13:54:33 UTC+09:00", "date_ymd": "2025-01-25", "time_hm": "13:54", "text": "ê°œì¸ ë³µê¸°ìš© ë©”ëª¨ì¥"}
{"source_file": "C:\\Users\\user\\Downloads\\Telegram Desktop\\ChatExport_2026-02-02 (3)\\messages.html", "channel": "íŒíŒí€ì¹˜", "message_id": 6, "ts_title": "25.01.2025 13:54:45 UTC+09:00", "date_ymd": "2025-01-25", "time_hm": "13:54", "text": "+) ì§€ë“£ë…¸"}
{"source_file": "C:\\Users\\user\\Downloads\\Telegram Desktop\\ChatExport_2026-02-02 (3)\\messages.html", "channel": "íŒíŒí€ì¹˜", "message_id": 7, "ts_title": "25.01.2025 13:55:04 UTC+09:00", "date_ymd": "2025-01-25", "time_hm": "13:55", "text": "ì•„í•˜í† í°ìš© ì‹ ì¹´ ê³ ë¥´ê¸°\n+) ì‹ ê·œë©´ ì‹ ê·œì´ë²¤ ì°¾ì•„ì„œ ë°›ê¸°\n\ní†µì‹ ë¹„í• ì¸\nhttps://card.kbcard.com/CRD/DVIEW/HCAMCXPRICAC0076?mainCC=a&cooperationcode=04482 - 30ì´ìƒ ìœ í”ŒëŸ¬ìŠ¤ 12,000 í• ì¸\n\në§ˆì¼ë¦¬ì§€\nhttps://m.kbcard.com/CRD/DVIEW/MCAMCXHIACRC0002?mainCC=b&allianceCode=09126&jehuId=KBSTR - 400ë§Œì›ê¹Œì§€ 1500ì›ë‹¹ ëŒ€í•œí•­ê³µ 2ë§ˆì¼ / 400ì´í›„ 1000ì›ë‹¹ 1ë§ˆì¼ / KBpay ê²°ì œ í•„ìˆ˜\n\nê¹¡í• ì¸\nhttps://www.tossbank.com/product-service/card/wide-card - 500ë§Œì›ê¹Œì§€ 2% í• ì¸\n\në„¥ìŠ¨ìºì‰¬\nhttps://www.hyundaicard.com/cpc/cr/CPCCR0201_01.hc?cardflag=N&cardWcd=NXHCV&eventCode=00000\në¬´ì œí•œ 3% ë„¥ìŠ¨í¬ì¸íŠ¸ ì ë¦½ / í˜„ê¸ˆí™”í•˜ë©´ 2.5%ì •ë„ í• ì¸(íŒ”ë¼ê³ )"}
{"source_file": "C:\\Users\\user\\Downloads\\Telegram Desktop\\ChatExport_2026-02-02 (3)\\messages.html", "channel": "íŒíŒí€ì¹˜", "message_id": 8, "ts_title": "25.01.2025 13:55:12 UTC+09:00", "date_ymd": "2025-01-25", "time_hm": "13:55", "text": "https://youtu.be/ugpywe34_30?si=RzWatIcEUYfHSxEw"}
{"source_file": "C:\\Users\\user\\Downloads\\Telegram Desktop\\ChatExport_2026-02-02 (3)\\messages.html", "channel": "íŒíŒí€ì¹˜", "message_id": 11, "ts_title": "19.03.2025 14:44:46 UTC+09:00", "date_ymd": "2025-03-19", "time_hm": "14:44", "text": "ì‚¬í•˜ë¼ ì‹œì¦Œ3 ì˜¤í”ˆ // í˜„ì¬ FAQ ë° ì´ìŠˆë“¤ \n\n1. í˜„ì¬ ì¶œì²µ(1exp) ë¯¸ì…˜ì´ ì¼ë¶€ ìœ ì €ë“¤ë§Œ í´ë ˆì„ ê°€ëŠ¥.\n- ì˜¤ëŠ˜ì´ ì‹œì¦Œ3 ì˜¤í”ˆë‚ ì´ë¼ ì•„ì§ ë°ì´í„° ë™ê¸°í™”ê°€ ì§„í–‰ì¤‘ì„. ë°ì´í„° ë™ê¸°í™”ê°€ ì™„ë£Œë˜ë©´ í´ë ˆì„ ê°€ëŠ¥í•´ì§ˆ ì˜ˆì •.\n\n2. ì‹œì¦Œ2 ë°ë¯¸ê°“ SBT ë¯¼íŒ…ì€ wen??\n- 1ë²ˆ ë‚´ìš©ê³¼ ë§ˆì°¬ê°€ì§€ë¡œ, ì˜¤ëŠ˜ì´ ì‹œì¦Œ3 ì˜¤í”ˆë‚ ì´ë¼ ì•„ì§ ë°ì´í„° ë™ê¸°í™”ê°€ ì§„í–‰ì¤‘ì„. ë°ì´í„° ë™ê¸°í™”ê°€ ì™„ë£Œë˜ë©´ ë¯¼íŒ… ê°€ëŠ¥í•´ì§ˆ ì˜ˆì •.\n\n3. ì‹œì¦Œ3 ì‹ ê·œìœ ì €ëŠ” Sigil of Initial ë¯¼íŒ…ì´ ì•ˆë˜ê³ , ê·¸ ì¤‘ ì¼ë¶€ëŠ” \"ì‚¬í•˜ë¼ ì„±ì·¨ NFT\"ë§Œ ë¯¼íŒ…ê°€ëŠ¥.\n- 1ë²ˆ ë‚´ìš©ê³¼ ë§ˆì°¬ê°€ì§€ë¡œ, ì˜¤ëŠ˜ì´ ì‹œì¦Œ3 ì˜¤í”ˆë‚ ì´ë¼ ì•„ì§ ë°ì´í„° ë™ê¸°í™”ê°€ ì§„í–‰ì¤‘ì„. ë°ì´í„° ë™ê¸°í™”ê°€ ì™„ë£Œë˜ë©´ ë¯¼íŒ… ê°€ëŠ¥í•´ì§ˆ ì˜ˆì •.\n\n4. ì•„ë¬´ taskë„ apply ì•ˆí–ˆëŠ”ë° ë°´ë‹¹í–ˆì–´ìš”\n- íŒ€ì™ˆ) ì´ë¯¸ í•´ë‹¹ ë¬¸ì œì— ëŒ€í•´ í”Œë«í¼ì— ì•Œë¦¼ì´ ê°”ì„ ê±°ì„. ì•Œë¦¼ì„ í™•ì¸í•´ì£¼ì„¸ìš”.\nì•Œë¦¼ ëª»ë°›ì•˜ìœ¼ë©´ íŒ€ì›í•œí…Œ ì—°ë½í•´ì•¼í• ë“¯.\n\n5. ì¼ë¶€ taskì—ì„œ DPë¥¼ 1ê°œë§Œ ì œì¶œí–ˆëŠ”ë°(ë˜ëŠ” DPë¥¼ ì œì¶œë„ ì•ˆí–ˆìŒ), ì™œ daily limitì— ë„ë‹¬í–ˆë‹¤ê³  ëœ¨ë‚˜ìš”?\n- íŒ€ì™ˆ) task í• ë‹¹ì˜ ê³µì •ì„± ë° ë¶ˆê· í˜•í•œ ì‘ì—… ì•¡ì„¸ìŠ¤ë¥¼ ë°©ì§€í•˜ê¸° ìœ„í•´ ìœ ì €ë‹¹ ìµœëŒ€ ì‘ì—… ë¶€í•˜(DP ì œì¶œ ê°€ëŠ¥ íšŸìˆ˜)ë¥¼ ì„¤ì •í–ˆìŒ. ì´ë¥¼ í†µí•´ ê³ í’ˆì§ˆ ë°ì´í„°ë¥¼ ì œê³µí•˜ëŠ” ì§„ì •í•œ ê¸°ì—¬ìëŠ” ê³µì •í•œ ê¸°íšŒë¥¼ ì–»ì„ ìˆ˜ ìˆì„ ê²ƒ. ì´ëŸ° ì‚¬ìš©ìë‹¹ task ì œì¶œ limitì€ UTC ì˜¤ì „ 00:30 ê¸°ì¤€ìœ¼ë¡œ ë§¤ì¼ ì´ˆê¸°í™”ë˜ì„œ ë‹¤ìŒ ë‚ ì—ë„ DPë¥¼ ì œì¶œí• ìˆ˜ ìˆì„ ê±°ì„.\n**  ì´ì œ ê° ê³„ì •ì—ëŠ” ëª¨ë“  ì‘ì—…ì— ê±¸ì³ ê³µìœ ë˜ëŠ” ì¼ì¼ ì´ ì œì¶œ í•œë„ê°€ ìˆìŠµë‹ˆë‹¤. ë”°ë¼ì„œ ì‚¬ìš©ìëŠ” ìì‹ ì˜ ìƒí™©ì— ë”°ë¼ ì‘ì—…ì˜ ìš°ì„ ìˆœìœ„ë¥¼ ì •í•´ì•¼ í•  ìˆ˜ë„ ìˆìŠµë‹ˆë‹¤. ** ì¤‘ìš”\n\n6. S2ì—ì„œ ëª‡ ê°€ì§€ taskì—ì„œ examì— ë–¨ì–´ì¡ŒëŠ”ë°, ì´ì œ ë” ì´ìƒ ì´ taskë“¤ì— ì ‘ê·¼í•  ìˆ˜ ì—†ëŠ” ê²ƒ ê°™ìŠµë‹ˆë‹¤. ë‹¤ì‹œ examì„ ë³¼ ê¸°íšŒê°€ ìˆì„ê¹Œìš”?\n-  ì‚¬ìš©ìë“¤ì´ examì„ ë‹¤ì‹œ ë³¼ ìˆ˜ ìˆëŠ” ì¶”ê°€ ê¸°íšŒë¥¼ ê°€ì§ˆ ìˆ˜ ìˆë„ë¡ exam bankë¥¼ ì—…ë°ì´íŠ¸í•˜ëŠ” ê²ƒì„ ê³ ë ¤í•˜ê³  ìˆìŒ.\n- ì•„ë§ˆ ë‹¤ìŒ ë¼ìš´ë“œì—ì„œ ë™ì¼í•œ ë„ë©”ì¸ì˜ ìƒˆë¡œìš´ taskê°€ ë„ì…ë˜ë©´ ì‚¬ìš©ìê°€ examì„ ë‹¤ì‹œ ì¹˜ë¥¼ ìˆ˜ ìˆëŠ” ê¸°íšŒë¥¼ ì¤„ ê²ƒìœ¼ë¡œ ì˜ˆìƒí•¨."}
{"source_file": "C:\\Users\\user\\Downloads\\Telegram Desktop\\ChatExport_2026-02-02 (3)\\messages.html", "channel": "íŒíŒí€ì¹˜", "message_id": 13, "ts_title": "19.03.2025 15:19:40 UTC+09:00", "date_ymd": "2025-03-19", "time_hm": "15:19", "text": "ê·¸ë˜ì„œ ì‚¬í•˜ë¼ ì‹œì¦Œ3ëŠ” ì‹œì¦Œ2ì™€ ë­ê°€ ë‹¤ë¥´ëƒ?\n\nì¼ë‹¨ ê°€ì¥ ì¤‘ìš”í•œ ê²ƒ.\n** ì´ì œ ê° ê³„ì •ì— ëª¨ë“  ì‘ì—…ì— ê±¸ì³ ê³µìœ ë˜ëŠ” ì¼ì¼ ì´ ì œì¶œ í•œë„(data point)ê°€ ì¡´ì¬í•¨. **\n\n- EXP íšë“ì„ ê¸°ì¤€ìœ¼ë¡œ, ì‹œì¦Œ2ì—ëŠ” í¬ê²Œ \n  - ì¶œì²µ(1exp)\n  - ë§¤ì¼ 20SPì´ìƒ íšë“(5exp) ë¯¸ì…˜\n  - Oracle of Knowledge (Model Optimization, Persona Emulation, Tech Chroniclesì—ì„œ ê°ê° 100SPë¥¼ íšë“í•˜ë©´ 30expì”© ì–»ì„ ìˆ˜ ìˆëŠ” ë¯¸ì…˜)\nì´ ìˆì—ˆìŒ.\në‹¤ë§Œ Oracle ë¯¸ì…˜ì€ ì‹œì¦Œ ë‚´ë‚´ ì§„í–‰ë˜ëŠ”ê±°ê¸° ë•Œë¬¸ì— ê° ì„¹ì…˜ë³„ ìš”êµ¬í•˜ëŠ” SPëŸ‰ì„ ì²œì²œíˆ ì±„ìš°ë©´ì„œ ì‚¬í•˜ë¼ ì¼í€˜ë¥¼ í•˜ë©´ëì—ˆìŒ.\n\nê·¼ë° ì‹œì¦Œ3ë“¤ì–´ì„œ ìƒˆë¡œìš´ í€˜ìŠ¤íŠ¸ë“¤ì´ ì¶”ê°€ë¨.\n- ê¸°ì¡´ Oracle ë¯¸ì…˜ê³¼ ë‹¬ë¦¬, ì´ì œ í•˜ë£¨ì— Prompt Collection/ Persona Emulation (ì ¤ ì–´ë ¤ìš´ taskë“¤)ë¡œ ìµœì†Œ 40SPì”© ë°›ìœ¼ë©´ 3expë¥¼ ì£¼ëŠ” daily ë¯¸ì…˜ìœ¼ë¡œ ë°”ê¿”ë²„ë¦¼.\n- Grand Oracle of Knowledge(ê¸°ì¡´ Oracle of Knowledge ë¯¸ì…˜)ì—ì„œ\n  Tech Chronicles, Model Optimization, Pawspective ê´€ë ¨ Taskë“¤ì—ì„œ \n  ê°ê° ìµœëŒ€ 100 / 200 / 300 SPë¥¼ ì–»ì–´ì„œ  30 / 10 / 5 EXPë¥¼ í´ë ˆì„í•˜ë„ë¡ ë°”ê¿§ìŒ. \n\n* ì‹œì¦Œ2ë‹¹ì‹œ ë¦¬ë·° task ê¸°ì¤€ task ë‹¹\n   1SP/1DP ë¦¬ë·° task = ë³´í†µ ì œì¶œí•œë„ í•˜ë£¨ì— 10ê°œ\n   2SP/1DP ë¦¬ë·° task =  ì œì¶œí•œë„ 8ê°œì—¿ìŒ. \n(annotateì€ ì œì¶œí•œë„ ë‹¤ë¥¸ë° ê²°ë¡ ì ìœ¼ë¡œ reviewë‘ ì–»ëŠ” SPëŠ” ê±°ì§„ ê°™ìŒ)\ní•˜ì§€ë§Œ ì¼ì¼ ì´ ì œì¶œ í•œë„ê°€ ë„ì…ë˜ë©´ì„œ review task 3ê°œ ê¸°ì¤€ ëª¨ë“  taskë¥¼ ì¼ì¼ ì œì¶œí•œë„ê¹Œì§€ ì œì¶œí•  ìˆ˜ ì—†ì–´ì§."}
{"source_file": "C:\\Users\\user\\Downloads\\Telegram Desktop\\ChatExport_2026-02-02 (3)\\messages.html", "channel": "íŒíŒí€ì¹˜", "message_id": 14, "ts_title": "19.03.2025 15:21:33 UTC+09:00", "date_ymd": "2025-03-19", "time_hm": "15:21", "text": "ê²°ë¡ \nì•ì„œ ë§í–ˆë“¯ ê³„ì •ë‹¹ ëª¨ë“  taskì— ê³µìœ ë˜ëŠ” ì¼ì¼ ì´ ì œì¶œí•œë„ê°€ ìƒê²¼ê¸° ë•Œë¬¸ì—, ì‹œì¦Œ2ì²˜ëŸ¼ ê·¸ëƒ¥ ëª¨ë“  taskë“¤ ë¬´ì§€ì„±ìœ¼ë¡œ daily limitê¹Œì§€ DPì œì¶œí•˜ê¸°ê°€ ë” ì´ìƒ ì•ˆë˜ê³ , ìê¸° ìƒí™©ì— ë§ì¶°ì„œ ì „ëµì ìœ¼ë¡œ ì ‘ê·¼í•´ì•¼í•¨.\n\n- Grand Oracle of Knowledge ë¯¸ì…˜ì´ Tech Chronicles, Model Optimization, Pawspective ì„¹ì…˜ë§Œ í•´ë‹¹ì´ë‹ˆ, í•´ë‹¹ ì„¹ì…˜ ë¨¼ì € 100SPë¥¼ ì±„ì›Œì„œ 30 EXPë¥¼ ê°ê° ì–»ëŠ”ê²Œ ë°”ëŒì§í•´ë³´ì„. ê³„ì •ë‹¹ ì œì¶œí•œë„ê°€ ìƒê²¼ê¸° ë•Œë¬¸ì— í•´ë‹¹ ì„¹ì…˜ì´ ì•„ë‹Œ taskì— DPë¥¼ ì œì¶œí•´ í•˜ë£¨ì— ì‚¬ìš©ê°€ëŠ¥í•œ DP ì œì¶œ íšŸìˆ˜ë¥¼ ì“°ëŠ”ê±¸ ì˜ ìƒê°í•´ì•¼í•¨.\n\n- AI í™œìš©ì„ ì˜í•´ì„œ Persona, Prompt Taskë¥¼ ì–´ì§€ê°„íˆ approve ì˜ ì‹œí‚¤ëŠ”ê±°ê°€ ì•„ë‹Œì´ìƒ, ë§¤ì¼ 3exp ë¯¸ì…˜ ë…¸ë¦¬ê³  ë§ˆëƒ¥ í•´ë‹¹ taskë“¤ ì‹œë„í•˜ëŠ” ê²ƒì€ ë‚œì´ë„ê°€ ë†’ì•„ì„œ  ê³„ì •ë‹¹ ê³µìœ ë˜ëŠ” DPì œì¶œíšŸìˆ˜ë¥¼ ë¬´ì˜ë¯¸í•˜ê²Œ ì°¨ê°í•  ìˆ˜ ìˆìœ¼ë‹ˆ ê°ì ìƒí™©ì— ë§ì¶°ì„œ ì „ëµì ìœ¼ë¡œ DP ì œì¶œíšŸìˆ˜ë¥¼ ì‚¬ìš©í•´ì•¼í• ê±°ì„. ê´œíˆ ì‹œë„í–ˆë‹¤ê°€ daily ì œì¶œíšŸìˆ˜ ë‹¤ ì¨ì„œ 20SPíšë“ ë¯¸ì…˜ë„ í´ë ˆì„ ëª»í• ìˆ˜ë„..."}
{"source_file": "C:\\Users\\user\\Downloads\\Telegram Desktop\\ChatExport_2026-02-02 (3)\\messages.html", "channel": "íŒíŒí€ì¹˜", "message_id": 17, "ts_title": "20.03.2025 14:18:13 UTC+09:00", "date_ymd": "2025-03-20", "time_hm": "14:18", "text": "â­ï¸Sahara AI Exam \nRed Teaming Challenge - Adversarial Prompts for Explicit/Adult Content - Llama Family\n\në‹µ\n1. What is the purpose of LLM jailbreaking attacks?\n- To identify security vulnerabilities in the model\n\n2. What does â€œJailbreakingâ€ Large Language Models (LLMs) refer to?\n- Using specially crafted prompts to bypass design restrictions and enable LLMs to perform prohibited or unintended operations.\n\n3. In the context of Large Language Models, what does â€œTransformerâ€ mean?\n- A deep learning model architecture that uses self-attention to process and understand input data efficiently, revolutionizing NLP and beyond.\n\n4. What is the role of the Chain of Thoughtsâ€™ technique when testing LLMs?\n- To promote step-by-step reasoning, enhancing accuracy and uncovering logical capabilities.\n\n5. In the context of system prompting, what is the â€œChain of Thoughtsâ€?\n- A technique that guides models to generate step-by-step reasoning for complex tasks."}
{"source_file": "C:\\Users\\user\\Downloads\\Telegram Desktop\\ChatExport_2026-02-02 (3)\\messages.html", "channel": "íŒíŒí€ì¹˜", "message_id": 18, "ts_title": "22.03.2025 16:38:59 UTC+09:00", "date_ymd": "2025-03-22", "time_hm": "16:38", "text": "ì•„ì§ë„ 5exp / ì¶œì²µ ë¯¸ì…˜ë“¤ í´ë ˆì„ ì œëŒ€ë¡œ ì•ˆë˜ëŠ” ì‚¬ëŒë“¤ ìˆëŠ”ê±° ê°™ê¸´í•œë° ì§€ê¸ˆ ê¸°ì¤€ ì¶œì²µì€ 19,20,21ì¼ê¹Œì§€ / 5exp ë¯¸ì…˜ì€ 19,20ì¼ê¹Œì§€ í´ë ˆì„ê°€ëŠ¥í•œë“¯\nì¶œì²µ ë¯¸ì…˜ ë²„ê·¸ë‚˜ì„œ 20ì¼ ê±´ë„ˆë›°ê³  19, 21ì¼ë§Œ ë°›ì•„ì§€ëŠ” ë²„ê·¸ë„ ìˆë‚˜ë´„\n\nì´ì œ 19,20,21ì¼ ì–´ì¹˜ê¹Œì§„ ì •ìƒ í´ë ˆì„ë˜ëŠ”ë“¯\n\nì†”ì§íˆ ì´ëŸ´ê±°ë©´ ê± ì•ˆì •í™”ëœ ìƒíƒœì—ì„œ ìƒˆë¡œìš´ ì‹œì¦Œ ì§„í–‰í•´ì¤¬ìœ¼ë©´ í•¨"}
{"source_file": "C:\\Users\\user\\Downloads\\Telegram Desktop\\ChatExport_2026-02-02 (3)\\messages.html", "channel": "íŒíŒí€ì¹˜", "message_id": 19, "ts_title": "23.03.2025 18:50:29 UTC+09:00", "date_ymd": "2025-03-23", "time_hm": "18:50", "text": "ì‹œì¦Œ2 10000ë“± ì´ë‚´ì˜€ë˜ ì‚¬ëŒì€ ë°ë¯¸ê°“ ë¯¼íŒ…ê°€ëŠ¥"}
{"source_file": "C:\\Users\\user\\Downloads\\Telegram Desktop\\ChatExport_2026-02-02 (3)\\messages.html", "channel": "íŒíŒí€ì¹˜", "message_id": 21, "ts_title": "24.03.2025 13:39:00 UTC+09:00", "date_ymd": "2025-03-24", "time_hm": "13:39", "text": "â­ï¸Sahara AI Exam \nDeadpoolâ€™s Chaotic Gig - Bar Fight Recovery (Gig I), (Gig II), (Gig III)\n\në‹µ\n1. What does RLHF stand for in the context of machine learning?\nâ€¢   Reinforcement Learning from Human Feedback.\n\n2. Which of the following is a primary goal of using RLHF with LLMs?\nâ€¢   To align model outputs with human values and preferences.\n\n3. In the context of LLMs, what is a \"prompt\"?\nâ€¢   An input given to the model to generate a response.\n\n4. What role do human evaluators play in RLHF?\nâ€¢   They provide feedback on the model's outputs.\n\n5. Which of the following is a common challenge in RLHF?\nâ€¢   Collecting high-quality, consistent human feedback."}
{"source_file": "C:\\Users\\user\\Downloads\\Telegram Desktop\\ChatExport_2026-02-02 (3)\\messages.html", "channel": "íŒíŒí€ì¹˜", "message_id": 22, "ts_title": "24.03.2025 13:41:22 UTC+09:00", "date_ymd": "2025-03-24", "time_hm": "13:41", "text": "â­ï¸Sahara AI Exam \nPet Aging Insights - Caring for Senior Pets\n\në‹µ\n1. Which of the following pets is known for its ability to regrow its tail if it loses it?\nâ€¢   Lizard\n\n2. Which of the following pets is nocturnal by nature?\nâ€¢   Hedgehog\n\n3. What is the term for a group of rabbits?\nâ€¢   Fluffle\n\n4. What is the average gestation period for a cat?\nâ€¢   60 days\n\n5. Which of the following pets is known for its ability to change color based on its environment?\nâ€¢   Chameleon"}
{"source_file": "C:\\Users\\user\\Downloads\\Telegram Desktop\\ChatExport_2026-02-02 (3)\\messages.html", "channel": "íŒíŒí€ì¹˜", "message_id": 23, "ts_title": "24.03.2025 13:43:58 UTC+09:00", "date_ymd": "2025-03-24", "time_hm": "13:43", "text": "â­ï¸Sahara AI Exam \nUnusual Lodgings - Unique Places to Stay\n\në‹µ\n1. Which country is known as the \"Land of the Rising Sun\"?\nâ€¢   Japan\n\n2. About how long is the Nile River?\nâ€¢   4000 miles\n\n3. What is the name of the highest navigable lake in the world, shared by Peru and Bolivia?\nâ€¢   Lake Titicaca\n\n4. Which country is home to the \"Door to Hell,\" a natural gas field that has been burning continuously since 1971?\nâ€¢   Turkmenistan\n\n5. What is the term for the phenomenon where travelers experience fatigue and disorientation after crossing multiple time zones quickly?\nâ€¢   Jet lag"}
{"source_file": "C:\\Users\\user\\Downloads\\Telegram Desktop\\ChatExport_2026-02-02 (3)\\messages.html", "channel": "íŒíŒí€ì¹˜", "message_id": 24, "ts_title": "24.03.2025 13:46:54 UTC+09:00", "date_ymd": "2025-03-24", "time_hm": "13:46", "text": "â­ï¸Sahara AI Exam \nYour Dream Job... In Text Form!\n\në‹µ\n1. Which company developed the \"Unreal Engine,\" a widely used game engine in the gaming industry?\nâ€¢   Epic Games\n\n2. What is the name of the protagonist in the \"Legend of Zelda\" series?\nâ€¢   Link\n\n3. What does \"MMORPG\" stand for in gaming terminology?\nâ€¢   Massively Multiplayer Online Role-Playing Game\n\n4. Which gaming company is responsible for creating the \"Assassin's Creed\" series?\nâ€¢   Ubisoft\n\n5. What is the term for the practice of playing video games for an audience, often on platforms like Twitch or YouTube?\nâ€¢   Streaming"}
{"source_file": "C:\\Users\\user\\Downloads\\Telegram Desktop\\ChatExport_2026-02-02 (3)\\messages.html", "channel": "íŒíŒí€ì¹˜", "message_id": 25, "ts_title": "24.03.2025 13:48:37 UTC+09:00", "date_ymd": "2025-03-24", "time_hm": "13:48", "text": "â­ï¸Sahara AI Exam \nTech Workflows - Optimizing Processes\n\në‹µ\n1. Which company developed the first commercially successful graphical user interface (GUI)?\nâ€¢   Xerox\n\n2. What is the primary function of a router in a network?\nâ€¢   To connect devices and direct data traffic\n\n3. What does \"IoT\" stand for?\nâ€¢   Internet of Things\n\n4. Which of the following is a cloud computing service provided by Amazon?\nâ€¢   AWS (Amazon Web Services)\n\n5. What is the purpose of a VPN (Virtual Private Network)?\nâ€¢   To encrypt internet traffic and provide anonymity"}
{"source_file": "C:\\Users\\user\\Downloads\\Telegram Desktop\\ChatExport_2026-02-02 (3)\\messages.html", "channel": "íŒíŒí€ì¹˜", "message_id": 26, "ts_title": "24.03.2025 14:41:08 UTC+09:00", "date_ymd": "2025-03-24", "time_hm": "14:41", "text": "Model Optimization Taskë“¤ ê¹¨ì•ŒíŒ\n\nModel Optimization Taskë“¤ì€ ë´‡ë°©ì§€ë¡œ ì €ë ‡ê²Œ ê°ê´€ì‹ ë¬¸ì œë¥¼ í•˜ë‚˜ì”© ê»´ë†“ëŠ”ë°, ì„ ì§€ì¤‘ì—ì„œ ëŒ€ë¬¸ìë¡œ ì‹œì‘í•˜ëŠ” ì„ ì§€ê°€ ì •ë‹µ ì„ ì§€ì„.\në³µë¶™í•´ì„œ gpt ëŒë¦¬ëŠ” ì‹œê°„ì— ë‡Œë¹„ì›Œì„œ ëŒ€ë¬¸ìë¡œ ì‹œì‘í•˜ëŠ” ì„ ì§€ ê³ ë¥´ë©´ ì‚¬í•˜ë¼ì— í• ë‹¹í•  ë‡Œìš©ëŸ‰ì„ ì¢€ ë¹„ìš¸ ìˆ˜ ìˆìŒ. \nì‚¬ì‹¤ ëŒ€ì¶© ë¬¸ì œ ì½ì–´ë´ë„ ì§„ì§œ ë§ ì•ˆë˜ëŠ” ì„ ì§€ë“¤ ê°€ìš´ë° ì„ ì§€ í•˜ë‚˜ë§Œ ì í•©í•˜ê²Œ ë„£ì–´ì£¼ê¸° ë•Œë¬¸ì— í° ë¬¸ì œëŠ” ì—†ì§€ë§Œ, ê°„í˜¹ í—·ê°ˆë¦¬ê²Œ ì¤„ë•Œê°€ ìˆìœ¼ë©´ ëŒ€ë¬¸ì ì‹œì‘ ì„ ì§€ (ëŒ€ë¬¸ìê°€ ì—†ë‹¤ë©´ ìˆ«ìë¡œ ì‹œì‘í•˜ëŠ” ì„ ì§€ ê¸°íƒ€ë“±ë“±..) ê³¨ë¼ì„œ í’€ë©´ ë¨"}
{"source_file": "C:\\Users\\user\\Downloads\\Telegram Desktop\\ChatExport_2026-02-02 (3)\\messages.html", "channel": "íŒíŒí€ì¹˜", "message_id": 30, "ts_title": "25.03.2025 15:47:17 UTC+09:00", "date_ymd": "2025-03-25", "time_hm": "15:47", "text": "Review Task ë¯¸ì„¸íŒ\n\nReview ê±¸ë¦¬ë©´ ë³´í†µ ì§œì¦ë‚˜ëŠ”ê²Œ ë‹¤ë¥¸ ì‚¬ëŒë“¤(annotator)ì´ ì œì¶œí•œ DPê°€ ìˆì–´ì•¼ ë¦¬ë·°ì‘ì—…ì„ í•  ìˆ˜ ìˆëŠ”ë°, ì´ê²Œ ì‹œì¦Œ í›„ë°˜ê°€ë©´ ê°ˆìˆ˜ë¡ ê²½ìŸì´ ì¹˜ì—´í•´ì ¸ì„œ ë¦¬ë·° DP ë°°ì •ë°›ê¸°ê°€ í˜ë“¦. \nê·¸ë˜ì„œ All data points have been reviewedë§Œ ëœ¨ê³  ë¹¨ë¦¬ ë¦¬ë·° ëª»í•˜ëŠ” ê²½ìš°ê°€ ë§ì€ë°, ì§€ê¸ˆê¹Œì§€ì˜ ê²½í—˜ìœ¼ë¡œëŠ” ê°œì¸ì ìœ¼ë¡œ ì €ë ‡ê²Œ Task ì°½ì´ë‘ Working ì°½ ë…¹í™”í•œ gifì²˜ëŸ¼ ì°½ ì™”ë‹¤ê°”ë‹¤í•˜ëŠ”ê²Œ ì œì¼ ë¹ ë¥´ê³  í¸í•˜ê²Œ DP ì¡ëŠ”ë²• ê°™ìŒ. ë¬¼ë¡  ë” ì¢‹ì€ ë°©ë²•ì´ ìˆì„ ìˆ˜ ìˆìŒ..\n\nReview ë²„íŠ¼ í™œì„±í™” ì•ˆë˜ì–´ ìˆì–´ë„ ë§í¬ìƒì—ì„œ sahara-data ë¶€ë¶„ workingìœ¼ë¡œ ë°”ê¿”ì„œ ì™”ë‹¤ê°”ë‹¤ í•˜ë©´ëŒ\nì˜ˆì‹œ)\nhttps://app.saharalabs.ai/#/individualLabeler/sahara-data/~~~\nâ†’ https://app.saharalabs.ai/#/individualLabeler/working/~~~"}
{"source_file": "C:\\Users\\user\\Downloads\\Telegram Desktop\\ChatExport_2026-02-02 (3)\\messages.html", "channel": "íŒíŒí€ì¹˜", "message_id": 31, "ts_title": "30.03.2025 16:07:17 UTC+09:00", "date_ymd": "2025-03-30", "time_hm": "16:07", "text": "ì•ˆë…•í•˜ì„¸ìš” ì˜¤ëœë§Œì…ë‹ˆë‹¤\në‹¤ë¦„ì´ ì•„ë‹ˆë¼ ê°œì¸ì‚¬ì •ìœ¼ë¡œ ì‚¬í•˜ë¼ ê´€ë ¨ í¬ìŠ¤íŒ…ì„ ëª»í•˜ê³  ìˆëŠ”ë° ì €ëŠ” ì•ìœ¼ë¡œ ì´ë²ˆ ì‹œì¦Œ3ì€ ì¶œì²µë§Œ ë¶€íƒí•´ì„œ ë§ˆì¹ ì˜ˆì •ì…ë‹ˆë‹¤..\nì•„ë¬´ë˜ë„ ë†’ì€ í™•ë¥ ë¡œ ì‹œì¦Œ4ê°€ ì§„í–‰ë  ê²ƒ ê°™ì€ë°, ê·¸ë•Œ ëµ™ê² ìŠµë‹ˆë‹¤!"}
{"source_file": "C:\\Users\\user\\Downloads\\Telegram Desktop\\ChatExport_2026-02-02 (3)\\messages.html", "channel": "íŒíŒí€ì¹˜", "message_id": 32, "ts_title": "19.05.2025 23:28:42 UTC+09:00", "date_ymd": "2025-05-19", "time_hm": "23:28", "text": "350ë§Œ ëª…, í”„ë¼ì´ë¹— í…ŒìŠ¤íŠ¸ 20ë§Œ ëª… ì´ìƒ ì°¸ì—¬!\nì´ë²ˆ SIWA í…ŒìŠ¤íŠ¸ë„·ì—ì„œëŠ” ë°ì´í„°ì…‹ ì†Œìœ ê¶Œê³¼ ê¸°ì—¬ë„ë¥¼ ì˜¨ì²´ì¸ì—ì„œ ë“±ë¡í•˜ê³  ì¶”ì í•  ìˆ˜ ìˆëŠ” ë ˆì§€ìŠ¤íŠ¸ë¦¬ ì‹œìŠ¤í…œì´ ë„ì…ë˜ì—ˆìŠµë‹ˆë‹¤.\n\nì´ì œ ê°œë°œì, ë°ì´í„° ê¸°ì—¬ì, AI ìŠ¤íƒ€íŠ¸ì—…ì€ AI ìì‚°ì„ íˆ¬ëª…í•˜ê²Œ ë“±ë¡, ì¶”ì , ìˆ˜ìµí™”í•  ìˆ˜ ìˆìŠµë‹ˆë‹¤.\níƒˆì¤‘ì•™í™” AI ê²½ì œì˜ ìƒˆë¡œìš´ ì‹œëŒ€ê°€ ì—´ë¦½ë‹ˆë‹¤. ğŸŒ\n\nì´ë²ˆ SIWA í…ŒìŠ¤íŠ¸ë„·ì€ ì•„ë˜ 3ê°€ì§€ í•µì‹¬ ìš”ì†Œë¥¼ ì¤‘ì‹¬ìœ¼ë¡œ êµ¬ì„±ë©ë‹ˆë‹¤:\n1ï¸âƒ£ ë°ì´í„°ì…‹ NFT ë¯¼íŒ…\n2ï¸âƒ£ ê¸€ë¡œë²Œ ìì‚° ë ˆì§€ìŠ¤íŠ¸ë¦¬\n3ï¸âƒ£ ìë™í™”ëœ ê¸°ì—¬ë„ ì¶”ì  ì‹œìŠ¤í…œ\n\në°”ë¡œ í¬í„¸ì„ ë°©ë¬¸í•´ ì°¸ì—¬í•´ë³´ì„¸ìš”! \ní¬í„¸ ë§í¬: https://portal.saharalabs.ai/main/explore\n\nì›¹ì‚¬ì´íŠ¸|íŠ¸ìœ„í„°|ë””ìŠ¤ì½”ë“œ|ë¸”ë¡œê·¸\ní•œêµ­ ì»¤ë®¤ë‹ˆí‹° ê³µì§€ë°©|í•œêµ­ ì»¤ë®¤ë‹ˆí‹° ì±„íŒ…ë°©"}
{"source_file": "C:\\Users\\user\\Downloads\\Telegram Desktop\\ChatExport_2026-02-02 (3)\\messages.html", "channel": "íŒíŒí€ì¹˜", "message_id": 33, "ts_title": "24.05.2025 21:41:08 UTC+09:00", "date_ymd": "2025-05-24", "time_hm": "21:41", "text": "huma finance claim site open\n\nì›Œë‚™ ì†Œì•¡ìœ¼ë¡œ ì°¸ì—¬í•˜ê¸°ë„ í–ˆê³ , ì»¤ë®¤ë‹ˆí‹°í™œë™ë„ ì•ˆí•´ì„œ ê¸°ëŒ€ê°€ ì—†ì—ˆëŠ”ë° ìƒê°ë³´ë‹¤ ë§ì´ ì±™ê²¨ì¤˜ì„œ ìƒê°ì¹˜ ëª»í•œ ìš©ëˆ ë°›ì€ ê¸°ë¶„ì´ë„¤ìš”\n\nì±—êµ´ - ë””ì½” role ê¸°ì¤€\n- 5ë ™ (ì´ˆë°˜ì—” 2ë ™ì»·) Newborn Role - 1800ê°œ\n- 10ë ™ Baby Huma Role - 2900ê°œ ì •ë„\n\n* ì±—êµ´ expëŠ” ì§ í¸(1ì±„íŒ…ë‹¹ 2~3exp ì •ë„?) - í•˜ì§€ë§Œ 2ë ™ì€ 2~3ì‹œê°„ì´ë©´ ì°ì–´ì„œ ì•„ì£¼ íš¨ìœ¨ì´ ì¢‹ì•˜ë˜ í¸.  (10ë ™ì€ gg)\n\nì• ì´ˆì— í”„ë¡œì íŠ¸ì°¨ì›ì—ì„œ ì±—êµ´ì„ ê¶Œì¥í•˜ì§€ë„ ì•Šì•˜ê³  ë””ì½” expë´‡ì´ í„°ì§„ì ë„ ìˆì–´ì„œ ê¸°ëŒ€ì•ˆí–ˆëŠ”ë° Newborn í• ë‹¹ìœ¼ë¡œ 1800ê°œë‚˜ ì±™ê²¨ì¤¬ë„¤ìš”. \nìš”ì¦˜ ëŒ€ë¶€ë¶„ ì´ëŸ° ì»¤ë®¤ë‹ˆí‹° í• ë‹¹ ì—ë“œê°€ ì¹´ì´í† ë¡œ ë„˜ì–´ê°€ê³  ìˆëŠ”ë° ë‚­ë§Œì˜ ì±„íŒ…ë”¸ê¹ 2ë ™ ë‹¤ê³„í–ˆì—ˆìœ¼ë©´ ë§›ë“œëª½í˜„\n\nì˜ˆì¹˜\nì €ëŠ” í’€ ë§ˆì§€ë§‰ìœ¼ë¡œ ì—´ë ¸ì„ë•Œ ì†Œì•¡ Maxië¡œ 3ê°œì›” ë½ì—…í•´ì„œ ì˜ë¯¸ì—†ëŠ” ì •ë„ë¡œ í• ë‹¹ë°›ì•˜ëŠ”ë° ì´ˆì°½ê¸°ì— ë„£ìœ¼ì‹ ë¶„ë“¤ì€ ê±°ì˜ ì ˆë°˜ì •ë„ë„ ë‚˜ì™”ë‹¤ê³  í•˜ë„¤ìš”\n\nì˜ì™¸ë¡œ ë°”ë‚¸ë„ ëš«ê³ , ì—ë“œëŠ” ì‹œì¦Œ3ê¹Œì§€ ìˆì„ ì˜ˆì •ì´ë‹ˆ Humaì— bullishí•˜ë‹¤ë©´ ì‹œì¦Œ3ê¹Œì§€ ì—ë“œ ì±™ê²¨ë³´ì…”ë„ ì¢‹ì„ë“¯í•˜ë„¤ìš”"}
{"source_file": "C:\\Users\\user\\Downloads\\Telegram Desktop\\ChatExport_2026-02-02 (3)\\messages.html", "channel": "íŒíŒí€ì¹˜", "message_id": 34, "ts_title": "28.05.2025 22:27:38 UTC+09:00", "date_ymd": "2025-05-28", "time_hm": "22:27", "text": "ìš°ì„ \n\nbsc > soph 3ë°° ë”°ë¦¬"}
{"source_file": "C:\\Users\\user\\Downloads\\Telegram Desktop\\ChatExport_2026-02-02 (3)\\messages.html", "channel": "íŒíŒí€ì¹˜", "message_id": 35, "ts_title": "28.05.2025 22:46:32 UTC+09:00", "date_ymd": "2025-05-28", "time_hm": "22:46", "text": "BSC -> SOPHON ë£¨íŠ¸\n\n\"ê¸°ì¶œë¬¸ì œ\"\n\nEndpoint\nhttps://docs.layerzero.network/v2/deployments/deployed-contracts\n\në£°ë£¨"}
{"source_file": "C:\\Users\\user\\Downloads\\Telegram Desktop\\ChatExport_2026-02-02 (3)\\messages.html", "channel": "íŒíŒí€ì¹˜", "message_id": 36, "ts_title": "30.05.2025 12:35:23 UTC+09:00", "date_ymd": "2025-05-30", "time_hm": "12:35", "text": "ë§ì´ë“¤ ì°¸ì—¬í•˜ê³  ìˆëŠ” Loud (ìƒì „ ì•¼í•‘ ì•ˆí•˜ë‹¤ê°€ ì €ë„ í•´ë³´ëŠ”ì¤‘)\n\nê·¼ë° Phase 2 (Smart Follower 10ëª… ëª¨ìœ¼ë©´ ë°›ì„ ìˆ˜ ìˆëŠ” fcfs) ìŠ¤ëƒ…ìƒ·ì€ ì´ë¯¸ ë©°ì¹  ì „ì— ì°í˜”ë‹¤ê³  í•˜ë„¤ìš”\n(ì‹¤ì œë¡œ ìŠ¤ë§ˆíŠ¸ íŒ”ë¡œì›Œ ëˆì£¼ê³  íŒŒëŠ”ê±°ë„ ìƒê²¨ë‚˜ê³  ìˆëŠ” ê±¸ ë³´ë©´ ë§ëŠ” íŒë‹¨ì´ë¼ê³  ìƒê°ë˜ë„¤ìš”)\n\në©°ì¹ ì „ë¶€í„° smart follower ìˆ˜ 10ëª…ì´ìƒì´ì—ˆì§€ë§Œ ì†”ë¼ë‚˜ ì§€ê°‘ì„ Kaito ì‚¬ì´íŠ¸ì—ì„œ ì—°ê²°í•˜ì§€ ì•Šìœ¼ì‹ ë¶„ë“¤ì€ ì§€ê¸ˆì´ë¼ë„ ì—°ê²°í•´ì£¼ì‹œë©´ IAO ì°¸ê°€ ê°€ëŠ¥í•˜ì‹œê³ , ì €ì²˜ëŸ¼ ì–´ì œë¶€í„° ìŠ¤ë§ˆíŠ¸ íŒ”ë¡œì›Œ ëª¨ìœ¼ê³  Stay Loudio í•˜ì‹ ë¶„ë“¤ì€ ì­‰ ì—´ì‹¬íˆ LOUDí•´ì„œ top 1000 ë…¸ë ¤ë³´ë©´ ë ê²ƒ ê°™ìŠµë‹ˆë‹¤!\n\nì›ë¬¸"}
{"source_file": "C:\\Users\\user\\Downloads\\Telegram Desktop\\ChatExport_2026-02-02 (3)\\messages.html", "channel": "íŒíŒí€ì¹˜", "message_id": 37, "ts_title": "30.05.2025 22:46:45 UTC+09:00", "date_ymd": "2025-05-30", "time_hm": "22:46", "text": "Loud top 1000 ìŠ¤ëƒ…ìƒ· soon\n\nì›ë¬¸ë³´ê¸°"}
{"source_file": "C:\\Users\\user\\Downloads\\Telegram Desktop\\ChatExport_2026-02-02 (3)\\messages.html", "channel": "íŒíŒí€ì¹˜", "message_id": 38, "ts_title": "31.05.2025 01:07:36 UTC+09:00", "date_ymd": "2025-05-31", "time_hm": "01:07", "text": "The END\nì›ë¬¸ë³´ê¸°"}
{"source_file": "C:\\Users\\user\\Downloads\\Telegram Desktop\\ChatExport_2026-02-02 (3)\\messages.html", "channel": "íŒíŒí€ì¹˜", "message_id": 39, "ts_title": "09.06.2025 20:49:12 UTC+09:00", "date_ymd": "2025-06-09", "time_hm": "20:49", "text": "ì´ì „ì— ì—¬ëŸ¬ í…”ë°©ì—ì„œ WLë¿Œë¦° í•˜ë¦¬ìª½ NFT BAE\n\nWLëŒ€ìƒ ì§€ê°‘ì£¼ì†Œ ê±·ëŠ”ì¤‘\n\nì±„ë„ë§í¬ëª½í˜„"}
{"source_file": "C:\\Users\\user\\Downloads\\Telegram Desktop\\ChatExport_2026-02-02 (3)\\messages.html", "channel": "íŒíŒí€ì¹˜", "message_id": 40, "ts_title": "09.06.2025 23:49:29 UTC+09:00", "date_ymd": "2025-06-09", "time_hm": "23:49", "text": "No Plasma CAP increase for today\n\ní˜¹ì‹œë‚˜ ê¸°ëŒ€í•œì‚¬ëŒë“¤ì€ ìëŸ¬ê°‘ì‹œë‹¹"}
{"source_file": "C:\\Users\\user\\Downloads\\Telegram Desktop\\ChatExport_2026-02-02 (3)\\messages.html", "channel": "íŒíŒí€ì¹˜", "message_id": 41, "ts_title": "10.06.2025 08:57:53 UTC+09:00", "date_ymd": "2025-06-10", "time_hm": "08:57", "text": "ì‚¬í•˜ë¼ ë¹Œë“œíŒ¨ë“œ wlëŒ€ìƒ ë©”ì¼ ì™”ë„¤ìš”\në°ë¯¸ê°“ì€ 150ë¶ˆ ì •ë„ í• ë‹¹ë°›ì€ë“¯?\n\nhttps://www.buidlpad.com/projects/sahara-ai/invite\n\nkycì™„ë£Œ í•˜ì‹œê³  ê¸°ê°„ë‚´ì— ì´ ë§í¬ì— ë°›ìœ¼ì‹  ì´ˆëŒ€ì½”ë“œ ì…ë ¥í•˜ì‹œë©´ ë  ê²ƒ ê°™ìŠµë‹ˆë‹¤"}
{"source_file": "C:\\Users\\user\\Downloads\\Telegram Desktop\\ChatExport_2026-02-02 (3)\\messages.html", "channel": "íŒíŒí€ì¹˜", "message_id": 42, "ts_title": "10.06.2025 09:35:06 UTC+09:00", "date_ymd": "2025-06-10", "time_hm": "09:35", "text": "ë‹‰ë„¤ì„ì— ğŸ”† ë‹¬ê³  ì—¬ìš° ë¶™ì´ê¸° = 200$ >> ë§¤ì¼ task ëª‡ì‹œê°„ íˆ¬ìí•´ì„œ í…Œë„· ë°ë¯¸ê°“ ë˜¥ê¼¬ì‡¼í•˜ê¸° = 150$\n\nì˜¤ëŠ˜ë„ ë²ˆë²ˆíˆ ì»¤ë®¤ í• ë‹¹ ìŠ¹\në°ë¯¸ê°“ ì—ë“œ ë§ì´ ì±™ê²¨ë‹¤ì˜¤"}
{"source_file": "C:\\Users\\user\\Downloads\\Telegram Desktop\\ChatExport_2026-02-02 (3)\\messages.html", "channel": "íŒíŒí€ì¹˜", "message_id": 43, "ts_title": "17.06.2025 15:15:01 UTC+09:00", "date_ymd": "2025-06-17", "time_hm": "15:15", "text": "ë¹—ì¸ ê³µì‹ ì‹¤ì‹œê°„ ì•Œë¦¼ ì±„ë„ ë“±ì¥.. \n\në”ë”°ë¦¬ ê²Œì„¯ê±°ë¼~\n\nhttps://t.me/BithumbExchangeData"}
{"source_file": "C:\\Users\\user\\Downloads\\Telegram Desktop\\ChatExport_2026-02-02 (3)\\messages.html", "channel": "íŒíŒí€ì¹˜", "message_id": 44, "ts_title": "17.06.2025 15:53:21 UTC+09:00", "date_ymd": "2025-06-17", "time_hm": "15:53", "text": "ì±„ë„ ë“¤ì–´ê°€ê³  êµ¬ê¸€í¼ ì œì¶œí•˜ë©´ 3ì²œì›ë„ ë°›ìœ¼ë‹ˆê¹Œ êµ¬ê¸€í¼ ì œì¶œë„ í•©ì‹œë‹¤! \nğŸ™‚ğŸ™ƒğŸ™‚ğŸ™ƒğŸ™‚\n\nê³µì§€ ì›ë¬¸"}
{"source_file": "C:\\Users\\user\\Downloads\\Telegram Desktop\\ChatExport_2026-02-02 (3)\\messages.html", "channel": "íŒíŒí€ì¹˜", "message_id": 45, "ts_title": "18.06.2025 09:04:41 UTC+09:00", "date_ymd": "2025-06-18", "time_hm": "09:04", "text": "ì—…ë¹„íŠ¸(Upbit) ê³µì§€ë³€ê²½\n[ì•ˆë‚´] ì—…ë¹„íŠ¸ íŒì—…ìŠ¤í† ì–´ì— ì´ˆëŒ€í•©ë‹ˆë‹¤! (ê°¤ëŸ­ì‹œ S25ì—£ì§€ ì—…ë¹„íŠ¸ ìµìŠ¤í´ë£¨ì‹œë¸Œ ìˆ˜ëŸ‰ ì¶”ê°€ ì•ˆë‚´)\n2025-06-18 09:00:00"}
{"source_file": "C:\\Users\\user\\Downloads\\Telegram Desktop\\ChatExport_2026-02-02 (3)\\messages.html", "channel": "íŒíŒí€ì¹˜", "message_id": 46, "ts_title": "18.06.2025 09:08:37 UTC+09:00", "date_ymd": "2025-06-18", "time_hm": "09:08", "text": "ì´ì œ ì—…ë¹„íŠ¸ íŒì—…ìŠ¤í† ì–´ ê°¤ëŸ­ì‹œ s25 í•˜ë£¨ë‹¹ 5ëŒ€ì”© ì¶”ì²¨"}
{"source_file": "C:\\Users\\user\\Downloads\\Telegram Desktop\\ChatExport_2026-02-02 (3)\\messages.html", "channel": "íŒíŒí€ì¹˜", "message_id": 47, "ts_title": "19.06.2025 17:07:22 UTC+09:00", "date_ymd": "2025-06-19", "time_hm": "17:07", "text": "ì‚¬í•˜ë¼ 6ì›” 26ì¼ TGEì¸ ë“¯\n\nhttps://www.okx.com/help/okx-to-list-sahara-sahara-ai-for-spot-trading"}
{"source_file": "C:\\Users\\user\\Downloads\\Telegram Desktop\\ChatExport_2026-02-02 (3)\\messages.html", "channel": "íŒíŒí€ì¹˜", "message_id": 48, "ts_title": "19.06.2025 17:15:22 UTC+09:00", "date_ymd": "2025-06-19", "time_hm": "17:15", "text": "ğŸš¨ ë“œë””ì–´ TGE ğŸš¨\nìƒˆë¡œìš´ ë¹…ë‰´ìŠ¤ì…ë‹ˆë‹¤!\nì‚¬í•˜ë¼ AIê°€ @okx ì™€ íŒŒíŠ¸ë„ˆì‹­ì„ ë§ºê³ \nì´ 2ê°œì˜ ë¦¬ì›Œë“œ í’€ì„ í†µí•´\n$SAHARA í† í° 28,000,000ê°œë¥¼\nì—ì–´ë“œëìœ¼ë¡œ ë°°í¬í•©ë‹ˆë‹¤! ğŸª‚\n\nğŸ‘‰ https://okx.SaharaAI.com\n\n#SaharaAI #TGE #ì—ì–´ë“œë #OKX \n\nhttps://x.com/SaharaLabsAI/status/1935609639175119277"}
{"source_file": "C:\\Users\\user\\Downloads\\Telegram Desktop\\ChatExport_2026-02-02 (3)\\messages.html", "channel": "íŒíŒí€ì¹˜", "message_id": 49, "ts_title": "19.06.2025 17:17:21 UTC+09:00", "date_ymd": "2025-06-19", "time_hm": "17:17", "text": "ì‚¬í•˜ë¼í–ˆë˜ ì‚¬ëŒë“¤ì€ \nhttps://okx.saharaai.com/\nì—ì„œ Pool A ë“±ë¡í•˜ê¸°"}
{"source_file": "C:\\Users\\user\\Downloads\\Telegram Desktop\\ChatExport_2026-02-02 (3)\\messages.html", "channel": "íŒíŒí€ì¹˜", "message_id": 50, "ts_title": "20.06.2025 16:07:06 UTC+09:00", "date_ymd": "2025-06-20", "time_hm": "16:07", "text": "TGE â‰  OKX campaign"}
{"source_file": "C:\\Users\\user\\Downloads\\Telegram Desktop\\ChatExport_2026-02-02 (3)\\messages.html", "channel": "íŒíŒí€ì¹˜", "message_id": 51, "ts_title": "20.06.2025 16:25:20 UTC+09:00", "date_ymd": "2025-06-20", "time_hm": "16:25", "text": "TGE â‰  OKX campaign \nì¶”ê°€ì„¤ëª…) okx poolì— ë“±ë¡í•´ë‘ë©´ ì‚¬í•˜ë¼ dsp ì—ì–´ë“œëì„ okx ê±°ë˜ì†Œë¡œ ë°›ëŠ”ë‹¤ëŠ” ë§ì€ ì‚¬ì‹¤ì´ ì•„ë‹™ë‹ˆë‹¤. \nOKX Poolê´€ë ¨ ìº í˜ì¸ì€ OKX ìœ ì €ë¥¼ ìœ„í•œ exclusive airdrop, ì¦‰ ë³„ê°œ ì—ì–´ë“œëì´ê³  DSP ì—ì–´ë“œëì„ ìœ„í•œ í´ë ˆì„ í˜ì´ì§€ëŠ” ë”°ë¡œ ìˆì„ ì˜ˆì •ì…ë‹ˆë‹¤"}
{"source_file": "C:\\Users\\user\\Downloads\\Telegram Desktop\\ChatExport_2026-02-02 (3)\\messages.html", "channel": "íŒíŒí€ì¹˜", "message_id": 52, "ts_title": "21.06.2025 00:37:53 UTC+09:00", "date_ymd": "2025-06-21", "time_hm": "00:37", "text": "https://stickerdom.store/bundle/1/26\nbayc ìŠ¤í‹°ì»¤ ì›¹ì‚¬ì´íŠ¸"}
{"source_file": "C:\\Users\\user\\Downloads\\Telegram Desktop\\ChatExport_2026-02-02 (3)\\messages.html", "channel": "íŒíŒí€ì¹˜", "message_id": 53, "ts_title": "22.06.2025 05:17:50 UTC+09:00", "date_ymd": "2025-06-22", "time_hm": "05:17", "text": "ì‚¬í•˜ë¼ OKX ë³„ë„ ì´ë²¤íŠ¸ ì§€ê¸ˆê¹Œì§€ Pool A ì œì¶œí•œê±° ì´ˆê¸°í™”ë¼ì„œ ë‹¤ì‹œ ì œì¶œí•´ì•¼í•œë‹¤ë„¤ìš”\nê¹Œë¨¹ì§€ë§êµ¬ ë‹¤ì‹œ ì œì¶œí•©ì‹œë‹¤ ğŸ™‚ğŸ™ƒğŸ™‚ğŸ™ƒğŸ™‚\n\nì œì¶œê¸°í•œ 6.24 ì˜¤í›„ 5ì‹œê¹Œì§€\n\nê³µì§€ ì›ë¬¸"}
{"source_file": "C:\\Users\\user\\Downloads\\Telegram Desktop\\ChatExport_2026-02-02 (3)\\messages.html", "channel": "íŒíŒí€ì¹˜", "message_id": 54, "ts_title": "22.06.2025 16:15:32 UTC+09:00", "date_ymd": "2025-06-22", "time_hm": "16:15", "text": "ì—í˜¸í˜¸ ì‹œë°”ë£¨ì›¨í›„í›„ ì¸ìƒ"}
{"source_file": "C:\\Users\\user\\Downloads\\Telegram Desktop\\ChatExport_2026-02-02 (3)\\messages.html", "channel": "íŒíŒí€ì¹˜", "message_id": 55, "ts_title": "25.06.2025 00:26:28 UTC+09:00", "date_ymd": "2025-06-25", "time_hm": "00:26", "text": "êµ¬ë¼ìŸì´ ì†ì¶œì¤‘"}
{"source_file": "C:\\Users\\user\\Downloads\\Telegram Desktop\\ChatExport_2026-02-02 (3)\\messages.html", "channel": "íŒíŒí€ì¹˜", "message_id": 56, "ts_title": "25.06.2025 04:37:14 UTC+09:00", "date_ymd": "2025-06-25", "time_hm": "04:37", "text": "ì‚¬í•˜ë¼ ë””ì½”ë¡¤ë„ ë­ ì¢€ ì±™ê²¨ì£¼ë ¤ë‚˜ë³´ë„¤ìš”"}
{"source_file": "C:\\Users\\user\\Downloads\\Telegram Desktop\\ChatExport_2026-02-02 (3)\\messages.html", "channel": "íŒíŒí€ì¹˜", "message_id": 57, "ts_title": "25.06.2025 20:07:56 UTC+09:00", "date_ymd": "2025-06-25", "time_hm": "20:07", "text": "Sahara OKX Pool A ë³´ìƒ 268ê°œ ë“¤ì–´ì™”ë„¤ìš”"}
{"source_file": "C:\\Users\\user\\Downloads\\Telegram Desktop\\ChatExport_2026-02-02 (3)\\messages.html", "channel": "íŒíŒí€ì¹˜", "message_id": 58, "ts_title": "26.06.2025 12:58:02 UTC+09:00", "date_ymd": "2025-06-26", "time_hm": "12:58", "text": "ì‚¬í•˜ë¼ ì¤€ë¹„í•´ë³´ê¸°\n\nCA (ETH, BSC)\n0xFDFfB411C4A70AA7C95D5C981a6Fb4Da867e1111\n\n0. ê±°ë˜ì†Œ ìƒì¥ì‹œê°„ ê´€ë ¨\n> í•˜ë‹¨ì˜ ì±„ë„ ê¸€ ë³´ì‹œë©´ ê°€ë…ì„± ì¢‹ì„ ë“¯\n> https://t.me/SUS_secretnote/4595\n\n1. ë¹„ë“¤íŒ¨ë“œ í´ë ˆì„ ê´€ë ¨\n> ETH ì²´ì¸ìœ¼ë¡œ í´ë ˆì„ ê°€ëŠ¥í•  ë“¯\n> ë°”ë‚¸ ê³„ì • ì—°ê²° ì´ìœ ëŠ” ë°”ë‚¸ì—ì„œ ETHë‘ BNB ë‘˜ë‹¤ ë°›ì•„ì¤Œ\n\n2. í…ŒìŠ¤íŠ¸ë„· í´ë ˆì„ ê´€ë ¨\n> ì´ê±´ BNB ì²´ì¸ìœ¼ë¡œ í´ë ˆì„\n> í˜¹ì‹œë‚˜ ëª¨ë¥¼ê¹Œë´ í´ë ˆì„ ì‹œ ì¶”ê°€ ìˆ˜ìˆ˜ë£Œê°€ ìˆìŒ(ê°€ìŠ¤ë¹„ ë§ê³ )\n> ì´ê±° ê´€ë ¨í•´ì„œëŠ” í•˜ë‹¨ì˜ FAQ ì°¸ì¡°\n\n3. ë¸Œë¦¿ì§€ ê´€ë ¨\n> ì €ëŠ” Relayì•„ë‹ˆë©´ Portal ì“¸ ê²ƒ ê°™ìŒ\n> https://www.relay.link/bridge\n> https://portalbridge.com/\n\n4. ì£¼ì˜ì‚¬í•­\n> ë¸Œë¦¿ì§€ ì‚¬ê³  ì¡°ì‹¬ (í™˜ë¶ˆ, ë„¤ì´í‹°ë¸Œ ì—¬ë¶€ ë“±ë“±)\n> ìœ„ì˜ ì‚¬í•­ê³¼ ë‹¤ë¥¸ ë£¨íŠ¸ or ìƒˆë¡œìš´ ì •ë³´ ìˆì„ ë• ë¹ ë¥´ê²Œ í•˜ì‹œê¸¸\n> í…ŒìŠ¤íŠ¸ë„· í• ë‹¹ì ë°˜ë“œì‹œ BNB ì¶”ê°€ í´ë ˆì„í”¼ ì²´í¬\n\nê¸€ë¡œë²Œ ë™ì‹œìƒì¥ 30ë¶„ ì´í›„ ì—…ë¹—ì¸ ìƒì¥ì¸ë° ê°­ë„ ê³ ë¯¼í•´ë³´ë©´ ì¢‹ê² ìŒ. ì´ëŸ°ê±° ì „ëµêµ¬ìƒí•´ì„œ í•´ë³´ê³  ì•ˆí•´ë³´ê³  ì²œì§€ì°¨ì´ì„. ì•¼í•‘ì´ë‘ ë¹„ìŠ·í•œê±´ë° ì•ˆí•˜ëŠ” ì‚¬ëŒì€ ëê¹Œì§€ ì•ˆí•¨(ë³¸ì¸ ì €ê²©ì„)"}
{"source_file": "C:\\Users\\user\\Downloads\\Telegram Desktop\\ChatExport_2026-02-02 (3)\\messages.html", "channel": "íŒíŒí€ì¹˜", "message_id": 59, "ts_title": "26.06.2025 19:06:59 UTC+09:00", "date_ymd": "2025-06-26", "time_hm": "19:06", "text": "ë¹„ë“¤íŒ¨ë“œ í´ë ˆì„ì‹œê°„ ì˜¤í›„ 8ì‹œ"}
{"source_file": "C:\\Users\\user\\Downloads\\Telegram Desktop\\ChatExport_2026-02-02 (3)\\messages.html", "channel": "íŒíŒí€ì¹˜", "message_id": 60, "ts_title": "26.06.2025 19:31:41 UTC+09:00", "date_ymd": "2025-06-26", "time_hm": "19:31", "text": "$Sahara ì›œí™€ ë¸Œë¦¿ì§€ëŠ” ë˜í•‘ëœ ì´ë” ì‚¬í•˜ë¼ë¥¼ ì¤Œ (ca ë‹¤ë¦„)\n\nì—…ë¹„íŠ¸ ì…ê¸ˆ : 0xFDFfB411C4A70AA7C95D5C981a6Fb4Da867e1111\n\nì›œí™€ ë¸Œë¦¿ì§€ : 0x0CAb456149EE99F87574daA80bC2b6b74aF594Db"}
{"source_file": "C:\\Users\\user\\Downloads\\Telegram Desktop\\ChatExport_2026-02-02 (3)\\messages.html", "channel": "íŒíŒí€ì¹˜", "message_id": 61, "ts_title": "26.06.2025 20:29:57 UTC+09:00", "date_ymd": "2025-06-26", "time_hm": "20:29", "text": "ì´ì œ ìŠ¬ìŠ¬ ì¶œê¸ˆ ì˜ ë˜ëŠ”ê±°ê°™ê¸°ë„"}
{"source_file": "C:\\Users\\user\\Downloads\\Telegram Desktop\\ChatExport_2026-02-02 (3)\\messages.html", "channel": "íŒíŒí€ì¹˜", "message_id": 62, "ts_title": "26.06.2025 21:24:51 UTC+09:00", "date_ymd": "2025-06-26", "time_hm": "21:24", "text": "ë¹—ì¸ë„ 10ì‹œë¡œ ë°”ê¿§ë„¤"}
{"source_file": "C:\\Users\\user\\Downloads\\Telegram Desktop\\ChatExport_2026-02-02 (3)\\messages.html", "channel": "íŒíŒí€ì¹˜", "message_id": 63, "ts_title": "26.06.2025 21:24:51 UTC+09:00", "date_ymd": "2025-06-26", "time_hm": "21:24", "text": "ë¹—ì¸(Bithumb) ê³µì§€ë³€ê²½\nì‚¬í•˜ë¼ì—ì´ì•„ì´(SAHARA) ì›í™” ë§ˆì¼“ ì¶”ê°€ (ê±°ë˜ ì˜¤í”ˆ ì‹œê°„ ì˜¤í›„ 10:00 ì˜ˆì •)\n2025-06-26 21:24:31"}
{"source_file": "C:\\Users\\user\\Downloads\\Telegram Desktop\\ChatExport_2026-02-02 (3)\\messages.html", "channel": "íŒíŒí€ì¹˜", "message_id": 64, "ts_title": "26.06.2025 23:59:15 UTC+09:00", "date_ymd": "2025-06-26", "time_hm": "23:59", "text": "ì‚¬í•˜ë¼ ê¸¸ê³ ë„ ì§§ì€ ì—¬ì • ìˆ˜ê³ í•˜ì…¨ìŠµë‹ˆë‹¤!!"}
{"source_file": "C:\\Users\\user\\Downloads\\Telegram Desktop\\ChatExport_2026-02-02 (3)\\messages.html", "channel": "íŒíŒí€ì¹˜", "message_id": 65, "ts_title": "27.06.2025 14:22:39 UTC+09:00", "date_ymd": "2025-06-27", "time_hm": "14:22", "text": "ì´ì „ì— ë§ì”€ë“œë ¸ë˜ íƒˆì¤‘ì•™í™” ì»¤ë®¤ë‹ˆí‹°ëŠ” ê¸ˆì¼ í›„í•œ ë³´ìƒì„ ë°œí‘œí•œ ë°ˆì½”ì–´ë¡œ ì‹œì‘í•©ë‹ˆë‹¤.\n\ní˜„ì¬ ê´€ë¦¬ìëŠ” ì € í•˜ë‚˜ì´ê³  ì—¬ëŸ¬ë¶„ë“¤ì˜ ì°¸ì—¬ëŠ” ììœ¨ì…ë‹ˆë‹¤.\n\nì œê°€ ì»¤ë®¤ë‹ˆí‹°ì— ê¸€ì„ ì¨ì„œ ìˆ˜í˜œë¥¼ ë°›ì„ ìƒê°ì€ ì¶”í˜¸ë„ ì—†ìœ¼ë©°\n\nê¸°ì¡´ì— Sê¸‰ í”„ë¡œì íŠ¸ê°€ ì•„ë‹Œ A~Bê¸‰ì„ í•˜ë ¤ê³  í–ˆëŠ”ë° ë°ˆì½”ì–´ëŠ” ë³´ìƒìœ¼ë¡œë§Œ ë³´ë©´ Sê¸‰ì´ì§€ë§Œ ì‹œê¸°ê°€ ë„ˆë¬´ ì ì ˆí•´ì„œ ì´ê±¸ë¡œí–ˆìŠµë‹ˆë‹¤.\n\nì¢€ ì¶”í•˜ì§€ë§Œ ì œ ê°œì¸ í”¼ë“œì—ëŠ” ì¡°ê¸ˆì”© ì ë˜ ìµœëŒ€í•œ ì»¤ë®¤ë‹ˆí‹°ì—ëŠ” í˜„ì¬ ê³ ì •ë˜ì–´ ìˆëŠ” ê³µì§€ê¸€ (ì•„ë§ˆ í•˜ë£¨ ì´í‹€ë‚´ë¡œ ë‹¤ë¥¸ ìœ ì €ë¶„ì˜ ê¸€ë¡œ ë®ì—¬ì§ˆê²ƒì…ë‹ˆë‹¤) ì´ì™¸ì—ëŠ” ì œê°€ ë…¸ì¶œë˜ì§€ ì•Šì„ ê±°ë¼ì„œ ì œ ê°œì¸í”¼ë“œê¹Œì§€ ë²„í”„ ë°›ì„ ê²ƒ ê°™ì§€ëŠ” ì•Šë‹¤ê³  ìƒê°í–ˆìŠµë‹ˆë‹¤.\n\nì–‘í•´ë¶€íƒë“œë¦½ë‹ˆë‹¤\n\nhttps://x.com/i/communities/1938459353465688551"}
{"source_file": "C:\\Users\\user\\Downloads\\Telegram Desktop\\ChatExport_2026-02-02 (3)\\messages.html", "channel": "íŒíŒí€ì¹˜", "message_id": 66, "ts_title": "07.07.2025 16:53:09 UTC+09:00", "date_ymd": "2025-07-07", "time_hm": "16:53", "text": "TAC SBT êµ¬ë§¤í•˜ì‹ ë¶„ë“¤ ì´ì „ì— ë””ì½” First Force ë¡¤ ë°›ì•„ê°€ë¼ê³  ì—¬ê¸°ì €ê¸°ì„œ ê³µì§€ ëŒì•„ë‹¤ë…”ì—ˆì£ \nê·¼ë° ì´ˆë°˜ì— Ton Keeper ë§ê³  ë‹¤ë¥¸ ì›”ë ›ì€ ìê¾¸ ì‚¬ì´íŠ¸ì—ì„œ ì¸ì¦í•˜ëŠ”ë° ì—ëŸ¬ê°€ ë– ì„œ ê·¸ëƒ¥ ê·€ì°®ì•„ì„œ ëƒ…ë‘ê³  ìˆì—ˆëŠ”ë° ì´ì œ OKX ì›”ë ›ë„ ì¸ì¦ ì •ìƒì ìœ¼ë¡œ ê°€ëŠ¥í•˜ë„ë¡ ê³ ì³ë†¨ë„¤ìš”\nìƒê°ë‚œ ê¹€ì— í•˜ê³  ì™”ìŒ\n\nRole í´ë ˆì„ ì‚¬ì´íŠ¸ | ë””ìŠ¤ì½”ë“œ"}
{"source_file": "C:\\Users\\user\\Downloads\\Telegram Desktop\\ChatExport_2026-02-02 (3)\\messages.html", "channel": "íŒíŒí€ì¹˜", "message_id": 67, "ts_title": "11.07.2025 16:26:21 UTC+09:00", "date_ymd": "2025-07-11", "time_hm": "16:26", "text": "[Dria Early Contributor Appreciation Program] \n\nhttps://dria.co/edge-ai/my-node \n\nDriaì—ì„œ ë…¸ë“œ ëŒë¦¬ê³  ìˆëŠ” ì‚¬ëŒ ëŒ€ìƒìœ¼ë¡œ ë½€ì°Œ ì±™ê²¨ì£¼ëŠ” í”„ë¡œê·¸ë¨ ì‹œì‘í•˜ë‚˜ë³´ë„¤ìš”\n\nusdë¡œ ë³´ìƒì±™ê²¨ì£¼ê³ , ìœ„ì— ë§í¬ë”°ë¼ì„œ claimí•˜ë©´ ë©ë‹ˆë‹¤\n\nê¸°ì¤€:\n1. í¬ì¸íŠ¸ ìƒìœ„ 50%ì´ìƒë§Œ claim ê°€ëŠ¥\n2. last 30ì¼ë™ì•ˆ task í•˜ë‚˜ë¼ë„ ì²˜ë¦¬í•œ ë…¸ë“œ (ë³´ìƒ ìì²´ëŠ” all-time points ê¸°ì¤€)\n\n*\n- Reward pool = Total points * 0.000025\n- Reward ê³„ì‚°ì‹: (Your points / Total points in your percentile) Ã— (Your percentileâ€™s % of total pool) Ã— (Total reward pool in USD)\n\nì´ë²ˆ 7.10 ë³´ìƒì€\nTotal reward pool: $10K+\nPercentile breakdown:\nTop 10%: â‰¥ 10,065 points (~2,738 nodes)\nTop 20%: â‰¥ 7,900 points (~5,476 nodes)\nTop 30%: â‰¥ 6,175 points (~8,214 nodes)\nTop 40%: â‰¥ 5,357 points (~10,952 nodes)\nTop 50%: â‰¥ 4,806.5 points (~13,690 nodes)\në¡œ ëŠì–´ì„œ ì œê³µë  ì˜ˆì •\n\nPS. ë³´ìƒì—„ì²­ ì ì€ê²Œ ì •ìƒì„.."}
{"source_file": "C:\\Users\\user\\Downloads\\Telegram Desktop\\ChatExport_2026-02-02 (3)\\messages.html", "channel": "íŒíŒí€ì¹˜", "message_id": 68, "ts_title": "12.07.2025 23:38:44 UTC+09:00", "date_ymd": "2025-07-12", "time_hm": "23:38", "text": "ê²Œì´íŠ¸(83.33%/100%) Completed"}
{"source_file": "C:\\Users\\user\\Downloads\\Telegram Desktop\\ChatExport_2026-02-02 (3)\\messages.html", "channel": "íŒíŒí€ì¹˜", "message_id": 69, "ts_title": "13.07.2025 21:36:36 UTC+09:00", "date_ymd": "2025-07-13", "time_hm": "21:36", "text": "https://www.bitgetapp.com/asia/events/pumpfun-publicsale\n\nì„¸ì¼í˜ì´ì§€ ë“¤ì–´ê°€ë©´ ì–¼ë§ˆ í• ë‹¹ëëŠ”ì§€ ë°”ë¡œ ë‚˜ì˜¤ë„¤ìš” (ë“¤ì–´ê°„ ì–‘ì˜ 28%)"}
{"source_file": "C:\\Users\\user\\Downloads\\Telegram Desktop\\ChatExport_2026-02-02 (3)\\messages.html", "channel": "íŒíŒí€ì¹˜", "message_id": 70, "ts_title": "13.07.2025 23:06:40 UTC+09:00", "date_ymd": "2025-07-13", "time_hm": "23:06", "text": "íŒí€ ì„¸ì¼ ëª»í•œê±° í™”ë‚˜ì„œ ê²Œì•„ì˜¤ ëŸ°ì¹˜íŒ¨ë“œë‚˜ ì°¸ì—¬ì¤‘\n\n\nê²Œì´íŠ¸ ëŸ°ì¹˜íŒ¨ë“œ | ê³µì§€"}
{"source_file": "C:\\Users\\user\\Downloads\\Telegram Desktop\\ChatExport_2026-02-02 (3)\\messages.html", "channel": "íŒíŒí€ì¹˜", "message_id": 71, "ts_title": "15.07.2025 00:54:02 UTC+09:00", "date_ymd": "2025-07-15", "time_hm": "00:54", "text": "ê·¸ë§Œì—°ì¥í•´ ì  ì¥"}
{"source_file": "C:\\Users\\user\\Downloads\\Telegram Desktop\\ChatExport_2026-02-02 (3)\\messages.html", "channel": "íŒíŒí€ì¹˜", "message_id": 72, "ts_title": "31.07.2025 17:12:16 UTC+09:00", "date_ymd": "2025-07-31", "time_hm": "17:12", "text": "ì–ë“œëª½í˜„ ìŒ€ë¨¹"}
{"source_file": "C:\\Users\\user\\Downloads\\Telegram Desktop\\ChatExport_2026-02-02 (3)\\messages.html", "channel": "íŒíŒí€ì¹˜", "message_id": 73, "ts_title": "05.08.2025 16:41:22 UTC+09:00", "date_ymd": "2025-08-05", "time_hm": "16:41", "text": "ë°ˆì½”ì–´ ë°‹ì—… í›„ê¸°\n\nê²Œì„ëŸ¬ì„œ ì•ˆí•˜ë‹¤ê°€ ì²« ì•¼í•‘ì„ ë°ˆì½”ì–´/ë°ˆì—‘ìŠ¤ë¡œ ì‹œì‘í–ˆì—ˆëŠ”ë°, ì œ ì²« ì•¼í•‘ ì†Œë“ì„ ì•ˆê²¨ë‹¤ì¤€ ë°ˆì½”ì–´ ë°‹ì—…ì— @Fachenko ë‹˜ ë•ë¶„ì— ìš´ì¢‹ê²Œ ë‹¤ë…€ì˜¬ ìˆ˜ ìˆì—ˆìŠµë‹ˆë‹¤\n\nì›ì²´ ìê¸ˆë ¥ì´ ë¹µë¹µí•œ íŒ€ì´ë‹¤ë³´ë‹ˆ ë°‹ì—…ì—ì„œ ë˜í”Œ/ì—ì–´ë“œë/í”„ë¼ì´ì¦ˆ í’€ë„ ìƒìƒì´ìƒì´ì—ˆê³ , ë°‹ì—… ì»¨í…ì¸ ë„ ì¬ë°Œê²Œ ì§œì£¼ì…”ì„œ ì¦ê²ê²Œ ë°‹ì—… ì¦ê¸°ê³  ì™”ìŠµë‹ˆë‹¤\n\ní™€ë¤ì€ ì«„ë³´ë¼ ì•ˆí•˜ê³  ë¸”ë™ì­ë§Œ í–ˆëŠ”ë° ë”œëŸ¬ë¶„í•œí…Œ ì‹¹ ë“œë ˆì¸ë‹¹í•´ë²„ë ¸ë„¤ìš”\në”œëŸ¬ë¶„ì´ ë„ˆë¬´ ì˜í•¨..\n\n$M 200ê°œ ì—ì–´ë“œëë„ ë°›ê³  ë¸”ë™ì­ ë„íŒŒë¯¼ë„ ëŠë¼ê³  ì•„ì£¼ ì¬ë°Œì—ˆìŠµë‹ˆë‹¤\n\nKOLì€ ì•„ë‹ˆë¼ í•˜ê¼¬ì£¼ì œì— ë‹¤ë¥¸ ìœ ëª…ì¸ì‚¬ë¶„ë“¤í•œí…Œ ì¸ì‚¬í•˜ë©´ ì™€ì‚¬ë°”ë¦¬ ë‹¹í• ê±°ê°™ì•„ì„œ ë©´ì‹ ìˆëŠ” ë¶„ë“¤ì´ë‘ë§Œ ì¡°ìš©íˆ ë°‹ì—… ì¦ê¸°ë‹¤ê°€ ë‚˜ì™”ë„¤ìš”\n\nì•¼í•‘ë„ í•˜ë©´ì„œ ì€ê·¼ ì •ë“  í”„ë¡œì íŠ¸ë¼ ë‹¤ìŒ ë°‹ì—…/ì‚¬ì´ë“œ íŒŒí‹°ë„ ìˆìœ¼ë©´ ê¼­ ì°¸ê°€í•˜ê³  ì‹¶ë„¤ìš”\n\níŠ¸ìœ„í„°ì—ë‘ ì§¤ë§‰í•˜ê²Œ í›„ê¸°ë‚¨ê²¼ìŠµë‹ˆë‹¤"}
{"source_file": "C:\\Users\\user\\Downloads\\Telegram Desktop\\ChatExport_2026-02-02 (3)\\messages.html", "channel": "íŒíŒí€ì¹˜", "message_id": 76, "ts_title": "05.08.2025 22:13:46 UTC+09:00", "date_ymd": "2025-08-05", "time_hm": "22:13", "text": "https://open.kakao.com/o/gNW5pUKh\n\n2ì°¨ ë°°ê¸‰ë°›ì€ê±° ì¼ë¶€ë¶„ ë©”ê°€ì½”íˆë¡œ í™˜ì›í•˜ê² ìŠµë‹ˆë‹¤"}
{"source_file": "C:\\Users\\user\\Downloads\\Telegram Desktop\\ChatExport_2026-02-02 (3)\\messages.html", "channel": "íŒíŒí€ì¹˜", "message_id": 78, "ts_title": "05.08.2025 22:32:50 UTC+09:00", "date_ymd": "2025-08-05", "time_hm": "22:32", "text": "ë°‹ì—… ì—ë“œë°›ì€ê±° ì¼ë¶€ë¶„ í™˜ì›í–ˆìŠµë‹ˆë‹¤!\n\në©”ê°€ì»¤í”¼ë¡œ ëë‚´ë©´ ì¬ë¯¸ì—†ì„ê±°ê°™ì•„ì„œ ì†Œì†Œí•œ í›„íŒë„ ê°™ì´ ì¤€ë¹„í–ˆìŠµë‹ˆë‹¤\n\nìƒê°ë³´ë‹¤ ë‹¤ë“¤ ì •ë‹µì„ ë§ì´ ë§ì¶”ì‹œë”ë¼êµ¬ìš”\n\në°ˆì½”ì–´ í™”ì´íŒ…~"}
{"source_file": "C:\\Users\\user\\Downloads\\Telegram Desktop\\ChatExport_2026-02-02 (3)\\messages.html", "channel": "íŒíŒí€ì¹˜", "message_id": 81, "ts_title": "06.08.2025 19:42:05 UTC+09:00", "date_ymd": "2025-08-06", "time_hm": "19:42", "text": "ë°ˆì½”ì–´ 2ì°¨ì—ë“œ ê°ì‚¬í•©ë‹ˆë‹¤!!!!\nì¬ë°ŒëŠ” ë°‹ì—… ì—´ì–´ì£¼ì…”ì„œ ê°ì‚¬í•©ë‹ˆë‹¤!!!"}
{"source_file": "C:\\Users\\user\\Downloads\\Telegram Desktop\\ChatExport_2026-02-02 (3)\\messages.html", "channel": "íŒíŒí€ì¹˜", "message_id": 82, "ts_title": "08.08.2025 18:37:47 UTC+09:00", "date_ymd": "2025-08-08", "time_hm": "18:37", "text": "TREE ì›ì íšŒê·€ì¤‘\n\në¹—ì¸ ìƒì¥ì‡½ is goodğŸ˜¡"}
{"source_file": "C:\\Users\\user\\Downloads\\Telegram Desktop\\ChatExport_2026-02-02 (3)\\messages.html", "channel": "íŒíŒí€ì¹˜", "message_id": 83, "ts_title": "15.08.2025 16:42:17 UTC+09:00", "date_ymd": "2025-08-15", "time_hm": "16:42", "text": "https://www.3ridge.io/event/68904d026aeb38763f7e8567\n\në””ìŠ¤í”„ë ˆë“œì¸¡ì—ì„œ Mitosis ê´€ë ¨ ìŠ¤í† ë¦¬í…”ëŸ¬ ìº í˜ì¸í•˜ê¸¸ë˜ ì–¼ë§ˆì •ë„ ë°›ì„ê¹Œ ê¶ê¸ˆí•´ì„œ ì‚´ì§ ì‚´í´ë³´ê¸°\n\nhttps://dashboard.despreadlabs.io/kimchi-map-pretge?dateRange=30D&utm_source=3ridge.io\n\ní˜„ì¬ ë””ìŠ¤í”„ë ˆë“œ ìì²´ì œì‘ í…”ë ˆê·¸ë¨ ë§ˆì¸ë“œì‰ì–´ ëŒ€ì‹œë³´ë“œìƒì—ì„œ ëŒ€ëµ 2.3%ì¸ë° ì´ ë§ˆì´í† ì‹œìŠ¤ì˜ ì ìœ ìœ¨ì— ë”°ë¼ ì „ì²´ ë³´ìƒ í’€ì´ ë³€ë™ë¨. \nì‹œì¦Œ ì¢…ë£Œ ì‹œì (ë‚´ì¼ 8.16 ì˜¤í›„ 12ì‹œ) ê¸°ì¤€ ë§ˆì¸ë“œì‰ì–´ì— ë”°ë¼ í•´ë‹¹ ì‹œì¦Œì˜ ì´ $MITO í† í° ë³´ìƒ í’€ì´ ê²°ì •ë¨.\n\n2~5% ë§ˆì¸ë“œì‰ì–´ ì‚°ì •í•˜ë©´ ì „ì²´ ë°œí–‰ëŸ‰(1B $MITO)ì˜ 0.01% $MITOê°€ í• ë‹¹.\n\nìŠ¤í† ë¦¬í…”ëŸ¬í’€ì€ kolë“¤ë¼ë¦¬ ë…¸ë‚˜ë¬µìœ¼ë©´ ë˜ë‹ˆê¹Œ ì¼ë°˜ì»¤ë®¤ë‹ˆí‹° í’€í• ë‹¹ë§Œ ë³´ë©´ ì´ ë³´ìƒí’€ì˜ 40í¼, 200ëª…ì—ê²Œ ëœë¤ì¶”ì²œì§€ê¸‰ì„\n\ní˜„ì¬ ê¸€ì“°ëŠ”ì‹œì ê¸°ì¤€ ì°¸ì—¬ì¸ì›ìˆ˜ 168ëª…ì´ë‹ˆê¹Œ 200ëª…ì€ ë¬´ì¡°ê±´ ì±„ìš´ë‹¤ê³  ë³´ë©´\n\n1B * 0.01 * 0.01 * 0.4 = ì´ 40k $MITO ê°€ ë³´ìƒí’€\n\n200ëª…ì”© ë‚˜ëˆ ë¨¹ìœ¼ë©´ ì¸ë‹¹ 200 $MITO\n\nFDV $250~500Më¡œ ìƒê°í•˜ë©´ ë°¥ê°’ ì •ë„ ë‚˜ì˜¤ëŠ”ë° mitosis ê´€ë ¨ ê²Œì‹œê¸€ 3ê°œì´ìƒ ì‘ì„± ê¸°ì¤€ì´ë‹ˆ ì‹¬ì‹¬í•œì‚¬ëŒë“¤ì€ ë‚´ì¼ê¹Œì§€ ì‘ì„±í•´ì„œ í•´ë´ë„ ì¢‹ì„ë“¯"}
{"source_file": "C:\\Users\\user\\Downloads\\Telegram Desktop\\ChatExport_2026-02-02 (3)\\messages.html", "channel": "íŒíŒí€ì¹˜", "message_id": 85, "ts_title": "16.08.2025 00:10:08 UTC+09:00", "date_ymd": "2025-08-16", "time_hm": "00:10", "text": "[ ë°”ì´ë‚¸ìŠ¤ì—ì„œ ê³ ì´ìœ¨ë¡œ 1ë‹¬ê°„ ê¿€ ë¹¨ì•„ë³´ì ]\n\n1ì¤„ ìš”ì•½ : ë°”ì´ë‚¸ìŠ¤ í’ì°¨í•´ì„œ 2.3ë§Œë‹¬ëŸ¬ë¡œ ì´ìœ¨ 30% ë¹¨ê¸°\n\n(1) ë°”ì´ë‚¸ìŠ¤ì—ì„œ 9ì›” 16ì¼ê¹Œì§€ USDC ì˜ˆì¹˜í•  ê²½ìš° 10%ì˜ ë³´ë„ˆìŠ¤ ì´ìë¥¼ ë³´ì¥í•©ë‹ˆë‹¤. \n\n(2) Loanì„ í†µí•´ ì½”ì¸ì„ ë‹´ë³´ë¡œ ë‹¤ë¥¸ ì½”ì¸ì„ ë¹Œë¦¬ê²Œë˜ë©´ ë‹´ë³´ë¡œ ì¡íŒ ì½”ì¸ì€ Earnì— ìë™ìœ¼ë¡œ ë„£ì–´ì§‘ë‹ˆë‹¤.\n\nì¦‰, USDCë¥¼ ë‹´ë³´ë¡œ USDTë¥¼ ë¹Œë¦¬ë©´ USDCëŠ” 10%ì˜ ì´ìë¥¼ ë§›ë³´ê²Œ ë©ë‹ˆë‹¤.\n\nì—¬ìœ ê°€ ìˆìœ¼ë©´ 10ë§Œë¶ˆ ì˜ˆì¹˜ í›„ 77000$ë¥¼ ë¹Œë¦¬ë©´ 23000$ìœ¼ë¡œ 10ë§Œë¶ˆì˜ íš¨ê³¼ë¥¼ ë‚´ëŠ” ì…ˆì´ ë©ë‹ˆë‹¤. ëˆì´ ì—¬ìœ ê°€ ì—†ìœ¼ë©´ ê°€ëŠ¥í•œëŒ€ë¡œ USDTë¥¼ ë¹Œë¦¬ê³  USDCë¥¼ ì‚¬ì„œ ì˜ˆì¹˜í•˜ì„¸ìš” (ì—¬ëŸ¬ë²ˆ)\n\ní˜„ì¬ USDC ì´ìœ¨ 12.22% (10% + 2.22%) \nUSDT ëŒ€ì¶œì´ìœ¨ 6.5%\n\n((12.22% * 4.34) - (6.5% * 3.34)) = 31%ì˜ ì´ìœ¨\n\në§Œì•½ USDT ëŒ€ì¶œì´ìœ¨ì´ 4.5%ë¡œ ì¤„ì–´ì§€ë©´ 37.68%\n\nRisk :\nBinance ê±°ë˜ì†Œê°€ ë§í•  í™•ë¥ \nUSDCê°€ ë””íŒ¨ê¹…ë‚  í™•ë¥ "}
{"source_file": "C:\\Users\\user\\Downloads\\Telegram Desktop\\ChatExport_2026-02-02 (3)\\messages.html", "channel": "íŒíŒí€ì¹˜", "message_id": 86, "ts_title": "20.08.2025 16:29:25 UTC+09:00", "date_ymd": "2025-08-20", "time_hm": "16:29", "text": "ë¡¯ë°ì›”ë“œ ë°‹ì—… ì¡´ë²„ì¤‘ ğŸ˜¡ğŸ˜¡\n\nhttps://lu.ma/bgu1iirz"}
{"source_file": "C:\\Users\\user\\Downloads\\Telegram Desktop\\ChatExport_2026-02-02 (3)\\messages.html", "channel": "íŒíŒí€ì¹˜", "message_id": 87, "ts_title": "20.08.2025 19:15:43 UTC+09:00", "date_ymd": "2025-08-20", "time_hm": "19:15", "text": "FABLO KBW í‹°ì¼“ ë‹¹ì²¨ì ë°œí‘œ\n\në–¨ì–´ì§„ì›¨í›„\n\n*2ì°¨ ì´ë²¤íŠ¸ë„ í•´ì„œ ê·¸ê±°ë¼ë„ ë„£ìŒ"}
{"source_file": "C:\\Users\\user\\Downloads\\Telegram Desktop\\ChatExport_2026-02-02 (3)\\messages.html", "channel": "íŒíŒí€ì¹˜", "message_id": 89, "ts_title": "21.08.2025 13:44:21 UTC+09:00", "date_ymd": "2025-08-21", "time_hm": "13:44", "text": "íŒŒí‹°ëëª½í˜„"}
{"source_file": "C:\\Users\\user\\Downloads\\Telegram Desktop\\ChatExport_2026-02-02 (3)\\messages.html", "channel": "íŒíŒí€ì¹˜", "message_id": 90, "ts_title": "21.08.2025 13:47:43 UTC+09:00", "date_ymd": "2025-08-21", "time_hm": "13:47", "text": "KBW ë¹—ì¸ ì´ë²¤íŠ¸ë„ ì˜¤ëŠ˜ ë‹¹ì²¨ í†¡ì™”ë„¤ìš”\n\në‹¹ì²¨ë˜ì‹ ë¶„ì€ ë‚´ì¼17ì‹œê¹Œì§€ ë¹—ì¸ ê³ ê°ì„¼í„°ë¡œ ì „í™”í•˜ê¸°"}
{"source_file": "C:\\Users\\user\\Downloads\\Telegram Desktop\\ChatExport_2026-02-02 (3)\\messages.html", "channel": "íŒíŒí€ì¹˜", "message_id": 91, "ts_title": "21.08.2025 13:57:18 UTC+09:00", "date_ymd": "2025-08-21", "time_hm": "13:57", "text": "ë°©ê¸ˆ ìˆì—ˆë˜ ì¼.txt\n\ní•˜ë¦¬ì—ì„œ ì´ë” ê°€ê²©ì´ íŠ€ê¸° ì‹œì‘í•´ì„œ í•˜ì´í¼ ìŠ¤ìº”ë³´ë‹ˆê¹Œ\n\nì–´ë–¤ ìœ ì €ê°€ ë“¤ê³  ìˆëŠ” ë¹„íŠ¸ë¥¼ íŒ”ê³  ì´ë”ë¥¼ ì‹œì¥ê°€ë¡œ ì‚¬ì£¼ê³  ìˆì—ˆìŒ\n\në°”ë‚¸ì€ 4290$ ì¸ë° ì‹œì¥ê°€ë¡œ ê¸íˆëŠ” ê°€ê²©ì€ ~4450$ ê¹Œì§€\n\në°”ë¡œ ë³´ë‚´ì„œ ì¡°ê¸ˆ íŒ”ì•„ë´„\n\nê¸°ë¶€ì²œì‚¬ : https://hypurrscan.io/address/0x2ea18c23f72a4b6172c55b411823cdc5335923f4"}
{"source_file": "C:\\Users\\user\\Downloads\\Telegram Desktop\\ChatExport_2026-02-02 (3)\\messages.html", "channel": "íŒíŒí€ì¹˜", "message_id": 94, "ts_title": "21.08.2025 14:56:41 UTC+09:00", "date_ymd": "2025-08-21", "time_hm": "14:56", "text": "ê¸°ë…ìœ¼ë¡œ ì‚¬ë´¤ìŠµë‹ˆë‹¤"}
{"source_file": "C:\\Users\\user\\Downloads\\Telegram Desktop\\ChatExport_2026-02-02 (3)\\messages.html", "channel": "íŒíŒí€ì¹˜", "message_id": 95, "ts_title": "21.08.2025 15:28:07 UTC+09:00", "date_ymd": "2025-08-21", "time_hm": "15:28", "text": "ìŠ¤íŠ¸ë¼ì´í¬ ì—…ë¹„íŠ¸ í•«ì›”ë › ì±„ìš°ê³  ì¶œê¸ˆí•´ì£¼ëŠ”ë“¯\n\nhttps://etherscan.io/address/0x8a62adb3b622051531257cc15a6eb38a32af9e38#tokentxns\n\nì²œí•˜ì œì¼ ìœ ë™ì„± í„¸ì–´ë¨¹ê¸°ëŒ€íšŒ ì‹œì‘"}
{"source_file": "C:\\Users\\user\\Downloads\\Telegram Desktop\\ChatExport_2026-02-02 (3)\\messages.html", "channel": "íŒíŒí€ì¹˜", "message_id": 97, "ts_title": "22.08.2025 17:00:33 UTC+09:00", "date_ymd": "2025-08-22", "time_hm": "17:00", "text": "ë°”ì´ë‚¸ìŠ¤(Binance) ê³µì§€\nPlasma USDT Locked Product: Total Subscription Limit Expands to 1B USDT With a New 250M USDT Quota \n2025-08-22 17:00:08"}
{"source_file": "C:\\Users\\user\\Downloads\\Telegram Desktop\\ChatExport_2026-02-02 (3)\\messages.html", "channel": "íŒíŒí€ì¹˜", "message_id": 98, "ts_title": "22.08.2025 17:04:23 UTC+09:00", "date_ymd": "2025-08-22", "time_hm": "17:04", "text": "ì´ 1B ê¹Œì§€ ëŠ˜ë¦´ì˜ˆì •ì´ê³ , ì˜¤ëŠ˜ ì˜¤í›„6ì‹œë¶€í„° ì¶”ê°€ ìº¡ ì—´ë¦¬ëŠ”ê±´ 250M ì¶”ê°€ì„\n\napr 4í† ë§‰ë‚ ì˜ˆì •..."}
{"source_file": "C:\\Users\\user\\Downloads\\Telegram Desktop\\ChatExport_2026-02-02 (3)\\messages.html", "channel": "íŒíŒí€ì¹˜", "message_id": 99, "ts_title": "22.08.2025 20:59:44 UTC+09:00", "date_ymd": "2025-08-22", "time_hm": "20:59", "text": "ì´ìƒí•œ ê³ ë˜ê°€ í•˜ë¦¬ BTC ë§¤ë„ í›„ ETH ë§¤ìˆ˜í•˜ëŠ”\n ê²ƒ ë•Œë¬¸ì— ê°­ì´ ë‚˜ëŠ” ê±¸ ê³„ì† ëª¨ë‹ˆí„°ë§í•¨. \n\në‹¤ë“¤ ë°”ë‚¸ì—ì„œ ì´ë” êµ¬í•˜ê³  ë˜ì¡ŒëŠ”ë° ë‚œ ê·¸ëƒ¥ ë¸íƒ€ ì—´ë¦¬ëŠ” ìƒê° ì•ˆí•˜ê³  í˜¸ê°€ ìœ„ì•„ë˜ë¡œ ê³„ì† ëŒ. í•˜í•„ ì™¸ë¶€ë¼ì„œ ì†ìœ¼ë¡œ í–ˆëŠ”ë°ë„ ìˆ˜ìµì´ ë‚¨. \n\n--- \nì† ë§¤ë§¤ í•´ë„ ìˆ˜ìµì´ ë‚  ê²ƒì´ë¼ê³  í™•ì‹ í•œ ì´ìœ \n\n(ë‡Œí”¼ì…œ)\nì´ˆë°˜ì—ëŠ” í•˜ë¦¬ì—ì„œ mm ëŒë¦¬ê³  ìˆëŠ” ìœˆí„°ë®¤íŠ¸ ê°™ì€ ì¹œêµ¬ë“¤ì´ ê³„ì† ë©”ì´ì»¤ ëŒ€ì£¼ê³  ìˆì–´ì„œ í”¼ë¢°ì¹¨ì´ ì•ˆë‚˜ì™”ìŒ.\n\nê·¼ë° ë¬¸ì œëŠ” ê³ ë˜ê°€ 300 ë¹„íŠ¸ì”© ë“¤ê³  ethë¡œ ë°”ê¿¨ê¸° ë•Œë¬¸ì— mm ëŒë¦¬ëŠ” ì¹œêµ¬ë“¤ì˜ ì¸ë²¤í† ë¦¬ê°€ ë¹µê¾¸ê°€ ë‚˜ê¸° ì‹œì‘í•œ ê²ƒ ê°™ìŒ.\n\nì²˜ìŒì—ëŠ” í…Œí† ë‚¨ ë§¤ìˆ˜ ë‹¤ ë°›ì•„ë¨¹ìœ¼ë ¤ê³  30ì´ë” 50ì´ë”ì”© í˜¸ê°€ ê½‚ì•„ë†“ê³  ìˆì—ˆëŠ”ë°,\n\nê³ ë˜ ì¸ë²¤í† ë¦¬ì— BTC 50ê°œ ì •ë„ ë‚¨ì€ ìˆœê°„ë¶€í„° í•˜ë¦¬ ì˜¤ë”ë¶ì´ ë¹„ê¸° ì‹œì‘í•¨. ê·¸ ë•Œë¶€í„° í”¼ë¢°ì¹¨ì´ ì´ì§€ê³  ì†ìœ¼ë¡œ ë”¸ê¹ ë”¸ê¹ ë§¤ìˆ˜ë§¤ë„ ëŒ€ì¤˜ë„ ì‚¬íŒ”ì´ ëë˜ë“¯.\n\ní•˜ë¦¬ê°€ ë§ì´ ì•ˆë˜ëŠ”ê²Œ ìƒëŒ€ë°©ì´ ë­í•˜ëŠ”ì§€ ë‹¤ ë³´ì´ë‹ˆê¹, btc ê°œìˆ˜ 0ë˜ëŠ” ìˆœê°„ ê±°ë˜ ì•ˆí•˜ë©´ ëê³ , btc ì—­ê°­ ë‚œê±° ë¨¹ê³  ë§ˆë¬´ë¦¬ ì§€ìœ¼ë©´ ëìŒ.\n\nê·¸ëŸ¬ë‹¤ê°€ ë‹¤ì‹œ ê³ ë˜ ì§€ê°‘ì— ë¹„íŠ¸ ê½‚íˆë©´ ì „ìŸ ì¤€ë¹„í•˜ê¸°ë¥¼ ë°˜ë³µí•  ìˆ˜ê°€ ìˆì—ˆìŒ."}
{"source_file": "C:\\Users\\user\\Downloads\\Telegram Desktop\\ChatExport_2026-02-02 (3)\\messages.html", "channel": "íŒíŒí€ì¹˜", "message_id": 100, "ts_title": "26.08.2025 16:48:17 UTC+09:00", "date_ymd": "2025-08-26", "time_hm": "16:48", "text": "mexc WLFI ëŸ°íŒ¨ (ì‹ ê·œìœ ì €ì „ìš© + í’€ìº¡ 26USDTğŸ˜†)"}
{"source_file": "C:\\Users\\user\\Downloads\\Telegram Desktop\\ChatExport_2026-02-02 (3)\\messages.html", "channel": "íŒíŒí€ì¹˜", "message_id": 101, "ts_title": "26.08.2025 16:49:59 UTC+09:00", "date_ymd": "2025-08-26", "time_hm": "16:49", "text": "Worse than pump launchpad (max cap $75)ğŸ¤”"}
{"source_file": "C:\\Users\\user\\Downloads\\Telegram Desktop\\ChatExport_2026-02-02 (3)\\messages.html", "channel": "íŒíŒí€ì¹˜", "message_id": 104, "ts_title": "29.08.2025 11:56:00 UTC+09:00", "date_ymd": "2025-08-29", "time_hm": "11:56", "text": "?"}
{"source_file": "C:\\Users\\user\\Downloads\\Telegram Desktop\\ChatExport_2026-02-02 (3)\\messages.html", "channel": "íŒíŒí€ì¹˜", "message_id": 105, "ts_title": "29.08.2025 15:35:18 UTC+09:00", "date_ymd": "2025-08-29", "time_hm": "15:35", "text": "BINANCE FUTURES ARE CURRENTLY OFFLINE: MARKET\n\nğŸ”— velo.xyz"}
{"source_file": "C:\\Users\\user\\Downloads\\Telegram Desktop\\ChatExport_2026-02-02 (3)\\messages.html", "channel": "íŒíŒí€ì¹˜", "message_id": 106, "ts_title": "29.08.2025 16:49:44 UTC+09:00", "date_ymd": "2025-08-29", "time_hm": "16:49", "text": "ì›¨í›„"}
{"source_file": "C:\\Users\\user\\Downloads\\Telegram Desktop\\ChatExport_2026-02-02 (3)\\messages.html", "channel": "íŒíŒí€ì¹˜", "message_id": 107, "ts_title": "30.08.2025 20:52:06 UTC+09:00", "date_ymd": "2025-08-30", "time_hm": "20:52", "text": "ì¼ê¸°ì¥\në°ˆì½”ì–´ í† í° Mì´ ê¸‰ë“±í•´ì„œ bsc <-> memecore ê°„ ì•„ë¹„íŠ¸ë¼ì§€\n\në¸Œë¦¿ì§€: https://app.free.tech/M?from=bnb&to=memecore\n(ë‹¤ë¥¸ ë¸Œë¦¿ì§€ ë” ìˆëŠ”ì§€ëŠ” ëª¨ë¦„)\n\n* ë¬´í„±ëŒ€ê³  ë³´ë‚´ë©´ ì»¨íŠ¸ë™ì— ë¬¼ëŸ‰ì—†ìœ¼ë©´ ì±„ì›Œì§ˆë•Œê¹Œì§€ ë¬¶ì—¬ì„œ ê°œì³ë§ìŒ\n\nì•„ë§ˆ ë¸Œë¦¿ì§€ íŠ¸ì­ë„£ì€ ìˆœì„œëŒ€ë¡œ í•´ë‹¹ ì»¨íŠ¸ë™ì— M ì±„ì›Œì§€ë©´ ë³´ë‚¼ìˆ˜ ìˆëŠ” ë¬¼ëŸ‰ ìˆœì„œëŒ€ë¡œ ë³´ë‚´ì£¼ëŠ”ê±°ê°™ìŒ(ê± ëœë¤ìœ¼ë¡œ ë³´ë‚´ì£¼ëŠ”ê±°ê°™ê¸°ë„í•˜ê³  ëª°ë£¨)\n\nëª‡ë°”í€´ì”© ëŒë¦¬ëŠ”ê±´ ë§ˆì§€ë§‰ì— ë‹¤ í† í•´ë‚¼ìˆ˜ë„ ìˆê³ \në˜ ì´ë ‡ê²Œ ê¸‰ë“±ì´ë²¤íŠ¸ ë‚˜ì˜¤ë©´(íŒ€ì—ì„œ ë¬¼ëŸ‰ ë§ì´ ì¥ê³  ìš´ì „í•˜ëŠ”ë“¯. ë°‹ì—… ì „ì—ë„ ì«™ ì˜¬ë ¸ëŠ”ë° ì´ë²ˆ kbwë•Œë„ ì§€ì†ì ìœ¼ë¡œ ìš´ì „í•˜ì§€ì•Šì„ê¹Œ ì‹¶ì„ì§€ë„) ì»¨íŠ¸ë™ ë¬¼ëŸ‰ ì§€ì¼œë³´ê³  ì„ ì°©ìˆœ ì´ë²¤íŠ¸ëŠë‚Œìœ¼ë¡œ ì°¸ì—¬í• ë“¯\n\nhttps://explorer.meson.fi/\nì—¬ê¸°ì„œë„ ì§ê´€ì ìœ¼ë¡œ ë¸Œë¦¿ì§€ íŠ¸ì­ë“¤ êµ¬ê²½ê°€ëŠ¥"}
{"source_file": "C:\\Users\\user\\Downloads\\Telegram Desktop\\ChatExport_2026-02-02 (3)\\messages.html", "channel": "íŒíŒí€ì¹˜", "message_id": 108, "ts_title": "01.09.2025 22:43:36 UTC+09:00", "date_ymd": "2025-09-01", "time_hm": "22:43", "text": "ì•„ë¬´ê²ƒë„ ì•ˆí•˜ê³  ì„ ì„ ë§Œ ë¨¹ì€ ì‚¬ëŒì˜ ì˜¤ëŠ˜ ìˆ˜ìµë‚ ìˆ˜ìˆì—ˆë˜ ê²ƒë“¤ ë³µê¸°\n\n1. eth sol chainê°„ gap(ë¹¨ë¦¬ë³´ëƒˆìœ¼ë©´ 10%ì´ìƒ, ëŠ¦ê²Œë³´ëƒˆìœ¼ë©´ 4%)\n\n2. ë”°ë¦¬ - 1ë“±: ì¿ ì½”ì¸, 2ë“±: ì•¼ì¸, 3ë“± ì—…ë¹„íŠ¸, 4ë“±: mexc?\n-í˜„ë¬¼ìƒì¥ì„ í´ë ˆì„ ë™ì‹œì— ì—¬ëŠ”ê³³ê³¼, í´ë ˆì„ì´í›„ì— ì—¬ëŠ”ê³³ì„ ë‚˜ëˆ„ì–´ì„œ ë² íŒ…í•  ì´ìœ ê°€ ìˆì—ˆë‹¤ê³ ë´„(ë³µê¸°í•´ë´ë„, ì¿ ì½”ì¸ì—ëŠ” ëª»ë³´ëƒˆì„ê±°ê°™ìŒ)\n\n3. bybit,okx,bitget ì„ ì„  2í¼ (ì•ˆì •ì ì¸ ê°€ì •ì„ ê¾¸ë¦´ ìê²©ì´ ìˆëŠ” ë‚¨ì)\n\n4. wlfiì˜ ì„ ì„ ìˆ˜ìš”ê°€ xplë¡œ í–¥í•´ì„œ ë°”ë‚¸<>í•˜ë¦¬ xplê°­ì´ ì¢í˜€ì§ˆê±°ì˜ˆìƒí•˜ê³  ë² íŒ…(2í”„ë¡œê¸´í•œë°, ìŠ¬í”¼ê³ ë ¤í•˜ë©´ 1í”„ë¡œ)\n\n\nì¢…í•©ì ìœ¼ë¡œ wlfiì˜ ìƒì¥ì¼ì •ì´ë‚˜ ëŒ€í•´ì„œ ê³µë¶€ë¥¼ í–ˆì—ˆì–´ì•¼ í–ˆëŠ”ë°\nì„ ì„ ì—ë§Œ ì§‘ì°©í•´ì„œ ëšì±„ìš°ê³  ì•Œë¹ ë…¸ í•œê²Œ ë„ˆë¬´ì•„ì‰¬ìš´ í•˜ë£¨ì„"}
{"source_file": "C:\\Users\\user\\Downloads\\Telegram Desktop\\ChatExport_2026-02-02 (3)\\messages.html", "channel": "íŒíŒí€ì¹˜", "message_id": 109, "ts_title": "02.09.2025 09:08:41 UTC+09:00", "date_ymd": "2025-09-02", "time_hm": "09:08", "text": "FABLO KBW2025 ë¬´ë£Œ ì´ˆëŒ€ê¶Œ ì´ë²¤íŠ¸ 2íƒ„ ë‹¹ì²¨ì ë°œí‘œ\n\nFABLO ì–´í”Œ - ë”ë³´ê¸° - ë‚˜ì˜ì•„ì´í…œ - ì¿ í°\nì—ì„œ í™•ì¸ê°€ëŠ¥\n\në‹¹ì²¨ë˜ë©´ ì´ë ‡ê²Œ ì¿ í°ì´ ë“¤ì–´ì™€ìˆìŒ\n\në¹—ì¸ ë‹¹ì²¨ëëŠ”ë° ë˜ ë‹¹ì²¨ëë„¤;;"}
{"source_file": "C:\\Users\\user\\Downloads\\Telegram Desktop\\ChatExport_2026-02-02 (3)\\messages.html", "channel": "íŒíŒí€ì¹˜", "message_id": 111, "ts_title": "02.09.2025 21:08:16 UTC+09:00", "date_ymd": "2025-09-02", "time_hm": "21:08", "text": "ìµœê·¼ì— ì—¬ê¸°ì €ê¸° ëˆë„£ì„ë°ê°€ ë„ˆë¬´ ë§ì•„ì„œ ê¸°ë… ë±ƒì§€ë§Œ ì±™ê¸°ë ¤ê³  100ë¶ˆë§Œ ì¬ë¯¸ì‚¼ì•„ë„£ì—ˆëŠ”ë° í’€ì–¼ë¡œë“œëª½í˜„\n\nëˆ ë§ì´ë„£ì–´ì„œ ì¥ì¢ƒí• ë‹¹ë°›ì•˜ìœ¼ë©´ ì¢€ í”¼ëˆˆë¬¼ë‚¬ì„ê±°ê°™ìŒ\n\n*ë…¸í‹°ì–´ëŠ” 290ë¶ˆ í• ë‹¹ì´ì—‡ë‚˜ë´„"}
{"source_file": "C:\\Users\\user\\Downloads\\Telegram Desktop\\ChatExport_2026-02-02 (3)\\messages.html", "channel": "íŒíŒí€ì¹˜", "message_id": 112, "ts_title": "02.09.2025 23:35:33 UTC+09:00", "date_ymd": "2025-09-02", "time_hm": "23:35", "text": "ë¹—ì¸ ì„œë²„í„°ì§„ë“¯"}
{"source_file": "C:\\Users\\user\\Downloads\\Telegram Desktop\\ChatExport_2026-02-02 (3)\\messages.html", "channel": "íŒíŒí€ì¹˜", "message_id": 113, "ts_title": "03.09.2025 21:16:48 UTC+09:00", "date_ymd": "2025-09-03", "time_hm": "21:16", "text": "KBW2025 í‹°ì¼“ 2ì¥ ë‚¨ì•„ì„œ 2ì¥ ë¿Œë¦´ê²Œìš”\n\nê°€ì‹¤ë¶„ë“¤ì€ í¼ì—ë‹¤ê°€ ì´ë²ˆì£¼ë§ê¹Œì§€ ì‘ì„±ë¶€íƒ.. \n\nhttps://x.com/methepann/status/1963214072196809168"}
{"source_file": "C:\\Users\\user\\Downloads\\Telegram Desktop\\ChatExport_2026-02-02 (3)\\messages.html", "channel": "íŒíŒí€ì¹˜", "message_id": 114, "ts_title": "08.09.2025 15:28:19 UTC+09:00", "date_ymd": "2025-09-08", "time_hm": "15:28", "text": "ì¶”ì²¨í•´ì„œ ëŒ€ìƒìì—ê²Œ íŠ¸ìœ„í„° dmìœ¼ë¡œ ì „ë‹¬ì™„ë£Œí–ˆìŠµë‹ˆë‹¤ ğŸ˜‰\n\nìƒê°ë³´ë‹¤ ë§ì´ ì°¸ì—¬í•´ì£¼ì…¨ëŠ”ë° ë‚˜ì¤‘ì— ë” ê¸°íšŒê°€ ìˆë‹¤ë©´ ì´ì™¸ì—ë„ ì—¬ëŸ¬ê°€ì§€ ë¿Œë¦¬ë„ë¡ ë…¸ë ¥í•˜ê² ìŠµë‹ˆë‹¤ â˜•ï¸"}
{"source_file": "C:\\Users\\user\\Downloads\\Telegram Desktop\\ChatExport_2026-02-02 (3)\\messages.html", "channel": "íŒíŒí€ì¹˜", "message_id": 115, "ts_title": "09.09.2025 00:36:39 UTC+09:00", "date_ymd": "2025-09-09", "time_hm": "00:36", "text": "ë¹—ì¸ë„ ë­ ë³´ì—¬ì£¼ë‚˜"}
{"source_file": "C:\\Users\\user\\Downloads\\Telegram Desktop\\ChatExport_2026-02-02 (3)\\messages.html", "channel": "íŒíŒí€ì¹˜", "message_id": 116, "ts_title": "11.09.2025 00:58:10 UTC+09:00", "date_ymd": "2025-09-11", "time_hm": "00:58", "text": "ì¹¼ë°ë¼ë„ 2~3ë¶„ì „ì— 30ë¶„ ì—°ê¸°ê³µì§€ ë•Œë ¸ì—ˆìŒ\nê·¸ 30ë¶„ë™ì•ˆ ë°”ë‚¸ ìƒì¥í›„ ì¶œê¸ˆì—´ë¦¬ê³  ìƒì¥ ê°•í–‰í–ˆì—ˆìŒ"}
{"source_file": "C:\\Users\\user\\Downloads\\Telegram Desktop\\ChatExport_2026-02-02 (3)\\messages.html", "channel": "íŒíŒí€ì¹˜", "message_id": 117, "ts_title": "11.09.2025 01:39:52 UTC+09:00", "date_ymd": "2025-09-11", "time_hm": "01:39", "text": "ìƒì¥ ê°•í–‰ ìƒê°í•˜ê³  ë±ìŠ¤ì—ì„œ ì•ˆê¸ì–´ì„œ ë³´ë‚¸ ì•„ë¹„ëŸ¬ë“¤ì´ ìƒë”° ê°ˆê¸´ê±°ê°™ë„¤"}
{"source_file": "C:\\Users\\user\\Downloads\\Telegram Desktop\\ChatExport_2026-02-02 (3)\\messages.html", "channel": "íŒíŒí€ì¹˜", "message_id": 118, "ts_title": "11.09.2025 02:44:03 UTC+09:00", "date_ymd": "2025-09-11", "time_hm": "02:44", "text": "ë‹¤ë“¤ ì•Œê² ì§€ë§Œ ê·¸ë˜ë„ ê·¼ê±° ì ì–´ë³´ë©´\n\nê¸ì •ì ì¸ ì ì€ (ìœ í†µëŸ‰ ì´ìŠˆ)\n\në±ìŠ¤ êµ¬ë¦¼, ì²´ì¸ êµ¬ë¦¼, ë¸Œë¦¿ì§€ ê³µë¸Œ ì œì™¸ ì „ë¶€ ë¨¹í†µì´ë¼ ì´ë” êµ¬í•˜ê¸° í˜ë“¦ì—ë„ ë¶ˆêµ¬í•˜ê³ ? ê·¸ë ‡ê¸° ë•Œë¬¸ì—? í´ë ˆì„ ì—´ë¦¬ê³  í˜„ì„ ê°­ì´ 10% ì´ë‚´?ë¡œ ë‚´ë ¤ì˜´ \n\nL2ë¼ ì—…ë¹„íŠ¸ ì£¼ì†Œ ì „ë¶€ ê°™ê³  ì–¼ì¶” ëŒë ¤ë³´ë‹ˆê¹Œ 100ì–µë„ ì•ˆë“¤ì–´ì˜´\n\nê·¸ë˜ì„œ ê·¸ëƒ¥ í´ë ˆì„ í’€ë¦¬ê³  ë³´ë‚´ë†“ì€ ì´ë” ì´ë”ë ‰ìŠ¤ì—ì„œ ì „ë¶€ ìŠ¤ì™‘ í•˜ê³  ë³´ëƒ„(ë”¸ê¹ 20ë²ˆì— ìŠ¤ì™‘í•œë²ˆ ê²¨ìš° ëœê±° ê°™ë„¤)\n\në¶€ì •ì ì¸ ì ì€(ë§¤ìˆ˜ì„¸ ì´ìŠˆ)\n\nìƒˆë²½ 1ì‹œë°˜ ìƒì¥ì„  ì˜¤í”ˆë ›ì € ë§í•¨ ì´ë²ˆì£¼ 4ê°œì§¸ ì›ìƒì„ ë“±ë“±ìœ¼ë¡œ í™”ë ¥ì„ ë§ì´ ì£½ì—¬ë†”ì„œ ê·¸ë‚˜ë§ˆ 70ì› ê°„ê±°ê°™ë„¤ \n\nì†Œí° ì •ë„ ì¡°ê±´ë§Œ ëì–´ë„ 100ì› ì°ì„ê±°ë¼ ìƒê°í–ˆì—ˆìŒ\n\n1. ìì²´ ë©”ì¸ë„· ê°€ì§„ ì¹œêµ¬ë“¤ì€ ë¯¸ë¦¬ë¯¸ë¦¬ ëˆì„ ë„£ì–´ë‘ê¸° + ê¸°ë³¸ì ì¸ ì£¼ë¥˜ ë±ìŠ¤, ë¸Œë¦¿ì§€ëŠ” ìˆ™ì§€ í•´ë‘ê¸°(ì´í›„ ì•±ìŠ¤, ë©”ê°€ì´ë”, OG, ëª¨ë‚˜ë“œ ë“±ë“±)\n\n2. ê°œì¸ì ìœ¼ë¡œ ìœ í†µëŸ‰ í¥ì¡°ê±´ì´ ë§¤ìˆ˜ì„¸ ì•…ì¡°ê±´ë³´ë‹¤ í›¨ì”¬ í¬ë‹¤ ìƒê°í•¨ ì´ë²ˆì€ íŠ¹íˆ ê·¸ ì–‘ìª½ì´ ê·¹ë‹¨ì ì´ì—ˆì–´ì„œ ì—…ë¹„íŠ¸ ë”°ë¦¬ íŒë‹¨í• ë–„ ì € ë‘ê°œ ê¸°ì¤€ìœ¼ë¡œ ë‚˜ëˆ  ìƒê°í•˜ë©´ íŒë‹¨ì— ë„ì›€ì´ ë©ë‹ˆë‹¤"}
{"source_file": "C:\\Users\\user\\Downloads\\Telegram Desktop\\ChatExport_2026-02-02 (3)\\messages.html", "channel": "íŒíŒí€ì¹˜", "message_id": 119, "ts_title": "11.09.2025 18:51:21 UTC+09:00", "date_ymd": "2025-09-11", "time_hm": "18:51", "text": "ê±°ë˜ì§€ì› ì¤‘ì¸ íŒí”„(PUMP)ì˜ ì‹¬ë³¼ëª…ì€ PUMPBTCë¡œ ì§€ì›ë  ì˜ˆì •ì…ë‹ˆë‹¤."}
{"source_file": "C:\\Users\\user\\Downloads\\Telegram Desktop\\ChatExport_2026-02-02 (3)\\messages.html", "channel": "íŒíŒí€ì¹˜", "message_id": 120, "ts_title": "11.09.2025 19:31:04 UTC+09:00", "date_ymd": "2025-09-11", "time_hm": "19:31", "text": "https://polymarket.com/event/who-will-win-the-usdh-ticker-159?tid=1757586585198\n\ní˜¸ê°€ ê½¤ ìˆë„¤"}
{"source_file": "C:\\Users\\user\\Downloads\\Telegram Desktop\\ChatExport_2026-02-02 (3)\\messages.html", "channel": "íŒíŒí€ì¹˜", "message_id": 121, "ts_title": "15.09.2025 13:15:11 UTC+09:00", "date_ymd": "2025-09-15", "time_hm": "13:15", "text": "ë¹—ì¸(Bithumb) ê³µì§€ë³€ê²½\nì•„ë°˜í‹°ìŠ¤(AVNT) ì›í™” ë§ˆì¼“ ì¶”ê°€ (ê±°ë˜ ì˜¤í”ˆ ì˜¤í›„ 1ì‹œ 30ë¶„ ì˜ˆì •)\n2025-09-15 13:14:55"}
{"source_file": "C:\\Users\\user\\Downloads\\Telegram Desktop\\ChatExport_2026-02-02 (3)\\messages.html", "channel": "íŒíŒí€ì¹˜", "message_id": 122, "ts_title": "15.09.2025 13:15:21 UTC+09:00", "date_ymd": "2025-09-15", "time_hm": "13:15", "text": "ê¸°ì‹¸ì›€ on"}
{"source_file": "C:\\Users\\user\\Downloads\\Telegram Desktop\\ChatExport_2026-02-02 (3)\\messages.html", "channel": "íŒíŒí€ì¹˜", "message_id": 124, "ts_title": "16.09.2025 21:00:18 UTC+09:00", "date_ymd": "2025-09-16", "time_hm": "21:00", "text": "$AVNT ìƒì¥(Up,Bit,Binance)\n\níƒ€ì„ë¼ì¸\n2025.09.15 11:30 - ğŸ˜‡ ì—…ë¹„íŠ¸ $AVNT ìƒì¥ ê³µì§€\n- ê±°ë˜ ì§€ì›: 2025.09.15 14:00 ì˜ˆì •\n- ì²´ì¸: Base\n- í˜„ì„  4~5í¼ ê¹Œì§€ ë²Œì–´ì¡‹ë‹¤ê°€ 0.5~1í¼ëŒ€ ìœ ì§€\n2025.09.15 12:04 - ğŸ˜† ë¹—ì¸ $AVNT ìƒì¥ ê³µì§€\n- ê±°ë˜ ì§€ì›: 2025.09.15 14:00 ì˜ˆì •\n- ì²´ì¸: Base\n2025.09.15 12:47 - ğŸ˜ ë°”ì´ë‚¸ìŠ¤ $AVNT spot ìƒì¥ ê³µì§€  \n- ê±°ë˜ ì§€ì›: 2025.09.15 14:00 ì˜ˆì •\n- ì¶œê¸ˆì§€ì› ì˜ˆì •: 2025.09.15 15:00 ì˜ˆì •\n2025.09.15 13:11 - ğŸ˜‡ ì—…ë¹„íŠ¸ $AVNT ê±°ë˜ì§€ì› ê°œì‹œ ì‹œì  ë³€ê²½ ê³µì§€\n- ì—…ë¹„íŠ¸ì˜ ê²¬ì œì‹œì‘ (ê±°ë˜ì‹œì  30ë¶„ ì•ë‹¹ê¹€) - ê±°ë˜ ì§€ì›: 13:30 (ìˆ˜ì •)\n- *ë¹—ì¸ ìˆ˜ì •ê³µì§€ëŠ” ê¸°íƒ€ ê³µì§€ë°©(ëŒ€í‘œì ìœ¼ë¡œ ìƒˆìš°ì¡ì´ì–´ì„  ê³µì§€ë°©) ë“±ì— ëœ¨ì§€ë§Œ ì—…ë¹„íŠ¸ ìˆ˜ì •ê³µì§€ëŠ” ëª»ì¡ì•„ì¤Œ. ì—…ë¹„íŠ¸ëŠ” ê³µì‹ í…”ê·¸ë°© ì•ŒëŒ ì¼œë‘˜ê²ƒ. *\n2025.09.15 13:14 - ğŸ˜†ë¹—ì¸ $AVNT ê±°ë˜ì§€ì› ê°œì‹œ ì‹œì  ë³€ê²½\n- ë¹—ì¸ í—ë ˆë²Œë–¡ ê¸°ì‹¸ì›€ ìˆ˜ì •ê³µì§€\n- ê±°ë˜ì§€ì›: 13:30 (ìˆ˜ì •)\n- ìˆ˜ì • ê³µì§€ ë‹¹ì‹œ ë¹—ì¸ ì…ê¸ˆì•¡ ì•½ 6ì–µì›\n- ì—…ë¹„íŠ¸ ê±°ë˜ì‹œì  ìˆ˜ì • ê³µì§€ ì´í›„ë¶€í„° í˜„ì„  ë‹¤ì‹œ ë²Œì–´ì§€ê¸° ì‹œì‘. 3~5í¼ëŒ€ í˜„ì„ .\n2025.09.15 13:30 - ğŸ˜‡ğŸ˜† ì—…ë¹—ì¸ ì…ê¸ˆëŸ‰\n- ì—…ë¹„íŠ¸: 110ì–µ ê°€ëŸ‰\n- ë¹—ì¸: 22ì–µ ê°€ëŸ‰\n2025.09.15 13:35 - ğŸ˜‡ğŸ˜† ì—…ë¹—ì¸ ê±°ë˜ ì‹œì‘\n- ì—…ë¹„íŠ¸\n    - 1ì´ˆë´‰ H:1690\n    - ë§¤ë„ë´‡ ëŒë ·ì–´ì•¼ ìµœìƒì˜ í”Œë ˆì´\n    - ìƒë‚¨ìì‹ ìƒë”°ë¦¬ ì—¿ìœ¼ë©´ ë§ì´ ë¨¹ì—ˆì„ë“¯(ìš´ë¹¨)\n- ë¹—ì¸\n    - H:1671\n- ë‘˜ë‹¤ 6~8% ì •ë„ 1ë¶„ë´‰ê¸°ì¤€ ê¹€í”„\n- 1ë¶„ë´‰ ë”°ë¦¬ ëª»ë¨¹ì€ì‚¬ëŒë“¤ ë°”ë‚¸ ë”°ë¦¬í•˜ëŸ¬ íšŒêµ°\n    - ì•ˆë¹¼ì£¼ë‹¤ê°€ 13:56 ì¯¤ì— ë¹¼ì£¼ê¸° ì‹œì‘\n    - ì—­í”„ êµ¬ê°„ ëŒì…\n2025.09.15 14:00 - ğŸ˜ ë°”ë‚¸ spot ìƒì¥\n- 1ì´ˆë´‰ H:1.4 \n- ë”±íˆ í”„ë¦¬ë¯¸ì—„ ì—†ìŒ\n2025.09.15 14:00 ~ ì´í›„ \n- ë¯¸ì¹œ í›„íŒìœ¼ë¡œ 1.5ë¶ˆê¹Œì§€ ì°ê³  ë‚´ë ¤ì˜´\n- ìˆ í—·ì§•ì¹˜ê³  ì•ˆí‘¼ì‚¬ëŒë“¤ ëª¨ë‘ ë¤í”„íŠ¸ëŸ­ì— êµí†µì‚¬ê³ \n- ë”°ë¦¬ì˜ ì˜ì—­ë³´ë‹¨ ë§¤ë§¤ì˜ ì˜ì—­ì´ë¼ ê·¸ëƒ¥ ê°„ëµí•˜ê²Œë§Œ íƒ€ì„ë¼ì¸ ì‘ì„±\n\n\níŠ¹ì´ì‚¬í•­\n- ì—…ë¹„íŠ¸ ì˜ë¬¸ì˜ ìƒì¥ë“¤ ê³µí†µì  : \"í”¼í„°í‹¸ì˜ Founders Fund, ë¦¬ë“œ íˆ¬ì\" (ì¶œì²˜: ëˆí¬í•˜ ì±„ë„  ì°¸ì¡°)\n- FLOCKì— ì´ì€ ì½”ë² /ë² ì´ìŠ¤ ê´€ë ¨ í”½ ìƒì¥\n- ìƒì¥ì „ì— ì´ë¯¸ ë§ì´ ì˜¬ëë‹¤ê³ (ìœ ?ì¶œ) ìƒê°í–ˆëŠ”ë° ë” ì˜¬ë¦¼..\n\ní›„ê¸°\n- ë§¤ë„ë´‡ ì•ˆëŒë¦¬ê³  ë©ë•Œë¦¬ë‹¤ê°€ ë³„ë¡œ ì´ë“ëª»ë´„"}
{"source_file": "C:\\Users\\user\\Downloads\\Telegram Desktop\\ChatExport_2026-02-02 (3)\\messages.html", "channel": "íŒíŒí€ì¹˜", "message_id": 125, "ts_title": "16.09.2025 21:02:45 UTC+09:00", "date_ymd": "2025-09-16", "time_hm": "21:02", "text": "ë…¸ì…˜ì—ë‹¤ê°€ ê°œì¸ ë³µê¸°ìš©ìœ¼ë¡œ ìƒì¥ ë³µê¸°í•˜ë˜ê±´ë° ì±„ë„ì—ë„ ìƒê°ë‚˜ë©´ ì˜¬ë ¤ë³¼ ìƒê°\n\në¶€ì¡±í•œ ì  ì•Œë ¤ì£¼ì„¸ìš”..\n\ní…”ê·¸ëŠ” ì‚¬ì§„ ë„£ê¸°ê°€ í˜ë“¤ì–´ì„œ ë…¸ì…˜ë§Œí¼ ê°€ë…ì„±ì´ ì•ˆì¢‹ì€ë“¯\n\në…¸ì…˜ì— ë„£ì–´ë‘” ì¤‘ê°„ì¤‘ê°„ í˜„ì„ ê°­ ì°¨íŠ¸ë‚˜ ìƒì¥ë‹¹ì‹œ ì°¨íŠ¸ë‚˜ ì´ëŸ°ê±´ ê± ê·€ì°®ì•„ì„œ ë¹¼ë²„ë¦¼"}
{"source_file": "C:\\Users\\user\\Downloads\\Telegram Desktop\\ChatExport_2026-02-02 (3)\\messages.html", "channel": "íŒíŒí€ì¹˜", "message_id": 126, "ts_title": "16.09.2025 21:43:10 UTC+09:00", "date_ymd": "2025-09-16", "time_hm": "21:43", "text": "$ZKC ìƒì¥ (Up/Bit/Binance)\n\ní† í° ì´ ê³µê¸‰ëŸ‰ 1B / ì´ˆê¸° ìœ í†µëŸ‰ 200M ê°€ëŸ‰\n- BNB Smart Chain\n0x15247e6E23D3923a853cCf15940A20CCdf16e94a\n- Ethereum\n0x000006c2A22ff4A44ff1f5d0F2ed65F781F55555\n- Base:\n0xAA61bB7777bD01B684347961918f1E07fBbCe7CF\ní”„ë¦¬ë§ˆì¼“ì€ Whales Marketë§Œ ì¡´ì¬\n\në¸Œë¦¿ì§€ \n- Wormhole\n- ì´ì™¸ì— ë‹¤ë¥¸ê²ƒë„ ìˆê¸´í–ˆìŒ(ìƒëµ)\n\níƒ€ì„ë¼ì¸\n2025.09.12 - ğŸ˜ Binance $ZKC Spot ìƒì¥ ê³µì§€ \n- ê±°ë˜ ì§€ì›: 2025.09.15 23:00 ì˜ˆì •\n- ì²´ì¸: ETH, BNB\n2025.09.15 18:04 - ğŸ˜ Binance Wallet ê³µì§€: $ZKC Alpha ê±°ë˜ì‹œì‘ 21:30\n- Alpha ë¬¼ëŸ‰ ì¸ë‹¹ 90ZKC\n2025.09.15 18:25 - ğŸ˜‡ ì—…ë¹„íŠ¸ $ZKC ìƒì¥ ê³µì§€\n- ì²´ì¸: ETH\n- ê±°ë˜ ì§€ì›: 2025.09.15 23:00 ì˜ˆì •\n2025.09.15 18:35 - ğŸ˜† ë¹—ì¸ $ZKC ìƒì¥ ê³µì§€\n- ì²´ì¸: ETH\n- ê±°ë˜ ì§€ì›: 2025.09.15 23:00 ì˜ˆì •\n2025.09.15 20:58 ê°€ëŸ‰ - Kaito ë””ì½” ê³µì§€\n- $ZKCì— ëŒ€í•œ ì„¸ë¶€ ì •ë³´ë¥¼ ê³§ ê³µìœ í•´ ë“œë¦´ ì˜ˆì •ì´ë‹ˆ ê³„ì† ì§€ì¼œë´ ì£¼ì„¸ìš”. í˜„ì¬ëŠ” ê°€ìŠ¤ë¹„ë¡œ ì´ë”ë¦¬ì›€ ë„¤íŠ¸ì›Œí¬ì— $ETHë¥¼ ì¶©ì „í•  ìˆ˜ ìˆìŠµë‹ˆë‹¤\n2025.09.15 21:23 - ğŸ˜ Binance Alpha ê±°ë˜ ì‹œì‘\n- 21:30ë¶„ ìƒì¥ì´ë¼ê³ ëŠ” í•˜ì§€ë§Œ ì‚´ì§ ë” ë¹¨ë¦¬ ê±°ë˜ ì‹œì‘í•˜ëŠ”ê²½ìš°ê°€ ìˆì–´ì„œ ë¯¸ë¦¬ ëŒ€ê¸°íƒ€ê³  ìˆì—ˆëŠ”ë° ìƒê°ë³´ë‹¤ ê±°ë˜ ì‹œì‘ì„ ë¹¨ë¦¬í•¨\n- Liq ì•½ 3.26M\n- 2ë¶ˆ í„°ì¹˜í›„ 21:30ë¶„ ë°”ë‚¸ ì•ŒíŒŒ í´ë ˆì„ ë§¤ë„ ì••ë ¥ìœ¼ë¡œ 1.5ë¼ì¸ê¹Œì§€ í•˜ë½ (ë² ìŠ¤íŠ¸ ë§¤ì§‘ íƒ€ì´ë°)\n- 1.5~1.6ì—ì„œ ë§¤ì§‘ íƒ€ì´ë°ì„ ë§ì´ì¤Œ\n- ** ì¬ë°ŒëŠ”ê±°\n    - 0xC06a306CfA4Cb2AcfC9e9F3740EBfb69D670969C\n    - í•´ë‹¹ ì§€ê°‘ì´ íŒ¬ì¼€ì´í¬ ìŠ¤ì™‘ í’€ ë§Œë“¤ì–´ì§€ê³  íŒ€ì—ì„œ ìœ ë™ì„± ë„£ì–´ì£¼ëŠ”ê±° ë´‡ëŒë ¤ì„œ ìŠ¤ë‚˜ì´í•‘ìœ¼ë¡œ ì”ëœ© ê¸ìŒ\n2025.09.15 21:50 - ğŸª ETH dex pool\n- liqëŠ” ë‹¹ì—°í•˜ì§€ë§Œ bscí’€ë³´ë‹¤ ë¶€ì¡±í•´ì„œ ì¡°ì‹¬í–ˆì–´ì•¼í•¨\n- ìŠ¬í”¼ ê³ ë ¤í•´ì„œ ì¤‘ê°„ì¤‘ê°„ ZKC(eth)ê°€ ë” ì‹¼ ê²½ìš°ê°€ ìˆì—ˆê¸° ë•Œë¬¸ì— ìˆ˜ëŸ‰ ëª¨ì„ë•Œ ë¸Œë¦¿ì§€ ì•ˆí•´ë„ ë˜ê²Œ ethì—ì„œ ì¡°ê¸ˆ ë§¤ì§‘í–‡ì–´ë„ ê´œì°®ì•—ìŒ.\n- ë‹¤ë§Œ ETH â†’ BSC ë¸Œë¦¿ì§€ëŠ” 18ë¶„ ê±¸ë¦°ë‹¤ëŠ” ë§ë³´ê³  ì‹œë„ëŠ” ì•ˆí•´ë´„\n2025.09.15 22:09 - ì—ì–´ë“œë ë¬¼ëŸ‰ í´ë ˆì„ ì‹œì‘\n- ì•¼í•‘/í”„ë¡œë²„ ì—ë“œ ë¬¼ëŸ‰\n- ì¹´ì´í†  ëŸ°íŒ¨ ë¬¼ëŸ‰ì€ ì•„ì§ ì•ˆí’€ë¦¼\n2025.09.15 22:00 ì¤‘í›„ë°˜ê²½ - ë¸Œë¦¿ì§€ ìƒíƒœ ë©”ë¡±\n- ì›œí™€ routeê°€ 2ê°œ ì •ë„ ìˆì—ˆëŠ”ë° 10ì‹œ ì¤‘í›„ë°˜ ë¶€í„° bsc â†’ eth ë¸Œë¦¿ì§€ ìƒíƒœê°€ ë©”ë¡±í•´ì§€ê¸° ì‹œì‘ (ëŒ€ë¶€ë¶„ì˜ ë¸Œë¦¿ì§€ íŠ¸ì­ì´ ì•ˆë³´ë‚´ì§)\n    - í•˜ë‚˜ëŠ” ìŠ¤ì™‘ë¹„ê°€ ë‹¤ë¥´ê³ \n    - í•˜ë‚˜ëŠ” ê±°ì§„ 1:1 ë¹„ìœ¨ but Mayanìœ¼ë¡œ ê°€ë©´ ê°ì˜¥ì— ê°‡í˜\n    - í•„ìë„ ìƒê°ì—†ì´ ë³´ëƒˆë‹¤ê°€ 40ë¶„ê°€ëŸ‰ ì³ë¬¶ì„ (í™˜ë¶ˆì€ ë˜ í…Œë”ë¡œ í•´ì¤˜ì„œ ì‹œê°„ëŸ¬ê·¸ + ì†í•´ë´„)\n    - ë¸Œë¦¿ì§€ 10~20ë¶„ ì§€ë‚˜ë„ ê°ˆ ê¸°ë¯¸ê°€ ì•ˆë³´ì´ê¸¸ë˜ ETH dex ë‹¬ë ¤ê°€ì„œ ë§¤ìˆ˜í•´ì„œ ë³´ëƒ„\n    - ë¸Œë¦¿ì§€ ìƒíƒœ ë©”ë¡± + ì•„ì§ê¹Œì§€ ì¹´ì´í†  ëŸ°íŒ¨ í´ë ˆì„ ê³µì§€ X â†’ ìƒì¥ ê°•í–‰í•œë‹¤ë©´ ë¯¸ì¹œ ëŒ€í¥ë”°ë¦¬ ì˜ˆê°\n2025.09.15 22:30 - ğŸ˜ Binance Boundless(ZKC) Future/Margin ê³µì§€ \n- ê±°ë˜ ì§€ì›: 2025.09.15 23:00\n2025.09.15 23:00 - ğŸ˜ Binance ê±°ë˜ ì‹œì‘ (Spot/Futures)\n- H:1.8 ì´í›„ í•˜ë½ 1.4~1.5 ë¶€ê·¼ëŒ€ ìœ ì§€\n- í˜„ì„  15í¼ ~ ì¶œê¸ˆ ì•ˆì—´ì–´ì„œ ì²œì²œíˆ í˜„ì„  ì¡íˆê¸° ì‹œì‘\n2025.09.15 23:05 - ğŸ˜‡ğŸ˜†ì—…ë¹—ì¸ ê±°ë˜ ì‹œì‘\n- 22:50 ê¸°ì¤€ ì…ê¸ˆëŸ‰\n    - ì—…ë¹„íŠ¸ ëŒ€ëµ 46ì–µ\n    - ë¹—ì¸ ëŒ€ëµ 10ì–µ\n- 22:55 - ğŸ˜‡ ì—…ë¹„íŠ¸ ë§¤ë„ ìµœì €ê°€ ê¸°ì¤€ ì—…ë°ì´íŠ¸ (ìƒì¥ ê°•í–‰)\n    - ìƒì¥ ê°•í–‰ ì´í›„ ğŸª dex $ZKC ê°€ê²© 1.9ê¹Œì§€ ìƒìŠ¹\n- ì—…ë¹„íŠ¸/ë¹—ì¸ ëª¨ë‘ ìƒì¥ ê°•í–‰(ì…ê¸ˆëŸ‰ ì•„ìŠ¬ì•„ìŠ¬í•˜ê²Œ ë‚´ë¶€ ê°€ì´ë“œë¼ì¸ ìµœì†Œì»· ì±„ìš´ë“¯)\n    - ë¹—ì¸ì€ ì—…ë¹„íŠ¸ê°€ ê°•í–‰í•´ì„œ ì…ê¸ˆëŸ‰ ì• ë§¤í–ˆì§€ë§Œ ì¼ë‹¨ ë‹¥ìƒì¥ ëˆ„ë¥¸ë“¯\n- ğŸ˜‡ ì—…ë¹„íŠ¸: 2900~3000ì› ìŠ¤íƒ€íŠ¸ í›„ 3700 ê¹Œì§€ í›„íŒ\n    - 1.5~1.6 ë§¤ì§‘ê°€ ê¸°ì¤€ ê¹€í”„ 2900~3000ì›ëŒ€ì—ë„ 30~40%\n    - 1.8~1.9 ë’¤ëŠ¦ê²Œ ëŒ€ê°€ë¦¬ ê¹¨ê³  ë§¤ìˆ˜í–ˆì–´ë„ ê¹€í”„ 10~20%ëŒ€ëŠ” ì¤Œ\n- ğŸ˜† ë¹—ì¸: 2900~3300 ìŠ¤íƒ€íŠ¸ í›„ ì—…ë¹„íŠ¸ ëŒ€ë¹„ ì ì€ ë¬¼ëŸ‰ìœ¼ë¡œ ë¯¸ì¹œ í›„íŒ (ATH 7000ì›)\n    - ë‹¹ì‹œ ê±°ë˜ì§ì „ ë¹—ì¸/ì—…ë¹„íŠ¸ í˜¸ê°€ë´¤ìœ¼ë©´ ë¹—ì¸ì´ ì—…ë¹„íŠ¸ì— ë¹„í•´ í……í……ì¸ê²Œ í•œëˆˆì— ë³´ì¼ì •ë„\n- ë¹—ì¸ ì…ê¸ˆëŸ‰ì´ ì ì—ˆê³ , 5~6ì²œì› ëŒíŒŒì‹œì ì— í›„ë”°ë¦¬ ë³´ë‚´ë©´ ìµœì†Œ í•œì‚¬ì´í´ì€ ë¬´ì¡°ê±´ ë¨¹ì—¬ì¤„ê±°ë¼ëŠ” íŒë‹¨ì— í›„ë”°ë¦¬ ì‹œì‘\n    - ë‹¹ì‹œ bscâ†’eth ë¸Œë¦¿ì§•í•´ì„œ ë³´ë‚´ê¸°ì—ëŠ” ì‹œê°„ ì´‰ë°• / 22:00 ì¤‘í›„ë°˜ ë¶€ê·¼ì— ë³´ë‚¸ ë¸Œë¦¿ì§€ ì•„ì§ë„ í™˜ë¶ˆì•ˆëœ ì  ìƒê°í•´ì„œ ì´ë” ë±ìŠ¤ì—ì„œ ê¸ì–´ì„œ ë³´ëƒ„\n    - liq í……í……ì´ë¼ ì• íŠ¸ì­ì°íˆëŠ”ê±° ë³´ê³  í”¼ë¢°ì¹¨ í”¼í•´ì„œ ë§¤ìˆ˜\n    - í›„ë”°ë¦¬ ìš©ì‚¬ë“¤ë¡œ ì¸í•´ ZKC(eth) 2ë¶ˆì„ ì— ì•ˆì°©\n    - í•œ ì‚¬ì´í´ ë³´ë‚´ê³  ë‚˜ì„œ ê³ ë˜í˜•ë‹˜ë“¤ 7000ì—ì„œ ë°˜í† ë§‰ê¹Œì§€ ë°€ì–´ë²„ë¦¬ëŠ”ê±° ë³´ê³  ìš•ì‹¬ ì•ˆë¶€ë¦¬ê³  í•œì‚¬ì´í´ì—ì„œ ìŠ¤íƒ‘.\n        - ì›¬ë§Œí•´ì„œëŠ” ë´‡ëŒë¦¬ëŠ” ë”°ë¦¬í˜•ë“¤ ëª»ì´ê¹€\n2025.09.15 23:44 - ğŸ˜ Binance ì¶œê¸ˆ ì˜¤í”ˆ\n- ë°”ë‚¸ ì¶œê¸ˆ ë¬¼ëŸ‰ìœ¼ë¡œ ì°¨íŠ¸ ì§„ì••ì™„ë£Œ (ë²”ì¸ì€ you know whoâ€¦)\n- ê³µì§€í›„ í˜„ì„  8í¼ê¹Œì§€ ë²Œì–´ì§\n2025.09.16 00:00 - Kaito ê³µì§€ ($ZKC ëŸ°íŒ¨ ë¬¼ëŸ‰ ê³§ ì—ì–´ë“œë í•˜ê² ë‹¤) \n- ëŸ°íŒ¨ ë¬¼ëŸ‰ í—·ì§•\n    - í’€í€ë¹„ ìœ ì§€í•˜ë‹¤ê°€ í’€í€ë¹„ ì‚´ì§ í’€ë ¤ì„œ 1ì‹œì— ë°”ë‚¸ ê¸°ì¤€ ëŒ€ëµ -1.45% í€ë¹„ ìƒë‚©\n- ì¶œê¸ˆì€ 2025.09.16 00:40ë¶„ ê°€ëŸ‰ë¶€í„° ì—´ë¦°ë“¯\n    - ìŠ¤ì™‘/ì¶œê¸ˆ ê°€ìŠ¤ë¹„ ì´ìŠˆ(feeê°€ ì‚¬ì•…í–ˆìŒ)\n2025.09.16 02:30 - ğŸ˜…  Boundless(ZKC) Coinbase Spot ìƒì¥ ê³µì§€ \n\në‹¹ì‹œ ë¦¬ìŠ¤í¬/ê³ ë ¤í•´ì•¼ í•  ì  ì´ëª¨ì €ëª¨\n- ì¹´ì´í†  ëŸ°íŒ¨ê°€ ì œë•Œ ì„¸ì¼ë¬¼ëŸ‰ ë¶„ë°°í•´ì¤„ê¹Œ?\n    - ì¹´ì´í†  ëŸ°ì¹˜íŒ¨ë“œì—ëŠ”Â 47M $ZKC í• ë‹¹ (í‰ë‹¨ FDV 290M) / ì´ì¤‘ 50%ë§Œ TGE ì–¸ë½ , ë‚˜ë¨¸ì§€ëŠ” 6ê°œì›” í›„ ì–¸ë½\n    - ì „ì²´ ê³µê¸‰ëŸ‰ì˜ 2% ê°€ëŸ‰ì´ í’€ë¦¬ê¸° ë•Œë¬¸ì— ì¹´ì´í†  ëŸ°íŒ¨ í´ë ˆì„ì´ ìƒì¥ ì „ì— ë˜ëŠëƒì— ë”°ë¼ ë”°ë¦¬ í¥í–‰ì˜ í–‰ë°©ì´ ìƒë‹¹íˆ ë‹¬ë¼ì§.\n    - ë”°ë¦¬í•˜ë©´ì„œë„ ì—¬ëŸ¬ ê³ ìˆ˜ë“¤ì˜ ì–˜ê¸°ë„ ë“£ê¸°ë„ í–ˆê³  ì§€ê¸ˆê» ì¹´ì´í† ì˜ í–‰ë³´ë¥¼ ë³´ì•˜ê¸° ë•Œë¬¸ì— ì¹´ì´í† ì˜ ê¸°ìˆ ë ¥ ë¶€ì¡± ì´ìŠˆë¡œ ìƒì¥ í›„ì— í´ë ˆì„ í’€ë¦°ë‹¤ëŠ” ìª½ìœ¼ë¡œ ë² íŒ….\n        - ì§€ê¸ˆê¹Œì§€ 8ê°œ í”„ë¡œì íŠ¸ ëŸ°ì¹˜íŒ¨ë“œë¥¼ ì§„í–‰ì¤‘ì´ì§€ë§Œ ì§„í–‰ê³¼ì •ì—ì„œ ì¡ìŒì´ êµ‰ì¥íˆ ë§ì•˜ìŒ (í• ë‹¹ ì´ìŠˆ, ë³´ì¦ê¸ˆ ì´ìŠˆ, í™˜ë¶ˆ ì´ìŠˆâ€¦)\n        - ëŸ°íŒ¨ ì§„í–‰ë„ ì œëŒ€ë¡œ ëª»í•˜ëŠ”ë° ì²«ë²ˆì§¸ ëŸ°íŒ¨ í´ë ˆì„ì´ ì›í™œíˆ ëŒì•„ê°ˆê±°ë¼ê³  ìƒê°í•˜ëŠ”ê±´ ë„ˆë¬´ ë‚™ê´€ì ì¸ ì˜ˆì¸¡ì´ë¼ê³  íŒë‹¨\n- ìƒì¥ ì—°ê¸° ë° ë°”ë‚¸ ì¶œê¸ˆ ì˜¤í”ˆ\n    - ë‹¤ë§Œ ìµœê·¼ ìƒì¥ ê¸°ì¡°ë¥¼ ë´¤ì„ ë•Œ ì›¬ë§Œí•˜ë©´ ìƒì¥ ê°•í–‰í–ˆê¸° ë•Œë¬¸ì— ë”°ë¦¬ í•´ë³¼ë§Œí•˜ë‹¤ê³  ìƒê°í•¨\n    - ë‹¤ë§Œ ì¹¼ë°ë¼ì²˜ëŸ¼ ì—…ë¹—ì¸ 30ë¶„ì—°ê¸°í•˜ê³  ì§±í‘ì´ ìƒì¥ ì§í›„ì— ì¶œê¸ˆì—´ì—ˆìœ¼ë©´..\n        - ë‹¹ì‹œ ì§€ê°‘ ê¹Œë³´ë©´ ë°”ë‚¸ í•« ë¬¼ëŸ‰ì´ ë§ì•˜ì–´ì„œ ì—…ë¹„íŠ¸ ê²¬ì œë¡œ ì§±í‘ ì…ë§›ëŒ€ë¡œ ì¶œê¸ˆ ì—´ì–´ë²„ë ¤ì„œ ì£½ì˜€ì„ ìˆ˜ë„ ìˆìŒ\n        - ì„¸ìë¦¬ ì¼ê¸°ì¥ë‹˜ë„ ì´ì•¼ê¸°í•˜ì…¨ë˜ ë‚´ìš©\n- ì›¨ì¼ì¦ˆë§ˆì¼“ ì¥ì™¸ê±°ë˜ê°€ ë³´ê³  0.8~1ë¶ˆì„  ìŠ¤íƒ€íŠ¸ ìƒê°í–‡ê³ , 1.2~1.3ë¶ˆë„ ëŒ€ê°€ë¦¬ ê¹¨ê³  ì‚´ ìƒê°ì´ì—‡ëŠ”ë° ì‹¤ì œ ë±ìŠ¤ ìŠ¤íƒ€íŠ¸ê°€ ë„ˆë¬´ ë¹„ì‹¸ì„œ ì†ì´ ì•ˆê°”ìŒ\n    - ë‹¹ì‹œ ì¥ì™¸ê°€ $0.9 / MC 180M ê°€ëŸ‰.\n    - ì¥ì™¸ë§ˆì¼“ì´ Whales Marketë§Œ ìƒì¥í•´ìˆë‹¤ëŠ” ì  / Pre market ê±°ë˜ëŸ‰ì´ ê·¸ë ‡ê²Œ í¬ì§€ëŠ” ì•Šì•˜ë‹¤ëŠ” ì  â†’ êµ­ë‚´ ê±°ë˜ì†Œ ë° ë°”ì´ë‚¸ìŠ¤ ë“± Major CEX ìƒì¥ ê¸°ëŒ€ê°ìœ¼ë¡œ ê°€ê²© ê²¬ì¸í–ˆë‹¤ê³  ë³´ê³  ì†”ì§íˆ ì‹œì‘ê°€ 1.5ë¶ˆ ì´ìƒì€ ìƒê°í•´ë³¸ì ì´ ì—†ìŒ.\n    - ë¬´ì¼€ë‹˜ì´ ìƒì¥ ë‹¹ì¼ë‚  ì¥ì™¸ê°€ ê´€ë ¨í•´ì„œ ë§›ìˆê²Œ ë§ì•„ì£¼ì…¨ìœ¼ë‹ˆ ë””í…Œì¼ì€ í•´ë‹¹ ê²Œì‹œê¸€ ë³´ëŠ”ê²Œ ë” ì¢‹ìŒ\n\n\ní›„ê¸°\n- ë§›ë“œëª½í˜„\n- ìƒì¥ë”°ë¦¬/í›„ë”°ë¦¬ ì ë‹¹íˆ ë¨¹ê³  ìˆ ì§„ì…ë„ ìƒê°í•´ë³¼ê±¸"}
{"source_file": "C:\\Users\\user\\Downloads\\Telegram Desktop\\ChatExport_2026-02-02 (3)\\messages.html", "channel": "íŒíŒí€ì¹˜", "message_id": 127, "ts_title": "17.09.2025 19:07:40 UTC+09:00", "date_ymd": "2025-09-17", "time_hm": "19:07", "text": "ê°œì¸ì ì¸ ë³µê¸° í…”ë°©ì— ì˜®ê²¨ë³¸ê±´ë° ë§ì€ ë¶„ë“¤ì´ ë´ì£¼ì…”ì„œ ì‚´ì§ ë¶€ë„ëŸ½ë„¤ìš”\ní¬ì›Œë”©í•´ì£¼ì‹  ì„ ìƒë‹˜ë“¤ ê°ì‚¬í•˜ê³  ë¶€ì¡±í•œ ì  ìˆìœ¼ë©´ ë§ì€ í”¼ë“œë°± ë°”ëë‹ˆë‹¤\në”°ë¦¬ ì´ˆë³´ì¸ì—ì˜¹ğŸ¥²\n\nê·¸ë¦¬ê³  ì•„ë¬´ë˜ë„ í…”ë ˆê·¸ë¨ìœ¼ë¡œ ê¸€ì„ ê¸¸ê²Œ ì¨ë³´ê¸´ ê±°ì˜ ì²˜ìŒì´ë¼ ê°€ë…ì„±ì— ëŒ€í•œ ê³ ë ¤ê°€ ë¯¸ì§„í–ˆë„¤ìš”\n\nê·¸ë˜ì„œ ì•ìœ¼ë¡œëŠ” ê°€ë…ì„± ì¢‹ê²Œ ê·¸ëƒ¥ ë…¸ì…˜ì—ë‹¤ ì •ë¦¬í•´ë³¼ê¹Œ ì‹¶ë„¤ìš”\n\nì–´ì œ AVNT/ZKC ìƒì¥ ë³µê¸°í–ˆë˜ê±° ë…¸ì…˜ì—ë‹¤ê°€ ë” ê°€ë…ì„± ì¢‹ê²Œí•´ì„œ ì˜¬ë ¸ìœ¼ë‹ˆ í…”ê·¸ ê¸€ ë§êµ¬ ë…¸ì…˜ê¸€ ë´ì£¼ì‹œë©´ ë  ê²ƒ ê°™ìŠµë‹ˆë‹¤ ğŸ˜’\n\n$ZKC ìƒì¥ (Up/Bit/Binance)\n$AVNT ìƒì¥ (Up/Bit/Binance)"}
{"source_file": "C:\\Users\\user\\Downloads\\Telegram Desktop\\ChatExport_2026-02-02 (3)\\messages.html", "channel": "íŒíŒí€ì¹˜", "message_id": 128, "ts_title": "17.09.2025 20:17:45 UTC+09:00", "date_ymd": "2025-09-17", "time_hm": "20:17", "text": "ì˜¤ëŠ˜ë„ ì—…ë¹—ì¸ì˜ ìƒì¥ì´ ìˆì—ˆìŠµë‹ˆë‹¤\n\nTOSHIë‘ HOLO ìƒì¥ì´ì—ˆëŠ”ë° ì´ë²ˆì—ë„ ì¢‹ì€ í¼í¬ë¨¼ìŠ¤ë¥¼ ë³´ì—¬ì¤¬ë„¤ìš”\n\nìš” ê·¼ë˜ ì›ìƒ í¼í¬ë¨¼ìŠ¤ê°€ ë„ˆë¬´ ì¢‹ì€ë° ì´ëŸ¬ë‹¤ê°€ ì–¸ì œ í•œë²ˆ ë§ë”°ë¦¬ì— êµí†µì‚¬ê³  ë‹¹í• ê±° ê°™ì•„ì„œ ë‘ë µë„¤ìš”\n\nê¸ˆì¼ ë”°ë¦¬ëŠ” ì™¸ì¶œ ë‚˜ê°”ë‹¤ ì™€ì„œ ë©€ëš±ë©€ëš±ë‹¨ í•©ë¥˜í–ˆë‹¤ê°€ í¬ëª¨ì™€ì„œ í›„ë”°ë¦¬ë§Œ ì¢€ í•´ë´¤ëŠ”ë° ì¸ê°„ì§€í‘œ ì ë¦½í–ˆë„¤ìš” ğŸ˜‚\n\në…¸ì…˜ ë³µê¸° â¤µï¸\n$TOSHI ìƒì¥ (Up/Bit)\n$HOLO ìƒì¥ (Bit)"}
{"source_file": "C:\\Users\\user\\Downloads\\Telegram Desktop\\ChatExport_2026-02-02 (3)\\messages.html", "channel": "íŒíŒí€ì¹˜", "message_id": 130, "ts_title": "19.09.2025 13:59:52 UTC+09:00", "date_ymd": "2025-09-19", "time_hm": "13:59", "text": "ë‹¤ë“¤ ì›ìƒì„ í™•ì‹ í•˜ë˜ BARDê°€ ì–´ê¹€ì—†ì´ ì›ìƒì„ í–ˆìŠµë‹ˆë‹¤\n\nìŠ¬ìŠ¬ ë§ë”°ë¦¬ ë‚˜ì˜¬ íƒ€ì´ë°ì´ ì•„ë‹ê¹Œí•˜ëŠ” ì–˜ê¸°ë¥¼ êº¼ëƒˆì—ˆëŠ”ë° ì¢…í•©ì ìœ¼ë¡œ ë³´ë©´ í”Œë ˆì´ì— ë”°ë¼ ë§ë”°ë¦¬ê°€ ë˜ê¸° ì•„ì£¼ ì‰¬ìš´ ë”°ë¦¬ê°€ ì•„ë‹ˆì—ˆë‚˜ ì‹¶ë„¤ìš”\n\nëª‡ëª‡ í”Œë ˆì´ / ê·¸ë•Œê·¸ë•Œ ìµœì„ ì˜ íŒë‹¨ì„ í•œ ì‚¬ëŒë“¤ ì œí•˜ë©´ ë¨¹ê¸°ê°€ í˜ë“¤ê¸°ë„ í–ˆê³  ì—¬ëŸ¬ê°€ì§€ ìì—°ì¬í•´ê°€ ìˆì–´ì„œ ê³ ë‚œë„ì˜ ë”°ë¦¬ê°€ ì•„ë‹ˆì˜€ë‚˜ ìƒê°ì´ ë“­ë‹ˆë‹¤\n\nLA TAO ë”°ë¦¬ ë³µê¸°ëŠ” ì¢€ë§Œ ìˆë‹¤ ì˜¬ë¦¬ê³  ì–´ì œì˜ ë©”ì¸ë””ì‰¬ ë¨¼ì € ì˜¬ë¦¬ê² ìŠµë‹ˆë‹¤\n\në…¸ì…˜ ë³µê¸° â¤µï¸\n$BARD ìƒì¥ (Up/Bit/Binance)"}
{"source_file": "C:\\Users\\user\\Downloads\\Telegram Desktop\\ChatExport_2026-02-02 (3)\\messages.html", "channel": "íŒíŒí€ì¹˜", "message_id": 131, "ts_title": "19.09.2025 23:17:37 UTC+09:00", "date_ymd": "2025-09-19", "time_hm": "23:17", "text": "ì‚¬ì´ë“œ ë””ì‹œì˜€ë˜ LAì™€ TAOí¸ì…ë‹ˆë‹¤\n\në©”ì¸ì´ì—ˆë˜ ë¡¬ë°”ë“œì— ë¹„í•˜ë©´ ì‰¬ìš´ ë‚œì´ë„ì˜€ìŠµë‹ˆë‹¤\n\nì˜ì™¸ë¡œ TAOê°€ 18ì¼ë‚  ìƒì¥ì¤‘ ë‚œë„ ëŒ€ë¹„ ê°€ì¥ ë‚˜ì€ í¼í¬ë¨¼ìŠ¤ë¥¼ ë³´ì—¬ì¤˜ì„œ ë†€ëìŠµë‹ˆë‹¤\nTAOëŠ” ë¬´ë‚œë¬´ë‚œ í‰ë²”í•œ ì›ìƒì´ì—ˆì§€ë§Œ ëˆˆì—¬ê²¨ë³¼ë§Œí•œ í”Œë ˆì´ë„ ìˆì–´ì„œ í•œë²ˆ ë³´ë©´ ì¢‹ì„ ê²ƒ ê°™ë„¤ìš”\n\nì•„ë§ˆ LAëŠ” ì˜†ìƒëŒ€ë¹„ ì•”ì‚´ì´ ë§ì´ ì‹¬ì–´ì ¸ìˆë˜ê±°ë„ í•˜ë‚˜ì˜ ë§ë”°ë¦¬ ìš”ì¸ì´ ë˜ì§€ì•Šì•˜ë‚˜ ì‹¶ê¸°ë„ í•©ë‹ˆë‹¤\n\në‹¤ë§Œ ì´ 3ê°œ ìƒì¥ì´ ì €ë…ì‹œê°„ëŒ€ì— ëª°ë ¤ì„œ LA â†’ TAO â†’ BARD ìˆœìœ¼ë¡œ ì§‘ì¤‘ë ¥ì„ ì†Œëª¨í•´ì•¼ í•´ì„œ êµ‰ì¥íˆ í”¼ë¡œí–ˆë„¤ìš”\ní•˜ë‚˜ì”© ìˆœì°¨ì ìœ¼ë¡œ í•œ ì½”ì¸ì— ì§‘ì¤‘í•  ìˆ˜ ìˆì—ˆë˜ ê²ƒë„ ì•„ë‹ˆê³  ê±°ì§„ ì´ 3ê°œë¥¼ ë™ì‹œì— ë´ì•¼í–ˆì–´ì„œ ë”ìš± í”¼ë¡œí–ˆë˜ ê²ƒ ê°™ë„¤ìš”\n\nê³µì§€ ìì²´ëŠ” ë¹„ìŠ·í•œ ì‹œê°„ëŒ€ì— ë‚˜ì™”ê¸° ë•Œë¬¸ì— ì„ íƒê³¼ ì§‘ì¤‘ì„ í•˜ëŠ” í¸ì´ ë” ë‚˜ì•˜ì„ ê²ƒ ê°™ê¸´í•©ë‹ˆë‹¤..\n\në…¸ì…˜ ë³µê¸° â¤µ\n$LA ìƒì¥ (Up) \n$TAO ìƒì¥ (Bit)"}
{"source_file": "C:\\Users\\user\\Downloads\\Telegram Desktop\\ChatExport_2026-02-02 (3)\\messages.html", "channel": "íŒíŒí€ì¹˜", "message_id": 133, "ts_title": "20.09.2025 21:21:45 UTC+09:00", "date_ymd": "2025-09-20", "time_hm": "21:21", "text": "KMNO ìƒì¥ ë³µê¸°ì…ë‹ˆë‹¤\n\níŠ¹ë³„í•œ ì¼ì€ ì—†ì—ˆìŠµë‹ˆë‹¤\n\në‹¤ë§Œ ê²½ì„ì´í˜•ì´ btc usdt ë§ˆì¼“ì— ì´ê²ƒì €ê²ƒ ì—„ì²­ ìƒì¥ì‹œì¼œë†”ì„œ ìŠ¬ìŠ¬ ì•”ì‚´í”½ì„ í•˜ë‚˜ ë¯¸ë¦¬ ìƒê°í•´ë‘ê³  ì‹¶ë„¤ìš”\n\ní‰ì¼ ìƒì¥ëŸ¬ì‰¬ ëë‚˜ê³  ì£¼ë§ íœ´ì‹ê¸° ì°¾ì•„ì™”ìœ¼ë‹ˆ ê·¸ë™ì•ˆì€ ì•„ìŠ¤í„° í€ë¹„ì‘ ë“± ì•„ìŠ¤í„°ì—ì„œ ë¨¹ê±°ë¦¬ë“¤ì„ ì¢€ ì°¾ì•„ë³¼ê¹Œ ì‹¶ë„¤ìš”\n\në…¸ì…˜ ë³µê¸° â¤µ\n$KMNO ìƒì¥ (Bit)"}
{"source_file": "C:\\Users\\user\\Downloads\\Telegram Desktop\\ChatExport_2026-02-02 (3)\\messages.html", "channel": "íŒíŒí€ì¹˜", "message_id": 134, "ts_title": "22.09.2025 15:22:18 UTC+09:00", "date_ymd": "2025-09-22", "time_hm": "15:22", "text": "0g mainnet - Layerzero OFT\n\nìŠ¤ê²Œ í”„ë¡ íŠ¸ì— ì•ˆì˜¬ë¼ì˜¬ ê°€ëŠ¥ì„± ê½¤ ìˆë‹¤ê³  ìƒê°\ní”„ë¡ íŠ¸ì— ì—†ìœ¼ë©´ ì»¨íŠ¸ë™ìœ¼ë¡œ ì˜ê¸°\n\nBNB eid : 30102\nETH eid: 30101\n0G mainnet eid: 30388\n\nì˜ˆì‹œ íŠ¸ì­\nbsc â†’ mainnet\nhttps://bscscan.com/tx/0xa8ca9fe850c89b1f5ca38df8ab62eca44b6dbe3d950955e16b3972c256f2ca3e\n\nmainnet dex: https://jaine.app/swap"}
{"source_file": "C:\\Users\\user\\Downloads\\Telegram Desktop\\ChatExport_2026-02-02 (3)\\messages.html", "channel": "íŒíŒí€ì¹˜", "message_id": 135, "ts_title": "22.09.2025 19:08:16 UTC+09:00", "date_ymd": "2025-09-22", "time_hm": "19:08", "text": "í´ë ˆì„X ë¸Œë¦¿ì§€X\n\nì¼ë‹¨ ìŠ¤ê²Œ í”„ë¡ íŠ¸ëŠ” ëœ¨ê¸´í•¨ (ë³´ë‚´ë´¤ì ì•ˆë³´ë‚´ì§ˆê±°ì„ ë¸Œë¦¿ì§€ ì„±ê³µíŠ¸ì­ ì•„ì§ ìƒˆë¡œ ì•ˆëœ¸) \n\n+) ì—…ë¹—ì¸ ì—°ê¸°\n\nê°œì¸ì ìœ¼ë¡œ ë°”ë‚¸ ì¶œê¸ˆ ì—´ë¦¬ì§€ ì•Šì„ê¹Œ ì‹¶ìŠµë‹ˆë‹¤\n\nhttps://stargate.finance/bridge?srcChain=bsc&srcToken=0x4B948d64dE1F71fCd12fB586f4c776421a35b3eE&dstChain=og&dstToken=0xEeeeeEeeeEeEeeEeEeEeeEEEeeeeEeeeeeeeEEeE"}
{"source_file": "C:\\Users\\user\\Downloads\\Telegram Desktop\\ChatExport_2026-02-02 (3)\\messages.html", "channel": "íŒíŒí€ì¹˜", "message_id": 136, "ts_title": "25.09.2025 17:12:29 UTC+09:00", "date_ymd": "2025-09-25", "time_hm": "17:12", "text": "í­í’ê°™ì•˜ë˜ KBW ê¸°ê°„ë„ ìŠ¬ìŠ¬ ëì´ ë³´ì´ë„¤ìš”\nê·¸ë™ì•ˆ ë³¸í–‰ì‚¬/ì—¬ëŸ¬ ì‚¬ì´ë“œíŒŒí‹° ì°¸ì„í•´ì„œ ì§‘ì—ì„œ ì°¬ì°¬íˆ ì •ë¦¬í•  ì‹œê°„ì´ ì—†ì–´ì„œ ë§ì´ ëŠ¦ì—ˆìŠµë‹ˆë‹¤\n\nì•„ì¼ë¦¿ë„ ì½”ì•ì—ì„œ ë³´ê³ , ì•¼ê°„ ë¡¯ë°ì›”ë“œë„ ê°€ë³´ê³  ê·¸ ê³¼ì •ì—ì„œ ìˆ˜ë§ì€ ê³ ìˆ˜ë“¤ì„ ì‹¤ë¬¼ë¡œ ì˜ì ‘í•´ë³´ê¸°ê¹Œì§€í•˜ë©´ì„œ ë°”ìœ ë‚˜ë‚ ì„ ë³´ëƒˆìŠµë‹ˆë‹¤..\nì—¬ê¸°ì €ê¸° ëŒì•„ë‹¤ë‹ˆëŠ”ë° ìƒì¥ì€ ê³„ì†í•˜ê³ , UXLINK/PINKFONG ë“±ë“± ì—¬ëŸ¬ ì´ë²¤íŠ¸ê°€ ê³„ì† í„°ì ¸ì„œ ë„ˆë¬´ ë°”ë¹³ë„¤ìš”\n\nê·¸ë˜ì„œ í”Œë¼ì¦ˆë§ˆ ìƒì¥ì „ ë°€ë¦° ìˆ™ì œ ì¡°ê¸ˆì´ë¼ë„ ì˜¬ë ¤ë³¼ê¹Œ í•©ë‹ˆë‹¤\nì˜¤ëŠ˜ì€ 9.22 ì›ìƒ ëª©ë¡ë“¤ë§Œ ì–´ëŠì •ë„ ì •ë¦¬í•´ë†¨ëŠ”ë°, ì•„ì¹¨ì— ê¸°ìŠµ ì˜†ìƒí•œ SUNë„ ê´œì°®ì€ í¼í¬ë¨¼ìŠ¤ë¥¼ ë³´ì—¬ì¤¬ê³ , 0GëŠ” ì•„ì‹œë‹¤ì‹œí”¼ crime ê·¸ ìì²´ì˜€ì£ \n\në‚˜ë¨¸ì§€ ìƒì¥ì€ ìµœëŒ€í•œ ë¹¨ë¦¬ ì˜¬ë ¤ë³¼ë ¤ê³  ë…¸ë ¥ì¤‘ì´ê¸´í•œë° ìƒì¥ ë‹¹ì‹œì— ë°”ë¡œë°”ë¡œ ì´ê²Œ ì‘ì„±ì„ í•´ì•¼ë˜ëŠ”ë° ë©°ì¹  ì§€ë‚œì±„ë¡œ ê¸°ì–µì´ í¬ë¯¸í•´ì§€ê³  + í”¼ë¡œê°€ ìŒ“ì¸ ìƒíƒœë¡œ ê¸°ë¡í•˜ë‹ˆ ê°€ë…ì„±ë„ ì´ì „ì— ë¹„í•´ ë–¨ì–´ì§€ê³  ë­”ê°€ ë†“ì¹˜ê±°ë‚˜ ê·¸ë•Œ ë‹¹ì‹œ ì“°ê³ ì‹¶ì—ˆë˜ ë‚´ìš©ì„ 100% ë°˜ì˜í•´ì„œ ëª»ì“°ê² ë„¤ìš” ã… ã… \n\nê·¸ë˜ì„œ 0G í¬í•¨ ì´í›„ ë³µê¸°ë“¤ì´ ì¢€ ë¯¸í¡í•œ ì ì´ ì´ì „ë³´ë‹¤ ë” ë§ì´ ë³´ì¼ ìˆ˜ ìˆìœ¼ë‹ˆ ë§ì€ í”¼ë“œë°± ë¶€íƒë“œë¦½ë‹ˆë‹¤..\níŠ¹íˆ 0Gì˜ ê²½ìš°ëŠ” íƒ€ì„ë¼ì¸ë„ ë³µì¡í•˜ê³  ë‹¹ì‹œì—ë„ ë§ì´ í˜¼ë€ìŠ¤ëŸ¬ì› ì–´ì„œ ê¹”ë”í•˜ê²Œ ì •ë¦¬í•˜ê¸°ê°€ ì–´ë µë„¤ìš”\n\n\në…¸ì…˜ ë³µê¸° â¤µï¸\n$SUN ìƒì¥ (Up) \n$0G ìƒì¥ (Up/Bit/Binance)"}
{"source_file": "C:\\Users\\user\\Downloads\\Telegram Desktop\\ChatExport_2026-02-02 (3)\\messages.html", "channel": "íŒíŒí€ì¹˜", "message_id": 138, "ts_title": "25.09.2025 20:11:25 UTC+09:00", "date_ymd": "2025-09-25", "time_hm": "20:11", "text": "í”Œë¼ì¦ˆë§ˆ ë¸Œë¦¿ì§€\n\nìŠ¤íƒ€ê²Œì´íŠ¸:\nhttps://stargate.finance/bridge?srcChain=bsc&srcToken=0x405FBc9004D857903bFD6b3357792D71a50726b0&dstChain=plasma&dstToken=0xEeeeeEeeeEeEeeEeEeEeeEEEeeeeEeeeeeeeEEeE\n\ndocsë³´ë©´ ì í¼, ë””ë¸Œë¦¿ì§€, ë¦´ë ˆì´ ë“± ì–´ê·¸ë¦¬ê²Œì´í„°ë‚˜ CCIP/í•˜ì´í¼ë ˆì¸ ë“±ë“± ìˆëŠ”ë° ìŠ¤ê²Œ í”„ë¡ íŠ¸ì— ì˜¬ë¼ì™”ìœ¼ë‹ˆ ìŠ¤ê²Œë§Œ ë³´ë©´ ë ë“¯\n\në ˆì œë¡œ íŠ¸ì­ ì°íˆëŠ”ê±´ ê³„ì† ë´¤ëŠ”ë° êµ³ì´ ì»¨íŠ¸ë™ ì•ˆí•´ë„ ë¹ ë¥´ê²Œ ìŠ¤ê²Œ í”„ë¡ íŠ¸ ì˜¬ë¼ì˜¬ê±° ê°™ì•„ì„œ ê¸°ë‹¤ë¦¬ë‹¤ê°€ ì´ì œ ê³µìœ "}
{"source_file": "C:\\Users\\user\\Downloads\\Telegram Desktop\\ChatExport_2026-02-02 (3)\\messages.html", "channel": "íŒíŒí€ì¹˜", "message_id": 139, "ts_title": "25.09.2025 21:40:24 UTC+09:00", "date_ymd": "2025-09-25", "time_hm": "21:40", "text": "ë¼ëŠ”ë° ì‹¤ì œë¡œ ë“¤ì–´ì˜¨ ì‚¬ëŒë“¤ì´ ìˆëŠ”ì§€"}
{"source_file": "C:\\Users\\user\\Downloads\\Telegram Desktop\\ChatExport_2026-02-02 (3)\\messages.html", "channel": "íŒíŒí€ì¹˜", "message_id": 140, "ts_title": "25.09.2025 21:43:45 UTC+09:00", "date_ymd": "2025-09-25", "time_hm": "21:43", "text": "ì´ê±° ì˜¤í•´ê°€ ìˆì„ìˆ˜ë„ìˆëŠ”ë° ì»¤ë®¤ ë¬¼ëŸ‰ =ì—­í• ê°€ì§„ì‚¬ëŒ ã… ã… !!"}
{"source_file": "C:\\Users\\user\\Downloads\\Telegram Desktop\\ChatExport_2026-02-02 (3)\\messages.html", "channel": "íŒíŒí€ì¹˜", "message_id": 141, "ts_title": "26.09.2025 02:20:24 UTC+09:00", "date_ymd": "2025-09-26", "time_hm": "02:20", "text": "í•˜ë¦¬ ìƒˆë²½ì— ë ˆì „ë“œ USDT ì•„ë¹„íŠ¸ë¼ì§€ ì°¬ìŠ¤ ìˆì—ˆìŒ\nìµœëŒ€ 4%ê°­ê¹Œì§€ ì¤Œ\nì´ì œëŠ” í˜¸ê°€ ë¹µë¹µí•´ì ¸ì„œ ë§›ì—†ì–´ì§„ ì—í›„.."}
{"source_file": "C:\\Users\\user\\Downloads\\Telegram Desktop\\ChatExport_2026-02-02 (3)\\messages.html", "channel": "íŒíŒí€ì¹˜", "message_id": 142, "ts_title": "26.09.2025 18:57:39 UTC+09:00", "date_ymd": "2025-09-26", "time_hm": "18:57", "text": "MIRA ë¸Œë¦¿ì§€ëŠ” ì—­ì‹œ ë ˆì œë¡œ\nbsc -> baseë¡œ ë³´ë‚´ëŠ”ê±°ëŠ” ìŠ¤ê²Œ í”„ë¡ íŠ¸ì— ì•ˆì˜¬ë¼ì˜¤ë©´ ì»¨íŠ¸ë™ìœ¼ë¡œ ì˜ê¸°"}
{"source_file": "C:\\Users\\user\\Downloads\\Telegram Desktop\\ChatExport_2026-02-02 (3)\\messages.html", "channel": "íŒíŒí€ì¹˜", "message_id": 143, "ts_title": "27.09.2025 16:34:29 UTC+09:00", "date_ymd": "2025-09-27", "time_hm": "16:34", "text": "ì§€ê°ìƒì˜ 9.23, 9.24ì¼ ì›ìƒ ë„ì ë„ì  ë³µê¸°ì…ë‹ˆë‹¤\n\nFLUIDê°€ í¥ë”°ë¦¬ì˜€ìŠµë‹ˆë‹¤\nHEMIëŠ” ë­ í‰ë²”í•œ 1~2í¼ ë ê¸° ë”°ë¦¬ì˜€ëŠ”ë° ë¹—ì¸ ì›ìƒë³´ë‹¤ëŠ” CZ metaë¡œ ì¸í•œ hemiì˜ ìƒìŠ¹, ë°”ì´ë‚¸ìŠ¤ ìƒì¥ ìª½ì„ ë³´ëŠ”ê²Œ ë” ë„ì›€ë  ê²ƒ ê°™ë‹¤ëŠ” ìƒê°ì…ë‹ˆë‹¤\n\ní¬ê²Œ ê¸¸ê²Œ ì‘ì„±í• ë§Œí•œ ë‚´ìš©ì€ ì—†ëŠ” ë”°ë¦¬ëª½í˜„ë“¤ì´ê³ , KBWê¸°ê°„ë™ì•ˆ ì§€ê¸ˆ ì›ìƒì„ 10ê°œë¥¼ í•´ì„œ ìˆ™ì œê°€ ë„ˆë¬´ ë§ì´ ìŒ“ì˜€ìŠµë‹ˆë‹¤..\n\nì´ë²ˆì£¼ KBW ê¸°ê°„ë™ì•ˆ í•œ ì›ìƒì€ ì´ì œ 6ê°œ ë‚¨ì•˜ë„¤ìš”...\n\në…¸ì…˜ ë³µê¸° â¤µï¸\n$FLUID ìƒì¥ (Up) \n$HEMI ìƒì¥ (Bit/Binance)"}
{"source_file": "C:\\Users\\user\\Downloads\\Telegram Desktop\\ChatExport_2026-02-02 (3)\\messages.html", "channel": "íŒíŒí€ì¹˜", "message_id": 145, "ts_title": "27.09.2025 16:56:23 UTC+09:00", "date_ymd": "2025-09-27", "time_hm": "16:56", "text": "ê·¸ë¦¬ê³  ì–´ì œ @tk_yeo ì„ ìƒë‹˜ì´ ìŠ¹ì¸í•´ì£¼ì…”ì„œ ì¢‹ì€ ê¸°íšŒ ë°›ì•„ ë””íŒŒì´ì•± í”„ë¼ì´ë¹— ë°‹ì—…ì— ë‹¤ë…€ì™”ì—ˆìŠµë‹ˆë‹¤\n\ní€´ì¦ˆ ì§„í–‰ë„ ì¬ë°Œì—ˆê³ , ë””íŒŒì´ì•± ê´€ë ¨ ì•ŒíŒŒë„ ë“£ê³  ë‚´ë¡œë¼í•˜ëŠ” ìœ ëª… kolë¶„ë“¤ì„ ë‘ ëˆˆìœ¼ë¡œ ë‹´ì„ ìˆ˜ ìˆì—ˆë˜ ê·€ì¤‘í•œ ì‹œê°„ì´ì—ˆìŠµë‹ˆë‹¤\n\në„ˆë¬´ ìœ ëª…í•˜ì‹ ë¶„ë“¤ì´ ë§ì•„ì„œ ì­ˆêµ¬ë¦¬ë¡œ ì–Œì „í•˜ê²Œ ë°¥ë§Œë¨¹ê³  ì¡°ìš©íˆ ìˆë‹¤ê°€ ë©´ì‹ ìˆëŠ” ëª‡ëª‡ ë¶„ë“¤í•œí…Œë§Œ ì¸ì‚¬ì¢€ ë“œë¦¬ê³ , ë¯¸ë¼ë”°ë¦¬í•˜ëŸ¬ tkì„ ìƒë‹˜í•œí…Œ ì¸ì‚¬ë“œë¦¬ê³  ë‚˜ì™”ìŠµë‹ˆë‹¤..\n\në°¥ëª½í˜„ë„ ì•„ì£¼ ë§›ìˆì—ˆê³  ì¢‹ì•˜ìŠµë‹ˆë‹¤\nì‚¬ì§„ì€ ë‹¹ì¼ ë°¥ëª½í˜„ ì‚¬ì§„ì…ë‹ˆë‹¤\n\në””íŒŒì´ì•± ì„ ë¬¼ ìˆ˜ìˆ˜ë£Œë„ 0.01%ë¡œ ì¸í•˜ë˜ì—ˆìœ¼ë‹ˆ ì—´ì‹¬íˆ ì‹¤ì‚¬ìš©í•´ê°€ë©´ì„œ Bonus HOME ì–¸ë½í•´ë³¼ê¹Œ í•©ë‹ˆë‹¤!"}
{"source_file": "C:\\Users\\user\\Downloads\\Telegram Desktop\\ChatExport_2026-02-02 (3)\\messages.html", "channel": "íŒíŒí€ì¹˜", "message_id": 151, "ts_title": "29.09.2025 15:10:37 UTC+09:00", "date_ymd": "2025-09-29", "time_hm": "15:10", "text": "KBW ê¸°ê°„ ìƒì¥ ì¤‘ Big thing ì¤‘ í•˜ë‚˜ ì˜€ë˜ XPLì…ë‹ˆë‹¤\n\nì„¸ì¼ì´ë‚˜ ì—ë“œë‚˜ ë„ˆë¬´ í˜œìì˜€ì§€ë§Œ(ë§ë”°ë¦¬ ìš”ê±´)  ë…¸ì…˜ì— ì‘ì„±í•´ë‘” ì—¬ëŸ¬ ê°€ì§€ ìš”ì¸ìœ¼ë¡œ ë”°ë¦¬ ìì²´ë§Œ ë†“ê³ ë³´ë©´ ë§ë”°ë¦¬ì˜€ìŠµë‹ˆë‹¤\n\nXPL ë³µê¸° ìì²´ëŠ” ì´ˆê³ ìˆ˜ íŒ¡íŒ¡ë‹˜ì˜ ì›¨ì˜¹ë³µê¸°ê°€ ìˆìœ¼ë‹ˆ íŒ¡íŒ¡ë‹˜ìª½ ë³µê¸°ë¥¼ ë³´ëŠ”ê²Œ ë” í”¼ì™€ ì‚´ì´ ë˜ì§€ì•Šì„ê¹Œ ì‹¶ë„¤ìš”\n\nì£¼ë§ì— ì¢€ ì‰¬ëŠë¼ ë°€ë¦° ìˆ™ì œê°€ ì•„ì§ ì¢€ ë‚¨ì•˜ëŠ”ë° ì—´ì‹¬íˆ í•´ë³´ê² ìŠµë‹ˆë‹¤\nê·¸ë¦¬ê³  ë‹¤ì‹œ í‰ì¼ ìŠ¤íƒ€íŠ¸ë¼ ìˆ™ì œê°€ ë” ë§ì•„ì§ˆ ê²ƒ ê°™ë„¤ìš”ğŸ˜‚\n\në…¸ì…˜ ë³µê¸° â¤µï¸\n$XPL ìƒì¥ (Up/Binance)"}
{"source_file": "C:\\Users\\user\\Downloads\\Telegram Desktop\\ChatExport_2026-02-02 (3)\\messages.html", "channel": "íŒíŒí€ì¹˜", "message_id": 152, "ts_title": "29.09.2025 18:32:22 UTC+09:00", "date_ymd": "2025-09-29", "time_hm": "18:32", "text": "SUPER\n\n- ì•„ë°œ - ì´ë”ë©”ì¸ë„·\n- ìƒì¥ê³µì§€ëœ¨ê³  í• ë§Œí–ˆë˜ í”Œë ˆì´\n- ê°­ ì¢€ ì‹¬í–ˆì—ˆìŒ 10~20%\n- AVAX -> ETH ë¸Œë¦¿ì§€ \n- https://blackhole.xyz/bridge"}
{"source_file": "C:\\Users\\user\\Downloads\\Telegram Desktop\\ChatExport_2026-02-02 (3)\\messages.html", "channel": "íŒíŒí€ì¹˜", "message_id": 154, "ts_title": "29.09.2025 20:18:06 UTC+09:00", "date_ymd": "2025-09-29", "time_hm": "20:18", "text": "FLUID ê¸°ì¶œ ìƒê°(FLUIDë„ í›„íŒì¤¬ìŒ)ë‚˜ì„œ ë°”ë¡œ ì—…ë¹„íŠ¸ ë³´ëƒ„\në§›ë“œëª½í˜„\n\nì—…ë¹„íŠ¸ ëŒ€í¥ë”°ë¦¬ë¡œ ì‹œì‘í•˜ë©´ ì•„ë°œë€ì²´ dexê°€ê°€ ëª»ë”°ë¼ì™€ì„œ ì•„ë°œë€ì²´ì—ì„œ í˜¸ë‹¤ë‹¥ ê¸ì–´ì„œ ë¸Œë¦¿ì§€ë³´ë‚´ì„œ ì—…ë¹„íŠ¸ë³´ë‚´ì„œ ë¨¹ì€ë“¯"}
{"source_file": "C:\\Users\\user\\Downloads\\Telegram Desktop\\ChatExport_2026-02-02 (3)\\messages.html", "channel": "íŒíŒí€ì¹˜", "message_id": 155, "ts_title": "29.09.2025 21:15:08 UTC+09:00", "date_ymd": "2025-09-29", "time_hm": "21:15", "text": "https://www.bithumb.com/react/inout/address/register/coin\n\në¹—ì¸ ì´ê±° ë“±ë¡í•˜ë©´ ì…ê¸ˆì‹¬ì‚¬ ì—†ìŒ\n\në°˜ë“œì‹œ ë“±ë¡í•´ ã„±ã„±"}
{"source_file": "C:\\Users\\user\\Downloads\\Telegram Desktop\\ChatExport_2026-02-02 (3)\\messages.html", "channel": "íŒíŒí€ì¹˜", "message_id": 156, "ts_title": "29.09.2025 22:02:48 UTC+09:00", "date_ymd": "2025-09-29", "time_hm": "22:02", "text": "ì—…ë¹„íŠ¸ í•«ì›”ë ›\n\nhttps://etherscan.io/address/0xe2ae7b9df303b877d555fd871e9d771f71fc28b9\n\nhttps://etherscan.io/address/0x8b09c96f6c36c1728a64bf35dc8584388384ca91\n\nhttps://etherscan.io/address/0x52CA871D923E80fb03A1c92fde969CaD5014ae28\n\n0.8ê¸°ì¤€ ëŒ€ëµ 91ì–µì›?"}
{"source_file": "C:\\Users\\user\\Downloads\\Telegram Desktop\\ChatExport_2026-02-02 (3)\\messages.html", "channel": "íŒíŒí€ì¹˜", "message_id": 157, "ts_title": "30.09.2025 00:25:49 UTC+09:00", "date_ymd": "2025-09-30", "time_hm": "00:25", "text": "ì´ë²ˆì—” ë”°ë¦¬ëŠ” ì™œ ì„±ê³µí–ˆì„ê¹Œ?\n\në‹¨ìˆœí•˜ê²Œ ë§í•˜ìë©´ ëª¨ë“  ìƒí™©ì´ í¥ë”°ë¦¬ë¡œ ê°€ëŠ” ì„ íƒì§€ë¥¼ ê³¨ë¼ì¤¬ìŒ.\n1.ì—ë“œ í´ë ˆì„ ë§‰í˜\n2.ë¹„ë“¤íŒ¨ë“œ ì¼ë¶€ë§Œ í´ë ˆì„ ë¨\n3.ë¸Œë¦¿ì§€ ì†Œìš”ì‹œê°„ì´ ë§¤ìš° ì˜¤ë˜ê±¸ë¦¼\n4.ë¯¸ì¹œë“¯í•œ ê¸°ìœ„ ìƒìŠ¹\n\nì´ ëª¨ë“ ê²Œ ê²¹ì³¤ê³ ,ë‹¹ì—°íˆ í¥ë”°ë¦¬ë¡œ ê°ˆ ìˆ˜ ë°–ì— ì—†ì—ˆë‹¤ê³  ìƒê°í•¨\n\në” ì´ìƒ ë¬¼ëŸ‰ì´ ì•ˆë‚˜ì˜¬ê²ƒì´ê³  ë‚˜ì˜¨ë‹¤í•´ë„ ìƒì¥ì‹œê°„ì´ ì½”ì•ì´ë¼ ì‹œê°„ ëŒ€ë¹„ ê´œì°®ì„ê±° ê°™ì•„ì„œ\n0.6ì— ì´ë”ì—ì„œ ì¢€ ë” ê¸ì—ˆìŒ.\n\nê¸°ìœ„ê°€ ë†’ì•„ì„œ ê°€ìŠ¤ë¹„ ë•Œë¬¸ì— ìƒê°ë³´ë‹¤ ì£¼ì €í•˜ì‹œëŠ”ë¶„ë“¤ë„ ìˆì—ˆëŠ”ë“¯\n\nê·¸ë¦¬ê³  ì—…ë¹—ì¸ ë‘˜ì¤‘ í•˜ë‚˜ ì„ íƒì„ í–ˆì–´ì•¼ í–ˆëŠ”ë° ë‘˜ë‹¤ ì…ê¸ˆì•¡ì´ ìƒê°ë³´ë‹¤ ì ì–´ì„œ ê³ ë¯¼ì„ ì¢€ í•˜ë‹¤ê°€ \n\në‘˜ë‹¤ ì„ íƒí•¨.\nì—…ë¹„íŠ¸ 70 ë¹—ì¸ 30 ìˆ˜ì¤€ìœ¼ë¡œ ë³´ëƒˆìŒ.\nê²°êµ­ ì—…ë¹„íŠ¸ëŠ” ë‚´ í‰ë‹¨ê¸°ì¤€ ì•½ 4ë°°ë¼ëŠ” í¥ë”°ë¦¬ë¥¼ ë³´ì—¬ì£¼ì—ˆê³ \në¹—ì¸ë„ ìµœì†Œ 2ë°°ì˜ í¥ë”°ë¦¬ë¥¼ ë³´ì—¬ì¤¬ìŒ.\n\nì €ëŠ” ê·¸ë˜ë„ ë¹„ë¡ ë†’ì€ê°€ê²©ì— íŒ”ì§„ ëª»í–ˆì§€ë§Œ ê·¸ë˜ë„ ë§Œì¡± ë¹—ì¸ì€ ì•ˆíŒ”ë ¤ì„œ í•œì°¸ì´ë‚˜ ë’¤ì— íŒ”ìŒ ê·¸ë˜ë„ ë§Œì¡±."}
{"source_file": "C:\\Users\\user\\Downloads\\Telegram Desktop\\ChatExport_2026-02-02 (3)\\messages.html", "channel": "íŒíŒí€ì¹˜", "message_id": 158, "ts_title": "30.09.2025 17:52:56 UTC+09:00", "date_ymd": "2025-09-30", "time_hm": "17:52", "text": "ë°˜ê°‘ìë‹ˆë‹¤ í–‰ë‹˜ë“¤.\nOPENMIND í•œêµ­ ì»¤ë®¤ë‹ˆí‹°. ì²˜ìŒ ì¸ì‚¬ ì˜¬ë¦½ë‹ˆë‹¤.\n\nKBWë¥¼ ê¸°ì ìœ¼ë¡œ OPENMINDê°€ í•œêµ­ ì»¤ë®¤ë‹ˆí‹°ë¥¼ ë³¸ê²©ì ìœ¼ë¡œ ë§Œë‚˜ê¸° ìœ„í•˜ì—¬ ì—¬ëŸ¬ë¶„ê³¼ í•¨ê»˜í•  íŠ¹ë³„í•œ ì»¤ë®¤ë‹ˆí‹° ì´ë²¤íŠ¸ë¥¼ ì¤€ë¹„í–ˆìŠµë‹ˆë‹¤\n\nğŸ¤–OPENMINDë€?\nOPENMINDëŠ” \"Linux on Ethereum for robotics\"ë¼ëŠ” ê°œë…ìœ¼ë¡œ, ì§€ëŠ¥í˜• ê¸°ê³„ë¥¼ ìœ„í•œ íƒˆì¤‘ì•™í™” ìš´ì˜ì²´ì œë¥¼ ê°œë°œí•©ë‹ˆë‹¤.\në¡œë´‡ ê¸°ì¢…ì— ê´€ê³„ì—†ì´ ì‚¬ìš© ê°€ëŠ¥í•œ OM1 ìš´ì˜ì²´ì œì™€ FABRIC í†µì‹  í”„ë¡œí† ì½œì„ í†µí•´ ë‹¤ì–‘í•œ ë¡œë´‡ë“¤ì´ í•˜ë‚˜ì˜ ìƒíƒœê³„ì—ì„œ ì†Œí†µí•  ìˆ˜ ìˆê²Œ í•©ë‹ˆë‹¤. AIì™€ DePIN(íƒˆì¤‘ì•™í™” ë¬¼ë¦¬ ì¸í”„ë¼)ì„ ê²°í•©í•œ ë¸”ë¡ì²´ì¸ ê¸°ë°˜ ë¡œë´‡ ìƒíƒœê³„ë¡œ, ê¸°ì¡´ ì¤‘ì•™ì§‘ì¤‘ì‹ ì‹œìŠ¤í…œì„ ë„˜ì–´ì„  ë¶„ì‚°í˜• ë¡œë´‡ ë„¤íŠ¸ì›Œí¬ë¥¼ êµ¬í˜„í•˜ê³  ìˆìŠµë‹ˆë‹¤.\nì°¸ì—¬ë°©ë²• \n\n1. OPENMIND í•œêµ­ ê³µì§€ë°©ì— ì…ì¥í•©ë‹ˆë‹¤.\n2. OPENMIND í•œêµ­ ì±„íŒ…ë°©ì— ì…ì¥í•©ë‹ˆë‹¤.\n3. ì±„íŒ…ë°©ì— ì¸ì‚¬ë¥¼ ë‚¨ê²¨ì£¼ì„¸ìš”.\n4. êµ¬ê¸€í¼ì„ ì‘ì„±í•´ì£¼ì„¸ìš”.\n\nì°¸ì—¬ ê¸°ê°„\n2025. 09. 30 (18:00) ~ 2025. 10. 05 (19:00)\n\nì´ë²¤íŠ¸ ë³´ìƒ\n- BBQ í™©ê¸ˆ ì˜¬ë¦¬ë¸Œ ì¹˜í‚¨+ì½œë¼1.25L : 20ëª… ì¶”ì²¨\n- ìŠ¤íƒ€ë²…ìŠ¤ ì•„ì´ìŠ¤ ì•„ë©”ë¦¬ì¹´ë…¸ T: 100ëª… ì¶”ì²¨"}
{"source_file": "C:\\Users\\user\\Downloads\\Telegram Desktop\\ChatExport_2026-02-02 (3)\\messages.html", "channel": "íŒíŒí€ì¹˜", "message_id": 159, "ts_title": "30.09.2025 19:22:44 UTC+09:00", "date_ymd": "2025-09-30", "time_hm": "19:22", "text": "ì–´ì œëŠ” ëŒ€í¥ë”°ë¦¬ 2ê°œê°€ ìˆì—ˆë„¤ìš”\nì–´ì œ ê°™ì€ ë”°ë¦¬ë¥¼ ë°”ë¡œë°”ë¡œ ì˜¬ë ¤ì•¼ ë˜ëŠ”ë° ë°€ë¦° ìˆ™ì œê°€ ë§ì•„ ì´ì „ ìƒì¥ 2ê°œ ë¨¼ì € ì˜¬ë¦¬ê² ìŠµë‹ˆë‹¤\n\nXPL ìƒì¥ ë‹¹ì¼ë‚ (9.25) ë¹—ì¸ì—ì„œ ë§ˆêµ¬ì¡ì´ ìƒì¥ ì§„í–‰í•œ BTR, POPCAT ë³µê¸°ì…ë‹ˆë‹¤\n\ní¬ê²Œ ë³µê¸°í• ë§Œí•  ê±°ë¦¬ê°€ ìˆì—ˆë˜ ìƒì¥ì€ ì•„ë‹ˆë‹ˆ ê²°ê³¼ì •ë„ë§Œ ê°€ë³ê²Œ ìˆ™ì§€í•˜ì‹œë©´ ë  ê²ƒ ê°™ìŠµë‹ˆë‹¤\n\nì°¬ì°¬íˆ ìˆ™ì œ í•´ê²°í•´ë‚˜ê°€ë ¤ í–ˆëŠ”ë° ê²½ì„/ë°±ì˜ ë“€ì˜¤ê°€ ë¶€ì¡±í•´ë³´ì˜€ëŠ”ì§€ ìˆ™ì œ 3ê°œ ë” ì–¹ì–´ì¤˜ì„œ ìµœëŒ€í•œ ë¹¨ë¦¬ ë”°ë¼ì¡ì•„ë³´ê² ìŠµë‹ˆë‹¤...\n\në…¸ì…˜ ë³µê¸° â¤µï¸\n$BTR ìƒì¥ (Bit) \n$POPCAT ìƒì¥ (Bit)"}
{"source_file": "C:\\Users\\user\\Downloads\\Telegram Desktop\\ChatExport_2026-02-02 (3)\\messages.html", "channel": "íŒíŒí€ì¹˜", "message_id": 161, "ts_title": "02.10.2025 20:07:55 UTC+09:00", "date_ymd": "2025-10-02", "time_hm": "20:07", "text": "1. DoubleZeroì˜ ê¸°ë³¸ í† í° ì´ë¦„ì€ ë¬´ì—‡ì…ë‹ˆê¹Œ?\n\nâœ… 2Z\n\n2. SECê°€ 2Z í† í°ì— ëŒ€í•´ ë°œí–‰í•œ ê²ƒì€ ë¬´ì—‡ì…ë‹ˆê¹Œ?\n\nâœ… ë¹„ì¡°ì¹˜ì˜ê²¬ì„œ(No-Action Letter)\n\n3. ë”ë¸”ì œë¡œì˜ í•µì‹¬ ë¯¸ì…˜ì€ ë¬´ì—‡ì…ë‹ˆê¹Œ?\n\nâœ… ëŒ€ì—­í­ ì¦ê°€, ì§€ì—° ê°ì†Œ (IBRL)\n\n4. ê¸°ì—¬ìë“¤ì´ ì™œ ê´‘ì„¬ìœ  ë§í¬ë¥¼ ë”ë¸”ì œë¡œ ë„¤íŠ¸ì›Œí¬ì— ì¶”ê°€í•©ë‹ˆê¹Œ?\n\nâœ… ìì‹ ë“¤ì˜ ê¸°ì—¬ ê°€ì¹˜ì— ë”°ë¼ 2Z í† í° ë³´ìƒì„ ë°›ê¸° ìœ„í•´\n\n5. ë”ë¸”ì œë¡œì˜ ê³µì •í•œ ë³´ìƒ ë¶„ë°°ë¥¼ ê°€ëŠ¥í•˜ê²Œ í•˜ëŠ” ì•Œê³ ë¦¬ì¦˜ì€ ë¬´ì—‡ì…ë‹ˆê¹Œ?\n\nâœ… ì…°í”Œë¦¬ ê°’(Shapley Value)\n\n6. 2025ë…„ 10ì›” 2ì¼ ê¸°ì¤€, ì†”ë¼ë‚˜ ìŠ¤í…Œì´í‚¹ ë¹„ì¤‘ì˜ ëª‡ %ê°€ ë”ë¸”ì œë¡œ ë„¤íŠ¸ì›Œí¬ì— ì—°ê²°ë˜ì–´ ìˆì—ˆìŠµë‹ˆê¹Œ?\n\nâœ… 21%\n\n7. ë”ë¸”ì œë¡œê°€ ë©”ì¸ë„·-ë² íƒ€ë¥¼ ì¶œì‹œí•œ ì‹œì ì€ ì–¸ì œì…ë‹ˆê¹Œ?\n\nâœ… 2025ë…„ 3ë¶„ê¸°\n\n8. ë”ë¸”ì œë¡œ ë„¤íŠ¸ì›Œí¬ì—ì„œ 2Z í† í°ì€ ì–´ë–»ê²Œ ì¸ì„¼í‹°ë¸Œ ì—­í• ì„ í•©ë‹ˆê¹Œ?\n\nâœ… ë„¤íŠ¸ì›Œí¬ ê¸°ì—¬ìë“¤ì—ê²Œ ë³´ìƒìœ¼ë¡œ ì§€ê¸‰ëœë‹¤\n\n9. ì•„ë˜ ì¤‘ ë”ë¸”ì œë¡œì˜ ì ì¬ì  í™œìš© ì‚¬ë¡€ê°€ ì•„ë‹Œ ê²ƒì€ ë¬´ì—‡ì…ë‹ˆê¹Œ?\n\nâœ… ê°€ì •ìš© ì¸í„°ë„· ì—°ê²°\n\n10. ë‹¤ìŒ ì¤‘ ë”ë¸”ì œë¡œì˜ ê¸°ì—¬ìë¡œ ë‚˜ì—´ëœ íšŒì‚¬ëŠ” ë¬´ì—‡ì…ë‹ˆê¹Œ?\n\nâœ… ê°¤ëŸ­ì‹œ(Galaxy)"}
{"source_file": "C:\\Users\\user\\Downloads\\Telegram Desktop\\ChatExport_2026-02-02 (3)\\messages.html", "channel": "íŒíŒí€ì¹˜", "message_id": 162, "ts_title": "02.10.2025 22:54:58 UTC+09:00", "date_ymd": "2025-10-02", "time_hm": "22:54", "text": "ì˜¤ëŠ˜ ë§›ìˆì—ˆë˜ ê²ƒ ì¤‘ ìƒê°ë‚˜ëŠ” ê±´\n\n1. ë©”í…Œì˜¤ë¼ fee ë¹¨ê¸°\n2. ì ë‹¹íˆ ì‚¬ì„œ ë”°ë¦¬\n3. ì„ ë¬¼ ì‡½\n4. í›„ë”°ë¦¬ ì˜í•˜ê¸°\n5. ì„ ì„ ê°­ - ë°”ì´ë‚¸ìŠ¤ê°€ ì‚´ì§ ë” ë‚®ì•˜ìŒ\n\nê·¼ë˜ ë”°ë¦¬ ì¤‘ì—ì„œ ì œì¼ ë°”ì˜ê²Œ ì›€ì§ì˜€ë„¤ìš”\n\nê·¼ë° ê²°ê³¼ëŠ” 1~5 ë‹¤ í•˜ê³ ë„ ì†í•´ë¥¼ ê²¨ìš° ë©´í•œ ìˆ˜ì¤€ì¸ë ˆí›„\n\nì• ë§¤í•˜ê²Œ ë©”í…Œì˜¤ë¼ ì§„ì…í•˜ê³ , ì• ë§¤í•˜ê²Œ ì‚¬ê³ , ì• ë§¤í•˜ê²Œ í›„ë”°ë¦¬ í•œ ê²Œ íŒ¨ì°©ì¸ ë“¯\n\në©”í…Œì˜¤ë¼ëŠ” ì¤€ë¹„ ì˜ í•´ì„œ ë ˆì¸ì§€ ì˜ ì„¤ì •í•´ë‘¬ì•¼ í–ˆê³  ì„±ê³µí•œ ì¼€ì´ìŠ¤ \n\në§¤ìˆ˜ëŠ” ì›ë˜ í•˜ë˜ ë°ë¡œ ê°€ê²© ì‹ ê²½ ì•ˆ ì“°ê³  ê¸ì—ˆì–´ì•¼ í–ˆê³ \n\nì‡½ì€.. ì‰½ì§€ ì•ŠìŒ.. ë¨¸ë“  ê°„ ë‹¤ìŒì—” ë” ì¤€ë¹„í•´ì„œ ì˜ ë¨¹ì–´ë´ì•¼ê² ë„¤ìš” \n\nì†”ë¼ë‚˜ëŠ” ëª½ê°€ ë¨¹ì„ ê²Œ ë§ë‹¤.. ğŸ—"}
{"source_file": "C:\\Users\\user\\Downloads\\Telegram Desktop\\ChatExport_2026-02-02 (3)\\messages.html", "channel": "íŒíŒí€ì¹˜", "message_id": 163, "ts_title": "02.10.2025 23:03:42 UTC+09:00", "date_ymd": "2025-10-02", "time_hm": "23:03", "text": "ë”ë¸”ì œë¡œë¡œ ë¦¬ìŠ¤í¬ ê°ìˆ˜ë¥¼ ì¤„ì´ê³ , ëˆë²„ëŠ”ë°©ë²•ì •ë¦¬\n\n1. ë©”í…Œì˜¤ë¼í’€ì„¤ì •\n\nì •ë§ ì˜ ëª¨ë¥´ëŠ” ë¶„ì•¼ì´ì§€ë§Œ, ì´ë²ˆì— ì˜í•˜ëŠ” ì‚¬ëŒë“¤ë³´ë©´ì„œ ë§ì´ ë°°ì› ëŠ”ë°\në‚®ì€ ê°€ê²©ì—ë¼ë„, ë©”í…Œì˜¤ë¼ í’€ ì„¤ì • ì˜í•´ë†“ê³ , ì²´ê²°ì‹œì¼°ìœ¼ë©´ ê´œì°®ì•˜ë˜ê²ƒ ê°™ìŒ\n\n2. í•˜ë¦¬<>binance ê°­\n7~9%ì •ë„ ê°­ì´ 3ë¶„ë™ì•ˆ ìœ ì§€ë˜ì—ˆê³ , ì˜¤ë”ë¶ë„ ë¹µë¹µë ˆí›„ ì˜€ìŒ\nê·¸ì´í›„ì—, 3~4%ê°­ì´ 15ë¶„ë™ì•ˆ ê½¤ ì˜¤ë˜ìœ ì§€ë˜ì–´ì„œ, ì¡ê¸°ì— ì •ë§ê´œì°®ì•˜ìŒ\nindexpriceë„ ë°”ì´ë‚¸ìŠ¤ í˜„ë¬¼ì¶”ì¢…ì¸ê±° í™•ì¸í›„, ì§„ì…í–ˆìŒ\n\ní•˜ë¦¬ê³µì§€ë°© í…”ë ˆê·¸ë¨ì´, íŠ¸ìœ„í„°ì•Œë¦¼ë³´ë‹¤ 30ì´ˆì •ë„ ë¹¨ë¦¬ì™€ì„œ, ê¼­ ì•Œë¦¼ì¼œë‘ëŠ”ê±° ì¶”ì²œ\n\n3. backpack spotì¶œê¸ˆë”°ë¦¬\nbackpack spotê°€ê²©ì´ dexë³´ë‹¤ 15%ì •ë„ ë‚®ì•„ì„œ, ì„ ë¬¼í—·ì§€í›„, ë”°ë¦¬í–ˆì–´ë„ ê´œì°®ì•˜ìŒ"}
{"source_file": "C:\\Users\\user\\Downloads\\Telegram Desktop\\ChatExport_2026-02-02 (3)\\messages.html", "channel": "íŒíŒí€ì¹˜", "message_id": 164, "ts_title": "03.10.2025 15:39:45 UTC+09:00", "date_ymd": "2025-10-03", "time_hm": "15:39", "text": "ë”ë¸”ì œë¡œëŠ” ì¢€ ë¬´ì„œì›Œì„œ ë³´ìˆ˜ì ìœ¼ë¡œ í”Œë ˆì´í–ˆëŠ”ë°, ê²°ê³¼ì ìœ¼ë¡œ íŒ¨ì¸ì´ì—ˆë„¤ìš”\në¦¬í…Œì¼ ë¬¼ëŸ‰ì´ ê±°ì§„ 0ì´ê³  ë§ˆìŒëŒ€ë¡œ ìš´ì „ê°€ëŠ¥í•œ ì½”ì¸ì´ë¼ ë¬´ì„œì›Œì„œ ê·¸ëŸ°ê±´ë°, crime sznì—ëŠ” ê·¸ëƒ¥ ëŒ€ê°€ë¦¬ ê¹¨ëŠ”ê²Œ ë‹µì´ë„¤ìš”\n\në ˆì´ë””ì›€/ë©”í…Œì˜¤ë¼ë§Œ ì¢€ ëŒë¦¬ë‹¤ê°€ ë§ˆì§€ë§‰ì— ìµœê³ ì ì—ì„œ í•˜ë½í• ë•Œ ë§ˆêµ¬ë§ˆêµ¬ ì‚¬ì§€ë©´ì„œ ì»¤ë®¤ë‹ˆí‹° ë©¤ë²„ê°€ ë˜ì„œ ê¸°ë„í•˜ë‹¤ê°€ ì ë‹¹íˆ ë„ë§ê°€ê³  í›„ë”°ë¦¬ë¡œ ê²¨ìš° ë©˜ì§•í•˜ê³  ì¼ë‹¹ë§Œ í–ˆë„¤ìš”ğŸ˜’\n\nì˜¤ëŠ˜ì€ 9.26ì¼ì ë³µê¸° ë§ˆì € ì˜¬ë¦¬ê² ìŠµë‹ˆë‹¤\n\nMIRA ìƒì¥ë³µê¸°ëŠ” ë”°ë¦¬ ì²˜ìŒí•´ë³´ì‹œëŠ”ë¶„ë“¤ì´ë©´ ê¼­ í•œë²ˆì”© í•´ë³´ì‹œë©´ ì¢‹ì„ ê²ƒê°™ë„¤ìš”\në‚˜ë¨¸ì§€ 2ê°œëŠ” í¬ê²Œ ì¤‘ìš”í•˜ì§„ ì•Šê³ , FLUIDëŠ” ì—…ë¹„íŠ¸ -> ë¹—ì¸ ë”°ë¼ ì›ìƒí•˜ëŠ” ê²½ìš° ì˜ˆí›„ê°€ ì–´ë–¤ì§€ ì•Œì•„ë³´ëŠ” ê·¸ëŸ° ê°ì„±ìœ¼ë¡œ ë³´ì‹œë©´ ë  ê²ƒ ê°™ìŠµë‹ˆë‹¤\n\nì´ì œ ê¸´ ì—°íœ´ì˜ ì‹œì‘ì¸ë°, ì•„ë§ˆ ì›ìƒë„ ë‹¹ë¶„ê°„ íœ´ì‹ê¸°ì¼ í™•ë¥ ì´ ì•„ì£¼ ë†’ìŠµë‹ˆë‹¤\nì €ëŠ” ë°€ë¦° ìˆ™ì œ í›„ë‹¤ë‹¥ ëë‚´ì„œ ì˜¬ë¦´í…Œë‹ˆ ë§ì´ ë´ì£¼ì„¸ìš© ğŸ˜’\n\n\në…¸ì…˜ ë³µê¸° â¤µï¸\n$MIRA ìƒì¥ (Up/Bit/Binance) âœ¨âœ¨âœ¨ğŸ¥°\n$CUDIS ìƒì¥ (Bit) \n$FLUID ìƒì¥ (Bit)"}
{"source_file": "C:\\Users\\user\\Downloads\\Telegram Desktop\\ChatExport_2026-02-02 (3)\\messages.html", "channel": "íŒíŒí€ì¹˜", "message_id": 167, "ts_title": "04.10.2025 19:35:34 UTC+09:00", "date_ymd": "2025-10-04", "time_hm": "19:35", "text": "ì—°íœ´ ì˜ ë³´ë‚´ê³  ê³„ì‹ ê°€ìš”?\n\në°€ë¦° ìˆ™ì œ ì´ì œ 3ê°œë§Œ ë”í•˜ë©´ ëì´ë„¤ìš”\n\n9.29ì¼ì ë³µê¸°ì…ë‹ˆë‹¤\në³µê¸°í•  ë‚´ìš©ì´ ë§ì•˜ë˜ ì •ì‹ ì—†ë˜ ë‚ ì´ì—ˆìŠµë‹ˆë‹¤\n\nFFì€ ë‘ë§í•  ê²ƒ ì—†ê³ , SUPERë„ ë³µê¸°í• ë§Œí•œ ê°€ì¹˜ê°€ ì¶©ë¶„íˆ ìˆëŠ” ì›ìƒì´ë¼ê³  ìƒê°í•©ë‹ˆë‹¤\níŠ¹íˆ FLUIDë•Œì™€ ìœ ì‚¬í•œ ì¡°ê±´ìœ¼ë¡œ FLUID ë³µê¸°ë¥¼ í–ˆë”ë¼ë©´, ë‚˜ë¦„ì˜ ê·¼ê±°ë¥¼ ê°€ì§€ê³  ë² íŒ…ì„ í•  ìˆ˜ ìˆì—ˆë˜ í”½ì´ ì•„ë‹ê¹Œ ì‹¶ë„¤ìš”\në‹¨ìˆœ ì—…ë¹„íŠ¸ ë”°ë¦¬ ì™¸ì—ë„ í° ê¸°íšŒê°€ ìˆì—ˆë˜ í”½ì´ê¸°ë„ í•˜êµ¬ìš”\n\në¹—ì¸ XPL ìƒì¥ì€ ì‚¬ì‹¤ í¬ê²Œ ì•ˆë´ë„ ë¬´ë°©í• ê²ƒ ê°™ìŠµë‹ˆë‹¤\në‹¨ìˆœ ê¸°ë¡ìš©ìœ¼ë¡œ ì‘ì„±ë§Œ í•´ë†¨ìŠµë‹ˆë‹¤\n\n\në…¸ì…˜ ë³µê¸° â¤µï¸\n$FF ìƒì¥ (Up/Bit/Binance)  âœ¨âœ¨âœ¨\n$SUPER ìƒì¥ (Up)  âœ¨âœ¨\n$XPL ìƒì¥ (Bit)"}
{"source_file": "C:\\Users\\user\\Downloads\\Telegram Desktop\\ChatExport_2026-02-02 (3)\\messages.html", "channel": "íŒíŒí€ì¹˜", "message_id": 170, "ts_title": "05.10.2025 13:02:16 UTC+09:00", "date_ymd": "2025-10-05", "time_hm": "13:02", "text": "ì•ˆë…•í•˜ì„¸ìš”. ziì¡´íŒŒì›Œì¼ë¯¼ì…ë‹ˆë‹¤. \nì •ë§ ë§ì€ ë¶„ë“¤ê»˜ì„œ ì§ˆë¬¸ì„ ë³´ë‚´ì£¼ì…”ì„œ ì§„ì‹¬ìœ¼ë¡œ ê°ì‚¬ë“œë¦½ë‹ˆë‹¤.\nìµœëŒ€í•œ ë§ì€ ë¶„ë“¤ì„ ì„ ì •í•´ ë‹µë³€ë“œë¦¬ê³  ì‹¶ì—ˆì§€ë§Œ, ì¼ì¼ì´ ë‹µì¥ë“œë¦¬ì§€ ëª»í•œ ì  ì–‘í•´ ë¶€íƒë“œë¦½ë‹ˆë‹¤.\n\nì € ì—­ì‹œ ë”°ë¦¬ë¥¼ ì™„ë²½í•˜ê²Œ ì˜ í•´ë‚´ëŠ” ê±´ ì•„ë‹ˆì§€ë§Œ, ì½”ì¸íŒì—ì„œ ê¾¸ì¤€íˆ ë”°ë¦¬ë¥¼ í•´ì˜¤ë©° ìŒ“ì•„ì˜¨ ê²½í—˜ì„ ë°”íƒ•ìœ¼ë¡œ\nì¡°ê¸ˆì´ë‚˜ë§ˆ ì—¬ëŸ¬ë¶„ì—ê²Œ ë„ì›€ì´ ë˜ê³ ì ì´ë²ˆ Q&Aë¥¼ ì¤€ë¹„í•˜ê²Œ ë˜ì—ˆìŠµë‹ˆë‹¤.\n\nì´ ì•„ë˜ì—ëŠ” ì—¬ëŸ¬ë¶„ì´ ì£¼ì‹  ì§ˆë¬¸ë“¤ì— ëŒ€í•œ ë‹µë³€ì„ ì •ë¦¬í–ˆìŠµë‹ˆë‹¤.\n\nQ. ë”°ë¦¬ë¥¼ í•˜ê¸° ìœ„í•œ ì¤€ë¹„ë¬¼ê³¼ ì„¸íŒ… ë°©ë²• \nì²´ì¸ë³„ ê°€ìŠ¤ë¹„: ìµœì†Œ 30ë‹¬ëŸ¬ ì´ìƒì€ ë„£ì–´ë‘ì‹œëŠ”ê²Œ ì¢‹ìŠµë‹ˆë‹¤.\n(íŠ¹íˆ ì´ë”ë¦¬ì›€ ì²´ì¸ì€ ê°€ìŠ¤ë¹„ê°€ ë†’ìœ¼ë‹ˆ ì¡°ê¸ˆ ë” ì—¬ìœ  ìˆê²Œ ì¤€ë¹„í•˜ëŠ” ê²Œ ì¢‹ìŠµë‹ˆë‹¤.)\në¸Œë¦¿ì§€ê°€ í•„ìš”í•  ê²½ìš° ì–‘ìª½ ì²´ì¸ì— í…Œë” ë˜ëŠ” ì¨í´ ë„£ì–´ë†“ê¸°\n\nì„¸íŒ… ë°©ë²•\n-ìƒˆë¡œìš´ ì²´ì¸ì¼ ê²½ìš° RPC ë°”ê¿”ë†“ê¸°(ì„ íƒì‚¬í•­ êµ³ì´ ì•ˆí•´ë„ ë¨)\n-ë¸Œë¦¿ì§€ ë¯¸ë¦¬ ì¼œë‘ê¸°\n-CA(ì»¨íŠ¸ë™íŠ¸ ì£¼ì†Œ) ë©”ëª¨í•´ë‘ê¸°\n-ìƒì¥ ì‹œê°„ ë©”ëª¨í•´ë‘ê¸°\n-ì•ŒëŒ,ë§¤ë„ ë´‡ ì…‹íŒ… í•´ë‘ê¸°\n\nQ. ê³µì‹ ì½”ì¸ì´ ì¶œì‹œë˜ì—ˆì„ ë•Œ DEX êµ¬ë§¤ ì „ ì˜¤í”¼ì…œ ì½”ì¸ì¸ì§€ í™•ì¸í•˜ëŠ” ë²•ì´ ê¶ê¸ˆí•©ë‹ˆë‹¤\nê³µì‹í™ˆí˜ì´ì§€,íŠ¸ìœ„í„°,ê±°ë˜ì†Œ ê³µì§€,ì½”ì¸ë§ˆì¼“ìº¡ì—ì„œ í™•ì¸ì´ ê°€ëŠ¥í•©ë‹ˆë‹¤.\n\nQ. ì—…ë¹„íŠ¸ ì…ê¸ˆ ë„¤íŠ¸ì›Œí¬ì™€ ë¯¸ë¦¬ dexìƒì¥í•œ ë„¤íŠ¸ì›Œí¬ê°€ ë‹¤ë¥¼ë•Œ ë¸Œë¦¿ì§€ê°€ í•„ìš”í•œë° ê·¸ ë¸Œë¦¿ì§€ë¥¼ ì–´ë–¤ ë°©ì‹ìœ¼ë¡œ ì°¾ìœ¼ì‹œë‚˜ìš”? \n-ì»¨íŠ¸ë™íŠ¸ì—ì„œ íŠ¸ëœ ì°¾ì•„ë³´ê¸°\n-Xì—ì„œ ì°¾ì•„ë³´ê¸°\n-êµ¬ê¸€ì— ê²€ìƒ‰\nì´ ì •ë„ë§Œ í•´ë„ ëŒ€ë¶€ë¶„ í•„ìš”í•œ ì •ë³´ëŠ” ë‹¤ ì°¾ì„ ìˆ˜ ìˆìŠµë‹ˆë‹¤.\n\nQ. ë‹¤ì–‘í•œ ë¸Œë¦¿ì§€ ë£¨íŠ¸ì•Œë ¤ì£¼ì„¸ìš¤. \në ˆì´ì–´ì œë¡œ, í•˜ì´í¼ë ˆì¸, íŠ¸ëœìŠ¤í¬í„°, ì›œí™€, ì»¨íŠ¸ë™íŠ¸ ì •ë„ê°€ ìˆë„¤ìš”.\n\nQ. ë”°ë¦¬í• ë•Œ ì´ˆë³´ìë“¤ì´ ê°€ì¥ ë§ì´í•˜ëŠ” ì‹¤ìˆ˜, ë° ì ˆëŒ€ í•˜ì§€ë§ì•„ì•¼í•˜ëŠ” ê²ƒë“¤ \nCAë‚˜ ì‹¬ë³¼ì„ í™•ì¸í•˜ì§€ ì•Šê±°ë‚˜,\nì²´ì¸ì„ í—·ê°ˆë¦¬ê³  ì…ì¶œê¸ˆ ì£¼ì†Œë¥¼ ì²´í¬í•˜ì§€ ì•ŠëŠ” ê²½ìš°ë„ ìˆìŠµë‹ˆë‹¤.\nì ˆëŒ€ ì‹œë“œ 100%ë¡œ ë”°ë¦¬í•˜ì§€ ë§ê¸°, í—·ì§• ì•ˆ ì¡ê¸°, ê·¼ê±° ì—†ì´ ë“¤ì–´ê°€ì§€ ë§ê¸°.\n\nQ. ìƒì¥ê³µì§€ê°€ ë–´ì„ë•Œ ì œì¼ ë¨¼ì € ë– ì˜¤ë¥´ëŠ” ì•„ì´ë””ì–´ë‚˜ ì‚¬ê³ ì˜ íë¦„ì´ ê¶ê¸ˆí•´ìš”!  ì–´ë”” ì‚¬ì´íŠ¸ì—ì„œ ë­˜ í™•ì¸í•˜ê³  ì§„í–‰í•˜ëŠ”ì§€ìš” \nìƒì¥ ê³µì§€ê°€ ì—…ë¹„íŠ¸ë‚˜ ë¹—ì¸ ê¸°ì¤€ìœ¼ë¡œ ë‚˜ì™”ë‹¤ë©´,\nì§€ë‚œë²ˆ ìƒì¥ ë³µê¸°ë¥¼ í•œ ë²ˆ ë” ë³´ê³  ë¨¸ë¦¿ì†ì— ìƒˆê²¨ë‘ê³ \nì²´ì¸ ì§€ì› ì—¬ë¶€ë¥¼ í™•ì¸í•˜ê³ ,\nê·¸ë‹¤ìŒ CA(ì»¨íŠ¸ë™íŠ¸ ì£¼ì†Œ)ë¥¼ ì°¾ì€ ë’¤ ë¸Œë¦¿ì§€ë¥¼ í™•ì¸í•©ë‹ˆë‹¤.\nê·¸ë¦¬ê³  ì‹œë‚˜ë¦¬ì˜¤ë¥¼ ì–´ëŠì •ë„ ì§œë³´ëŠ” ë“¯ í•©ë‹ˆë‹¤.\n\nQ. ê±°ë˜ì†Œë³„ í•«ì›”ë › ì…ê¸ˆëŸ‰ì„ ë³´ë©´ì„œ ë”°ë¦¬ë¥¼ í•´ì•¼í• ê²ƒê°™ì€ë°, ë”°ë¡œ í™•ì¸í•˜ì‹œëŠ” ë°©ë²•ì´ ìˆë‚˜ìš”? \në°ì´í„°ë§¥ì‹œë¥¼ í™œìš©í•´\ní•«ì›”ë ›ì„ ì œê³µë°›ëŠ” ëŒ€ë¡œ ì‚¬ìš©í•˜ê±°ë‚˜,\nì œê°€ ì§ì ‘ ìµœì†Œ ì…ê¸ˆì„ ë„£ì–´ ì§ì ‘ í•«ì„ ë”°ë³´ê¸°ë„ í•©ë‹ˆë‹¤.\në§Œì•½ ë”°ë‚´ì§€ ëª»í•  ê²½ìš°ì—ëŠ” ì§€ì¸ë¶„ë“¤ì˜ ë„ì›€ì„ ë°›ëŠ” í¸ì…ë‹ˆë‹¤.\n\nQ. ë”°ë¦¬í• ë•Œ ì—…ë¹„íŠ¸, ë¹—ì¸ì— ëª‡ ëŒ€ ëª‡ ë¹„ìœ¨ë¡œ ë³´ë‚´ëŠ”ì§€ ê¶ê¸ˆí•´ìš”! \në‹¹ì‹œì—ëŠ” ì…ê¸ˆì•¡ì— ë¹„ë¡€í•˜ê¸´ í–ˆì§€ë§Œ,\nì˜ˆì „ì—ëŠ” í•œ ê³³ì— ëª¨ë‘ ë„£ì—ˆìŠµë‹ˆë‹¤.\nì§€ê¸ˆì€ ë³´í†µ ì—…ë¹„íŠ¸ 6, ë¹—ì¸ 4 ì •ë„ì˜ ë¹„ìœ¨ë¡œ ë‚˜ëˆ„ê±°ë‚˜, ìƒí™©ì— ë”°ë¼ ë‹¤ì‹œ ëª°ë¹µí•˜ê¸°ë„ í•©ë‹ˆë‹¤.\n\nQ. ë‚´ê°€ í•˜ë ¤ëŠ” ë”°ë¦¬ì˜ í¥ë§ì„ íŒë‹¨í•  ìˆ˜ ìˆëŠ” ê¸°ì¤€\n-ì…ê¸ˆëŸ‰\n-ì²´ì¸ ì†ë„ ì—¬ë¶€\n-MC, FDV\n-CEX ìƒì¥ ì—¬ë¶€\n-CEX ì…ê¸ˆê¹Œì§€ ì‹œê°„ ì—¬ë¶€(ì»¨íŒ íšŸìˆ˜)\nëŒ€ë¶€ë¶„ ì´ëŸ¬í•œ ìš”ì†Œë“¤ì„ ë°”íƒ•ìœ¼ë¡œ í¥í• ì§€ ë§í• ì§€ë¥¼ ì–´ëŠ ì •ë„ ì˜ˆì¸¡í•´ë´…ë‹ˆë‹¤.\n\nQ. ë”°ë¦¬í• ë•Œ ë§¤ìˆ˜ë¶„ë§Œ ë”°ì§€ë©´ ì´ ì‹œë“œì˜ ëª‡í¼ì •ë„ ì¡ìœ¼ì‹œë‚˜ìš©? \ní•´ë‹¹ ì§ˆë¬¸ì€ ì €ì˜ ì‹œë“œë¥¼ ìœ ì¶”í•´ ë³¼ ìˆ˜ ìˆê¸°ì— ë‹¤ë¥¸ ë‹µë³€ì´ì§€ë§Œ\nì œê°€ ë”°ë¦¬ë¥¼ í•  ë•Œ ì–´ë–¤ ë°©ì‹ì„ ì¶”êµ¬í•˜ëŠ”ì§€ëŠ” ë§ì”€ë“œë¦´ ìˆ˜ ìˆìŠµë‹ˆë‹¤.\nì €ëŠ” í•­ìƒ ì •í•´ì§„ ê¸ˆì•¡ ì•ˆì—ì„œë§Œ í”Œë ˆì´í•©ë‹ˆë‹¤.\nì˜ˆë¥¼ ë“¤ì–´ 1,000ë‹¬ëŸ¬ë¡œ ì‹œì‘í–ˆë‹¤ë©´ ê·¸ ê¸ˆì•¡ë§Œ ì‚¬ìš©í•˜ê³ ,\në” íƒœìš°ê³  ì‹¶ì„ ë•Œë„ ìµœëŒ€í•œ 2ë°° ì´ë‚´ë¡œë§Œ ëŠ˜ë¦½ë‹ˆë‹¤.\n\nì´ìœ ëŠ” ê°„ë‹¨í•©ë‹ˆë‹¤.\në”°ë¦¬ëŠ” ê¸°íšŒê°€ ê³„ì† ì˜¤ì§€ë§Œ,ê³¼í•˜ê²Œ ë“¤ì–´ê°€ë©´ í•œ ë²ˆì˜ ì‹¤ìˆ˜ë¡œ ë§ì€ ì‹œë“œë¥¼ ìƒì„ ìˆ˜ê°€ ìˆìŠµë‹ˆë‹¤.\nê·¸ë˜ì„œ ì €ëŠ” ëŠ˜ ë¦¬ìŠ¤í¬ë¥¼ í†µì œí•˜ë©´ì„œ ê¾¸ì¤€íˆ ì°¸ì—¬í•˜ëŠ” ë°©í–¥ì„ íƒí–ˆìŠµë‹ˆë‹¤.\nì´ê²Œ ì¥ê¸°ì ìœ¼ë¡œ ë³´ë©´ ê°€ì¥ ì•ˆì •ì ì´ê³ , ê²°êµ­ ë” ì˜¤ë˜ ì‚´ì•„ë‚¨ëŠ” ë°©ë²•ì´ë¼ê³  ìƒê°í•©ë‹ˆë‹¤.\n\nQ.ì—…ë¹—ì¸ ìƒì¥ì„ ì˜ˆìƒí•˜ê³  ì›¨ì¼ì¦ˆ ë§ˆì¼“ê³¼ ê°™ì€ í”„ë¦¬ë§ˆì¼“ì—ì„œ ë¯¸ë¦¬ ê¸ê¸°ë„ í•˜ë‚˜ìš”?\nì´ê²ƒë„ ì¡°ê¸ˆ ìƒê°í•´ë´¤ëŠ”ë°, ê³ ë ¤í•´ì•¼ í•  ê²ƒì´ ë„ˆë¬´ ë§ìŠµë‹ˆë‹¤.\ní”„ë¦¬ë§ˆì¼“ ê°€ê²©ë„ ì¤‘ìš”í•˜ê³  CEX ìƒì¥,í—·ì§• ì—¬ë¶€ë„ ì¤‘ìš”í•´ì„œ ìƒê°í•  ë¶€ë¶„ì´ ë§ìŠµë‹ˆë‹¤.\nê·¸ë˜ì„œ í…ŒìŠ¤íŠ¸í•´ë³¼ ë§Œí•œ í”Œë ˆì´ê°€ ì•„ë‹ê¹Œ ì‹¶ë„¤ìš”.\n\nQ. ì—…ë¹—ì¸ ìƒì¥ì´ ëœ¨ê³  ëª¨ë“ ê±°ë˜ì†Œ ì¶œê¸ˆì´ ì—´ë ¤ìˆê³  í˜„ì„ ê°­ë„ í¬ì§€ ì•Šì„ë•ŒëŠ” í—·ì§•ì„ í•˜ë‚˜ìš”? í—·ì§•ì„ í•˜ì§€ì•ŠëŠ”ë‹¤ë©´ ê·¸ ê¸°ì¤€ì´ ê¶ê¸ˆí•©ë‹ˆë‹¤.\ní—·ì§•ì€ ë¦¬ìŠ¤í¬ë¥¼ ìµœì†Œí•œìœ¼ë¡œ ì¤„ì¼ ìˆ˜ ìˆëŠ” ìˆ˜ë‹¨ì…ë‹ˆë‹¤.\në¬´ì¡°ê±´ í—·ì§•í•˜ëŠ” ê²ƒì´ ì¢‹ë‹¤ê³  ìƒê°í•©ë‹ˆë‹¤.\nì €ëŠ” í•œ ë²ˆ ë…¸í—·ì§•ìœ¼ë¡œ í¬ê²Œ ì†ì‹¤ì„ ë³¸ ì´í›„ë¡œ ìµœëŒ€í•œ í—·ì§•ì„ í•˜ëŠ” í¸ì´ë„¤ìš”.\nì‹œë“œë¥¼ ì§€í‚¤ê¸° ìœ„í•´ì„œë¼ë©´ í•„ìˆ˜ë¼ê³  ìƒê°í•©ë‹ˆë‹¤.\n\nì œê°€ ë”°ë¡œ í—·ì§•ì„ í•˜ì§€ ì•ŠëŠ” ê¸°ì¤€ì€\nCEX ìƒì¥ ì—¬ë¶€, ìƒê°ë³´ë‹¤ ë°˜ì‘ì´ ì•ˆì™”ì„ ê²½ìš°,í•«ì›”ë ›ì´ ì ì„ ê²½ìš°\nê·¸ëŸ´ ë•ŒëŠ” ìƒìŠ¹ë¶„ê¹Œì§€ í•¨ê»˜ ë¨¹ì„ ìˆ˜ ìˆì–´ì„œ í—·ì§•ì„ í•˜ì§€ ì•Šì•˜ë˜ ê²ƒ ê°™ìŠµë‹ˆë‹¤.\në˜ëŠ” ì™¸ë¶€ì— ìˆì–´ ì •ë¦¬ë¥¼ ë°”ë¡œ í•˜ì§€ ëª»í•  ê²½ìš°ì—ë„ í—·ì§•ì„ ìƒëµí•˜ê³¤ í–ˆìŠµë‹ˆë‹¤.\n\nQ. fdvê°€ 5b-6b ì´ëŸ° ì—„ì²­ ë¬´ê±°ìš´ ìƒí™© ì´ì˜€ëŠ”ë° ê·¸ë˜ë„ ì–´ëŠì •ë„ ì—…ì‚¬ì´ë“œê°€ ìˆê²Ÿë‹¤ê³  íŒë‹¨í•˜ì‹ ê±´ê°€ìš” \nì˜ˆì „ì—ëŠ” ë°¸ë¥˜ë¥¼ ë§ì´ ê³ ë ¤í–ˆì—ˆëŠ”ë°,\nìµœê·¼ì— ìƒì¥í•œ ì½”ì¸ë“¤ì„ ë³´ë©´ ë¶ˆì¥ì´ ì§€ì† ë˜ëŠ” ì´ìƒ TGE ìƒì¥ ì‹œ ë°¸ë¥˜ê°€ í¬ê²Œ ì¤‘ìš”í•˜ì§€ ì•Šì€ ê²ƒ ê°™ìŠµë‹ˆë‹¤.\n\nì˜ˆë¥¼ ë“¤ì–´, ì§€ë‚œë²ˆ 2Zì˜ ê²½ìš°ë¥¼ ë³´ë©´ FDVê°€ ì•½ 16Bê¹Œì§€ ì°ì—ˆëŠ”ë°ìš”,\nì†”ì§íˆ ë§ë„ ì•ˆ ë˜ëŠ” ë°¸ë¥˜ë¼ê³  ìƒê°í–ˆìŠµë‹ˆë‹¤.\ní•˜ì§€ë§Œ 24ì‹œê°„ì´ ì§€ë‚œ í˜„ì¬ ìƒí™©ì„ ë³´ë©´ FDVê°€ ì•½ 5B ì •ë„ë¡œ ë‚´ë ¤ì™”ìŠµë‹ˆë‹¤.\n\nì´ëŸ° ì‚¬ë¡€ë¥¼ ë³´ë©´, TGE ë‹¹ì‹œì—ëŠ” ë°¸ë¥˜ë¥¼ í¬ê²Œ ì‹ ê²½ ì“°ì§€ ì•ŠëŠ” ê²ƒì´ ì˜¤íˆë ¤ ë‚«ë‹¤ê³  ìƒê°í•©ë‹ˆë‹¤.\n\nQ. ì´ë¯¸ í”„ë¦¬ë§ˆì¼“ì˜ 2-3ë°°ì˜ ê°€ê²©ìœ¼ë¡œ ë°”ë‚¸ ì•ŒíŒŒì— ìƒì¥ì„ í–ˆì„ë•Œ ì—ë“œ í´ë ˆì„,ìƒì¥ ì§€ì—° ê°™ì€ ì•ˆì¢‹ì€ ì´ìŠˆê°€ ëœ° ë•Œ ë±ìŠ¤ ê°€ê²©ì— ì˜í–¥ì„ ë¼ì¹˜ëŠ”ë° ì´ëŸ´ë• ì–´ë– í•œ ë°©ë²•ìœ¼ë¡œ íŒë‹¨ì„ í•˜ì‹œë‚˜ìš”? \nì €ëŠ” DCA(ë¶„í•  ë§¤ìˆ˜) ë°©ì‹ìœ¼ë¡œ ì½”ì¸ì„ êµ¬ë§¤í•©ë‹ˆë‹¤.\nìƒí™©ì´ ë§¤ë²ˆ ë‹¤ë¥´ê¸° ë•Œë¬¸ì—, ì²œì²œíˆ ë‚˜ëˆ ì„œ ë§¤ìˆ˜í•˜ëŠ” ê²Œ ê°€ì¥ ì¢‹ë‹¤ê³  ìƒê°í•©ë‹ˆë‹¤.\në˜ëŠ” ë³¸ì¸ì´ ë‚®ì€ ê°€ê²©ì´ë¼ ìƒê° í•  ë•Œ ë” ë‹´ëŠ” í¸ì´ë¼ ìƒê°í•˜ë„¤ìš”\nê·¸ë˜ì„œ ì–¸ì œ ì–´ë””ì„œ ë¬¼ëŸ‰ì´ ë‚˜ì˜¤ëŠ”ì§€ ë¯¸ë¦¬ ì²´í¬í•´ë‘ëŠ” ê²ƒì´ ì¤‘ìš”í•˜ê³ ,\nê·¸ë•Œê·¸ë•Œ ìƒí™©ì„ í™•ì¸í•˜ë©´ì„œ ëŒ€ì‘í•˜ëŠ” ê²Œ íš¨ìœ¨ì ì…ë‹ˆë‹¤.\n\nQ. ë¯¸ë¼ëŠ” í›„ë”°ë¦¬ 3ë²ˆë„˜ê²Œ ëŒë¦´ë™ì•ˆ ê¹€í”„ ìœ ì§€ë˜ì—ˆëŠ”ë° ë”ë¸”ì œë¡œëŠ” í•˜ë‹¤ê°€ ë’¤ì§ˆë»” í–ˆëŠ”ë°ì—¬ ë‘˜ ì°¨ì´ê°€ ë­ë¼ê³  ìƒê°í•˜ì‹­ë‹ˆê¹Œ\në¯¸ë¼ì™€ ë”ë¸”ì œë¡œì˜ ì°¨ì´ëŠ” \nê±°ë˜ì†Œ ì…ê¸ˆ ì‹œ í•„ìš”í•œ ì»¨íŒ(í™•ì¸) íšŸìˆ˜ì—ì„œ í¬ê²Œ ë‚˜íƒ€ë‚¬ìŠµë‹ˆë‹¤.\në¯¸ë¼ì˜ ê²½ìš° ì €ëŠ” ë‹¹ì‹œ ì§ì ‘ ì°¸ì—¬í•˜ì§„ ì•Šì•˜ì§€ë§Œ,\nì²´ì¸ì´ BASEì˜€ê¸° ë•Œë¬¸ì— ì…ê¸ˆê¹Œì§€ ì•½ 15~20ë¶„ ì •ë„ ê±¸ë ¸ì„ ê²ƒìœ¼ë¡œ ìƒê°í•©ë‹ˆë‹¤.\në°˜ë©´ ë”ë¸”ì œë¡œ(2Z)ëŠ” SOL ì²´ì¸ì´ë¼ ì…ê¸ˆ ì†ë„ê°€ í›¨ì”¬ ë¹¨ëìŠµë‹ˆë‹¤.\nì•½ 3~4ë¶„ ì´ë‚´ë¡œ ì…ê¸ˆì´ ì™„ë£Œë˜ì—ˆê¸° ë•Œë¬¸ì—,\në§ì€ ì‚¬ëŒë“¤ì´ DEXì—ì„œ ë¹ ë¥´ê²Œ ê¸ì–´ ë³´ë‚´ë©° ë¬¼ëŸ‰ì„ ë˜ì¡Œë˜ ê²ƒìœ¼ë¡œ ë³´ì…ë‹ˆë‹¤.\n\nQ. ì§€ê¸ˆê°™ì€ ë¶ˆì¥ì´ ì•„ë‹Œ ì¥ì´ ì¡°ìš©í• ë•Œë„ ê³„ì† ë”°ë¦¬ë¥¼ í•´ì˜¤ì…¨ëŠ”ì§€, ì•ìœ¼ë¡œ ì¥ì´ ì£½ì–´ë„ ê³„ì† ë”°ë¦¬ë¥¼ í•˜ì‹¤ê±´ì§€?\në”°ë¦¬ë¥¼ ë³¸ê²©ì ìœ¼ë¡œ í•œì§€ 1ë…„~2ë…„ì¯¤ ëœ ê²ƒ ê°™ë„¤ìš” ë¶ˆì¥,ë¬¼ì¥ ê°€ë¦¬ì§€ ì•Šê³  ë§ì´ í–ˆìŠµë‹ˆë‹¤.\nê¾¸ì¤€íˆ í•´ì˜¤ë©´ì„œ ë§ì´ ìƒê¸°ë„ í•˜ê³ , ë§ì´ ë²Œê¸°ë„ í–ˆìŠµë‹ˆë‹¤.\nê·¸ë˜ì„œ ì•ìœ¼ë¡œë„ ì œê°€ ê°€ì¥ ì˜í•˜ëŠ” ë¶„ì•¼ê°€ ì´ê±°ë¼ê³  ìƒê°í•˜ê³ ,\nê³„ì† ê¾¸ì¤€íˆ ì´ì–´ê°ˆ ê²ƒ ê°™ìŠµë‹ˆë‹¤.\n\nQ. ìš”ì¦˜ ë”°ë¦¬, ì—ë“œì‘, ì˜ˆì¹˜ì‘ ì´ ë©”íƒ€ê°€ ì–¸ì œê¹Œì§€ ê°ˆ ê±°ë¼ ë³´ì‹œë‚˜ìš”?  \nìœ„ì—ì„œ ë§ì”€í•˜ì‹  ë©”íƒ€ëŠ” ì½”ì¸ì˜ ê¸°ë³¸ì´ë¼ í•  ìˆ˜ ìˆìŠµë‹ˆë‹¤.\në§¤ë§¤ ì—­ì‹œ ê¸°ë³¸ì´ë¼ê³  ìƒê°í•˜ì§€ë§Œ, ìƒˆë¡œìš´ ë©”íƒ€ê°€ ìƒê¸°ë”ë¼ë„\nì•ì„œ ì–¸ê¸‰í•œ ê·¸ ë©”íƒ€ê°€ ì™„ì „íˆ ì‚¬ë¼ì§€ì§€ëŠ” ì•Šì„ ê²ë‹ˆë‹¤.\nìˆœí™˜ë˜ëŠ” ë©”íƒ€ë¼ê³  ìƒê°í•˜ì‹œë©´ ì´í•´í•˜ê¸° ì‰¬ìš¸ ê²ƒ ê°™ìŠµë‹ˆë‹¤.\n\në‹¤ë§Œ ë”°ë¦¬ëŠ” ì˜ˆì™¸ì¼ ìˆ˜ë„ ìˆìŠµë‹ˆë‹¤.\nìš”ì¦˜ì€ ê³ ë„í™”ëœ ë´‡ì´ ë„ˆë¬´ ë§ì•„ì„œ,\nìë™ìœ¼ë¡œ ëŒë¦¬ëŠ” ë¶„ë“¤ë„ ê½¤ ë§ì•„ í”„ë¦¬ë¯¸ì—„ì´ ë§¤ìš° ë¹¨ë¦¬ ì¤„ì–´ë“­ë‹ˆë‹¤.\nì¦‰,ë¨¹ì„ íŒŒì´ê°€ ì ì  ê³ ë„í™”ëœ ë´‡ ë•Œë¬¸ì— ì†ìœ¼ë¡œëŠ” ì ˆëŒ€ ëª»ë¨¹ëŠ” ìƒí™©ì´ ì˜¨ë‹¤ê³  ë§ì”€ë“œë¦¬ê³  ì‹¶ë„¤ìš”.\n\nê¸´ê¸€ ì½ì–´ì£¼ì…”ì„œ ê°ì‚¬í•©ë‹ˆë‹¤.\nì•„ë˜ëŠ” ë‹¹ì²¨ìë¶„ë“¤ ì…ë‹ˆë‹¤.\në§ì€ ì„±ì›ì— í˜ì…ì–´ ìƒí’ˆ ê·œëª¨ë¥¼ ëŠ˜ë ¸ìŠµë‹ˆë‹¤.\n\në‹¹ì²¨ì ì•ˆë‚´\nìµœìš°ìˆ˜ìƒ: ë°°ë‹¬ì˜ë¯¼ì¡± ì´ìš©ê¶Œ 2ë§Œ ì› - @EJseong95 ë‹˜\nìš°ìˆ˜ìƒ: ë°°ë‹¬ì˜ë¯¼ì¡± ì´ìš©ê¶Œ 1ë§Œ ì› - @Arblover256 ë‹˜\nê·¸ ì™¸ ì§ˆë¬¸ìë¶„ë“¤: ì»¤í”¼ ì¿ í°\n@ahnho,@AbbaAbbaAn1,@copymatch1,@bjk258482,@PJ777PJ,@kimclaim,@kikiki897,@parnakr,@MoonWhale_KR,@JOKER_7274\n,@Levelcap_Agent,@minjoon0102,@msk0529,@choicb"}
{"source_file": "C:\\Users\\user\\Downloads\\Telegram Desktop\\ChatExport_2026-02-02 (3)\\messages.html", "channel": "íŒíŒí€ì¹˜", "message_id": 171, "ts_title": "05.10.2025 18:35:12 UTC+09:00", "date_ymd": "2025-10-05", "time_hm": "18:35", "text": "SOMI ë³µê¸°ì…ë‹ˆë‹¤\n\nMIRA-SUPER-FFë¡œ ì—…ì €ì”¨ë“¤ ìŠ¤íŠ¸ë ˆìŠ¤ í…ŒìŠ¤íŠ¸ ë° ì„¤ê±°ì§€ ì§„í–‰ í›„ í•˜ë£¨ê°„ì˜ íœ´ì‹ê¸° ì´í›„ ìƒì¥ëœ post-TGE ì›ìƒì´ì—ˆìŠµë‹ˆë‹¤\n\nì˜¤ëœë§Œì— ë§ë”°ë¦¬ì˜€ëŠ”ë°, ì†œë‹ˆì•„ëŠ” ì—¬ëŸ¬ê°€ì§€ ì´ìœ ë¡œ ì°¸ì—¬ì•ˆí•œ ì›ìƒ ë”°ë¦¬ì…ë‹ˆë‹¤\ní”¼ê³¤í•˜ê¸°ë„ í–ˆê³ ...\n\në§ë”°ë¦¬ì„ì—ë„ ì—­ì‹œ ì¶©ë¶„íˆ ë³µê¸°í•  ê°€ì¹˜ê°€ ìˆë˜ ë”°ë¦¬ì˜€ìŠµë‹ˆë‹¤\nì—…ë¹„íŠ¸ë‚˜ ë¹—ì¸ì´ë‚˜ í¼í¬ë¨¼ìŠ¤ëŠ” ë¹„ìŠ·í–ˆìŠµë‹ˆë‹¤ (ë‘˜ë‹¤ ë§...)\në‹¤ë§Œ, ì›ìƒ ë”°ë¦¬ ì œí•˜ê³  ë‹¤ë¥¸ ê¸°íšŒë“¤ì„ ì˜ í¬ì°©í–ˆìœ¼ë©´ ë”°ë¦¬ê¾¼ë“¤ ì‹¹ ì¡ì•„ì£½ì¼ë•Œë„ ì¶©ë¶„íˆ ê´œì°®ì€ ìˆ˜ìµì„ ì˜¬ë¦´ ìˆ˜ ìˆì—ˆë˜ ì´ë²¤íŠ¸ì˜€ìŠµë‹ˆë‹¤\n\nì´ë¡œì¨ ë‚¨ì€ ìˆ™ì œ 2ê°œ ğŸ˜Œ\n\në…¸ì…˜ ë³µê¸° â¤µ\n$SOMI ìƒì¥ (Up/Bit) ğŸ˜ˆ"}
{"source_file": "C:\\Users\\user\\Downloads\\Telegram Desktop\\ChatExport_2026-02-02 (3)\\messages.html", "channel": "íŒíŒí€ì¹˜", "message_id": 172, "ts_title": "07.10.2025 16:15:13 UTC+09:00", "date_ymd": "2025-10-07", "time_hm": "16:15", "text": "DOOD ì—…ë¹„íŠ¸ í•«ì›”ë ›\n\nhttps://solscan.io/account/Dtg461zxsxWukZbKRMPoa4BDXtdcLTaPvSKdbt3Xrk23#transfers\nhttps://solscan.io/account/HoegqUk7NB3W3B68L98h724u7nB94JABjhq6uk8Njwbj#transfers\nhttps://solscan.io/account/7V43WztAom3CFuTzbamWzjvTX8oAPs3iwg1xbARbvwCq#transfers\nhttps://solscan.io/account/8LNNuKoFbRX64ov9uLmKrs6czztJwmidWArGjDk9kAJ\n\ní˜„ì¬ ê¸°ì¤€ ì…ê¸ˆì•¡ ëŒ€ëµ 193ì–µ"}
{"source_file": "C:\\Users\\user\\Downloads\\Telegram Desktop\\ChatExport_2026-02-02 (3)\\messages.html", "channel": "íŒíŒí€ì¹˜", "message_id": 173, "ts_title": "08.10.2025 12:04:13 UTC+09:00", "date_ymd": "2025-10-08", "time_hm": "12:04", "text": "ì½”ë¦¬ TEA í• ë‹¹ë°œí‘œ\n\në°”í…€ì—… ë°©ì‹ì´ë¼í•´ì„œ ì¥ì¢ƒì†Œì•¡ë§Œ ë„£ì—ˆëŠ”ë° ë” ë„£ì„ê±¸~\n\n** ìµœëŒ€ 1300ë¶ˆê¹Œì§€ í• ë‹¹ë°›ì€ë“¯"}
